{
    "name": "Olivia Nichols",
    "age": 29,
    "height": "5'6\"",
    "school": "University of California, Berkeley",
    "job_industry": "Tech",
    "job_title": "Software Engineer",
    "hometown_location": "Portland, Oregon",
    "dating_location": "Los Angeles, California",
    "languages_spoken": [
        "English",
        "French"
    ],
    "values": [
        "Hard work",
        "Ambition",
        "Compassion"
    ],
    "interests": [
        "Hiking",
        "Music",
        "Cooking"
    ],
    "education_level": "Graduate",
    "religious_beliefs": "Agnostic",
    "politics": "Liberal",
    "dating_intentions": "Long term",
    "relationship_type": "Monogamy",
    "gender": "Woman",
    "pronouns": "She/Her/Hers",
    "sexuality": "Straight",
    "ethnicity": "White Caucasian",
    "has_children": false,
    "want_children": true,
    "pets": [
        "Dog"
    ],
    "zodiac_sign": "Cancer",
    "mbti_personality_type": "ENTJ",
    "drinking": "Sometimes",
    "smoking": "No",
    "marijuana": "No",
    "drugs": "No",
    "exercise": "Active",
    "partner_preferences": {
        "minimum_age": 27,
        "maximum_age": 35,
        "minimum_height": "5'7\"",
        "maximum_height": "6'4\"",
        "has_children": false,
        "want_children": true,
        "sexuality": "Straight",
        "drinking": "Yes",
        "smoking": "No",
        "marijuana": "No",
        "drugs": "No",
        "exercise": "Active"
    },
    "summary": "Olivia Nichols is a 29-year-old ambitious, compassionate, and hard-working software engineer based in Los Angeles who originated from Portland, Oregon. She graduated from the University of California, Berkeley. She can converse in English and French and loves hiking, listening to music, and cooking.\n\nOlivia is a straight woman who goes by the pronouns she/her/hers and is comfortable in monogamous relationships. She prefers long-term relationships and plans to have children in the future. Currently, she does not have any kids. She's an animal lover who owns a dog.\n\nPolitically, Olivia leans liberal, is agnostic, and identifies her ethnicity as White Caucasian. Her lifestyle is an active one, with an occasional inclination towards drinking; however, Olivia steers clear from smoking, marijuana, and drugs. Her zodiac sign is Cancer and her MBTI type is ENTJ.\n\nShe likes her potential partner to be a straight man, between 27 to 35 years old, who does not smoke or use marijuana or drugs. The preferred partner should be atleast 5'7\" tall, childless, and also wants children. Expectedly, Olivia wants her partner to lead an active lifestyle and appreciates if he also enjoys occasional drinking.",
    "user_id": "6bce0e1e-1718-476d-94ce-87801e1614a7"
}
