{
    "name": "Farah Mahmoud",
    "age": 30,
    "height": "5'6\"",
    "school": "University of Pennsylvania",
    "job_industry": "Publishing",
    "job_title": "Editor",
    "hometown_location": "Austin, Texas",
    "dating_location": "Los Angeles, California",
    "languages_spoken": [
        "English",
        "Arabic"
    ],
    "values": [
        "Honesty",
        "Kindness",
        "Integrity",
        "Family"
    ],
    "interests": [
        "Literature",
        "Running",
        "Cooking",
        "Volunteering"
    ],
    "education_level": "Graduate",
    "religious_beliefs": "Muslim",
    "politics": "Liberal",
    "dating_intentions": "Long term",
    "relationship_type": "Monogamy",
    "gender": "Woman",
    "pronouns": "She/Her/Hers",
    "sexuality": "Straight",
    "ethnicity": "Middle Eastern",
    "has_children": false,
    "want_children": true,
    "pets": [
        "Cat"
    ],
    "zodiac_sign": "Pisces",
    "mbti_personality_type": "INFJ",
    "drinking": "No",
    "smoking": "No",
    "marijuana": "No",
    "drugs": "No",
    "exercise": "Active",
    "partner_preferences": {
        "minimum_age": 30,
        "maximum_age": 40,
        "minimum_height": "5'5\"",
        "maximum_height": "6'3\"",
        "has_children": false,
        "want_children": true,
        "sexuality": "Straight",
        "drinking": "No",
        "smoking": "No",
        "marijuana": "No",
        "drugs": "No",
        "exercise": "Active",
        "gender": "Man",
        "dating_intentions": "Long term",
        "relationship_type": "Monogamy",
        "ethnicities": [
            "Black African Descent",
            "East Asian",
            "Hispanic/Latino",
            "Middle Eastern",
            "White Caucasian"
        ],
        "politics": [
            "Liberal"
        ],
        "job_industry": [
            "Publishing",
            "Journalism",
            "Education",
            "Non-profit"
        ],
        "languages_spoken": [
            "English"
        ],
        "values": [
            "Honesty",
            "Kindness",
            "Integrity",
            "Family"
        ],
        "interests": [
            "Literature",
            "Travelling",
            "Cooking",
            "Volunteering"
        ],
        "education_level": [
            "Undergraduate",
            "Graduate",
            "Doctoral"
        ]
    },
    "profile_summary": "This profile is of a 30-year-old woman who identifies with She/Her/Hers pronouns. She is Middle Eastern, straight, and has an education level of a graduate from the University of Pennsylvania. Professionally, she is an Editor in the Publishing industry. Originally from Austin, Texas, she now resides in Los Angeles, California for her dating scope. She is a Muslim, aligns with liberal politics, desires a long-term and monogamous relationship. She doesn't have children but wishes to have them in the future. She is a non-drinker and non-smoker, with a straight refusal to marijuana and drugs. She leads an active life playing a lot with her pet cat. Her interests include literature, running, cooking, and volunteering. She speaks both English and Arabic and values honesty, kindness, integrity, and family. She is a Pisces and categorizes herself as an INFJ personality type (Myers\u2013Briggs Type Indicator).",
    "preferences_summary": "The user is seeking a man aged between 30 and 40 years old. Ideally, he'd stand between 5'5\" and 6'3\" in height. She prefers someone who doesn't have children but wants to have them in the future. She's looking for a straight, active non-smoker and non-drinker. The potential partner should be mostly politically liberal. She's open to dates of Black African, East Asian, Hispanic/Latino, Middle Eastern, and White Caucasian ethnicity. Her Lifestyle matches involves working in either the publishing, journalism, education, or non-profit domain. Being able to converse in English is critical, shares her values of honesty, kindness, integrity and family, and has interests in literature, travelling, cooking and volunteering. Also, she's hoping for someone who's achieved an education level ranging from undergraduate to doctoral degree levels.",
    "user_id": "e07d58ca-749b-4265-846b-8d60c644dedc"
}
