{
    "name": "Aaliyah Johnson",
    "age": 32,
    "height": "5'8\"",
    "school": "University of California, Los Angeles",
    "job_industry": "Tech",
    "job_title": "Software Engineer",
    "hometown_location": "Seattle, Washington",
    "dating_location": "Los Angeles, California",
    "languages_spoken": [
        "English",
        "Spanish",
        "French"
    ],
    "values": "Open-mindedness, compassion, and equality",
    "interests": "Cooking, hiking, and coding",
    "education_level": "Graduate",
    "religious_beliefs": "Agnostic",
    "politics": "Liberal",
    "dating_intentions": "Long term",
    "relationship_type": "Monogamy",
    "gender": "Woman",
    "pronouns": "She/Her/Hers",
    "sexuality": "Gay",
    "ethnicity": "Black African Descent",
    "has_children": false,
    "want_children": true,
    "pets": [
        "Dog",
        "Fish"
    ],
    "zodiac_sign": "Sagittarius",
    "mbti_personality_type": "ENFJ",
    "drinking": "Sometimes",
    "smoking": "No",
    "marijuana": "No",
    "drugs": "No",
    "exercise": "Active",
    "partner_preferences": {
        "minimum_age": 30,
        "maximum_age": 40,
        "minimum_height": "5'6\"",
        "maximum_height": "6'2\"",
        "has_children": false,
        "want_children": true,
        "sexuality": "Gay",
        "drinking": "Sometimes",
        "smoking": "No",
        "marijuana": "No",
        "drugs": "No",
        "exercise": "Active"
    },
    "summary": "Aaliyah Johnson is a 32-year-old gay woman from Seattle, Washington, currently living in Los Angeles, California. She is 5'8\" and a Software Engineer working in the tech industry. She is educated to graduate level and fluent in English, Spanish, and French. Open-mindedness, compassion, and equality are her core values, and she enjoys cooking, hiking, and coding. Aaliyah is an agnostic with liberal political beliefs. She is interested in a monogamous, long-term relationship and is open to having children in the future. As a pet lover, she has a dog and a fish. She identifies as an ENFJ Sagittarius who is in favor of an active lifestyle, an occasional drinker, and does not smoke, consume marijuana, or other drugs. Her ideal partner should be between the age of 30 and 40, with a height between 5'6\" and 6'2\", have no children but open to having them, an active lifestyle, and should not smoke or consume drugs.",
    "user_id": "2d40d7fd-a5dd-456d-959d-a1b89057b945"
}
