{
    "name": "Ariana Martinez",
    "age": 31,
    "height": "5'6\"",
    "school": "University of California, Santa Cruz",
    "job_industry": "Technology",
    "job_title": "Software Engineer",
    "hometown_location": "San Diego, California",
    "dating_location": "Los Angeles, California",
    "languages_spoken": [
        "English",
        "Spanish"
    ],
    "values": "Family, Health, Creativity",
    "interests": "Hiking, Reading, Cooking, Coding",
    "education_level": "Graduate",
    "religious_beliefs": "Atheist",
    "politics": "Liberal",
    "dating_intentions": "Long term",
    "relationship_type": "Monogamy",
    "gender": "Woman",
    "pronouns": "She/Her/Hers",
    "sexuality": "Straight",
    "ethnicity": "Hispanic/Latino",
    "has_children": false,
    "want_children": true,
    "pets": [
        "Dog"
    ],
    "zodiac_sign": "Taurus",
    "mbti_personality_type": "INTP",
    "drinking": "Sometimes",
    "smoking": "No",
    "marijuana": "No",
    "drugs": "No",
    "exercise": "Active",
    "partner_preferences": {
        "minimum_age": 30,
        "maximum_age": 40,
        "minimum_height": "5'8\"",
        "maximum_height": "6'4\"",
        "has_children": false,
        "want_children": true,
        "sexuality": "Straight",
        "drinking": "Yes",
        "smoking": "No",
        "marijuana": "No",
        "drugs": "No",
        "exercise": "Active"
    },
    "summary": "Ariana Martinez is a 31-year-old Hispanic/Latino woman, currently residing in Los Angeles, California. She is a Software Engineer in the tech industry who attributes great value to family, health, and creativity. Ariana graduated from the University of California, Santa Cruz and enjoys pastimes, such as hiking, reading, cooking. Despite being an Atheist and a Liberal, she is looking for a long-term, monogamous relationship. She is fluent in both English and Spanish.\n\nAriana leads an active lifestyle, drinks occasionally, and does not smoke or use marijuana or other drugs. As a proud dog owner and a Taurus, she does not have children but definitely wants to in the future. She identifies with the \"INTP\" MBTI personality type.\n\nIn terms of partner preferences, Ariana is looking for a straight man, aged between 30 and 40, tall (between 5'8\" and 6'4\"). Her ideal partner should not already have children but should want some in the future. He should be an active individual who drinks occasionally, but avoids smoking or drug use.",
    "user_id": "0271a4c2-9c0a-4046-92fb-a6488b99ebcb"
}
