{
    "name": "Beatrice Liu",
    "age": 28,
    "height": "5'5\"",
    "school": "University of California, Los Angeles",
    "job_industry": "Technology",
    "job_title": "Software Engineer",
    "hometown_location": "San Diego, California",
    "dating_location": "Los Angeles, California",
    "languages_spoken": [
        "English",
        "Mandarin"
    ],
    "values": [
        "Hard Work",
        "Family",
        "Honesty"
    ],
    "interests": [
        "Reading",
        "Coding",
        "Yoga"
    ],
    "education_level": "Graduate",
    "religious_beliefs": "Atheist",
    "politics": "Liberal",
    "dating_intentions": "Long term",
    "relationship_type": "Monogamy",
    "gender": "Woman",
    "pronouns": "She/Her/Hers",
    "sexuality": "Straight",
    "ethnicity": "East Asian",
    "has_children": false,
    "want_children": true,
    "pets": [
        "Cat"
    ],
    "zodiac_sign": "Libra",
    "mbti_personality_type": "INTJ",
    "drinking": "Sometimes",
    "smoking": "No",
    "marijuana": "No",
    "drugs": "No",
    "exercise": "Active",
    "partner_preferences": {
        "minimum_age": 28,
        "maximum_age": 35,
        "minimum_height": "5'7\"",
        "maximum_height": "6'2\"",
        "has_children": false,
        "want_children": true,
        "sexuality": "Straight",
        "drinking": "Yes",
        "smoking": "No",
        "marijuana": "No",
        "drugs": "No",
        "exercise": "Active"
    },
    "summary": "Beatrice Liu is a straight, single, 28 year-old woman of East Asian descent. She is a software engineer in the tech industry and resides in Los Angeles, California. Beatrice prides herself on her values, which include hard work, family, and honesty. She enjoys reading, coding, and yoga as her hobbies. Beatrice was educated to a graduate level at the University of California and identifies herself as an atheist with liberal political views. She is interested in a long-term, monogamous relationship and intends to have children in the future. Beatrice speaks English and Mandarin fluently. She occasionally enjoys a drink, doesn't smoke, and refrains from drug use. Beatrice is physically active and she owns a cat. Her MBTI personality type is INTJ and she is a Libra. In terms of her relationship preferences, she is interested in a straight man aged between 28 and 35 who leads an active lifestyle, does not smoke, and is open to having children.",
    "user_id": "8f4e2072-3ed0-4f9e-8353-66394f262fbd"
}
