{
    "name": "Leonora Pearson",
    "age": 28,
    "height": "5'6\"",
    "school": "University of Michigan",
    "job_industry": "Healthcare",
    "job_title": "Nurse practitioner",
    "hometown_location": "Grand Rapids, Michigan",
    "dating_location": "Los Angeles, California",
    "languages_spoken": [
        "English",
        "Spanish"
    ],
    "values": [
        "Family",
        "Personal growth",
        "Healthy lifestyle",
        "Philanthropy"
    ],
    "interests": [
        "Running",
        "Cooking",
        "Reading",
        "Exploring new cities",
        "Volunteering at the local shelter"
    ],
    "education_level": "Graduate",
    "religious_beliefs": "Christian",
    "politics": "Moderate",
    "dating_intentions": "Long term",
    "relationship_type": "Monogamy",
    "gender": "Woman",
    "pronouns": "She/Her/Hers",
    "sexuality": "Straight",
    "ethnicity": "White Caucasian",
    "has_children": false,
    "want_children": true,
    "pets": [
        "Dog"
    ],
    "zodiac_sign": "Virgo",
    "mbti_personality_type": "ENFJ",
    "drinking": "Sometimes",
    "smoking": "No",
    "marijuana": "No",
    "drugs": "No",
    "exercise": "Active",
    "partner_preferences": {
        "minimum_age": 27,
        "maximum_age": 35,
        "minimum_height": "5'7\"",
        "maximum_height": "6'3\"",
        "has_children": false,
        "want_children": true,
        "sexuality": "Straight",
        "drinking": "Sometimes",
        "smoking": "No",
        "marijuana": "No",
        "drugs": "No",
        "exercise": "Active"
    },
    "summary": "Leonora Pearson is a 28-year old woman who identifies as straight. She is a graduate from the University of Michigan and works in the healthcare sector as a Nurse Practitioner. Originating from Grand Rapids, Michigan, she now lives in Los Angeles, California. She is fluent in English and Spanish. \n\nShe values her family, personal growth, maintaining a healthy lifestyle, and philanthropy. Her interests include running, cooking, reading, exploring new cities, and volunteering at the local shelter. \n\nLeonora identifies as a Christian, holds moderate political views, and is interested in long-term dating. She does not currently have children but desires them in the future. She owns a dog, does sometimes drink, but does not smoke or use drugs. \n\nShe is physically active, a Virgo, and ENFJ on the Myers-Briggs type indicator. Leonora prefers a monogamous relationship and is in search of a straight man who is also interested in a long-term and wants children. \n\nHer ideal partner is between the ages of 27 to 35, at least 5'7\" in height, doesn't smoke, and is physically active. Active drinking is fine but he should not engage in any drug use.",
    "user_id": "10bd51f5-840e-4453-9d66-54863f409beb"
}
