{
    "name": "Gabriel Sinclair",
    "age": 29,
    "height": "6'1\"",
    "school": "University of California, Berkeley",
    "job_industry": "Healthcare",
    "job_title": "Physician",
    "hometown_location": "Chicago, Illinois",
    "dating_location": "Los Angeles, California",
    "languages_spoken": [
        "English",
        "Spanish"
    ],
    "values": [
        "Honesty",
        "Family",
        "Health & Fitness",
        "Creativity"
    ],
    "interests": [
        "Traveling",
        "Photography",
        "Yoga",
        "Reading",
        "Hiking"
    ],
    "education_level": "Doctoral",
    "religious_beliefs": "Agnostic",
    "politics": "Moderate",
    "dating_intentions": "Life partner",
    "relationship_type": "Monogamy",
    "gender": "Man",
    "pronouns": "He/Him/His",
    "sexuality": "Straight",
    "ethnicity": "Black African Descent",
    "has_children": false,
    "want_children": true,
    "pets": [
        "Dog",
        "None"
    ],
    "zodiac_sign": "Libra",
    "mbti_personality_type": "ENFJ",
    "drinking": "Sometimes",
    "smoking": "No",
    "marijuana": "No",
    "drugs": "No",
    "exercise": "Active",
    "partner_preferences": {
        "minimum_age": 25,
        "maximum_age": 35,
        "minimum_height": "5'0\"",
        "maximum_height": "6'0\"",
        "has_children": false,
        "want_children": true,
        "sexuality": "Straight",
        "drinking": "Yes",
        "smoking": "No",
        "marijuana": "No",
        "drugs": "No",
        "exercise": "Active",
        "gender": "Woman",
        "dating_intentions": "Life partner",
        "relationship_type": "Monogamy",
        "ethnicities": [
            "Black African Descent",
            "White Caucasian",
            "Hispanic/Latino",
            "East Asian",
            "Other"
        ],
        "politics": [
            "Liberal",
            "Moderate",
            "Not political"
        ],
        "job_industry": [
            "Healthcare",
            "Education",
            "Nonprofit"
        ],
        "languages_spoken": [
            "English",
            "Spanish"
        ],
        "values": [
            "Honesty",
            "Family",
            "Adventure",
            "Creativity"
        ],
        "interests": [
            "Traveling",
            "Photography",
            "Yoga",
            "Reading",
            "Hiking",
            "Taking care of pets"
        ],
        "education_level": [
            "Undergraduate",
            "Graduate",
            "Doctoral"
        ]
    },
    "profile_summary": "Our 29-year-old user is a Black African Descent man who identifies as straight and uses the pronouns He/Him/His. He is 6'1\" tall and hails from Chicago, Illinois, but currently is in the dating scene in Los Angeles, California. He works in the Healthcare industry as a Physician and holds a Doctoral level education from the University of California, Berkeley. This Libra is an active individual who values honesty, family, health & fitness, and creativity. He is agnostic and politically moderate. As for hobbies, he enjoys traveling, photography, yoga, reading, and hiking. He speaks both English and Spanish and has a ENFJ personality type. He sometimes drinks, but does not smoke or use marijuana or drugs. Whilst not currently a parent, he is open to the idea of having children in the future. He also has a pet dog. His intention in dating is to find a life partner who shares monogamous beliefs.",
    "preferences_summary": "The user is seeking a woman aged between 25 and 35, with a height ranging from 5'0\" to 6'0\". She should be without children, but desiring to have them in the future. The user prefers a straight and active woman who drinks, but does not smoke or use marijuana or other drugs. She should be interested in monogamy, with the intention of finding a life partner. Her ethnicity could be of Black African Descent, White Caucasian, Hispanic/Latino, East Asian, or Other. Her political orientation should be preferably Liberal, Moderate, or apolitical. She might be working in the healthcare, education, or nonprofit sector. The user would like her to speak English or Spanish, value honesty, family, adventure, and creativity, and enjoy traveling, photography, yoga, reading, hiking, and taking care of pets. As for her education, the user prefers that she holds an Undergraduate, Graduate, or Doctoral degree.\n",
    "user_id": "107aa631-bb3a-49e2-9df2-a871ec54df89"
}
