{
    "name": "Jane Smith",
    "age": 34,
    "height": "5'6\"",
    "school": "Harvard University",
    "job_industry": "Technology",
    "job_title": "Software Engineer",
    "hometown_location": "Houston, Texas",
    "dating_location": "Los Angeles, California",
    "languages_spoken": [
        "English",
        "Spanish",
        "Mandarin Chinese"
    ],
    "values": "Family, inclusivity, personal growth",
    "interests": "Coding, hiking, photography, cooking",
    "education_level": "Doctoral",
    "religious_beliefs": "Buddhist",
    "politics": "Liberal",
    "dating_intentions": "Long term",
    "relationship_type": "Monogamy",
    "gender": "Woman",
    "pronouns": "She/Her/Hers",
    "sexuality": "Straight",
    "ethnicity": "Asian",
    "has_children": true,
    "want_children": false,
    "pets": [
        "Cat",
        "Dog"
    ],
    "zodiac_sign": "Aries",
    "mbti_personality_type": "INTJ",
    "drinking": "Sometimes",
    "smoking": "No",
    "marijuana": "No",
    "drugs": "No",
    "exercise": "Active",
    "partner_preferences": {
        "minimum_age": 30,
        "maximum_age": 40,
        "minimum_height": "5'6\"",
        "maximum_height": "6'2\"",
        "has_children": true,
        "want_children": false,
        "sexuality": "Straight",
        "drinking": "Yes",
        "smoking": "No",
        "marijuana": "No",
        "drugs": "No",
        "exercise": "Active"
    },
    "summary": "Jane Smith is a successful 34-year-old Software Engineer based in Los Angeles, California. Originally from Houston, Texas, she is multilingual, speaking English, Spanish, and Mandarin Chinese. She highly values family, inclusivity, and personal growth.\n\nJane holds a doctoral degree from Harvard University and works in the technology industry. She identifies as a straight Asian woman and adheres to Buddhist religious beliefs. Politically, she leans towards liberal ideologies.\n\nWhen she's not working, Jane enjoys a wide range of activities like coding, hiking, photography, and cooking. She is active, with exercise being part of her regular routine. She occasionally drinks, but doesn't smoke or do drugs.\n\nShe is a single mother who is not looking to have more children. Her household is lively with a cat and a dog. She is an Aries and an INTJ personality type.\n\nJane is looking for a long-term, monogamous relationship with a straight man who is between the ages 30 and 40, and active like her. Her potential partner should also accept that she already has a child, and should not plan on having more children. He should have the same stance as Jane on smoking, drinking, and drug use.",
    "user_id": "10a80b1d-ea88-4d10-b3e5-c355fcbd6246"
}
