{
    "name": "Samuel Okeke",
    "age": 30,
    "height": "6'2\"",
    "school": "University of California, Berkeley",
    "job_industry": "Technology",
    "job_title": "Software Engineer",
    "hometown_location": "Lagos, Nigeria",
    "dating_location": "Los Angeles, California",
    "languages_spoken": [
        "English",
        "Igbo"
    ],
    "values": [
        "Honesty",
        "Commitment",
        "Self-improvement"
    ],
    "interests": [
        "Coding",
        "Basketball",
        "Traveling",
        "Cooking"
    ],
    "education_level": "Graduate",
    "religious_beliefs": "Christian",
    "politics": "Moderate",
    "dating_intentions": "Life partner",
    "relationship_type": "Monogamy",
    "gender": "Man",
    "pronouns": "He/Him/His",
    "sexuality": "Straight",
    "ethnicity": "Black African Descent",
    "has_children": false,
    "want_children": true,
    "pets": [
        "Dog",
        "None"
    ],
    "zodiac_sign": "Leo",
    "mbti_personality_type": "INTJ",
    "drinking": "Sometimes",
    "smoking": "No",
    "marijuana": "No",
    "drugs": "No",
    "exercise": "Active",
    "partner_preferences": {
        "minimum_age": 25,
        "maximum_age": 35,
        "minimum_height": "5'2\"",
        "maximum_height": "6'0\"",
        "has_children": false,
        "want_children": true,
        "sexuality": "Straight",
        "drinking": "Sometimes",
        "smoking": "No",
        "marijuana": "No",
        "drugs": "No",
        "exercise": "Active",
        "gender": "Woman",
        "dating_intentions": "Life partner",
        "relationship_type": "Monogamy",
        "ethnicities": [
            "Black African Descent",
            "East Asian",
            "Hispanic/Latino",
            "Middle Eastern",
            "Native American",
            "Pacific Islander",
            "South Asian",
            "Southeast Asian",
            "White Caucasian",
            "Other"
        ],
        "politics": [
            "Liberal",
            "Moderate",
            "Conservative",
            "Not political",
            "Other"
        ],
        "job_industry": [
            "Health Care",
            "Education",
            "Technology",
            "Arts",
            "Science"
        ],
        "languages_spoken": [
            "English"
        ],
        "values": [
            "Honesty",
            "Commitment",
            "Self-improvement"
        ],
        "interests": [
            "Movies",
            "Sports",
            "Traveling",
            "Cooking"
        ],
        "education_level": [
            "Undergraduate",
            "Graduate",
            "Doctoral",
            "Other"
        ]
    },
    "profile_summary": "The profile belongs to a 30-year-old man who stands tall at 6'2\". He attended the University of California, Berkeley and is currently working as a Software Engineer in the Technology sector. Born in Lagos, Nigeria, he now resides in Los Angeles, California. He is fluent in English and Igbo. He is committed to values of honesty, self-improvement, and commitment. His interests include Coding, Basketball, Traveling, and Cooking. He completed his graduate studies and identifies as a Christian. In terms of politics, he leans moderate. His ultimate dating intention is to find a life partner and he prefers monogamous relationships. He identifies as straight. His ethnicity is Black African Descent. Although he doesn't have any children currently, he is open to having some in future. While he enjoys the company of dogs and it seems he doesn't have other pets. His Zodiac sign is Leo and his MBTI personality type is INTJ. When it comes to lifestyle habits, he occasionally drinks but refrains from smoking, marijuana, and other drugs. He maintains an active exercise routine.",
    "preferences_summary": "The ideal dating partner is a woman between the ages of 25 and 35 who stands between 5'2\" and 6'0\" tall. She is expected to be childless, with the desire to have children in the future, and straight in terms of sexuality. Her habits should reflect occasional drinking, no smoking, and no use of marijuana or drugs. She is active in terms of exercise. The preferred ethnic backgrounds range widely from Black African Descent, East Asian, Hispanic/Latino, Middle Eastern, Native American, to Pacific Islander, South Asian, Southeast Asian, White Caucasian, and includes others. She should hold liberal, moderate, conservative, or non-political views. Career-wise, she should be predominantly in the Health Care, Education, Technology, Art, or Science industries. English should be among her spoken languages. Her values should include Honesty, Commitment, and Self-improvement, and she should have an interest in Movies, Sports, Traveling, and Cooking. She should have at least an undergraduate level education. This partner should be seeking a long-term relationship and should be inclined towards monogamy.",
    "user_id": "dab18ddd-4fc1-4443-966e-1d9e173ced2c"
}
