{
    "name": "Amirah Al Harbi",
    "age": 27,
    "height": "5'7\"",
    "school": "King Saud University",
    "job_industry": "Healthcare",
    "job_title": "Pharmacist",
    "hometown_location": "Riyadh, Saudi Arabia",
    "dating_location": "Los Angeles, California",
    "languages_spoken": [
        "Arabic",
        "English"
    ],
    "values": [
        "Family",
        "Career",
        "Religion"
    ],
    "interests": [
        "Cooking",
        "Travel",
        "Fitness"
    ],
    "education_level": "Graduate",
    "religious_beliefs": "Muslim",
    "politics": "Moderate",
    "dating_intentions": "Life partner",
    "relationship_type": "Monogamy",
    "gender": "Woman",
    "pronouns": "She/Her/Hers",
    "sexuality": "Straight",
    "ethnicity": "Middle Eastern",
    "has_children": false,
    "want_children": true,
    "pets": [
        "None"
    ],
    "zodiac_sign": "Scorpio",
    "mbti_personality_type": "ISFJ",
    "drinking": "No",
    "smoking": "No",
    "marijuana": "No",
    "drugs": "No",
    "exercise": "Active",
    "partner_preferences": {
        "minimum_age": 28,
        "maximum_age": 35,
        "minimum_height": "5'8\"",
        "maximum_height": "6'2\"",
        "has_children": false,
        "want_children": true,
        "sexuality": "Straight",
        "drinking": "No",
        "smoking": "No",
        "marijuana": "No",
        "drugs": "No",
        "exercise": "Active",
        "gender": "Man",
        "dating_intentions": "Life partner",
        "relationship_type": "Monogamy",
        "ethnicities": [
            "Middle Eastern"
        ],
        "politics": [
            "Moderate"
        ],
        "job_industry": [
            "Healthcare",
            "Engineering",
            "Education"
        ],
        "languages_spoken": [
            "Arabic",
            "English"
        ],
        "values": [
            "Family",
            "Career",
            "Religion"
        ],
        "interests": [
            "Cooking",
            "Travel",
            "Fitness"
        ],
        "education_level": [
            "Graduate",
            "Doctoral"
        ]
    },
    "profile_summary": "The user is a 27-year-old woman who identifies as straight and practices monogamy. She is of Middle Eastern ethnicity with her height being 5'7\". She has a graduate degree from King Saud University, and she is working as a Pharmacist in the healthcare industry. Her hometown is Riyadh, Saudi Arabia but she is currently located in Los Angeles, California. She speaks both Arabic and English. Her values are family, career, and religion with a political orientation being moderate. She enjoys cooking, traveling, and fitness in her spare time. She's a Muslim and a non-drinker and non-smoker, and she leads an active lifestyle. She holds an ISFJ Myers-Briggs personality type and is a Scorpio by zodiac sign. She doesn't have children but is aspiring to have them in the future. And though she does not currently have any pets, she is expecting to meet her life partner.\n",
    "preferences_summary": "The user's desired dating partner is a man, who is of Middle-Eastern ethnicity and between the ages of 28 to 35 years. His height should be between 5'8\" and 6'2\". He must be intending to find a life partner through a monogamous relationship, just like the user. He should not have any children currently, but should desire to have them in the future. His language skills should include English and Arabic. In terms of lifestyle, he should be a non-drinker, non-smoker, not use marijuana or other drugs, and should be active in exercise. He should have similar values and interests, which are: family, career, religion, cooking, travel, and fitness. His education level should either be graduate or doctoral. He must work in one of the following fields: Healthcare, Engineering, or Education and share a moderate political viewpoint.",
    "user_id": "4f22154f-8fc7-41b6-999d-261fa6015473"
}
