{
    "name": "Elena Ivanova",
    "age": 35,
    "height": "5'6\"",
    "school": "Moscow State University",
    "job_industry": "Healthcare",
    "job_title": "Physician",
    "hometown_location": "Moscow, Russia",
    "dating_location": "Los Angeles, California",
    "languages_spoken": [
        "Russian",
        "English"
    ],
    "values": [
        "Education",
        "Honesty",
        "Adventure"
    ],
    "interests": [
        "Cooking",
        "Reading",
        "Music",
        "Hiking"
    ],
    "education_level": "Doctoral",
    "religious_beliefs": "Agnostic",
    "politics": "Liberal",
    "dating_intentions": "Life partner",
    "relationship_type": "Monogamy",
    "gender": "Woman",
    "pronouns": "She/Her/Hers",
    "sexuality": "Straight",
    "ethnicity": "White Caucasian",
    "has_children": false,
    "want_children": true,
    "pets": [
        "Cat"
    ],
    "zodiac_sign": "Virgo",
    "mbti_personality_type": "INFJ",
    "drinking": "Sometimes",
    "smoking": "No",
    "marijuana": "No",
    "drugs": "No",
    "exercise": "Active",
    "partner_preferences": {
        "minimum_age": 33,
        "maximum_age": 45,
        "minimum_height": "5'8\"",
        "maximum_height": "6'3\"",
        "has_children": false,
        "want_children": true,
        "sexuality": "Straight",
        "drinking": "Yes",
        "smoking": "No",
        "marijuana": "No",
        "drugs": "No",
        "exercise": "Active"
    },
    "summary": "Elena Ivanova is a 35 year old woman and healthcare professional from Moscow, Russia, currently residing in Los Angeles, California. Professionally, she serves as a Physician and appreciates the virtues of education, honesty, and adventure. Elena holds a doctoral degree and identifies as agnostic and liberal in her religious and political affiliations. She is seeking a life partner and is open to starting a family in the future as she doesn't have any children but desires to have some. Her interests are diverse and include cooking, reading, music, and hiking. A lover of cats, Elena exercises religiously, doesn't smoke, and indulges in drinks occasionally. As a Virgo and an INFJ, Elena is looking for a straight man between the ages of 33-45 who is also active, a non-smoker, open to having children, and shares her love for cats.\n",
    "user_id": "03527613-fa9e-4b08-b433-5d41e5b15738"
}
