{
    "name": "Sophia Sanchez",
    "age": 28,
    "height": "5'6\"",
    "school": "University of California, Los Angeles",
    "job_industry": "Healthcare",
    "job_title": "Nurse Practitioner",
    "hometown_location": "San Gabriel, California",
    "dating_location": "Los Angeles, California",
    "languages_spoken": [
        "English",
        "Spanish"
    ],
    "values": [
        "Family",
        "Ethics",
        "Work-life balance"
    ],
    "interests": [
        "Hiking",
        "Photography",
        "Yoga"
    ],
    "education_level": "Graduate",
    "religious_beliefs": "Catholic",
    "politics": "Moderate",
    "dating_intentions": "Life partner",
    "relationship_type": "Monogamy",
    "gender": "Woman",
    "pronouns": "She/Her/Hers",
    "sexuality": "Straight",
    "ethnicity": "Hispanic/Latino",
    "has_children": false,
    "want_children": true,
    "pets": [
        "Dog"
    ],
    "zodiac_sign": "Virgo",
    "mbti_personality_type": "INFJ",
    "drinking": "Sometimes",
    "smoking": "No",
    "marijuana": "No",
    "drugs": "No",
    "exercise": "Active",
    "partner_preferences": {
        "minimum_age": 28,
        "maximum_age": 35,
        "minimum_height": "5'8\"",
        "maximum_height": "6'2\"",
        "has_children": false,
        "want_children": true,
        "sexuality": "Straight",
        "drinking": "Yes",
        "smoking": "No",
        "marijuana": "No",
        "drugs": "No",
        "exercise": "Active"
    },
    "summary": "Sophia Sanchez is a 28-year-old woman based in Los Angeles, California. She is a Nurse Practitioner in the Healthcare industry and a graduate of the University of California, Los Angeles. Sophia comes from a Hispanic/Latino background, and she speaks both English and Spanish. Her values range from family orientation to maintaining a concentration on work-life balance.\n\nSophia identifies as a straight woman (pronouns are She/Her/Hers), and she's focused on potentially finding a life partner for a monogamous relationship. She doesn't currently have children but is open to having them in the future. She is an active person, often found hiking, doing yoga, or indulging her love of photography.\n\nA Catholic with moderate political beliefs, she's a non-smoking occasional social drinker who doesn't use marijuana or other drugs. Sophia shares her life with her dog, and her ideal partner would share similar habits regarding lifestyle choices and future goals. They would be a heterosexual man aged between 28 and 35, leading an active lifestyle and sharing Sophia's wish for children. He preferably wouldn't already have children, would be a non-smoker, and wouldn't use recreational drugs.",
    "user_id": "898ba6da-0242-4e03-8466-8e0674fee1c8"
}
