{
    "name": "Alex Lee",
    "age": 29,
    "height": "5'10\"",
    "school": "University of California, Berkeley",
    "job_industry": "Software",
    "job_title": "Full Stack Developer",
    "hometown_location": "San Francisco, California",
    "dating_location": "Los Angeles, California",
    "languages_spoken": [
        "English",
        "Korean"
    ],
    "values": "Dedication, Hard Work, Integrity",
    "interests": "Traveling, Hiking, Music, Technology",
    "education_level": "Graduate",
    "religious_beliefs": "Atheist",
    "politics": "Liberal",
    "dating_intentions": "Life partner",
    "relationship_type": "Monogamy",
    "gender": "Man",
    "pronouns": "He/Him/His",
    "sexuality": "Straight",
    "ethnicity": "East Asian",
    "has_children": false,
    "want_children": true,
    "pets": [
        "Dog",
        "Reptile"
    ],
    "zodiac_sign": "Leo",
    "mbti_personality_type": "ENTJ",
    "drinking": "Sometimes",
    "smoking": "No",
    "marijuana": "No",
    "drugs": "No",
    "exercise": "Active",
    "partner_preferences": {
        "minimum_age": 24,
        "maximum_age": 35,
        "minimum_height": "5'4\"",
        "maximum_height": "6'1\"",
        "has_children": false,
        "want_children": true,
        "sexuality": "Straight",
        "drinking": "No",
        "smoking": "No",
        "marijuana": "No",
        "drugs": "No",
        "exercise": "Sometimes"
    },
    "summary": "Alex Lee is a 29-year-old man who originally hails from San Francisco, California, and currently resides in Los Angeles, California. He is a full stack developer in the software industry and holds a degree from the University of California, Berkeley. With dedication, hard work, and integrity as his core values, Alex is passionate about traveling, hiking, music, and technology. \n\nHe identifies as a straight East Asian man, and his pronouns are he/him/his. Identity-wise, Alex is an atheist and holds liberal political beliefs. He is a Leo as per his zodiac sign and an ENTJ according to the Myers Briggs personality type.\n\nAlex is a non-smoker and drinks occasionally. He is active in terms of exercise and keeps pets - a dog and a reptile. Despite not having children, Alex is open to the idea of having children in the future.\n\nIn terms of his ideal partner, Alex is interested in monogamy with a straight woman aged between 24 and 35, who is at least 5'4\" and at most 6'1\". His potential partner should also desire children in the future, must not smoke, and must exercise at least occasionally. Drinking and use of marijuana or other drugs are deal-breakers for him.",
    "user_id": "fea8a0f8-183a-49cb-897e-ba5ad910ebae"
}
