{
    "name": "Anaya Naidoo",
    "age": 28,
    "height": "5'5\"",
    "school": "University of Pretoria",
    "job_industry": "Software",
    "job_title": "Software Engineer",
    "hometown_location": "Durban, South Africa",
    "dating_location": "Los Angeles, California",
    "languages_spoken": [
        "English",
        "Afrikaans",
        "Zulu"
    ],
    "values": [
        "Family",
        "Ambition",
        "Kindness"
    ],
    "interests": [
        "Cooking",
        "Hiking",
        "Art"
    ],
    "education_level": "Graduate",
    "religious_beliefs": "Hindu",
    "politics": "Liberal",
    "dating_intentions": "Long term",
    "relationship_type": "Monogamy",
    "gender": "Woman",
    "pronouns": "She/Her/Hers",
    "sexuality": "Straight",
    "ethnicity": "South Asian",
    "has_children": false,
    "want_children": true,
    "pets": [
        "None"
    ],
    "zodiac_sign": "Libra",
    "mbti_personality_type": "INFJ",
    "drinking": "Sometimes",
    "smoking": "No",
    "marijuana": "No",
    "drugs": "No",
    "exercise": "Active",
    "partner_preferences": {
        "minimum_age": 27,
        "maximum_age": 35,
        "minimum_height": "5'7\"",
        "maximum_height": "6'2\"",
        "has_children": false,
        "want_children": true,
        "sexuality": "Straight",
        "drinking": "Sometimes",
        "smoking": "No",
        "marijuana": "No",
        "drugs": "No",
        "exercise": "Active"
    },
    "summary": "Anaya Naidoo is a 28-year-old Software Engineer originally from Durban, South Africa, and currently living in Los Angeles, California. She pursued her higher education at the University of Pretoria. She fluidly speaks English, Afrikaans, and Zulu. \n\nDescribed as a person who values family, ambition, and kindness, Anaya finds her joy in cooking, hiking, and art. She identifies as a Hindu and holds liberal political views. She is looking for a long-term relationship and prefers monogamy.\n\nIn terms of identity, Anaya is a straight South Asian woman who uses She/Her/Hers pronouns. She doesn't have any children but expresses a desire to have them in the future. She does not have any pets. As a Libra and an INFJ, Anaya perhaps exhibits a sense of balance, harmony, and introspective nature in her relations.\n\nShe does consume alcohol occasionally but refrains from smoking, and drug usage, including marijuana. Anay is active when it comes to maintaining her fitness.\n\nAnaya values similar habits and qualities in a potential partner. She prefers someone who is between the ages of 27 and 35, and who is at least 5'7\" tall. She desires someone who is active, does not smoke or use drugs, and is looking forward to having children just like her.",
    "user_id": "8415c02f-08db-418a-9ecb-10df70c71093"
}
