{
    "name": "Mai Nguyen",
    "age": 28,
    "height": "5'6\"",
    "school": "University of California, Berkeley",
    "job_industry": "Technology",
    "job_title": "Software Developer",
    "hometown_location": "San Diego, California",
    "dating_location": "Los Angeles, California",
    "languages_spoken": [
        "English",
        "Vietnamese"
    ],
    "values": [
        "Family",
        "Equality",
        "Creativity"
    ],
    "interests": [
        "Reading",
        "Coding",
        "Hiking",
        "Cooking"
    ],
    "education_level": "Graduate",
    "religious_beliefs": "Buddhist",
    "politics": "Liberal",
    "dating_intentions": "Long term",
    "relationship_type": "Monogamy",
    "gender": "Woman",
    "pronouns": "She/Her/Hers",
    "sexuality": "Straight",
    "ethnicity": "Southeast Asian",
    "has_children": false,
    "want_children": true,
    "pets": [
        "Cat"
    ],
    "zodiac_sign": "Scorpio",
    "mbti_personality_type": "INTJ",
    "drinking": "Sometimes",
    "smoking": "No",
    "marijuana": "No",
    "drugs": "No",
    "exercise": "Active",
    "partner_preferences": {
        "minimum_age": 27,
        "maximum_age": 35,
        "minimum_height": "5'8\"",
        "maximum_height": "6'2\"",
        "has_children": false,
        "want_children": true,
        "sexuality": "Straight",
        "drinking": "Yes",
        "smoking": "No",
        "marijuana": "No",
        "drugs": "No",
        "exercise": "Active"
    },
    "summary": "Mai Nguyen is a 28-year-old software developer from San Diego, California, currently living in Los Angeles. She studied at the University of California, Berkeley and speaks both English and Vietnamese. Her core values incorporate the importance of family, equality, and creativity. \n\nMai enjoys a diverse array of activities including reading, coding, hiking, and cooking. She is a Buddhist and identifies with a liberal political ideology. Mai seeks a long-term monogamous relationship. She identifies as a straight woman and uses the pronouns she/her/hers. \n\nMai, being of Southeast Asian background, does not have children but does wish to start a family in the future. She has a cat and her zodiac sign is Scorpio. According to the Myers-Briggs Type Indicator (MBTI), she is an INTJ type personality. She enjoys having a drink occasionally but does not smoke or use marijuana or other drugs. Mai remains active through regular exercise.\n\nAs for her preferences in a partner, Mai is interested in straight men between the ages of 27 and 35, with a height between 5'8\" and 6'2\". Her partner should not have children but should want them in the future. He should be comfortable with drinking occasionally but not smoke or use marijuana or other drugs. A commitment to an active lifestyle is also important to Mai.",
    "user_id": "42baf210-e103-4f8c-86f9-73f49a7d3137"
}
