{
    "name": "Anne Garcia",
    "age": 31,
    "height": "5'3\"",
    "school": "University of California, Los Angeles",
    "job_industry": "Technology",
    "job_title": "Software Developer",
    "hometown_location": "Santa Fe, New Mexico",
    "dating_location": "Los Angeles, California",
    "languages_spoken": [
        "English",
        "Spanish"
    ],
    "values": "Environmental conservation, Social equality, Lifelong learning",
    "interests": "Coding, Biking, Travel, Cooking",
    "education_level": "Graduate",
    "religious_beliefs": "Agnostic",
    "politics": "Liberal",
    "dating_intentions": "Life partner",
    "relationship_type": "Monogamy",
    "gender": "Woman",
    "pronouns": "She/Her/Hers",
    "sexuality": "Straight",
    "ethnicity": "Hispanic/Latino",
    "has_children": false,
    "want_children": true,
    "pets": [
        "Dog"
    ],
    "zodiac_sign": "Virgo",
    "mbti_personality_type": "INTJ",
    "drinking": "Yes",
    "smoking": "No",
    "marijuana": "No",
    "drugs": "No",
    "exercise": "Active",
    "partner_preferences": {
        "minimum_age": 30,
        "maximum_age": 40,
        "minimum_height": "5'3\"",
        "maximum_height": "6'4\"",
        "has_children": false,
        "want_children": true,
        "sexuality": "Straight",
        "drinking": "Yes",
        "smoking": "No",
        "marijuana": "No",
        "drugs": "No",
        "exercise": "Active"
    },
    "summary": "Anne Garcia is a 31-year-old software developer working in the technology sector. She is Latino/Hispanic and identifies as a straight woman, using the pronouns she/her. Anne completed her graduate studies at the University of California, Los Angeles and currently lives in LA. She hails from Santa Fe, New Mexico and speaks both English and Spanish. \n\nHer interests include coding, biking, traveling, and cooking, with values rooted in environmental conservation, social equality, and lifelong learning. Anne is politically liberal, agnostic and is looking for a life partner in a monogamous relationship. She does not currently have children but is open to having them in the future. \n\nAnne also leads an active lifestyle, drinks socially, doesn't smoke or use marijuana. She owns a pet dog, falls under the Virgo zodiac sign, and identifies as an INTJ personality type.\n\nHer desired partner would be a straight man, within the age range of 30 to 40 years. He should lead an active lifestyle, be open to having children, and prefer not to smoke or use marijuana. Drinking is acceptable to her.",
    "user_id": "ce702fc6-4b78-4bfd-8ebe-1cf5e8f2f2c5"
}
