{
    "name": "Alejandro Martinez",
    "age": 28,
    "height": "5'10\"",
    "school": "University of California, Los Angeles",
    "job_industry": "Finance",
    "job_title": "Investment Banker",
    "hometown_location": "Anaheim, California",
    "dating_location": "Los Angeles, California",
    "languages_spoken": [
        "English",
        "Spanish",
        "Portuguese"
    ],
    "values": [
        "Family-oriented",
        "Career-driven",
        "Fitness"
    ],
    "interests": [
        "Traveling",
        "Running",
        "Reading"
    ],
    "education_level": "Graduate",
    "religious_beliefs": "Catholic",
    "politics": "Moderate",
    "dating_intentions": "Life partner",
    "relationship_type": "Monogamy",
    "gender": "Man",
    "pronouns": "He/Him/His",
    "sexuality": "Straight",
    "ethnicity": "Hispanic/Latino",
    "has_children": false,
    "want_children": true,
    "pets": [
        "Dog"
    ],
    "zodiac_sign": "Gemini",
    "mbti_personality_type": "ENTJ",
    "drinking": "Sometimes",
    "smoking": "No",
    "marijuana": "No",
    "drugs": "No",
    "exercise": "Active",
    "partner_preferences": {
        "minimum_age": 24,
        "maximum_age": 30,
        "minimum_height": "5'2\"",
        "maximum_height": "5'10\"",
        "has_children": false,
        "want_children": true,
        "sexuality": "Straight",
        "drinking": "Sometimes",
        "smoking": "No",
        "marijuana": "No",
        "drugs": "No",
        "exercise": "Active"
    },
    "summary": "Alejandro Martinez is a 28-year-old straight man residing in Los Angeles, California. He is an Investment Banker in the Finance industry, having graduated from University of California, Los Angeles. He is fluent in English, Spanish, and Portuguese. He identifies as Catholic and politically moderate. Alejandro is deeply driven by family values, his career, and fitness. He has interests in traveling, running, and reading. \n\nAlejandro is a Gemini, with an MBTI personality type of ENTJ and carries an active exercise habit. He occasionally drinks but does not smoke or use marijuana or any drugs. Having no children as of now, Alejandro is looking to have children in the future. He is a proud owner of a dog. \n\nFor a future partner, Alejandro is looking for a straight woman who is within the age range of 24-30 years and height of 5'2\" - 5'10\". He prefers someone who doesn\u2019t smoke but drinks sometimes similar to himself. His prospective partner should share the same enthusiasm for fitness and also wish to have children in the future.",
    "user_id": "ace21faa-8c41-4892-bb50-c6b0c5238454"
}
