{"name": "Fatima Al-Mansoori", "age": 30, "height": "5'4\"", "school": "University of Dubai", "job_industry": "Healthcare", "job_title": "Pharmacist", "hometown_location": "Dubai, United Arab Emirates", "dating_location": "Los Angeles, California", "languages_spoken": ["Arabic", "English"], "values": ["Charity", "Family", "Knowledge"], "interests": ["Reading", "Fitness", "Cooking"], "education_level": "Graduate", "religious_beliefs": "Muslim", "politics": "Moderate", "dating_intentions": "Long term", "relationship_type": "Monogamy", "gender": "Woman", "pronouns": "She/Her/Hers", "sexuality": "Straight", "ethnicity": "Middle Eastern", "has_children": false, "want_children": true, "pets": ["None"], "zodiac_sign": "Aquarius", "mbti_personality_type": "ISFJ", "drinking": "No", "smoking": "No", "marijuana": "No", "drugs": "No", "exercise": "Active", "partner_preferences": {"minimum_age": 30, "maximum_age": 40, "minimum_height": "5'8\"", "maximum_height": "6'2\"", "has_children": false, "want_children": true, "sexuality": "Straight", "drinking": "No", "smoking": "No", "marijuana": "No", "drugs": "No", "exercise": "Active"}, "summary": "Fatima Al-Mansoori is a 30-year-old woman of Middle Eastern ethnicity from Dubai, currently residing in Los Angeles. As a graduate of the University of Dubai, she has made a career in the healthcare industry as a pharmacist. Fatima is a practicing Muslim with moderate political views and her core values revolve around charity, family, and knowledge. She enjoys interests such as reading, fitness, and cooking. \n\nShe's looking for a straight man who is serious about long-term relationships, between the ages of 30 and 40. Preferred traits in her potential partner include being active, non-drinking, non-smoking, and also wanting children in the future, as she currently doesn't have children but wishes to in the future. \n\nShe's a non-smoker, doesn't drink or use drugs, and leads an active lifestyle. She's an Aquarius and identifies as an ISFJ personality type.", "user_id": "2183495b-137a-41d2-9668-5ee755073680"}
{"name": "Priyanka Nair", "age": 30, "height": "5'6\"", "school": "University of Mumbai", "job_industry": "Healthcare", "job_title": "Physical Therapist", "hometown_location": "Mumbai, India", "dating_location": "Los Angeles, California", "languages_spoken": ["English", "Hindi", "Marathi"], "values": ["Family", "Health & Fitness", "Career"], "interests": ["Reading", "Yoga"], "education_level": "Graduate", "religious_beliefs": "Hindu", "politics": "Liberal", "dating_intentions": "Long term", "relationship_type": "Monogamy", "gender": "Woman", "pronouns": "She/Her/Hers", "sexuality": "Straight", "ethnicity": "South Asian", "has_children": false, "want_children": true, "pets": ["Dog"], "zodiac_sign": "Gemini", "mbti_personality_type": "ENFJ", "drinking": "Sometimes", "smoking": "No", "marijuana": "No", "drugs": "No", "exercise": "Active", "partner_preferences": {"minimum_age": 28, "maximum_age": 36, "minimum_height": "5'7\"", "maximum_height": "6'3\"", "has_children": false, "want_children": true, "sexuality": "Straight", "drinking": "Sometimes", "smoking": "No", "marijuana": "No", "drugs": "No", "exercise": "Sometimes"}, "summary": "Priyanka Nair is a 30-year-old Physical Therapist from Mumbai, India and is currently living in Los Angeles, California. She is a graduate from the University of Mumbai and values family, health and fitness, and her career. She enjoys reading and yoga in her leisurely time. She's primarily a speaker of English but can also converse in Hindi and Marathi. She identifies as a Hindu, with political views leaning liberally. She has no children, but would like some in the near future. She owns a dog and, according to her MBTI personality index, is an ENFJ. Priyanka drinks occasionally, doesn't smoke, and does not use drugs or marijuana. As for physical exercise, she maintains an active lifestyle.\n\nOn the partner front, Priyanka is looking for a monogamous, heterosexual relationship with an intention of being long term. The man she's looking for is also a straight individual aged between 28 and 36 years who values fitness, does not smoke, and is partial to occasional drinking at most. He should not have children but want some in the future. Ideally, he should be someone who stands at a height ranging from 5'7\" to 6'3\".", "user_id": "bd541401-add7-4570-ad34-e5c7a625a0b5"}
{"name": "James McGregor", "age": 32, "height": "6'1\"", "school": "University of Glasgow", "job_industry": "Technology", "job_title": "Software Engineer", "hometown_location": "Glasgow, Scotland", "dating_location": "Los Angeles, California", "languages_spoken": ["English", "Gaelic"], "values": ["Honesty", "Kindness", "Ambition"], "interests": ["Hiking", "Music", "Philosophy"], "education_level": "Graduate", "religious_beliefs": "Agnostic", "politics": "Liberal", "dating_intentions": "Long term", "relationship_type": "Monogamy", "gender": "Man", "pronouns": "He/Him/His", "sexuality": "Straight", "ethnicity": "White Caucasian", "has_children": false, "want_children": true, "pets": ["Dog"], "zodiac_sign": "Aquarius", "mbti_personality_type": "INTP", "drinking": "Sometimes", "smoking": "No", "marijuana": "No", "drugs": "No", "exercise": "Active", "partner_preferences": {"minimum_age": 28, "maximum_age": 35, "minimum_height": "5'0\"", "maximum_height": "6'2\"", "has_children": false, "want_children": true, "sexuality": "Straight", "drinking": "Sometimes", "smoking": "No", "marijuana": "No", "drugs": "No", "exercise": "Active"}, "summary": "James McGregor is a 32-year-old straight man living in Los Angeles, California. Originally from Glasgow, Scotland, he is fluent in English and Gaelic. He works in the tech industry as a Software Engineer and is a graduate of the University of Glasgow. Key values for James include honesty, kindness, and ambition. \n\nIn his free time, he enjoys hiking, music, and philosophy. Politically, he identifies as liberal and religiously as agnostic. He is interested in a long-term, monogamous relationship and wants children in the future. He is an Aquarius and an INTP personality type.\n\nHis lifestyle is active, though he occasionally enjoys a drink, he does not indulge in smoking tobacco or marijuana, and does not use drugs. His ideal partner would be someone aged between 28 and 35 who shares his aspiration for kids and his active, non-smoking lifestyle.", "user_id": "0a4150c7-007b-44ff-b903-cebe4f2c3b3b"}
{"name": "Mei Chen", "age": 28, "height": "5'4\"", "school": "University of California, Los Angeles", "job_industry": "Technology", "job_title": "Software Engineer", "hometown_location": "Shanghai, China", "dating_location": "Los Angeles, California", "languages_spoken": ["English", "Mandarin"], "values": ["Honesty", "Career Success", "Fitness"], "interests": ["Cooking", "Traveling", "Hiking"], "education_level": "Graduate", "religious_beliefs": "Buddhist", "politics": "Moderate", "dating_intentions": "Long term", "relationship_type": "Monogamy", "gender": "Woman", "pronouns": "She/Her/Hers", "sexuality": "Straight", "ethnicity": "East Asian", "has_children": false, "want_children": true, "pets": ["None"], "zodiac_sign": "Leo", "mbti_personality_type": "INTP", "drinking": "Sometimes", "smoking": "No", "marijuana": "No", "drugs": "No", "exercise": "Active", "partner_preferences": {"minimum_age": 28, "maximum_age": 35, "minimum_height": "5'7\"", "maximum_height": "6'4\"", "has_children": false, "want_children": true, "sexuality": "Straight", "drinking": "Sometimes", "smoking": "No", "marijuana": "No", "drugs": "No", "exercise": "Active"}, "summary": "Mei Chen is a 28-year-old software engineer, straight woman from Los Angeles, California who originally hails from Shanghai, China. She's educated with a graduate degree from the University of California, Los Angeles. Her religious beliefs are Buddhist and politically she identifies as moderate. She's an INTP with a Leo zodiac sign. Mei places high value on honesty, career success, and fitness. Her interests include cooking, hiking, and traveling. She speaks both English and Mandarin.\n\nIn terms of lifestyle, she's sometimes enjoys a drink but doesn't smoke, use marijuana, or drugs, and stays active with exercise. Mei doesn't have children but she does want to in the future. She's interested in a long-term monogamous relationship. \n\nHer preferred partner should be a straight man, between the ages of 28 and 35, who matches her lifestyle habits. He should also want children in the future.", "user_id": "67ffabf2-516e-416f-99e2-9a954b58348e"}
{"name": "Carlos Rodriguez", "age": 33, "height": "5'10\"", "school": "University of California, Los Angeles", "job_industry": "Entertainment", "job_title": "Film Producer", "hometown_location": "Los Angeles, California", "dating_location": "Los Angeles, California", "languages_spoken": ["English", "Spanish"], "values": ["Honesty", "Empathy", "Respect"], "interests": ["Cinema", "Travel", "Hiking"], "education_level": "Undergraduate", "religious_beliefs": "Christian", "politics": "Moderate", "dating_intentions": "Long term", "relationship_type": "Monogamy", "gender": "Man", "pronouns": "He/Him/His", "sexuality": "Straight", "ethnicity": "Hispanic/Latino", "has_children": false, "want_children": true, "pets": ["Dog"], "zodiac_sign": "Aries", "mbti_personality_type": "ENTJ", "drinking": "Sometimes", "smoking": "No", "marijuana": "No", "drugs": "No", "exercise": "Active", "partner_preferences": {"minimum_age": 25, "maximum_age": 35, "minimum_height": "5'2\"", "maximum_height": "5'10\"", "has_children": false, "want_children": true, "sexuality": "Straight", "drinking": "Yes", "smoking": "No", "marijuana": "No", "drugs": "No", "exercise": "Active"}, "summary": "Carlos Rodriguez is a 33-year-old film producer born and raised in Los Angeles, California. With a height of 5'10\", he is an active person who enjoys cinema, travel, and hiking. Carlos can fluently speak English and Spanish and attended the University of California, Los Angeles. Values that Carlos holds in high regard are honesty, empathy, and respect. \n\nHe is Christian, has a moderate political view, and identifies as heterosexual. Carlos uses \"he/him/his\" pronouns and comes from a Hispanic/Latino background. Although he doesn't have any children, he is open to having them in the future. He shares his home with a dog. \n\nTypical of an Aries, Carlos is an ENTJ, a decisive, ambitious, and strong-willed personality type. As for lifestyle choices, he occasionally drinks but doesn't smoke or use marijuana. \n\nCarlos is looking for a long-term, monogamous relationship with a straight woman between the ages of 25 and 35. He prefers a partner who enjoys being active, might want children in the future, and understands a smoke and drug-free lifestyle.", "user_id": "246686a9-e07e-45ab-9156-67c7dea0e78d"}
{"name": "Naomi Johnson", "age": 32, "height": "5'6\"", "school": "University of California, San Diego", "job_industry": "Healthcare", "job_title": "Pediatric Nurse", "hometown_location": "New York, New York", "dating_location": "Los Angeles, California", "languages_spoken": ["English", "Spanish"], "values": ["Family", "Kindness", "Hard Work"], "interests": ["Photography", "Traveling", "Volunteering"], "education_level": "Graduate", "religious_beliefs": "Christian", "politics": "Moderate", "dating_intentions": "Long term", "relationship_type": "Monogamy", "gender": "Woman", "pronouns": "She/Her/Hers", "sexuality": "Straight", "ethnicity": "Black African Descent", "has_children": false, "want_children": true, "pets": ["Dog"], "zodiac_sign": "Scorpio", "mbti_personality_type": "ENFJ", "drinking": "Sometimes", "smoking": "No", "marijuana": "No", "drugs": "No", "exercise": "Active", "partner_preferences": {"minimum_age": 30, "maximum_age": 40, "minimum_height": "5'8\"", "maximum_height": "6'1\"", "has_children": false, "want_children": true, "sexuality": "Straight", "drinking": "Yes", "smoking": "No", "marijuana": "No", "drugs": "No", "exercise": "Active"}, "summary": "Naomi Johnson is a 32-year-old Pediatric Nurse originally from New York, now residing in Los Angeles, California. She is a graduate from the University of California, San Diego and is fluent in both English and Spanish. With core values rooted in Family, Kindness, and Hard Work, Naomi sees herself engaged in long-term, monogamous dating intentions. She identifies as a straight woman of Black African descent, uses she/her/hers pronouns and doesn't have children but wishes to have some in the future. Her interests range from Photography, Traveling to Volunteering. Naomi's matchups must fall between the age of 30-40 and preferably non-smokers. Her preference extends to men who exercise regularly and share her desire of eventually wanting children. As a Christian and Moderate politically, she owns a dog, is an occasional drinker, doesn't smoke, and doesn't engage with drugs or marijuana. She belongs to Scorpio zodiac and identifies as ENFJ as per MBTI personality type.", "user_id": "718ecf88-343c-42a4-a8b0-cdb30db7a381"}
{"name": "Keiko Yamamoto", "age": 29, "height": "5'7\"", "school": "University of Tokyo", "job_industry": "Technology", "job_title": "Software Developer", "hometown_location": "Kyoto, Japan", "dating_location": "Los Angeles, California", "languages_spoken": ["Japanese", "English"], "values": ["Hard work", "Empathy", "Independence"], "interests": ["Coding", "Anime", "Rock climbing"], "education_level": "Graduate", "religious_beliefs": "Atheist", "politics": "Moderate", "dating_intentions": "Long term", "relationship_type": "Monogamy", "gender": "Woman", "pronouns": "She/Her/Hers", "sexuality": "Straight", "ethnicity": "East Asian", "has_children": false, "want_children": true, "pets": ["Cat"], "zodiac_sign": "Scorpio", "mbti_personality_type": "INTJ", "drinking": "No", "smoking": "No", "marijuana": "No", "drugs": "No", "exercise": "Active", "partner_preferences": {"minimum_age": 28, "maximum_age": 35, "minimum_height": "5'5\"", "maximum_height": "6'3\"", "has_children": false, "want_children": true, "sexuality": "Straight", "drinking": "No", "smoking": "No", "marijuana": "No", "drugs": "No", "exercise": "Active"}, "summary": "Keiko Yamamoto is a 29-year-old, atheistic, straight woman, originally from Kyoto, Japan but currently living in Los Angeles, California. She's a software developer in the tech industry who values hard work, empathy, and independence. Her interests include coding, anime, and rock climbing. Keiko is a graduate of the University of Tokyo and speaks both Japanese and English. She's politically moderate and has no children but would like to have some in the future. Keiko owns a cat, is an active Scorpion woman, and her Myers-Briggs type is INTJ. She doesn't smoke, drink, or use marijuana and drugs. Through the dating platform, Keiko is looking for a long-term, monogamous relationship with a straight man between the ages of 28 and 35, at least 5'5\" and not taller than 6'3\". Her ideal partner, who should share her active lifestyle, should not currently have children but must also want them in the future and lead a life free of smoking, drinking, marijuana, and drugs.", "user_id": "9f2feb25-8e9e-4708-956a-98fb7a9fe64d"}
{"name": "Emily Chen", "age": 28, "height": "5'6\"", "school": "New York University", "job_industry": "Tech", "job_title": "Software Developer", "hometown_location": "San Francisco, California", "dating_location": "Los Angeles, California", "languages_spoken": ["English", "Mandarin"], "values": ["Family", "Career progression", "Health and wellness"], "interests": ["Traveling", "Cooking", "Reading", "Hiking"], "education_level": "Graduate", "religious_beliefs": "Buddhist", "politics": "Moderate", "dating_intentions": "Long term", "relationship_type": "Monogamy", "gender": "Woman", "pronouns": "She/Her/Hers", "sexuality": "Straight", "ethnicity": "East Asian", "has_children": false, "want_children": true, "pets": ["Cat"], "zodiac_sign": "Virgo", "mbti_personality_type": "INTJ", "drinking": "Sometimes", "smoking": "No", "marijuana": "No", "drugs": "No", "exercise": "Active", "partner_preferences": {"minimum_age": 28, "maximum_age": 35, "minimum_height": "5'8\"", "maximum_height": "6'2\"", "has_children": false, "want_children": true, "sexuality": "Straight", "drinking": "Yes", "smoking": "No", "marijuana": "No", "drugs": "No", "exercise": "Active"}, "summary": "Emily Chen is a 28-year-old straight woman living in Los Angeles, California. A software developer by profession, she values her family, career progression, and health and wellness. She enjoys traveling, cooking, reading, and hiking while also appreciating her East Asian heritage. She speaks both English and Mandarin fluently. Emily holds a graduate degree from New York University. She is a practicing Buddhist and politically a moderate. Her relationship goal is long-term monogamy. Emily doesn't have children but would like to have some in the future. She owns a cat, doesn't smoke, occasionally drinks, and does not engage in drug use. She maintains an active health and fitness routine. She is interested in meeting straight men between 28 and 35 who have similar values and lifestyle preferences, who don't smoke, don't do drugs, are open to having children, and stay active.\n", "user_id": "c9069918-454f-4028-bae3-ce7f6e46db9e"}
{"name": "Jacob Goldstein", "age": 28, "height": "5'10\"", "school": "Columbia University", "job_industry": "Software", "job_title": "Software Engineer", "hometown_location": "Bronx, New York", "dating_location": "Los Angeles, California", "languages_spoken": ["English", "Hebrew"], "values": ["Family", "Career Growth", "Education"], "interests": ["Cooking", "Traveling", "Reading", "Tech"], "education_level": "Graduate", "religious_beliefs": "Jewish", "politics": "Liberal", "dating_intentions": "Life partner", "relationship_type": "Monogamy", "gender": "Man", "pronouns": "He/Him/His", "sexuality": "Straight", "ethnicity": "White Caucasian", "has_children": false, "want_children": true, "pets": ["None"], "zodiac_sign": "Libra", "mbti_personality_type": "INTJ", "drinking": "Yes", "smoking": "No", "marijuana": "No", "drugs": "No", "exercise": "Active", "partner_preferences": {"minimum_age": 24, "maximum_age": 30, "minimum_height": "5'4\"", "maximum_height": "5'11\"", "has_children": false, "want_children": true, "sexuality": "Straight", "drinking": "Yes", "smoking": "No", "marijuana": "No", "drugs": "No", "exercise": "Active"}, "summary": "Jacob Goldstein is a 28-year-old, 5'10\" tall software engineer originally from the Bronx. He graduated from Columbia University and is currently living and working in Los Angeles, California. Jacob values family, career growth, and education, and in his spare time, he enjoys cooking, traveling and reading. Being Jewish and liberal, Jacob is looking for a life partner with whom he can share a monogamous relationship. His preferred partner would also be looking to start a family in the future, just like him. He doesn't have any pets, he has occasional a drink but does not smoke or use drugs. As an active person, he appreciates a similar attribute in a partner. In terms of his preferred partner, he's seeking a straight woman between the ages of 24 and 30, who doesn't smoke, doesn't use drugs, leads an active life, and hopes for children in the future.", "user_id": "cb22e0c3-33e6-4864-8ff2-0a0a026c5517"}
{"name": "Jose Delgado", "age": 28, "height": "5'9\"", "school": "University of California, Los Angeles", "job_industry": "Technology", "job_title": "Software Engineer", "hometown_location": "Sacramento, California", "dating_location": "Los Angeles, California", "languages_spoken": ["English", "Spanish"], "values": ["Honesty", "Respect", "Loyalty"], "interests": ["Surfing", "Coding", "Travelling"], "education_level": "Graduate", "religious_beliefs": "Catholic", "politics": "Liberal", "dating_intentions": "Long term", "relationship_type": "Monogamy", "gender": "Man", "pronouns": "He/Him/His", "sexuality": "Straight", "ethnicity": "Hispanic/Latino", "has_children": false, "want_children": true, "pets": ["Dog"], "zodiac_sign": "Leo", "mbti_personality_type": "INTP", "drinking": "Sometimes", "smoking": "No", "marijuana": "No", "drugs": "No", "exercise": "Active", "partner_preferences": {"minimum_age": 24, "maximum_age": 30, "minimum_height": "5'4\"", "maximum_height": "6'0\"", "has_children": false, "want_children": true, "sexuality": "Straight", "drinking": "Sometimes", "smoking": "No", "marijuana": "No", "drugs": "No", "exercise": "Active"}, "summary": "The profile belongs to Jose Delgado, a 28-year-old straight man. He is 5'9\", Hispanic/Latino, and resides in Los Angeles, California. He is originally from Sacramento, California. As a software engineer in the technology industry, he is educated with a degree from the University of California, Los Angeles. He speaks both English and Spanish, highly values honesty, respect, and loyalty, and enjoys hobbies such as surfing, coding, and traveling. He identifies as a Catholic and a liberal. He is monogamous and is looking for a long-term relationship. He does not currently have children but wants some in the future. He has a dog, enjoys occasional drinking, but does not smoke or use any substances, including marijuana. He is active, hence exercises regularly and identifies as an INTP (Introverted, Intuitive, Thinking, Perceiving) in", "user_id": "1402f892-e04a-49c4-bfdf-1283b401348a"}
{"name": "Kimani Brown", "age": 32, "height": "5'7\"", "school": "University of California, Berkeley", "job_industry": "Entertainment", "job_title": "Video Editor", "hometown_location": "Oakland, California", "dating_location": "Los Angeles, California", "languages_spoken": ["English", "Spanish", "Swahili"], "values": "Honesty, Social equality, Compassion", "interests": "Documentary filmmaking, Music, Outdoor adventures", "education_level": "Graduate", "religious_beliefs": "Agnostic", "politics": "Liberal", "dating_intentions": "Long term, open to short", "relationship_type": "Monogamy", "gender": "Non binary", "pronouns": "They/Them/Their", "sexuality": "Other", "ethnicity": "Black African Descent", "has_children": false, "want_children": true, "pets": ["Cat"], "zodiac_sign": "Sagittarius", "mbti_personality_type": "ENFP", "drinking": "Sometimes", "smoking": "No", "marijuana": "No", "drugs": "No", "exercise": "Active", "partner_preferences": {"minimum_age": 28, "maximum_age": 38, "minimum_height": "5'0\"", "maximum_height": "6'2\"", "has_children": false, "want_children": true, "sexuality": "Other", "drinking": "Yes", "smoking": "No", "marijuana": "No", "drugs": "No", "exercise": "Active"}, "summary": "Kimani Brown, a 32-year-old Non-binary individual, resides in Los Angeles but was originally from Oakland. Kimani works as a Video Editor in the entertainment industry and holds a graduate degree from the University of California, Berkeley. Their interests include documentary filmmaking, listening to music, and adventuring outdoors. Though identifying as agnostic and politically liberal, Kimani places high importance on honesty, social equality, and compassion. They use They/Them/Their pronouns and speak English, Spanish, and Swahili fluently. \n\nAlthough Kimani doesn't have children, they sincerely hope to become a parent in the future. They love their cat, and enjoy healthy habits such as occasional drinking, not smoking, and being active physically. As a Sagittarius, and an ENFP from the Myers-Briggs Type Indicator, they are keen on finding a long-term relationship that could also work out in a short time frame. \n\nThey are interested in prospective partners between 28 and 38 years old who also want children. Non-smoking is a must, but are flexible about their partner's drinking habits. Exercise and activity are also a preferred trait in a partner. As Kimani identifies as \"Other\" regarding sexuality, they're open to others identifying similarly.", "user_id": "02192d31-eb99-4925-9dcf-98fe6f36f522"}
{"name": "Amara Davis", "age": 31, "height": "5'7\"", "school": "University of California, Berkeley", "job_industry": "Tech", "job_title": "Software Engineer", "hometown_location": "Oakland, California", "dating_location": "Los Angeles, California", "languages_spoken": ["English", "Spanish"], "values": "I value honesty, openness, understanding, and warmth.", "interests": "In my spare time, I like to explore new restaurants, operate my food blog, take outdoor hikes, and binge-watch crime documentaries.", "education_level": "Graduate", "religious_beliefs": "Agnostic", "politics": "Liberal", "dating_intentions": "Life partner", "relationship_type": "Monogamy", "gender": "Woman", "pronouns": "She/Her/Hers", "sexuality": "Gay", "ethnicity": "Black African Descent", "has_children": false, "want_children": true, "pets": ["Dog"], "zodiac_sign": "Leo", "mbti_personality_type": "ENFJ", "drinking": "Sometimes", "smoking": "No", "marijuana": "No", "drugs": "No", "exercise": "Active", "partner_preferences": {"minimum_age": 28, "maximum_age": 36, "minimum_height": "5'3\"", "maximum_height": "6'5\"", "has_children": false, "want_children": true, "sexuality": "Gay", "drinking": "Yes", "smoking": "No", "marijuana": "No", "drugs": "No", "exercise": "Active"}, "summary": "Amara Davis is a 31-year-old software engineer working in the tech industry. She is a graduate from the University of California, Berkeley and currently lives in Los Angeles, California. In her spare time, she likes to try new restaurants, operate her food blog, go for outdoor hikes, and watch crime documentaries. Amara identifies as a gay woman and uses she/her/hers pronouns. She is open to monogamous relationship and is keen on finding a life partner. She does not have children but looks forward to having some in the future. She does occasionally drink but is against smoking, marijuana, and drugs, and she keeps herself active. She is seeking a partner who is between 28-36 years old, doesn't smoke, and stays active like her. Amara's partner should be open to having children in the future, and they ought to identify as gay. Amara is a dog lover with Leo as her zodiac sign and has an ENFJ personality type as per the Myers-Briggs Type Indicator. She is also bilingual, fluent in both English and Spanish.", "user_id": "aab1a068-9010-4764-9d69-9089122f4461"}
{"name": "Aaliyah Ramirez", "age": 32, "height": "5'7\"", "school": "University of Florida", "job_industry": "Tech", "job_title": "Software Developer", "hometown_location": "Miami, Florida", "dating_location": "Los Angeles, California", "languages_spoken": ["English", "Spanish", "French"], "values": "Community, Family, Health & Fitness", "interests": "Travel, Cooking, Yoga, Hiking, Tech Innovation", "education_level": "Graduate", "religious_beliefs": "Other", "politics": "Liberal", "dating_intentions": "Long term", "relationship_type": "Monogamy", "gender": "Woman", "pronouns": "She/Her/Hers", "sexuality": "Straight", "ethnicity": "Hispanic/Latino", "has_children": false, "want_children": true, "pets": ["Dog"], "zodiac_sign": "Libra", "mbti_personality_type": "ENFJ", "drinking": "Sometimes", "smoking": "No", "marijuana": "No", "drugs": "No", "exercise": "Active", "partner_preferences": {"minimum_age": 32, "maximum_age": 40, "minimum_height": "5'10\"", "maximum_height": "6'4\"", "has_children": false, "want_children": true, "sexuality": "Straight", "drinking": "Sometimes", "smoking": "No", "marijuana": "No", "drugs": "No", "exercise": "Active"}, "summary": "Aaliyah Ramirez is a 32-year-old software developer originally from Miami, Florida but currently living in Los Angeles, California. She is a graduate from the University of Florida and is bilingual in English and Spanish, with a proficiency in French. Aaliyah values community, family, and health & fitness greatly in her life. Her main interests include traveling, cooking, yoga, hiking, and keeping up-to date with tech innovations. Aaliyah is liberal, has no children but wants some in future. She's an active woman who exercises often and likes to maintain a health-conscious lifestyle. She has a pet dog, belongs to the Libra zodiac sign, and her MBTI personality type is an ENFJ. She's seeking a relationship with a man within the age range of 32-40 years who shares similar lifestyle habits and relationship goals.", "user_id": "d99b049d-0b77-4289-b032-d3941385a975"}
{"name": "Jamie Lopez", "age": 31, "height": "5'7\"", "school": "University of California, Los Angeles", "job_industry": "Healthcare", "job_title": "Registered Nurse", "hometown_location": "San Diego, California", "dating_location": "Los Angeles, California", "languages_spoken": ["English", "Spanish"], "values": "Honesty, Empathy, Respect", "interests": "Yoga, Travel, Cooking", "education_level": "Graduate", "religious_beliefs": "Agnostic", "politics": "Liberal", "dating_intentions": "Life partner", "relationship_type": "Monogamy", "gender": "Non binary", "pronouns": "They/Them/Their", "sexuality": "Gay", "ethnicity": "Hispanic/Latino", "has_children": false, "want_children": true, "pets": ["Dog"], "zodiac_sign": "Libra", "mbti_personality_type": "ENFP", "drinking": "Sometimes", "smoking": "No", "marijuana": "No", "drugs": "No", "exercise": "Active", "partner_preferences": {"minimum_age": 29, "maximum_age": 40, "minimum_height": "5'6\"", "maximum_height": "6'1\"", "has_children": false, "want_children": true, "sexuality": "Gay", "drinking": "Yes", "smoking": "No", "marijuana": "No", "drugs": "No", "exercise": "Active"}, "summary": "Jamie Lopez is a 31-year-old, non-binary, gay individual from San Diego, California. Their ethnicity is Hispanic/Latino and their pronouns are they/them/their. Professionally, they are a Registered Nurse in the Healthcare industry after graduating from the University of California, Los Angeles. Jamie currently resides in Los Angeles and they actively speak English and Spanish. They highly value honesty, empathy, and respect. They enjoy yoga, traveling, and cooking. While they are agnostic and lean politically liberal, they are actively looking for a life partner interested in monogamy. They don’t have any children but would like to have in the future. They own a dog, don't smoke but drink occasionally. With an active lifestyle, Jamie is a Libra and identifies as ENFP according to the MBTI personality type. As per their preferences, they are open to meeting gay men who are between 29 and 40 years old, are active, don't smoke, but may drink, and are considering having children in the future.", "user_id": "7bf8cb58-bc66-4981-89b8-a2b3f743cd20"}
{"name": "Carlos Garcia", "age": 34, "height": "5'11\"", "school": "University of California, Berkeley", "job_industry": "Technology", "job_title": "Software Engineer", "hometown_location": "San Diego, California", "dating_location": "Los Angeles, California", "languages_spoken": ["English", "Spanish"], "values": "Honesty, Simplicity, Humor", "interests": "Coding, Photography, Hiking", "education_level": "Graduate", "religious_beliefs": "Agnostic", "politics": "Liberal", "dating_intentions": "Long term", "relationship_type": "Monogamy", "gender": "Man", "pronouns": "He/Him/His", "sexuality": "Gay", "ethnicity": "Hispanic/Latino", "has_children": false, "want_children": true, "pets": ["Dog"], "zodiac_sign": "Aquarius", "mbti_personality_type": "INTP", "drinking": "Sometimes", "smoking": "No", "marijuana": "No", "drugs": "No", "exercise": "Active", "partner_preferences": {"minimum_age": 27, "maximum_age": 40, "minimum_height": "5'5\"", "maximum_height": "6'2\"", "has_children": false, "want_children": true, "sexuality": "Gay", "drinking": "Yes", "smoking": "No", "marijuana": "No", "drugs": "No", "exercise": "Active"}, "summary": "Carlos Garcia is a 34-year-old, Hispanic/Latino man who identifies as gay and uses he/him/his pronouns. He is a software engineer in the technology industry, graduated from the University of California, Berkeley, and is currently located in Los Angeles. He is originally from San Diego. Carlos is fluent in both English and Spanish. He values honesty, simplicity, and humor.\n\nHis interests include coding, photography, and hiking. He categorizes himself as agnostic and politically liberal. He does not currently have children but is interested in having them in the future. He is an active individual who occasionally drinks but does not smoke or use drugs. His preferred partner is a man, between 27 and 40 years old, who also desires to have children and leads an active lifestyle.\n\nCarlos is an Aquarius and is classified as an INTP according to the MBTI personality scale. His ideal date is also a non-smoker and moderate drinker. He is a proud dog owner and meets potential matches in Los Angeles with the intention of cultivating a long-term relationship with someone who values a monogamous relationship.", "user_id": "f2f8a212-51d9-4521-9731-0bcf747b322c"}
{"name": "Sam Jones", "age": 36, "height": "6'2\"", "school": "Harvard University", "job_industry": "Technology", "job_title": "Software Engineer", "hometown_location": "Seattle, Washington", "dating_location": "Los Angeles, California", "languages_spoken": ["English", "Spanish", "Mandarin"], "values": "Honesty, openness, mutual respect and understanding", "interests": "Tech gadgets, biking, painting, literary fiction, chess", "education_level": "Doctoral", "religious_beliefs": "Agnostic", "politics": "Liberal", "dating_intentions": "Life partner", "relationship_type": "Monogamy", "gender": "Non binary", "pronouns": "They/Them/Their", "sexuality": "Other", "ethnicity": "Hispanic/Latino", "has_children": false, "want_children": true, "pets": ["Dog"], "zodiac_sign": "Capricorn", "mbti_personality_type": "ENFP", "drinking": "Sometimes", "smoking": "No", "marijuana": "Yes", "drugs": "No", "exercise": "Active", "partner_preferences": {"minimum_age": 30, "maximum_age": 40, "minimum_height": "5'2\"", "maximum_height": "6'5\"", "has_children": false, "want_children": true, "sexuality": "Other", "drinking": "Yes", "smoking": "No", "marijuana": "Yes", "drugs": "No", "exercise": "Active"}, "summary": "Sam Jones is a non-binary 36-year-old, tech-savvy software engineer. They are 6'2\", hold a doctoral degree from Harvard University, and are open to dating people of the same or other genders. They currently live in Los Angeles, but are originally from Seattle. Sam speaks English, Spanish, and Mandarin fluently. They are agnostic, lean liberal in politics, and is seeking a life partner for a monogamous relationship. Sam enjoys biking, painting, reading literary fiction, and playing chess. They own a dog, have no children, but they're open to having kids in the future. Sam's dating preferences include potential partners aged between 30 and 40, who lead an active lifestyle and enjoys a good drink.", "user_id": "94550be4-7a7c-4434-9f6d-5a3d895ea6b8"}
{"name": "Alex Lee", "age": 29, "height": "5'10\"", "school": "University of California, Berkeley", "job_industry": "Software", "job_title": "Full Stack Developer", "hometown_location": "San Francisco, California", "dating_location": "Los Angeles, California", "languages_spoken": ["English", "Korean"], "values": "Dedication, Hard Work, Integrity", "interests": "Traveling, Hiking, Music, Technology", "education_level": "Graduate", "religious_beliefs": "Atheist", "politics": "Liberal", "dating_intentions": "Life partner", "relationship_type": "Monogamy", "gender": "Man", "pronouns": "He/Him/His", "sexuality": "Straight", "ethnicity": "East Asian", "has_children": false, "want_children": true, "pets": ["Dog", "Reptile"], "zodiac_sign": "Leo", "mbti_personality_type": "ENTJ", "drinking": "Sometimes", "smoking": "No", "marijuana": "No", "drugs": "No", "exercise": "Active", "partner_preferences": {"minimum_age": 24, "maximum_age": 35, "minimum_height": "5'4\"", "maximum_height": "6'1\"", "has_children": false, "want_children": true, "sexuality": "Straight", "drinking": "No", "smoking": "No", "marijuana": "No", "drugs": "No", "exercise": "Sometimes"}, "summary": "Alex Lee is a 29-year-old man who originally hails from San Francisco, California, and currently resides in Los Angeles, California. He is a full stack developer in the software industry and holds a degree from the University of California, Berkeley. With dedication, hard work, and integrity as his core values, Alex is passionate about traveling, hiking, music, and technology. \n\nHe identifies as a straight East Asian man, and his pronouns are he/him/his. Identity-wise, Alex is an atheist and holds liberal political beliefs. He is a Leo as per his zodiac sign and an ENTJ according to the Myers Briggs personality type.\n\nAlex is a non-smoker and drinks occasionally. He is active in terms of exercise and keeps pets - a dog and a reptile. Despite not having children, Alex is open to the idea of having children in the future.\n\nIn terms of his ideal partner, Alex is interested in monogamy with a straight woman aged between 24 and 35, who is at least 5'4\" and at most 6'1\". His potential partner should also desire children in the future, must not smoke, and must exercise at least occasionally. Drinking and use of marijuana or other drugs are deal-breakers for him.", "user_id": "fea8a0f8-183a-49cb-897e-ba5ad910ebae"}
{"name": "Kim Rivera", "age": 30, "height": "5'5\"", "school": "Brown University", "job_industry": "Tech", "job_title": "Software Engineer", "hometown_location": "Chicago, Illinois", "dating_location": "Los Angeles, California", "languages_spoken": ["English", "Spanish"], "values": "Empathy, kindness, and hard work", "interests": "Coding, hiking, and cooking", "education_level": "Graduate", "religious_beliefs": "Agnostic", "politics": "Liberal", "dating_intentions": "Long term", "relationship_type": "Monogamy", "gender": "Woman", "pronouns": "She/Her/Hers", "sexuality": "Gay", "ethnicity": "Hispanic/Latino", "has_children": false, "want_children": true, "pets": ["Cat"], "zodiac_sign": "Cancer", "mbti_personality_type": "ENFJ", "drinking": "Yes", "smoking": "No", "marijuana": "Sometimes", "drugs": "No", "exercise": "Active", "partner_preferences": {"minimum_age": 28, "maximum_age": 35, "minimum_height": "5'5\"", "maximum_height": "5'9\"", "has_children": false, "want_children": true, "sexuality": "Gay", "drinking": "Yes", "smoking": "No", "marijuana": "Sometimes", "drugs": "No", "exercise": "Active"}, "summary": "Kim Rivera is a 30-year-old gay woman who identifies with the pronoun \"she/her\". She is a Software Engineer in the tech industry. A graduate from Brown University, Kim is based in Los Angeles, California, originally from Chicago, Illinois. She is bilingual, speaking English and Spanish. She values empathy, kindness, and hard work.\n\nKim enjoys coding, hiking, and cooking. Her liberal political views align with her Agnostic religious beliefs. She is looking to engage in a long-term monogamous relationship with a goal of having children in the future.\n\nCurrently, Kim is a cat owner and holds a zodiac sign of Cancer. She identifies as an ENFJ according to the Myers-Briggs Type Indicator. She occasionally enjoys drinking and using marijuana, whilst negating smoking and drug use. She stays active by regularly exercising.\n\nShe prefers to date gay women who are aged between 28 to 35 years old, taller than 5'5\", and looking to have children. Similar to her lifestyle, she prefers a partner who drinks, sometimes uses marijuana, doesn't smoke or use other drugs, and maintains an active life.", "user_id": "36e80623-1332-4a4a-87dd-49b965b64fa6"}
{"name": "Alex Morgan", "age": 32, "height": "5'9\"", "school": "University of California, Los Angeles", "job_industry": "Entertainment", "job_title": "Film Producer", "hometown_location": "Houston, Texas", "dating_location": "Los Angeles, California", "languages_spoken": ["English", "Spanish"], "values": "Integrity, Hard Work, Compassion", "interests": "Cinema, Hiking, Photography, Cooking", "education_level": "Graduate", "religious_beliefs": "Atheist", "politics": "Liberal", "dating_intentions": "Long term", "relationship_type": "Monogamy", "gender": "Non binary", "pronouns": "They/Them/Their", "sexuality": "Other", "ethnicity": "Hispanic/Latino", "has_children": false, "want_children": true, "pets": ["Dog"], "zodiac_sign": "Gemini", "mbti_personality_type": "ENFP", "drinking": "Sometimes", "smoking": "No", "marijuana": "Sometimes", "drugs": "No", "exercise": "Active", "partner_preferences": {"minimum_age": 28, "maximum_age": 38, "minimum_height": "5'5\"", "maximum_height": "6'2\"", "has_children": false, "want_children": true, "sexuality": "Other", "drinking": "Sometimes", "smoking": "No", "marijuana": "Sometimes", "drugs": "No", "exercise": "Active"}, "summary": "Alex Morgan is a 32-year-old, non-binary individual who works in the entertainment industry as a film producer. Based in Los Angeles and originally from Houston, Texas, they value integrity, hard work, and compassion. Their interests include cinema, hiking, photography, and cooking. An atheist with liberal political beliefs, Alex is multilingual, speaking both English and Spanish. They do not have children but wish to in the future. They also have a pet dog and their zodiac sign is Gemini. As an ENFP, they sometimes enjoy a drink and marijuana but do not smoke or take drugs. Alex is active and enjoys exercise. They are looking for a long-term, monogamous relationship with someone between the ages of 28 and 38 who shares similar values, interests, and lifestyle preferences. This person should be open to having children in the future and should not smoke. They should also be sometimes open to drinking and marijuana use.\n", "user_id": "c48f13c2-e570-46b6-9d49-65536e9e4e74"}
{"name": "Jamila Thomas", "age": 35, "height": "5'7\"", "school": "Stanford University", "job_industry": "Tech Industry", "job_title": "Senior Software Engineer", "hometown_location": "Sacramento, California", "dating_location": "Los Angeles, California", "languages_spoken": ["English", "Spanish", "Swahili"], "values": "Integrity, Creativity, Ambition, Kindness, Confidence", "interests": "Reading, Hiking, Live Music, Technology, Trail Running", "education_level": "Graduate", "religious_beliefs": "Agnostic", "politics": "Liberal", "dating_intentions": "Long term", "relationship_type": "Monogamy", "gender": "Woman", "pronouns": "She/Her/Hers", "sexuality": "Gay", "ethnicity": "Black African Descent", "has_children": false, "want_children": true, "pets": ["Dog"], "zodiac_sign": "Leo", "mbti_personality_type": "ENFJ", "drinking": "Yes", "smoking": "No", "marijuana": "No", "drugs": "No", "exercise": "Active", "partner_preferences": {"minimum_age": 32, "maximum_age": 40, "minimum_height": "5'3\"", "maximum_height": "6'0\"", "has_children": false, "want_children": true, "sexuality": "Gay", "drinking": "Yes", "smoking": "No", "marijuana": "No", "drugs": "No", "exercise": "Active"}, "summary": "Jamila Thomas is a 35-year-old Senior Software Engineer in the Tech Industry based in Los Angeles, California, originally from Sacramento. She is an educated woman from Stanford University, fluent in English, Spanish, and Swahili. Jamila is agnostic, politically liberal, and is looking for a long-term, monogamous relationship. She identifies as a woman, utilizes She/Her/Hers pronouns, identifies as gay, and is of Black African descent. She currently does not have children but hopes to in the future. Jamila is an active individual who enjoys reading, hiking, live music, technology, and trail running in her spare time. She is a dog owner, a Leo by zodiac sign, and is characterized as an ENFJ by MBTI typology. Jamila prefers drinking but is not favorable towards smoking, marijuana, or other drugs. She has a preference for women within the ages of 32 and 40 who shares the same viewpoints on alcohol consumption and substances, also values fitness, and is aspiring to have children in the future.", "user_id": "286b3c89-c413-46b5-91d2-69f2a5c6a4da"}
{"name": "Simone Rodriguez", "age": 34, "height": "5'6\"", "school": "California State University, Los Angeles", "job_industry": "Entertainment", "job_title": "Production Assistant", "hometown_location": "Phoenix, Arizona", "dating_location": "Los Angeles, California", "languages_spoken": ["English", "Spanish"], "values": "Honesty, ambition, and kindness are very important to me. I believe in creating a balance in life and always staying true to oneself.", "interests": "I have varied interests; love outdoor activities on the weekend, enjoy music of all types, and have a soft spot for cookery shows. When I can, I take time out to travel to learn about different cultures.", "education_level": "Graduate", "religious_beliefs": "Catholic", "politics": "Liberal", "dating_intentions": "Long term", "relationship_type": "Monogamy", "gender": "Woman", "pronouns": "She/Her/Hers", "sexuality": "Other", "ethnicity": "Hispanic/Latino", "has_children": false, "want_children": true, "pets": ["Dog"], "zodiac_sign": "Leo", "mbti_personality_type": "ENFJ", "drinking": "Sometimes", "smoking": "No", "marijuana": "No", "drugs": "No", "exercise": "Active", "partner_preferences": {"minimum_age": 30, "maximum_age": 40, "minimum_height": "5'5\"", "maximum_height": "6'2\"", "has_children": false, "want_children": true, "sexuality": "Other", "drinking": "Yes", "smoking": "No", "marijuana": "No", "drugs": "No", "exercise": "Active"}, "summary": "Simone Rodriguez is a 34-year old production assistant in the Entertainment industry, living in Los Angeles, California. She values honesty, ambition, and kindness, and has varied interests such as outdoor activities, music, and cooking. Simone is a graduate from California State University, Los Angeles and is a Catholic with liberal political views. She identifies as a woman (her/she pronouns) with a 'yet to be disclosed' sexuality and is of Hispanic/Latino ethnicity. Simone does not have children but does want them in the future. She currently has a dog as a pet. Her lifestyle includes occasional drinking and participating in regular physical activity while avoiding tobacco and drugs. Simone is a Leo and her MBTI personality type is ENFJ. When it comes to a partner, Simone prefers someone between the age of 30-40. They should ideally also be interested in having children, engage in physical activity and may drink socially, but non-smoking is a must for her along with the exclusion of marijuana and other forms of drugs.    \n", "user_id": "8614817c-ab8b-4aeb-868a-156cff37654a"}
{"name": "Jasmine Patel", "age": 31, "height": "5'4\"", "school": "University of California, Berkeley", "job_industry": "Tech", "job_title": "Software Engineer", "hometown_location": "San Francisco, California", "dating_location": "Los Angeles, California", "languages_spoken": ["English", "Hindi", "Spanish"], "values": "Sustainability, Authenticity, Lifelong learning", "interests": "Hiking, Living a green lifestyle, Coding, Playing the guitar, Cooking organic meals", "education_level": "Graduate", "religious_beliefs": "Hindu", "politics": "Liberal", "dating_intentions": "Long term, open to short", "relationship_type": "Monogamy", "gender": "Woman", "pronouns": "She/Her/Hers", "sexuality": "Straight", "ethnicity": "South Asian", "has_children": false, "want_children": true, "pets": ["Dog"], "zodiac_sign": "Aries", "mbti_personality_type": "INFJ", "drinking": "Sometimes", "smoking": "No", "marijuana": "No", "drugs": "No", "exercise": "Active", "partner_preferences": {"minimum_age": 28, "maximum_age": 35, "minimum_height": "5'8\"", "maximum_height": "6'3\"", "has_children": false, "want_children": true, "sexuality": "Straight", "drinking": "Sometimes", "smoking": "No", "marijuana": "No", "drugs": "No", "exercise": "Active"}, "summary": "Jasmine Patel is a 31-year-old woman who is 5'4\". She works in the tech industry as a software engineer and studied at the University of California, Berkeley. Jasmine currently lives in Los Angeles, California, but is originally from San Francisco. She speaks English, Hindi, and Spanish. Jasmine values sustainability, authenticity, and lifelong learning. Some of her interests include hiking, living a green lifestyle, coding, playing the guitar, and cooking organic meals. She is a Hindu, has a liberal political inclination, and seeks a long-term relationship, though she is open to short-term as well. Jasmine identifies herself as straight and is interested in monogamy. Jasmine is of South Asian ethnicity and she hopes to have children in the future. She has a pet dog, an Aries, an 'INFJ' MBTI personality type, and does not consume any type of drugs or smoke, although she drinks occasionally. Jasmine leads an active lifestyle. She prefers a straight partner between the ages of 28 and 35 who doesn't smoke or take drugs, exercises regularly, hopes to have children, and drinks occasionally.\n", "user_id": "5eb6607a-0a3d-49fa-89e7-c18dafc0f1cd"}
{"name": "Aaliyah Williams", "age": 36, "height": "5'7\"", "school": "Stanford University", "job_industry": "Technology", "job_title": "Software Engineer", "hometown_location": "Detroit, Michigan", "dating_location": "Los Angeles, California", "languages_spoken": ["English", "Spanish"], "values": "Family, Career, Adventure", "interests": "Coding, Food (Vegan cooking), Music (Jazz & Blues), Travel (Backpacking around the world)", "education_level": "Graduate", "religious_beliefs": "Agnostic", "politics": "Liberal", "dating_intentions": "Long term", "relationship_type": "Monogamy", "gender": "Woman", "pronouns": "She/Her/Hers", "sexuality": "Straight", "ethnicity": "Black African Descent", "has_children": false, "want_children": true, "pets": ["None"], "zodiac_sign": "Libra", "mbti_personality_type": "INTP", "drinking": "Sometimes", "smoking": "No", "marijuana": "No", "drugs": "No", "exercise": "Active", "partner_preferences": {"minimum_age": 30, "maximum_age": 40, "minimum_height": "5'7\"", "maximum_height": "6'3\"", "has_children": false, "want_children": true, "sexuality": "Straight", "drinking": "Yes", "smoking": "No", "marijuana": "No", "drugs": "No", "exercise": "Active"}, "summary": "Aaliyah Williams is a 36-year-old Software Engineer currently living in Los Angeles, California. She graduated from Stanford University and is fluent in English and Spanish. She values family, her career, and adventures. Her interests include coding, vegan cooking, jazz and blues music, and backpacking around the world. Although she identifies as agnostic and politically liberal, her main intentions for dating are to engage in a long term, monogamous relationship. Aaliyah, who identifies as a straight woman of Black African descent, does not currently have any children but is open to having them in the future. She does not have any pets and her lifestyle is fairly health-conscious - she works out regularly, and while she sometimes enjoys a drink, she does not smoke or use marijuana. As for her partner preferences, Aaliyah is looking for a straight man between the ages of 30 and 40 who leads an active lifestyle, does not smoke, and wants children.", "user_id": "219bc32e-cd65-49e0-a537-af080bbc153a"}
{"name": "Ava Johnson", "age": 28, "height": "5'6\"", "school": "University of California, Los Angeles", "job_industry": "Information Technology", "job_title": "Software Developer", "hometown_location": "New York, New York", "dating_location": "Los Angeles, California", "languages_spoken": ["English", "Spanish", "Korean"], "values": "Family, Creativity, Independence", "interests": "Yoga, Hiking, Coding, Painting, Music", "education_level": "Graduate", "religious_beliefs": "Agnostic", "politics": "Liberal", "dating_intentions": "Long term", "relationship_type": "Monogamy", "gender": "Woman", "pronouns": "She/Her/Hers", "sexuality": "Straight", "ethnicity": "Hispanic/Latino", "has_children": false, "want_children": true, "pets": ["Dog"], "zodiac_sign": "Gemini", "mbti_personality_type": "INTJ", "drinking": "Sometimes", "smoking": "No", "marijuana": "No", "drugs": "No", "exercise": "Active", "partner_preferences": {"minimum_age": 28, "maximum_age": 38, "minimum_height": "5'8\"", "maximum_height": "6'2\"", "has_children": false, "want_children": true, "sexuality": "Straight", "drinking": "Yes", "smoking": "No", "marijuana": "No", "drugs": "No", "exercise": "Active"}, "summary": "Ava Johnson is a 28-year-old software developer from New York, currently living in Los Angeles. She is a graduate from the University of California, Los Angeles and is multilingual, speaking English, Spanish and Korean. Ava cherishes values such as family, creativity, and independence, and has diverse interests in Yoga, hiking, coding, painting, and music.\n\nShe identifies as a straight woman with Hispanic/Latino ethnicity and prefers using 'She/Her' pronouns. While she currently does not have children, Ava indicates that she'd like to have them in the future. She is a dog lover and is in the market for a long-term relationship. Her political leanings are liberal and is Agnostic.\n\nAva is a gemini by star sign and an INTJ by MBTI personality type. She infrequently consumes alcohol but steers clear of smoking and drugs. She prefers a partner who does not smoke or use drugs, but doesn't mind if they drink. Her prospective partners should ideally lead an active lifestyle, similar to hers, sharing her interest in fitness and exercise.\n\nShe seeks a straight man who ranges in age from 28 to 38 years. It's important to her that this person does not have children but is open to the possibility in the future. Beyond this, she also prefers that they are taller, standing between 5'8\" and 6'2\".", "user_id": "2dd5d2a5-e4b9-480d-a661-78ea02cb1c9c"}
{"name": "Alexa Johnson", "age": 32, "height": "5'4\"", "school": "Harvard University", "job_industry": "Tech", "job_title": "Software Developer", "hometown_location": "Boston, Massachusetts", "dating_location": "Los Angeles, California", "languages_spoken": ["English", "Spanish"], "values": "Loyalty, Friendship, Honesty", "interests": "Coding, Reading, Hiking", "education_level": "Graduate", "religious_beliefs": "Atheist", "politics": "Liberal", "dating_intentions": "Long term", "relationship_type": "Monogamy", "gender": "Non binary", "pronouns": "They/Them/Their", "sexuality": "Other", "ethnicity": "Black African Descent", "has_children": false, "want_children": true, "pets": ["Dog"], "zodiac_sign": "Leo", "mbti_personality_type": "INTP", "drinking": "Sometimes", "smoking": "No", "marijuana": "No", "drugs": "No", "exercise": "Active", "partner_preferences": {"minimum_age": 30, "maximum_age": 40, "minimum_height": "5'0\"", "maximum_height": "7'0\"", "has_children": false, "want_children": true, "sexuality": "Other", "drinking": "Sometimes", "smoking": "No", "marijuana": "No", "drugs": "No", "exercise": "Active"}, "summary": "Alexa Johnson is a 32-year-old, non-binary, software developer living in Los Angeles. They are originally from Boston and graduated from Harvard University. They speak English and Spanish. They are an African descent and have an ITPN personality type, self-identifying as liberal and atheist. Although they don't currently have any children, they do aspire to in the future. Alexa has a pet dog, enjoys coding, reading, and hiking. They exercise regularly and occasionally enjoy a drink but don't smoke nor use drugs. They're interested in monogamous, long-term relationships with someone ages 30-40, who likewise values fitness, doesn't smoke, and wants children in future.", "user_id": "caa077e1-d72a-4603-85d9-35b1ca00ac96"}
{"name": "Imani Johnson", "age": 32, "height": "5'7\"", "school": "Howard University", "job_industry": "Healthcare", "job_title": "Registered Nurse", "hometown_location": "Chicago, Illinois", "dating_location": "Los Angeles, California", "languages_spoken": ["English", "Spanish"], "values": "Family, equality and sustainability", "interests": "Traveling, cooking, yoga, volunteer work", "education_level": "Graduate", "religious_beliefs": "Christian", "politics": "Liberal", "dating_intentions": "Life partner", "relationship_type": "Monogamy", "gender": "Woman", "pronouns": "She/Her/Hers", "sexuality": "Straight", "ethnicity": "Black African Descent", "has_children": false, "want_children": true, "pets": ["Dog"], "zodiac_sign": "Cancer", "mbti_personality_type": "ENFJ", "drinking": "Sometimes", "smoking": "No", "marijuana": "No", "drugs": "No", "exercise": "Active", "partner_preferences": {"minimum_age": 30, "maximum_age": 40, "minimum_height": "5'8\"", "maximum_height": "6'4\"", "has_children": false, "want_children": true, "sexuality": "Straight", "drinking": "Sometimes", "smoking": "No", "marijuana": "No", "drugs": "No", "exercise": "Active"}, "summary": "Imani Johnson is a 32-year-old woman of Black African descent. She is a registered nurse in the healthcare sector and holds a graduate degree from Howard University. Imani values family, equality, and sustainability, and enjoys interests such as traveling, cooking, yoga, and volunteering. Fluent in both English and Spanish, she is based in Los Angeles but her roots are in Chicago. A Christian liberal, her zodiac sign is Cancer and she has an ENFJ personality type. She is keen on fitness and is a non-smoker. Imani, pronouns she/her/hers, identifies as straight and is seeking a life partner in monogamous relationship context. She doesn't have children but wishes to have them in the future. She prefers someone aged between 30-40, with mirroring habits and preferences, who also wants children.\n", "user_id": "f3821f6c-10ce-47b2-8113-a7edc02e273e"}
{"name": "Raj Patel", "age": 32, "height": "5'10\"", "school": "University of Southern California", "job_industry": "Technology", "job_title": "Product Manager", "hometown_location": "Mumbai, India", "dating_location": "Los Angeles, California", "languages_spoken": ["English", "Hindi"], "values": "Hard work, family, education", "interests": "Traveling, coding, baking, yoga", "education_level": "Graduate", "religious_beliefs": "Hindu", "politics": "Moderate", "dating_intentions": "Long term, open to short", "relationship_type": "Monogamy", "gender": "Man", "pronouns": "He/Him/His", "sexuality": "Straight", "ethnicity": "South Asian", "has_children": false, "want_children": true, "pets": ["Dog"], "zodiac_sign": "Virgo", "mbti_personality_type": "INTJ", "drinking": "No", "smoking": "No", "marijuana": "No", "drugs": "No", "exercise": "Active", "partner_preferences": {"minimum_age": 27, "maximum_age": 37, "minimum_height": "5'0\"", "maximum_height": "6'0\"", "has_children": false, "want_children": true, "sexuality": "Straight", "drinking": "No", "smoking": "No", "marijuana": "No", "drugs": "No", "exercise": "Active"}, "summary": "Raj Patel is a 32-year-old South Asian man from Mumbai, India, now living in Los Angeles, California. He works in the technology industry as a Product Manager and is a graduate of the University of Southern California. Raj speaks English and Hindi and values hard work, education, and family. His interests range from traveling and baking to coding and doing yoga. \n\nAlthough Raj does not currently have children, he is open to having them in the future. Moreover, he is a proud owner of a dog. He's a Virgo and his Myers-Briggs Type Indicator (MBTI) is INTJ. \n\nIn terms of his lifestyle, Raj does not smoke or consume alcohol or drugs and maintains an active lifestyle. When it comes to dating, Raj is looking for a long-term relationship but is open to short-term as well. His potential partner's age range is between 27 and 37 years, they should be active and do not smoke or drink. Raj prefers women who are open to having children in the future.", "user_id": "c5e42987-0532-4cfa-bc22-e192f6896e5f"}
{"name": "Jasmine Laverne", "age": 34, "height": "5'8\"", "school": "University of Michigan", "job_industry": "Entertainment", "job_title": "Film Director", "hometown_location": "Atlanta, Georgia", "dating_location": "Los Angeles, California", "languages_spoken": ["English", "Spanish"], "values": "Creativity, Independence, Kindness", "interests": "Film, Yoga, Reading, Vegan Cooking", "education_level": "Graduate", "religious_beliefs": "Spiritual", "politics": "Liberal", "dating_intentions": "Long term", "relationship_type": "Monogamy", "gender": "Woman", "pronouns": "She/Her/Hers", "sexuality": "Gay", "ethnicity": "Black African Descent", "has_children": false, "want_children": true, "pets": ["Cat", "Dog"], "zodiac_sign": "Virgo", "mbti_personality_type": "INFJ", "drinking": "Sometimes", "smoking": "No", "marijuana": "No", "drugs": "No", "exercise": "Active", "partner_preferences": {"minimum_age": 30, "maximum_age": 40, "minimum_height": "5'0\"", "maximum_height": "6'0\"", "has_children": false, "want_children": true, "sexuality": "Gay", "drinking": "Yes", "smoking": "No", "marijuana": "No", "drugs": "No", "exercise": "Active"}, "summary": "Jasmine Laverne, a 34-year-old Film Director based in Los Angeles, is seeking a long-term, monogamous relationship. Fluent in English and Spanish, she holds a degree from the University of Michigan and works in the Entertainment industry. Hailing from Atlanta, Georgia, she takes pride in her creativity, independence, and kindness. Her interests include film, yoga, reading, and vegan cooking. She identifies as a Gay woman and primarily uses she/her/hers pronouns. She is of Black African descent, does not smoke or do drugs, and only drinks on occasion. Being an active individual, she likes to exercise regularly. She owns a cat and a dog and hopes to have children one day. As a Virgo and an INFJ, Jasmine tends to be introspective, spiritual, and liberal. When it comes to potential partners, Jasmine prefers women between 30 and 40 years old who do not smoke or do drugs but enjoy a drink now and then and maintain an active lifestyle. She hopes to meet a partner who also wants children.", "user_id": "ecf046ae-dbb7-432e-bac5-6ce42c1327fe"}
{"name": "Raymond Diaz", "age": 34, "height": "5'10\"", "school": "University of Southern California", "job_industry": "Healthcare", "job_title": "Emergency Room Nurse", "hometown_location": "San Diego, California", "dating_location": "Los Angeles, California", "languages_spoken": ["English", "Spanish", "French"], "values": "Family, Career, Adventure", "interests": "Traveling, Photography, Cooking, Fitness", "education_level": "Graduate", "religious_beliefs": "Catholic", "politics": "Liberal", "dating_intentions": "Life partner", "relationship_type": "Monogamy", "gender": "Man", "pronouns": "He/Him/His", "sexuality": "Gay", "ethnicity": "Hispanic/Latino", "has_children": false, "want_children": true, "pets": ["Dog"], "zodiac_sign": "Leo", "mbti_personality_type": "ENFJ", "drinking": "Sometimes", "smoking": "No", "marijuana": "No", "drugs": "No", "exercise": "Active", "partner_preferences": {"minimum_age": 28, "maximum_age": 40, "minimum_height": "5'5\"", "maximum_height": "6'2\"", "has_children": false, "want_children": true, "sexuality": "Gay", "drinking": "Sometimes", "smoking": "No", "marijuana": "No", "drugs": "No", "exercise": "Active"}, "summary": "Raymond Diaz is a 34-year-old, 5'10\", Hispanic/Latino man, who identifies as gay and uses he/him/his pronouns. He is an Emergency Room Nurse working in the healthcare industry in Los Angeles, California but originally hails from San Diego. Fluent in English, Spanish, and French, he values family, career, and adventure. He enjoys traveling, photography, cooking, and fitness.\n\nRaymond is a Catholic and holds liberal political views. He is looking for a life partner and is interested in a monogamous relationship. Although he doesn't currently have children, he intends to in the future. He enjoys the company of his dog and exercises actively. He occasionally drinks but doesn't smoke or use marijuana or any drugs.\n\nHe seeks a partner who is between 28-40 years old, with a height range of 5'5\" to 6'2\", who doesn't currently have children but wants to in the future. He prefers someone who is also active, occasionally drinks, and does not smoke or use drugs.", "user_id": "1f7f78b8-f029-4eb1-8e9a-3cd6795f245c"}
{"name": "Samuel Gonzalez", "age": 29, "height": "5'10\"", "school": "University of Chicago", "job_industry": "Media", "job_title": "Project Manager", "hometown_location": "San Antonio, Texas", "dating_location": "Los Angeles, California", "languages_spoken": ["English", "Spanish"], "values": "Honesty, hard work, and respect for diversity", "interests": "Reading, cooking, hiking, football", "education_level": "Graduate", "religious_beliefs": "Atheist", "politics": "Liberal", "dating_intentions": "Long term, open to short", "relationship_type": "Monogamy", "gender": "Man", "pronouns": "He/Him/His", "sexuality": "Straight", "ethnicity": "Hispanic/Latino", "has_children": false, "want_children": true, "pets": ["Dog"], "zodiac_sign": "Sagittarius", "mbti_personality_type": "ENTJ", "drinking": "Sometimes", "smoking": "No", "marijuana": "No", "drugs": "No", "exercise": "Active", "partner_preferences": {"minimum_age": 25, "maximum_age": 35, "minimum_height": "5'0\"", "maximum_height": "6'0\"", "has_children": false, "want_children": true, "sexuality": "Straight", "drinking": "Yes", "smoking": "No", "marijuana": "No", "drugs": "No", "exercise": "Active"}, "summary": "Samuel Gonzalez is a 29-year-old straight man from San Antonio, Texas, now residing in Los Angeles, California. He is Hispanic/Latino and identifies himself with he/him/his pronouns. Samuel works as a Project Manager in the Media industry and has a Graduate degree from the University of Chicago. An active individual, he enjoys reading, cooking, hiking, and football. Samuel is an atheist with liberal political views, and values honesty, hard work, and respect for diversity. He's a Sagittarius and an ENTJ personality type who occasionally enjoys a drink, doesn't smoke, or do drugs.\n\nSamuel seeks a straight woman between 25 and 35 years old, who is active and shares his vision of a monogamous relationship. She should also ideally not have children, but like Samuel, be open to having children in the future. He prefers a partner who enjoys a drink but refrains from smoking and drug use.", "user_id": "ba40b122-2c4c-4a10-b81d-c0ddfd3780c5"}
{"name": "Alexis Patel", "age": 33, "height": "5'6\"", "school": "University of California, Berkeley", "job_industry": "Non-Profit", "job_title": "Program Director", "hometown_location": "Houston, Texas", "dating_location": "Los Angeles, California", "languages_spoken": ["English", "Spanish", "Hindi"], "values": "Inclusion, equity, respect, honesty", "interests": "Traveling, reading, painting, volunteering", "education_level": "Graduate", "religious_beliefs": "Spiritual", "politics": "Liberal", "dating_intentions": "Long term, open to short", "relationship_type": "Monogamy", "gender": "Non binary", "pronouns": "They/Them/Their", "sexuality": "Other", "ethnicity": "South Asian", "has_children": true, "want_children": false, "pets": ["Dog"], "zodiac_sign": "Virgo", "mbti_personality_type": "INFJ", "drinking": "Sometimes", "smoking": "No", "marijuana": "No", "drugs": "No", "exercise": "Active", "partner_preferences": {"minimum_age": 30, "maximum_age": 40, "minimum_height": "5'4\"", "maximum_height": "6'2\"", "has_children": true, "want_children": false, "sexuality": "Other", "drinking": "Sometimes", "smoking": "No", "marijuana": "No", "drugs": "No", "exercise": "Sometimes"}, "summary": "Alexis Patel, 33, is a non-binary individual who uses they/them pronouns. They hold a graduate degree and work as a Program Director in the non-profit industry. Alexis is multilingual, speaking English, Spanish, and Hindi. They were originally from Houston, Texas but currently reside in Los Angeles, California. Alexis is spiritual and politically liberal. They're a parent and have no intention to have more children. Alexis also owns a dog. In their spare time, Alexis enjoys traveling, reading, painting, and volunteering. Alexis is an active individual and maintains a healthy lifestyle, including moderate drinking but no smoking, marijuana, or drug use. As a Virgo with an MBTI personality type of INFJ, they're seeking a partner aged between 30 and 40 who shares their lifestyle choices and has the same preferences regarding children.", "user_id": "f5138291-dc23-4e8b-94e3-3fb33e962f91"}
{"name": "Taylor Anderson", "age": 27, "height": "5'7\"", "school": "Stanford University", "job_industry": "Arts & Entertainment", "job_title": "Documentary Filmmaker", "hometown_location": "New York City, New York", "dating_location": "Los Angeles, California", "languages_spoken": ["English", "French", "ASL"], "values": "Creativity, Independence, Social Justice", "interests": "Traveling, Storytelling, Yoga", "education_level": "Graduate", "religious_beliefs": "Buddhist", "politics": "Liberal", "dating_intentions": "Life partner", "relationship_type": "Monogamy", "gender": "Non binary", "pronouns": "They/Them/Their", "sexuality": "Other", "ethnicity": "Black African Descent", "has_children": false, "want_children": true, "pets": ["Cat", "Fish"], "zodiac_sign": "Taurus", "mbti_personality_type": "ENFJ", "drinking": "Sometimes", "smoking": "No", "marijuana": "Yes", "drugs": "No", "exercise": "Active", "partner_preferences": {"minimum_age": 26, "maximum_age": 35, "minimum_height": "5'5\"", "maximum_height": "6'2\"", "has_children": false, "want_children": true, "sexuality": "Other", "drinking": "Yes", "smoking": "No", "marijuana": "Yes", "drugs": "No", "exercise": "Active"}, "summary": "Taylor Anderson is a creative and independent non-binary individual of Black African descent, looking for a life partner. The 27-year-old is a documentary filmmaker who highly values storytelling, traveling, and yoga. Fluent in English, French and ASL, Taylor was educated at Stanford University and is currently based in LA after originating from New York City.\n\nTaylor identifies as Buddhist, with liberal political views, and is keen on finding a partner who is comfortable with their preferences including occasional drinking, marijuana use, but no smoking or drugs. Fitness is important to them, hence an active lifestyle is a must-have characteristic for their ideal partner.\n\nIn the future, Taylor hopes to have children and envisions a harmonious family life with their beloved pets - a cat and some fish. Their ideal partner should be between 26 to 35 years old, with a height ranging from 5'5\" to 6'2\". Taylor prefers a partner who does not currently have children but wants to have them in the future. As an ENFJ and a Taurus, they are likely warm, outgoing, reliable, and possess strong values.\n", "user_id": "493575aa-786b-4bc7-a5bc-f7d5d1b58e18"}
{"name": "Aliyah Sanchez", "age": 28, "height": "5'6\"", "school": "University of California, Los Angeles", "job_industry": "Technology", "job_title": "Software Engineer", "hometown_location": "Austin, Texas", "dating_location": "Los Angeles, California", "languages_spoken": ["English", "Spanish", "Mandarin"], "values": "Honesty, Respect, Compassion, Innovation", "interests": "Computer Programming, Hiking, Music, Cooking, Community Volunteering", "education_level": "Graduate", "religious_beliefs": "Spiritual", "politics": "Liberal", "dating_intentions": "Long term", "relationship_type": "Monogamy", "gender": "Woman", "pronouns": "She/Her/Hers", "sexuality": "Gay", "ethnicity": "Hispanic/Latino", "has_children": false, "want_children": true, "pets": ["Dog", "Cat"], "zodiac_sign": "Aquarius", "mbti_personality_type": "ENTP", "drinking": "Sometimes", "smoking": "No", "marijuana": "No", "drugs": "No", "exercise": "Active", "partner_preferences": {"minimum_age": 27, "maximum_age": 35, "minimum_height": "5'0\"", "maximum_height": "6'0\"", "has_children": false, "want_children": true, "sexuality": "Gay", "drinking": "Yes", "smoking": "No", "marijuana": "No", "drugs": "No", "exercise": "Active"}, "summary": "Aliyah Sanchez is a 28-year-old software engineer based in Los Angeles, originally from Austin, Texas. She holds a graduate degree from the University of California, Los Angeles and is well-versed in English, Spanish, and Mandarin. Aliyah values honesty, respect, compassion, and innovation. She enjoys computer programming, hiking, music, cooking, and volunteering in her community. \n\nShe expresses herself as a spiritual woman who aligns with liberal political beliefs. Her dating intentions are more serious as she is looking for a long-term, monogamous relationship. Although she currently does not have kids, she is open to having them in the future. A proud owner of a dog and a cat, Aliyah is an active individual who occasionally enjoys a drink, but refrains from smoking and drug use. \n\nAs an Aquarius with an ENTP personality type, she is seeking a partner between the ages of 27 and 35 who does not have children but would like to in the future. This potential partner should not smoke, use drugs, or marijuana, but occasional drinking and an active lifestyle would be a plus.", "user_id": "399e74ac-53ae-4f5b-9b2d-ca4fe36cea95"}
{"name": "Aditi Patel", "age": 30, "height": "5'4\"", "school": "University of California - Berkeley", "job_industry": "Technology", "job_title": "Software Engineer", "hometown_location": "San Jose, California", "dating_location": "Los Angeles, California", "languages_spoken": ["English", "Hindi", "Spanish"], "values": "Education, hard work, kindness, inclusivity", "interests": "Hiking, coding, painting, cooking", "education_level": "Graduate", "religious_beliefs": "Hindu", "politics": "Liberal", "dating_intentions": "Life partner", "relationship_type": "Monogamy", "gender": "Woman", "pronouns": "She/Her/Hers", "sexuality": "Straight", "ethnicity": "South Asian", "has_children": false, "want_children": true, "pets": ["Cat"], "zodiac_sign": "Leo", "mbti_personality_type": "ENFJ", "drinking": "Sometimes", "smoking": "No", "marijuana": "No", "drugs": "No", "exercise": "Active", "partner_preferences": {"minimum_age": 28, "maximum_age": 35, "minimum_height": "5'5\"", "maximum_height": "6'5\"", "has_children": false, "want_children": true, "sexuality": "Straight", "drinking": "Sometimes", "smoking": "No", "marijuana": "No", "drugs": "No", "exercise": "Active"}, "summary": "Aditi Patel is a 30-year-old straight woman, standing 5'4\" tall, who currently lives in Los Angeles, California. She was born in San Jose, California, and is of South Asian ethnicity. She identifies with the pronouns She/Her/Hers and she describes herself as a Liberal Hindu. Aditi is highly educated, having graduated from the University of California - Berkeley, and works in the Technology industry as a Software Engineer. Aditi values education, hard work, kindness, and inclusivity. Her hobbies include hiking, coding, painting, and cooking. She occasionally drinks, does not smoke, use marijuana, or drugs, and she maintains an active lifestyle. Aditi does not have any children but is looking forward to having some one day. She speaks English, Hindi, and Spanish. She is looking for a straight man who is between 28 and 35 years old, is at least 5'5\" tall, does not have children yet but wants them in the future, maintains an active lifestyle and shares her views on drinking, smoking, and substance use. She owns a pet cat and her zodiac sign is Leo.", "user_id": "3f8ab3cb-fa0c-4572-9550-b9e6f6d377bd"}
{"name": "Amara Smith", "age": 29, "height": "5'7\"", "school": "University of Southern California", "job_industry": "Healthcare", "job_title": "Nurse", "hometown_location": "Austin, Texas", "dating_location": "Los Angeles, California", "languages_spoken": ["English", "Spanish"], "values": "Philanthropy, Authenticity, Family", "interests": "Traveling, Volunteering, Fitness, Cooking", "education_level": "Graduate", "religious_beliefs": "Other", "politics": "Liberal", "dating_intentions": "Long term", "relationship_type": "Monogamy", "gender": "Woman", "pronouns": "She/Her/Hers", "sexuality": "Gay", "ethnicity": "Black African Descent", "has_children": false, "want_children": true, "pets": ["Dog"], "zodiac_sign": "Aquarius", "mbti_personality_type": "ENFJ", "drinking": "Sometimes", "smoking": "No", "marijuana": "No", "drugs": "No", "exercise": "Active", "partner_preferences": {"minimum_age": 28, "maximum_age": 35, "minimum_height": "5'2\"", "maximum_height": "6'0\"", "has_children": false, "want_children": true, "sexuality": "Other", "drinking": "Yes", "smoking": "No", "marijuana": "No", "drugs": "No", "exercise": "Active"}, "summary": "Amara Smith is a 29-year-old gay woman of Black African descent, based in Los Angeles, California. She works in the healthcare industry as a nurse and is a graduate of the University of Southern California. She speaks English and Spanish, and values philanthropy, authenticity, and family. She enjoys traveling, volunteering, fitness, and cooking. Her political leanings are liberal and her religious beliefs are classified as other. \n\nIn her personal life, Amara does not smoke or use drugs, and drinks occasionally. She is active and owns a dog. Her zodiac sign is Aquarius and she identifies as an ENFJ on the Myers-Briggs Type Indicator. She doesn't have children but is open to having them in the future.\n\nAmara is seeking a serious, monogamous relationship with a partner between the ages of 28 and 35, who is active, does not smoke, is comfortable with drinking but does not use drugs. She is looking for someone who also wants children in the future. Her partner's sexuality is open-ended (\"other\"), reflecting Amara's inclusiveness and acceptance of differing expressions of love. ", "user_id": "8d179ec2-2309-4d97-bd2f-25a3763a6968"}
{"name": "Taylor Rivera", "age": 28, "height": "5'10\"", "school": "University of Wisconsin-Madison", "job_industry": "Tech", "job_title": "Software Engineer", "hometown_location": "Milwaukee, Wisconsin", "dating_location": "Los Angeles, California", "languages_spoken": ["English", "Spanish"], "values": "Environmental conservation, social justice, family", "interests": "Photography, hiking, cooking, reading, yoga", "education_level": "Graduate", "religious_beliefs": "Agnostic", "politics": "Liberal", "dating_intentions": "Long term", "relationship_type": "Monogamy", "gender": "Non binary", "pronouns": "They/Them/Their", "sexuality": "Bi", "ethnicity": "Hispanic/Latino", "has_children": false, "want_children": true, "pets": ["Dog", "Cat"], "zodiac_sign": "Taurus", "mbti_personality_type": "INFJ", "drinking": "Sometimes", "smoking": "No", "marijuana": "Sometimes", "drugs": "No", "exercise": "Active", "partner_preferences": {"minimum_age": 26, "maximum_age": 35, "minimum_height": "5'0\"", "maximum_height": "6'5\"", "has_children": false, "want_children": true, "sexuality": "Bi", "drinking": "Yes", "smoking": "No", "marijuana": "Yes", "drugs": "No", "exercise": "Active"}, "summary": "Taylor Rivera is a 28-year-old non-binary software engineer who identifies as bi and uses they/them pronouns. They stand 5'10\" tall and are of Hispanic/Latino ethnicity. Originally from Milwaukee, Wisconsin, they currently reside in Los Angeles, California.\n\nTheir educational background includes a degree from the University of Wisconsin-Madison, and their political leanings are liberal. Fluent in both English and Spanish, they describe themselves as agnostic.\n\nTaylor is passionate about environmental conservation and social justice, and holds family values in high regard. In their free time, they enjoy photography, hiking, cooking, reading, and yoga.\n\nAs for lifestyle, Taylor occasionally drinks, is open to using marijuana but does not smoke, and leads an active lifestyle. They have both a cat and a dog, but no kids. They, however, express a desire for children in the future.\n\nCategorized as an INFJ – presumably from the Myers-Briggs Type Indicator (MBTI) – and belonging to the zodiac sign Taurus, Taylor is seeking a long-term, monogamous relationship. When it comes to potential partners, they prefer someone active and between the ages of 26 and 35, who doesn't smoke but drinks and is open to marijuana usage. This potential partner should also have no children but ideally wants them in the future.", "user_id": "6e0157c9-33ae-4578-8b2f-a52a2effbb1d"}
{"name": "Imani Evans", "age": 28, "height": "5'7\"", "school": "University of Michigan", "job_industry": "Nonprofit", "job_title": "Program Coordinator", "hometown_location": "Chicago, Illinois", "dating_location": "Los Angeles, California", "languages_spoken": ["English", "Spanish"], "values": "Equality, social justice, and environmental sustainability", "interests": "Poetry, hiking, volunteering, cooking, traveing", "education_level": "Graduate", "religious_beliefs": "Agnostic", "politics": "Liberal", "dating_intentions": "Life partner", "relationship_type": "Monogamy", "gender": "Woman", "pronouns": "She/Her/Hers", "sexuality": "Gay", "ethnicity": "Black African Descent", "has_children": false, "want_children": true, "pets": ["Dog"], "zodiac_sign": "Sagittarius", "mbti_personality_type": "ENFJ", "drinking": "Yes", "smoking": "No", "marijuana": "Sometimes", "drugs": "No", "exercise": "Active", "partner_preferences": {"minimum_age": 27, "maximum_age": 35, "minimum_height": "5'4\"", "maximum_height": "6'0\"", "has_children": false, "want_children": true, "sexuality": "Gay", "drinking": "Yes", "smoking": "No", "marijuana": "Yes", "drugs": "No", "exercise": "Active"}, "summary": "Imani Evans is a 28-year-old woman from Chicago, Illinois, who now lives in Los Angeles, California. She holds a graduate degree from the University of Michigan and currently works as a Program Coordinator in a nonprofit organization. She is bilingual, speaking both English and Spanish. \n\nImani identifies as gay and uses she/her pronouns. Passionate about poetry, hiking, volunteering, cooking, and traveling, she values equality, social justice, and environmental sustainability. She's of Black African descent, politics-relaxingly liberal, and agnostically religious. \n\nImani doesn't have children but wants them in the future, and she is a proud dog owner. A Sagittarius with an outgoing and friendly ENFJ personality type, she enjoys a social drink, sometimes uses marijuana, but doesn't smoke or use other drugs. Imani leads an active lifestyle and is looking for a life partner with similar interests.\n\nHer future partner is ideally a gay woman aged between 27 to 35, ranging from 5'4\" to 6'0\" in height. Imani prefers a partner who doesn't smoke or use drugs, occasionally enjoys alcohol or marijuana, actively exercises, doesn't currently have children but is interested in having some in the future.", "user_id": "e75fc35b-85b8-4dd8-bc39-6f6ce18596b8"}
{"name": "Alex Morgan", "age": 28, "height": "5'9\"", "school": "University of California, Berkeley", "job_industry": "Tech", "job_title": "Software Engineer", "hometown_location": "Seattle, Washington", "dating_location": "Los Angeles, California", "languages_spoken": ["English", "Spanish", "Mandarin"], "values": "Loves adventure and values honesty, respect, and open-mindedness.", "interests": "Mountain biking, Coding, food tasting, and learning languages.", "education_level": "Graduate", "religious_beliefs": "Atheist", "politics": "Liberal", "dating_intentions": "Life partner", "relationship_type": "Monogamy", "gender": "Non binary", "pronouns": "They/Them/Their", "sexuality": "Other", "ethnicity": "Hispanic/Latino", "has_children": false, "want_children": true, "pets": ["Dog", "Fish"], "zodiac_sign": "Pisces", "mbti_personality_type": "ENTP", "drinking": "Sometimes", "smoking": "No", "marijuana": "No", "drugs": "No", "exercise": "Active", "partner_preferences": {"minimum_age": 26, "maximum_age": 34, "minimum_height": "5'4\"", "maximum_height": "6'0\"", "has_children": false, "want_children": true, "sexuality": "Straight", "drinking": "Yes", "smoking": "No", "marijuana": "No", "drugs": "No", "exercise": "Active"}, "summary": "Alex Morgan, a non-binary software engineer based in Los Angeles, is looking for a life partner. Originally from Seattle, they graduated from UC Berkeley and work in the tech industry. Alex is 5'9\", 28 years old, identifies as Hispanic/Latino, and uses they/them pronouns. They are multilingual, fluent in English, Spanish, and Mandarin. \n\nAdventure-loving and a foodie at heart, Alex also enjoys mountain biking, coding, and learning languages. They identify as an atheist and are politically liberal. One day they hope to have children, and for now, share their home with a dog and a fish. They sometimes enjoy a drink, but don't smoke or use marijuana. \n\nAlex's ideal partner would also be physically active, want children (but not have any currently), and not be involved in smoking or drug use. They're open to someone who drinks. Alex prefers a partner aged between 26 to 34 and a height between 5'4\" and 6'0\".", "user_id": "ba89b30d-cb7d-4679-bd7a-6d5c7518cbe2"}
{"name": "Samuel Cabrera", "age": 38, "height": "6'2\"", "school": "UCLA", "job_industry": "Healthcare", "job_title": "Nurse Practitioner", "hometown_location": "San Antonio, Texas", "dating_location": "Los Angeles, California", "languages_spoken": ["English", "Spanish"], "values": "Family, Education, Health", "interests": "Music, Traveling, Cooking", "education_level": "Graduate", "religious_beliefs": "Catholic", "politics": "Moderate", "dating_intentions": "Long term, open to short", "relationship_type": "Monogamy", "gender": "Man", "pronouns": "He/Him/His", "sexuality": "Straight", "ethnicity": "Hispanic/Latino", "has_children": true, "want_children": false, "pets": ["Dog"], "zodiac_sign": "Aries", "mbti_personality_type": "ENFP", "drinking": "Yes", "smoking": "No", "marijuana": "No", "drugs": "No", "exercise": "Active", "partner_preferences": {"minimum_age": 32, "maximum_age": 45, "minimum_height": "5'2\"", "maximum_height": "6'0\"", "has_children": true, "want_children": false, "sexuality": "Straight", "drinking": "Yes", "smoking": "No", "marijuana": "No", "drugs": "No", "exercise": "Active"}, "summary": "Samuel Cabrera is a 38-year-old Nurse Practitioner currently residing in Los Angeles, California. He has a graduate degree from UCLA and speaks both English and Spanish. Originally hailing from San Antonio, Texas, Samuel places great value on family, education, and health. Being a Catholic and politically moderate, he seeks a monogamous relationship and has long-term dating intentions but is open to short-term as well. \n\nSamuel is a straight man who uses He/Him/His pronouns and identifies ethnically as Hispanic/Latino. He is also a father, with no desires to have more children. In his spare time, he enjoys music, traveling, and cooking, and owns a pet dog. As an Aries and an ENFP, he enjoys staying active and occasionally having a drink but refrains from smoking, marijuana, and drugs. \n\nWhen it comes to his partner preferences, Samuel is attracted to straight women who also lead an active lifestyle, enjoy a drink but abstain from smoking, marijuana, and drugs. Ideal ages range from 32 to 45 years old with a height range from 5'2\" to 6'0\". She should also have children but not want more as Samuel is happy with his current family size.", "user_id": "5cd6a908-c2f7-45c8-9ef3-e13caee32974"}
{"name": "Amina Patel", "age": 29, "height": "5'4\"", "school": "Stanford University", "job_industry": "Technology", "job_title": "Software Engineer", "hometown_location": "New York, New York", "dating_location": "Los Angeles, California", "languages_spoken": ["English", "Gujarati"], "values": "Honesty, Positivity, Ambition", "interests": "Coding, Yoga, Book club, Cooking, Photography", "education_level": "Graduate", "religious_beliefs": "Hindu", "politics": "Liberal", "dating_intentions": "Long term", "relationship_type": "Monogamy", "gender": "Woman", "pronouns": "She/Her/Hers", "sexuality": "Straight", "ethnicity": "South Asian", "has_children": false, "want_children": true, "pets": ["Cat"], "zodiac_sign": "Virgo", "mbti_personality_type": "INTJ", "drinking": "Yes", "smoking": "No", "marijuana": "No", "drugs": "No", "exercise": "Active", "partner_preferences": {"minimum_age": 28, "maximum_age": 35, "minimum_height": "5'6\"", "maximum_height": "6'2\"", "has_children": false, "want_children": true, "sexuality": "Straight", "drinking": "Yes", "smoking": "No", "marijuana": "No", "drugs": "No", "exercise": "Active"}, "summary": "Amina Patel is a 29-year-old woman, South Asian by ethnicity, and stands 5'4\" tall. She is a Software Engineer in the technology industry and is based out of Los Angeles, California, though she is originally from New York. She is a graduate from Stanford University and fluent in English and Gujarati. \n\nShe lives her life by the values of honesty, positivity, and ambition. Her hobbies include coding, yoga, attending book clubs, cooking, and photography. Amina's religious belief is Hindu and she identifies herself as being politically liberal.\n\nShe is interested in monogamous and long-term relationships. She is straight and uses the pronouns - she, her, hers. Amina doesn't have children currently but looks forward to having them in the future. She is a cat person and is physically active. \n\nShe is a Virgo and identifies with the INTJ personality type in the Myers-Briggs Type Indicator. Amina is comfortable with drinking but doesn't smoke or use marijuana or other drugs.\n\nIn terms of her partner preferences, she is interested in straight men aged between 28-35, who are 5'6\" - 6'2\" tall. They should also want children in the future and be physically active. She expects her partner to be comfortable with drinking but abstain from smoking, marijuana or other drugs.\n", "user_id": "e59716f7-f251-4edd-a615-019a12b20640"}
{"name": "Priya Patel", "age": 28, "height": "5'4\"", "school": "University of Michigan", "job_industry": "Healthcare & Medical", "job_title": "Pediatric Nurse", "hometown_location": "Detroit, Michigan", "dating_location": "Los Angeles, California", "languages_spoken": ["English", "Hindi"], "values": "Equality, Civil rights, Self-development", "interests": "Traveling, Meditation, Photography", "education_level": "Graduate", "religious_beliefs": "Hindu", "politics": "Liberal", "dating_intentions": "Life partner", "relationship_type": "Monogamy", "gender": "Woman", "pronouns": "She/Her/Hers", "sexuality": "Straight", "ethnicity": "South Asian", "has_children": false, "want_children": true, "pets": ["None"], "zodiac_sign": "Taurus", "mbti_personality_type": "ISFJ", "drinking": "No", "smoking": "No", "marijuana": "No", "drugs": "No", "exercise": "Active", "partner_preferences": {"minimum_age": 28, "maximum_age": 35, "minimum_height": "5'6\"", "maximum_height": "6'4\"", "has_children": false, "want_children": true, "sexuality": "Straight", "drinking": "No", "smoking": "No", "marijuana": "No", "drugs": "No", "exercise": "Active"}, "summary": "Priya Patel is a 28-year-old Pediatric Nurse working in the healthcare and medical industry. She currently lives in Los Angeles, California, and is originally from Detroit, Michigan. Holding a graduate's degree from the University of Michigan, she upholds equality, civil rights, and self-development as her core values. \n\nPriya speaks English and Hindi and has a strong interest in traveling, meditation, and photography. She follows Hindu religious beliefs and leans towards liberal viewpoints politically. Priya identifies as a straight woman and uses she/her pronouns. Her background is South Asian. She doesn't have any children but has expressed a desire to have children in the future.\n\nPriya is a non-smoker and non-drinker. She leads an active lifestyle and is an ISFJ on the MBTI personality type chart. As a Taurus, she is looking for a life partner within the age range of 28 to 35 years. Her ideal partner shares her lifestyle choices, including non-smoking and non-drinking, and should also have a desire for kids, just like Priya herself.", "user_id": "392845c8-b073-460a-9258-17952c7e9a2b"}
{"name": "Ashley Johnson", "age": 28, "height": "5'7\"", "school": "University of Southern California", "job_industry": "Healthcare & Medical", "job_title": "Nurse", "hometown_location": "Atlanta, Georgia", "dating_location": "Los Angeles, California", "languages_spoken": ["English", "Spanish"], "values": "Family, Health, Equality", "interests": "Traveling, Hiking, Healthy living, Reading", "education_level": "Undergraduate", "religious_beliefs": "Christian", "politics": "Liberal", "dating_intentions": "Life partner", "relationship_type": "Monogamy", "gender": "Woman", "pronouns": "She/Her/Hers", "sexuality": "Straight", "ethnicity": "Black African Descent", "has_children": false, "want_children": true, "pets": ["Dog"], "zodiac_sign": "Virgo", "mbti_personality_type": "ESFJ", "drinking": "Sometimes", "smoking": "No", "marijuana": "No", "drugs": "No", "exercise": "Active", "partner_preferences": {"minimum_age": 28, "maximum_age": 35, "minimum_height": "5'8\"", "maximum_height": "6'2\"", "has_children": false, "want_children": true, "sexuality": "Straight", "drinking": "Sometimes", "smoking": "No", "marijuana": "No", "drugs": "No", "exercise": "Active"}, "summary": "Ashley Johnson is a 28-year-old woman of Black African descent based in Los Angeles, California. She is a nurse by profession and is educated up to the undergraduate level from the University of Southern California. Ashley values Family, Health, and Equality. She is interested in activities like Traveling, Hiking, Healthy Living, and Reading. She identifies as Christian with liberal political views and is seeking a life partner in a monogamous relationship. She is straight and uses she/her/hers pronouns.\n\nAshley does not have children but wishes to have them in the future. She has a dog and enjoys leading an active lifestyle. She occasionally drinks, but she stays away from smoking, marijuana, and other drugs. Her preferred partner would be a straight man who is between the age of 28 and 35, stands between 5'8\" and 6'2\", does not have children but wants them, leads an active lifestyle, occasionally drinks but doesn't smoke, use marijuana, or other drugs. Ashley is a Virgo and her MBTI personality type is recorded as \"ESFJ\".", "user_id": "195f0409-de0f-4ec0-afb7-74cd66efc406"}
{"name": "Alexis Rodriguez", "age": 29, "height": "5'5\"", "school": "University of California, Berkeley", "job_industry": "Healthcare", "job_title": "Registered Nurse", "hometown_location": "Santa Ana, California", "dating_location": "Los Angeles, California", "languages_spoken": ["English", "Spanish"], "values": "Honesty, compassion, and love for family are fundamental values in my life. I also have a deep respect for cultural diversity.", "interests": "I love exploring local farmers markets, hiking, trying new food recipes, reading self-development books, and practicing yoga.", "education_level": "Undergraduate", "religious_beliefs": "Catholic", "politics": "Liberal", "dating_intentions": "Life partner", "relationship_type": "Monogamy", "gender": "Woman", "pronouns": "She/Her/Hers", "sexuality": "Straight", "ethnicity": "Hispanic/Latino", "has_children": false, "want_children": true, "pets": ["Dog"], "zodiac_sign": "Gemini", "mbti_personality_type": "ENFJ", "drinking": "Sometimes", "smoking": "No", "marijuana": "No", "drugs": "No", "exercise": "Active", "partner_preferences": {"minimum_age": 27, "maximum_age": 35, "minimum_height": "5'6\"", "maximum_height": "6'2\"", "has_children": false, "want_children": true, "sexuality": "Straight", "drinking": "Yes", "smoking": "No", "marijuana": "No", "drugs": "No", "exercise": "Active"}, "summary": "Alexis Rodriguez is a 29-year-old straight woman looking for a life partner. She stands 5'5\" tall, works as a registered nurse, and lives in Los Angeles, California. She is Hispanic/Latino and speaks both English and Spanish. With a background in healthcare, she graduated from the University of California, Berkeley. She identifies as Catholic and holds liberal political beliefs. Her important values are honesty, compassion, and love for family, and she has a deep appreciation for cultural diversity.\n\nIn her free time, Alexis enjoys exploring local farmers markets, hiking, cooking new recipes, reading self-development books, and practicing yoga. She's into fitness and is active in exercising. As a Gemini and an ENFJ, she does not smoke or use drugs but occasionally enjoys a drink.\n\nAlexis doesn't have children but wants them in the future. She does, however, have a pet dog. Her preferred partner should be a straight male, aged between 27 and 35, who doesn't smoke or use drugs, and is active. He should be between 5'6\" and 6'2\" in height, have no children but wants them in the future, and enjoys drinking occasionally.", "user_id": "320ddc2a-11e8-4874-9863-1e1cc5415ff1"}
{"name": "Leo Williams", "age": 35, "height": "6'2\"", "school": "University of Texas at Austin", "job_industry": "Healthcare", "job_title": "Physical Therapist", "hometown_location": "Austin, Texas", "dating_location": "Los Angeles, California", "languages_spoken": ["English", "Spanish"], "values": "Kindness, straightforwardness, empathy", "interests": "Outdoor adventures, creating art, travel, cooking, reading", "education_level": "Graduate", "religious_beliefs": "Agnostic", "politics": "Moderate", "dating_intentions": "Life partner", "relationship_type": "Monogamy", "gender": "Man", "pronouns": "He/Him/His", "sexuality": "Straight", "ethnicity": "Black African Descent", "has_children": false, "want_children": true, "pets": ["Dog"], "zodiac_sign": "Leo", "mbti_personality_type": "ENFJ", "drinking": "Sometimes", "smoking": "No", "marijuana": "No", "drugs": "No", "exercise": "Active", "partner_preferences": {"minimum_age": 27, "maximum_age": 40, "minimum_height": "5'0\"", "maximum_height": "6'0\"", "has_children": false, "want_children": true, "sexuality": "Straight", "drinking": "Sometimes", "smoking": "No", "marijuana": "No", "drugs": "No", "exercise": "Active"}, "summary": "Leo Williams is a 35-year-old straight man of Black African descent who currently lives in Los Angeles, California. He is 6'2\" tall, a University of Texas at Austin graduate, and works in the healthcare industry as a physical therapist. Leo speaks English and Spanish. His values center on kindness, straightforwardness, and empathy. His interests include outdoor adventures, creating art, travelling, cooking, and reading. He subscribes to agnostic beliefs, exhibits moderate political views, and identifies as an ENFJ. Leo doesn't smoke or use drugs and occasionally drinks. He is active and enjoys working out. \n\nHe's looking for a life partner who is also monogamous. While Leo doesn't have children, he wishes to have them in the future. On the light-hearted side, he is a Leo and a dog-lover. Leo's ideal partner, aged between 27 and 40, shares his stance on smoking, drinking, and drugs. She also values an active lifestyle, doesn't have children, but wants them in the future.\n", "user_id": "924fa51d-9e26-462c-b460-b5654c4cd171"}
{"name": "Alex Vega", "age": 35, "height": "5'9\"", "school": "University of Michigan", "job_industry": "Entertainment", "job_title": "Director", "hometown_location": "Miami, Florida", "dating_location": "Los Angeles, California", "languages_spoken": ["English", "Spanish"], "values": "Family, Sustainability, Creativity", "interests": "Filmmaking, Basketball, Cooking, Traveling", "education_level": "Graduate", "religious_beliefs": "Agnostic", "politics": "Liberal", "dating_intentions": "Long term, open to short", "relationship_type": "Monogamy", "gender": "Non binary", "pronouns": "They/Them/Their", "sexuality": "Other", "ethnicity": "Hispanic/Latino", "has_children": false, "want_children": true, "pets": ["Cat"], "zodiac_sign": "Leo", "mbti_personality_type": "ENFP", "drinking": "Sometimes", "smoking": "No", "marijuana": "No", "drugs": "No", "exercise": "Active", "partner_preferences": {"minimum_age": 28, "maximum_age": 40, "minimum_height": "5'0\"", "maximum_height": "6'0\"", "has_children": false, "want_children": true, "sexuality": "Other", "drinking": "No", "smoking": "No", "marijuana": "No", "drugs": "No", "exercise": "Active"}, "summary": "Alex Vega, a 35-year-old non-binary Director working in the entertainment industry in Los Angeles, is seeking a long term relationship but is also open to short term. They are a graduate of the University of Michigan, identify as agnostic and liberal, and speak both English and Spanish. \n\nOriginally from Miami, Alex is of Hispanic/Latino ethnicity and prefers using \"they/them/their\" pronouns. They are an ENFP according to the Myers Briggs Type Indicator and their zodiac sign is Leo. While they do not have any children, they aspire to have them someday. Alex is active and occasionally enjoys a drink but does not consume smoking, marijuana, or any other drugs. In their free time, they indulge in activities like filmmaking, basketball, cooking, and traveling. Family bonds, sustainable living, and creativity are core parts of their personal values. \n\nAlex is interested in a partner aged between 28 and 40 years who is open to having children in the future. They prefer someone who is non-drinker, non-smoker, does not consume marijuana or engage in drug usage, and leads an active lifestyle. Alex is a cat lover and is hoping to find someone who shares the same penchant for pets.", "user_id": "40a47f27-1448-49e5-b2ef-8aabc11dce7b"}
{"name": "Alex Rodriguez", "age": 27, "height": "6'2\"", "school": "University of California", "job_industry": "Finance", "job_title": "Financial Analyst", "hometown_location": "San Francisco, California", "dating_location": "Los Angeles, California", "languages_spoken": ["English", "Spanish"], "values": "Honesty, Ambition, Equality", "interests": "Basketball, Music Festivals, Cooking", "education_level": "Graduate", "religious_beliefs": "Atheist", "politics": "Liberal", "dating_intentions": "Life partner", "relationship_type": "Monogamy", "gender": "Non binary", "pronouns": "They/Them/Their", "sexuality": "Other", "ethnicity": "Hispanic/Latino", "has_children": false, "want_children": true, "pets": ["None"], "zodiac_sign": "Gemini", "mbti_personality_type": "ENFJ", "drinking": "Sometimes", "smoking": "No", "marijuana": "No", "drugs": "No", "exercise": "Active", "partner_preferences": {"minimum_age": 24, "maximum_age": 35, "minimum_height": "5'0\"", "maximum_height": "6'5\"", "has_children": false, "want_children": true, "sexuality": "Other", "drinking": "Sometimes", "smoking": "No", "marijuana": "No", "drugs": "No", "exercise": "Active"}, "summary": "This non-binary individual, Alex Rodriguez, is a 27-year-old Financial Analyst based in Los Angeles, who originally hails from San Francisco. Having graduated from the University of California, they speak English and Spanish, value honesty, ambition, and equality, and bear liberal political views. Alex identifies as non-binary with they/them pronouns. \n\nTheir interests include basketball, music festivals, and cooking. In relation to lifestyle preferences, Alex, a Gemini, does exercise regularly but only indulges in alcohol occasionally. They do not smoke, nor do they use any sort of drugs. Alex identifies their sexuality as 'Other' and is looking for a life partner.\n\nAlex is from Hispanic/Latino ethnicity and does not have any children yet but hopes to in the future. They do not have any pets. Their dating preferences include individuals who are active like them, sometimes drinks, does not smoke nor use marijuana. Alex is interested in meeting someone of the ages 24 to 35 and has a height between 5'0'' and 6'5''. Their future partner should potentially want children as well.", "user_id": "254f44fe-17b2-49a8-9205-006590335cb5"}
{"name": "Samantha Jones", "age": 32, "height": "5'6\"", "school": "Columbia University", "job_industry": "Publishing", "job_title": "Senior Editor", "hometown_location": "Brooklyn, New York", "dating_location": "Los Angeles, California", "languages_spoken": ["English", "Spanish"], "values": "Honesty, Hardwork, Equality", "interests": "Reading, Travelling, Yoga", "education_level": "Graduate", "religious_beliefs": "Agnostic", "politics": "Liberal", "dating_intentions": "Long term", "relationship_type": "Monogamy", "gender": "Woman", "pronouns": "She/Her/Hers", "sexuality": "Straight", "ethnicity": "Hispanic/Latino", "has_children": false, "want_children": true, "pets": ["Dog"], "zodiac_sign": "Pisces", "mbti_personality_type": "ENFJ", "drinking": "Sometimes", "smoking": "No", "marijuana": "No", "drugs": "No", "exercise": "Active", "partner_preferences": {"minimum_age": 30, "maximum_age": 40, "minimum_height": "5'8\"", "maximum_height": "6'4\"", "has_children": false, "want_children": true, "sexuality": "Straight", "drinking": "Yes", "smoking": "No", "marijuana": "No", "drugs": "No", "exercise": "Sometimes"}, "summary": "Samantha Jones is a 32-year-old straight woman. She is a Senior Editor in the Publishing industry, and a graduate from Columbia University. Originally from Brooklyn, New York, she currently resides in Los Angeles, California. Samantha communicates in English and Spanish, and believes in honesty, hardwork, and equality. She enjoys reading, travelling, and practicing yoga, follows Liberal politics, and identifies as agnostic. She is seeking a long-term, monogamous relationship. Samantha doesn't have children, but would like to in the future. She has a pet dog, and occasionally enjoys a drink but doesn't smoke or do drugs. She is active and is a Pisces with an ENFJ personality type. Her preferences for a partner are a straight man between the age of 30 and 40, who is at least 5'8\", doesn't smoke, is fine with occasional drinking, does not use marijuana or other drugs, and sometimes exercises. Ideally, her partner would also want children in the future.\n", "user_id": "f8390f5b-469c-404a-be08-6e0408a361b2"}
{"name": "Maya Patel", "age": 28, "height": "5'6\"", "school": "Harvard University", "job_industry": "Technology", "job_title": "Software Engineer", "hometown_location": "Austin, Texas", "dating_location": "Los Angeles, California", "languages_spoken": ["English", "Hindi", "Spanish"], "values": "Maya believes in self-growth and always being open to learning new things. She also values family, friendships and enjoying the small moments in life.", "interests": "Maya loves reading, hiking, traveling internationally and yoga. She's also a big fan of live music.", "education_level": "Graduate", "religious_beliefs": "Hindu", "politics": "Liberal", "dating_intentions": "Life partner", "relationship_type": "Monogamy", "gender": "Woman", "pronouns": "She/Her/Hers", "sexuality": "Straight", "ethnicity": "South Asian", "has_children": false, "want_children": true, "pets": ["Cat"], "zodiac_sign": "Virgo", "mbti_personality_type": "ENFJ", "drinking": "Sometimes", "smoking": "No", "marijuana": "No", "drugs": "No", "exercise": "Active", "partner_preferences": {"minimum_age": 28, "maximum_age": 35, "minimum_height": "5'8\"", "maximum_height": "6'3\"", "has_children": false, "want_children": true, "sexuality": "Straight", "drinking": "Sometimes", "smoking": "No", "marijuana": "No", "drugs": "No", "exercise": "Active"}, "summary": "Maya Patel is an enthusiastic 28-year-old software engineer based in Los Angeles, California. An alumnus of Harvard University, she is a woman of South Asian ethnicity who uses she/her/hers pronouns and identifies as straight. In her free time, Maya loves reading, hiking, international travel, yoga, and attending live music events. Her belief system is grounded in self-growth, family, friendships, and appreciating life's simple moments. From a religious perspective, she aligns with Hindu beliefs and falls into the liberal political spectrum. A pet cat owner, she is looking for a life partner within an age range of 28-35 and hopes to have children in the future. She prefers a partner who is active, non-smoker and drinks on an occasional basis, just like her. Maya identifies as an ENFJ according to the MBTI personality types and her zodiac sign is Virgo.", "user_id": "e03132ad-8b16-49fa-8962-77a09296d072"}
{"name": "Ali Smith", "age": 31, "height": "5'8\"", "school": "Yale University", "job_industry": "Technology", "job_title": "Software Engineer", "hometown_location": "Chicago, Illinois", "dating_location": "Los Angeles, California", "languages_spoken": ["English", "Arabic"], "values": "Honesty, Loyalty, and Equality", "interests": "Traveling, Reading, Learning new languages", "education_level": "Graduate", "religious_beliefs": "Muslim", "politics": "Liberal", "dating_intentions": "Life partner", "relationship_type": "Monogamy", "gender": "Man", "pronouns": "He/Him/His", "sexuality": "Gay", "ethnicity": "Middle Eastern", "has_children": false, "want_children": true, "pets": ["Dog"], "zodiac_sign": "Gemini", "mbti_personality_type": "INFJ", "drinking": "Sometimes", "smoking": "No", "marijuana": "No", "drugs": "No", "exercise": "Active", "partner_preferences": {"minimum_age": 26, "maximum_age": 38, "minimum_height": "5'0\"", "maximum_height": "6'5\"", "has_children": false, "want_children": true, "sexuality": "Gay", "drinking": "Yes", "smoking": "No", "marijuana": "No", "drugs": "No", "exercise": "Active"}, "summary": "Ali Smith, a 31-year-old gay man, is a software engineer in the tech industry who originally hails from Chicago but is now located in Los Angeles. At Yale University, he completed his graduate studies. He is a Muslim with liberal political views, who speaks English and Arabic fluently. His values center around honesty, loyalty, and equality. Ali is actively ambitious; his hobbies include traveling, reading, and learning new languages. A Gemini with an INFJ personality type, he sometimes drinks but does not smoke or use recreational drugs. In terms of fitness, he maintains an active exercise routine. Ali doesn't have children but would like to in the future, and he has a pet dog. He is interested in a life partner who wants children, maintains an active lifestyle, and doesn't smoke or use recreational drugs. His preferred partner's age would range between 26 and 38.", "user_id": "6ab95db5-c091-4b5f-aac0-840205431394"}
{"name": "Kimiko Takahashi", "age": 36, "height": "5'4\"", "school": "UC Berkeley", "job_industry": "Tech", "job_title": "Software Developer", "hometown_location": "Kyoto, Japan", "dating_location": "Los Angeles, California", "languages_spoken": ["English", "Japanese"], "values": "Discipline, Integrity, and Self-Development", "interests": "Coding, Cooking, Gardening, and Traveling", "education_level": "Graduate", "religious_beliefs": "Buddhist", "politics": "Moderate", "dating_intentions": "Life partner", "relationship_type": "Monogamy", "gender": "Woman", "pronouns": "She/Her/Hers", "sexuality": "Straight", "ethnicity": "East Asian", "has_children": false, "want_children": true, "pets": ["Cat"], "zodiac_sign": "Capricorn", "mbti_personality_type": "ISTJ", "drinking": "Yes", "smoking": "No", "marijuana": "No", "drugs": "No", "exercise": "Active", "partner_preferences": {"minimum_age": 30, "maximum_age": 40, "minimum_height": "5'7\"", "maximum_height": "6'2\"", "has_children": false, "want_children": true, "sexuality": "Straight", "drinking": "Yes", "smoking": "No", "marijuana": "No", "drugs": "No", "exercise": "Active"}, "summary": "Kimiko Takahashi is a 36-year-old Software Developer from Kyoto, Japan and currently resides in Los Angeles, California. She holds a graduate degree from UC Berkeley and works in the tech industry. Kimiko speaks English and Japanese and self-identifies as a disciplined, active woman with interests in coding, cooking, gardening, and traveling. Practicing Buddhism, she holds moderate political views. As a straight woman, Kimiko is searching for a life partner and is open to monogamy. She is a proud cat owner and does not have children but is keen to have them in the future. Kimiko is a Capricorn and her Myers Briggs personality type is ISTJ. She enjoys drinking but does not smoke or do drugs. She is looking for a straight male partner between the ages of 30 and 40, who does not have children, but wants them in the future. Her ideal partner must be active and enjoy drinking but should not smoke or take drugs.", "user_id": "7ee4ed2d-95bf-4719-8a1c-b5ed04226aa7"}
{"name": "Aria Johnson", "age": 28, "height": "5'6\"", "school": "University of Texas", "job_industry": "Tech", "job_title": "Software Developer", "hometown_location": "Houston, Texas", "dating_location": "Los Angeles, California", "languages_spoken": ["English", "Spanish"], "values": "Family, Adventure, Creativity", "interests": "Traveling, Coding, Photography", "education_level": "Graduate", "religious_beliefs": "Atheist", "politics": "Liberal", "dating_intentions": "Life partner", "relationship_type": "Monogamy", "gender": "Woman", "pronouns": "She/Her/Hers", "sexuality": "Straight", "ethnicity": "Black African Descent", "has_children": false, "want_children": true, "pets": ["Dog"], "zodiac_sign": "Leo", "mbti_personality_type": "ENFJ", "drinking": "Sometimes", "smoking": "No", "marijuana": "No", "drugs": "No", "exercise": "Active", "partner_preferences": {"minimum_age": 28, "maximum_age": 36, "minimum_height": "5'8\"", "maximum_height": "6'2\"", "has_children": false, "want_children": true, "sexuality": "Straight", "drinking": "Yes", "smoking": "No", "marijuana": "No", "drugs": "No", "exercise": "Active"}, "summary": "Aria Johnson is a 28-year-old woman who identifies as straight and works as a software developer in the tech industry. She's originally from Houston, Texas, but is currently dating in Los Angeles, California. She is bilingual, speaking both English and Spanish. \n\nAria values family, adventure, and creativity and is interested in traveling, coding, and photography. She holds a graduate degree from the University of Texas and identifies as an atheist on the religious spectrum and a liberal in politics. \n\nShe is seeking a life partner and prefers monogamous relationships. She has no children but wishes to have some in the future. She has a dog and her zodiac sign is Leo. Being an ENFJ, Aria rarely drinks, does not smoke or use drugs. She leads an active lifestyle.\n\nAria welcomes straight men aged between 28 and 36 who do not smoke or use recreational drugs. Her potential partner should be active, drink socially, and open to having children in the future. He should also measure between 5'8\" and 6'2\" in height.", "user_id": "a01f4bb7-8b39-4997-8ebb-4d2ab742e7f4"}
{"name": "John Doe", "age": 28, "height": "5'10\"", "school": "University of Houston", "job_industry": "Healthcare", "job_title": "Nurse", "hometown_location": "Houston, Texas", "dating_location": "Los Angeles, California", "languages_spoken": ["English", "Portuguese"], "values": "Community, love and nurturing, environmental stability", "interests": "Music festivals, hiking, poetry writing", "education_level": "Graduate", "religious_beliefs": "Buddhist", "politics": "Liberal", "dating_intentions": "Long term", "relationship_type": "Monogamy", "gender": "Man", "pronouns": "He/Him/His", "sexuality": "Gay", "ethnicity": "Hispanic/Latino", "has_children": false, "want_children": true, "pets": ["Dog"], "zodiac_sign": "Scorpio", "mbti_personality_type": "ENFJ", "drinking": "Yes", "smoking": "No", "marijuana": "No", "drugs": "No", "exercise": "Active", "partner_preferences": {"minimum_age": 26, "maximum_age": 34, "minimum_height": "5'6\"", "maximum_height": "6'0\"", "has_children": false, "want_children": true, "sexuality": "Gay", "drinking": "Yes", "smoking": "No", "marijuana": "No", "drugs": "No", "exercise": "Active"}, "summary": "John Doe is a 28-year-old man from Houston, Texas, currently residing in Los Angeles, California. He is a Nurse in the healthcare field and holds a graduate degree from the University of Houston. He speaks English and Portuguese and identifies as a Gay Hispanic/Latino man with Scorpio as his zodiac sign. His social attitudes are liberal and he follows Buddhist religious beliefs. \n\nJohn is passionate about community, love and nurturing, and environmental stability. His interests include music festivals, hiking, and poetry writing. He does drink but does not smoke or use marijuana or drugs. John exercises regularly and has a dog. He follows monogamy and is interested in long-term dating. \n\nAlthough he doesn't have children, he wishes to have them in the future. When it comes to his potential partners, he prefers them to be within the age range of 26 to 34, between the heights of 5'6\" and 6'0\". He also wishes for them to want children, drink socially, live an active lifestyle, and to not smoke or use drugs. John's personality type is ENFJ.", "user_id": "457d4ed6-7bf6-4edb-b4cc-957604d2caf2"}
{"name": "Samuel Lee", "age": 32, "height": "5'9\"", "school": "University of Chicago", "job_industry": "Technology", "job_title": "Software Developer", "hometown_location": "San Francisco, California", "dating_location": "Los Angeles, California", "languages_spoken": ["English", "Spanish", "Korean"], "values": "Honesty, kindness, and ambition", "interests": "Coding, CrossFit, traveling, cooking, reading", "education_level": "Graduate", "religious_beliefs": "Agnostic", "politics": "Liberal", "dating_intentions": "Life partner", "relationship_type": "Monogamy", "gender": "Man", "pronouns": "He/Him/His", "sexuality": "Gay", "ethnicity": "East Asian", "has_children": false, "want_children": true, "pets": ["Dog"], "zodiac_sign": "Virgo", "mbti_personality_type": "ENTJ", "drinking": "Sometimes", "smoking": "No", "marijuana": "No", "drugs": "No", "exercise": "Active", "partner_preferences": {"minimum_age": 26, "maximum_age": 38, "minimum_height": "5'0\"", "maximum_height": "6'2\"", "has_children": false, "want_children": true, "sexuality": "Gay", "drinking": "Yes", "smoking": "No", "marijuana": "No", "drugs": "No", "exercise": "Active"}, "summary": "Samuel Lee, a 32-year-old software developer from San Francisco currently based in Los Angeles, speaks English, Spanish, and Korean. He's a physically active, gay East Asian man who enjoys coding, CrossFit, traveling, cooking, and reading. He is an agnostic liberal who values honesty, kindness, and ambition. A man of intellect, Samuel holds a graduate degree from the University of Chicago and identifies as an ENTJ on the Myers-Briggs Type Indicator. Though he currently does not have children, he is open to having them in the future. He's a fan of dogs but not a fan of smoking or drug use. He enjoys a drink occasionally and is looking for a gay man aged 26 to 38 who shares similar values and life goals, is physically active, comfortable with occasional drinking but not into smoking or drugs.\n", "user_id": "0d73caa4-9d2f-422a-831d-ee8c3aee9f8d"}
{"name": "Alex Garcia", "age": 32, "height": "6'0\"", "school": "University of California, Los Angeles", "job_industry": "Technology", "job_title": "Software Developer", "hometown_location": "Chicago, Illinois", "dating_location": "Los Angeles, California", "languages_spoken": ["English", "Spanish"], "values": "Independence, Creativity, Social Justice", "interests": "Cooking, Coding, Music", "education_level": "Graduate", "religious_beliefs": "Agnostic", "politics": "Liberal", "dating_intentions": "Long term", "relationship_type": "Monogamy", "gender": "Man", "pronouns": "He/Him/His", "sexuality": "Gay", "ethnicity": "Hispanic/Latino", "has_children": false, "want_children": true, "pets": ["Dog"], "zodiac_sign": "Scorpio", "mbti_personality_type": "INTJ", "drinking": "Sometimes", "smoking": "No", "marijuana": "No", "drugs": "No", "exercise": "Active", "partner_preferences": {"minimum_age": 28, "maximum_age": 35, "minimum_height": "5'6\"", "maximum_height": "6'2\"", "has_children": false, "want_children": true, "sexuality": "Gay", "drinking": "Yes", "smoking": "No", "marijuana": "No", "drugs": "No", "exercise": "Active"}, "summary": "Alex Garcia is a 32-year-old software developer residing in Los Angeles, California. Originally from Chicago, Illinois, he is a graduate of the University of California, Los Angeles. Alex identifies as a Hispanic/Latino gay man who uses He/Him/His pronouns. He has a keen interest in cooking, coding, and music. Alex summons his salsa skills in the kitchen and loves creating software. He values independence, creativity, and social justice.\n\nAlex believes in monogamy and is in search of a long-term relationship. Even though he doesn't have children, he hopes to embrace parenthood in the future. He shares his home with a dog, lives an active lifestyle, and occasionally enjoys a drink. \n\nAlex is open to dating men between the ages of 28 to 35 who have a similar desire for future parenthood, lead an active lifestyle, enjoy a drink now and then, and who don't smoke or use drugs. As an open-minded Scorpio and INTJ type, Alex is looking for someone who respects his beliefs and enjoys the colorful spectrum of life as he does.", "user_id": "bb05bdd8-6f8a-447b-bbb3-afeb5ca7c75e"}
{"name": "Alejandra Silva", "age": 29, "height": "5'7\"", "school": "University of California", "job_industry": "Non-profit Organization", "job_title": "Community Outreach Specialist", "hometown_location": "Miami, Florida", "dating_location": "Los Angeles, California", "languages_spoken": ["English", "Spanish", "French"], "values": "Compassion, Justice, Art, Nature, Education", "interests": "Travelling, Finger-painting, Hiking, Reading, Cooking", "education_level": "Graduate", "religious_beliefs": "Spiritual", "politics": "Liberal", "dating_intentions": "Life partner", "relationship_type": "Monogamy", "gender": "Woman", "pronouns": "She/Her/Hers", "sexuality": "Straight", "ethnicity": "Hispanic/Latino", "has_children": false, "want_children": true, "pets": ["Dog", "Cat"], "zodiac_sign": "Pisces", "mbti_personality_type": "ENFP", "drinking": "Sometimes", "smoking": "No", "marijuana": "No", "drugs": "No", "exercise": "Active", "partner_preferences": {"minimum_age": 28, "maximum_age": 37, "minimum_height": "5'7\"", "maximum_height": "6'3\"", "has_children": false, "want_children": true, "sexuality": "Straight", "drinking": "Yes", "smoking": "No", "marijuana": "No", "drugs": "No", "exercise": "Active"}, "summary": "Alejandra Silva is a 29-year-old woman who identifies herself under the pronouns \"She/Her/Hers\" and is of Hispanic/Latino ethnicity. She grew up in Miami, Florida, and currently lives in Los Angeles, California while working as a Community Outreach Specialist in the non-profit sector. She is a graduate from the University of California and is intellectually stimulated by reading. She is fluent in English, Spanish, and French and enjoys travelling, finger painting, hiking, and cooking. Alejandra is spiritually inclined and leans towards liberal politics. Her essential values include compassion, justice, art, nature, and education. A dog and cat lover, she sometimes likes to have a drink but stays away from smoking. She is actively involved in exercise and sport and her MBTI personality type is ENFP. Alejandra hopes to find a life partner who is a non-smoker, keeps active, and is interested in having children in the future.", "user_id": "2f7cd047-62a9-4a84-86cb-8024d0b8c84a"}
{"name": "Sonia Garcia", "age": 28, "height": "5'4\"", "school": "University of California, Berkeley", "job_industry": "Technology", "job_title": "Software Engineer", "hometown_location": "San Diego, California", "dating_location": "Los Angeles, California", "languages_spoken": ["English", "Spanish"], "values": "Equality, Sustainability, Education", "interests": "Hiking, Music, Coding, Foodie Adventure", "education_level": "Graduate", "religious_beliefs": "Agnostic", "politics": "Liberal", "dating_intentions": "Long term", "relationship_type": "Monogamy", "gender": "Woman", "pronouns": "She/Her/Hers", "sexuality": "Straight", "ethnicity": "Hispanic/Latino", "has_children": false, "want_children": true, "pets": ["Dog"], "zodiac_sign": "Scorpio", "mbti_personality_type": "INTJ", "drinking": "Sometimes", "smoking": "No", "marijuana": "No", "drugs": "No", "exercise": "Active", "partner_preferences": {"minimum_age": 27, "maximum_age": 35, "minimum_height": "5'8\"", "maximum_height": "6'2\"", "has_children": false, "want_children": true, "sexuality": "Straight", "drinking": "Yes", "smoking": "No", "marijuana": "No", "drugs": "No", "exercise": "Active"}, "summary": "Sonia Garcia is a 28-year-old straight woman of Hispanic/Latino ethnicity based in Los Angeles, California. She studied at the University of California, Berkeley, and is now working as a Software Engineer in the technology industry. Sonia speaks English and Spanish, and her core values include Equality, Sustainability, and Education. She's interested in Hiking, Music, Coding, and culinary adventures.\n\nSonia describes herself as a liberal, agnostic, and as an INTJ on the Myers-Briggs Type Indicator. She identifies as a Scorpio and uses the pronouns She/Her/Hers. Sonia exercises regularly, occasionally drinks, but does not smoke or use marijuana or drugs. She's a dog owner, has no children currently but wants them in the future. Her intentions are for long-term monogamous dating.\n\nSonia is seeking a straight male aged between 27 and 35, who mirrors her habits in drinking, smoking, and exercise. Her possible match ideally doesn't have children, however, also has future intentions of having children.", "user_id": "3e5fd9ca-027e-4b64-865b-9cbe89027f53"}
{"name": "Alex Hill", "age": 32, "height": "5'9\"", "school": "University of Cincinnati", "job_industry": "Finance", "job_title": "Financial Analyst", "hometown_location": "Cincinnati, Ohio", "dating_location": "Los Angeles, California", "languages_spoken": ["English", "Spanish"], "values": "Honesty, Hard work, Family", "interests": "Traveling, Hiking, Football, Cooking", "education_level": "Graduate", "religious_beliefs": "Buddhist", "politics": "Liberal", "dating_intentions": "Long term", "relationship_type": "Monogamy", "gender": "Man", "pronouns": "He/Him/His", "sexuality": "Gay", "ethnicity": "Black African Descent", "has_children": false, "want_children": true, "pets": ["Dog"], "zodiac_sign": "Taurus", "mbti_personality_type": "ENTJ", "drinking": "Yes", "smoking": "No", "marijuana": "No", "drugs": "No", "exercise": "Active", "partner_preferences": {"minimum_age": 28, "maximum_age": 36, "minimum_height": "5'6\"", "maximum_height": "6'2\"", "has_children": false, "want_children": true, "sexuality": "Gay", "drinking": "Yes", "smoking": "No", "marijuana": "No", "drugs": "No", "exercise": "Active"}, "summary": "Alex Hill is a 32-year-old man, working as a Financial Analyst in the Finance industry, based in Los Angeles, California. He graduated from the University of Cincinnati and identifies as a Buddhist with liberal political views. His interests are traveling, hiking, football, and cooking. Alex, who is of black African descent, identifies as gay and uses He/Him/His pronouns. He is a dog lover and does not have children, but wants them in the future. \n\nFitness is an integral part of his lifestyle, and he enjoys a drink now and then but doesn't smoke or use marijuana or other drugs. He's a Taurus and an ENTJ. Alex is looking for a long-term, monogamous relationship with a man aged between 28 and 36, who also wants children, is active, and doesn't smoke or use drugs. Drinking and a love for dogs would be a bonus. Alex would prefer his match also to identify as gay, aligning with his sexuality. He is multilingual and speaks English and Spanish fluently.\n", "user_id": "c107abff-6c1d-446d-b671-c0f4fb06c40a"}
{"name": "Aaliyah Thompson", "age": 28, "height": "5'7\"", "school": "New York University", "job_industry": "Entertainment", "job_title": "Film Producer", "hometown_location": "Brooklyn, New York", "dating_location": "Los Angeles, California", "languages_spoken": ["English", "Spanish"], "values": "Loyalty, Ambition, Creativity", "interests": "Cinema, Photography, Traveling, Yoga", "education_level": "Graduate", "religious_beliefs": "Spiritual", "politics": "Liberal", "dating_intentions": "Long term", "relationship_type": "Monogamy", "gender": "Woman", "pronouns": "She/Her/Hers", "sexuality": "Straight", "ethnicity": "Black African Descent", "has_children": false, "want_children": true, "pets": ["Dog"], "zodiac_sign": "Pisces", "mbti_personality_type": "ENFJ", "drinking": "Sometimes", "smoking": "No", "marijuana": "No", "drugs": "No", "exercise": "Active", "partner_preferences": {"minimum_age": 28, "maximum_age": 38, "minimum_height": "5'10\"", "maximum_height": "6'5\"", "has_children": false, "want_children": true, "sexuality": "Straight", "drinking": "Yes", "smoking": "No", "marijuana": "No", "drugs": "No", "exercise": "Active"}, "summary": "Aaliyah Thompson, aged 28, is a Film Producer in the entertainment industry based in Los Angeles. Originally from Brooklyn, New York, Aaliyah is a graduate from New York University who values loyalty, ambition, and creativity. She is a fluent speaker of English and Spanish, who interests in cinema, photography, traveling, and yoga. \n\nAaliyah describes herself as spiritual and liberal politically. She is seeking a long-term monogamous relationship. She identifies as a straight woman and uses the pronouns She/Her/Hers. She belongs to the Black African descent. \n\nAaliyah does not currently have children but does wish to have them in the future. She is a dog owner, occasionally drinks but doesn't use any kind of drugs nor smokes. She enjoys maintaining an active lifestyle. \n\nAs far as her partner preferences go, she is interested in straight men aged between 28 to 38, who are at least 5'10\" tall. They should enjoy an active lifestyle, want children in the future, comfortable with drinking but avoid smoking or drug use.", "user_id": "1f3d37ae-20da-4186-ab31-f62d3e1049f0"}
{"name": "Shreya Rao", "age": 32, "height": "5'6\"", "school": "University of California, Berkeley", "job_industry": "Technology", "job_title": "Software Engineer", "hometown_location": "San Francisco, California", "dating_location": "Los Angeles, California", "languages_spoken": ["English", "Hindi"], "values": "Compassion, Equality, Honesty, Knowledge, Family", "interests": "Coding, Cooking, Reading, Traveling, Running", "education_level": "Graduate", "religious_beliefs": "Hindu", "politics": "Liberal", "dating_intentions": "Life partner", "relationship_type": "Monogamy", "gender": "Woman", "pronouns": "She/Her/Hers", "sexuality": "Straight", "ethnicity": "South Asian", "has_children": false, "want_children": true, "pets": ["None"], "zodiac_sign": "Virgo", "mbti_personality_type": "INTJ", "drinking": "No", "smoking": "No", "marijuana": "No", "drugs": "No", "exercise": "Active", "partner_preferences": {"minimum_age": 30, "maximum_age": 45, "minimum_height": "5'6\"", "maximum_height": "6'2\"", "has_children": false, "want_children": true, "sexuality": "Straight", "drinking": "No", "smoking": "No", "marijuana": "No", "drugs": "No", "exercise": "Active"}, "summary": "Shreya Rao is a 32-year-old South Asian woman living in Los Angeles, California. She's a software engineer in the technology industry, having graduated from the University of California, Berkeley. Shreya is fluent in English and Hindi. Compassionate, honest, and valuing knowledge and family, she loves coding, cooking, reading, running, and traveling. Shreya is a Hindu, politically liberal, and looking for a life partner in monogamous relationship. She doesn't have children currently, but wants to in the future. Shreya doesn't own any pets. She's a Virgo and an INTJ. Healthy living is important for her as she doesn't drink, smoke or do drugs, and maintains an active exercise regime. Shreya is particularly interested in a male partner aged 30-45, who doesn't have children but is open to having them, lives a healthy lifestyle, and matches her active exercise routines.\n", "user_id": "55a76929-bb4e-4837-8ea7-03cd5e809970"}
{"name": "Alessia Romano", "age": 30, "height": "5'5\"", "school": "Oracle University", "job_industry": "Technology", "job_title": "Product Manager", "hometown_location": "Toronto, Ontario", "dating_location": "Los Angeles, California", "languages_spoken": ["English", "Italian", "Spanish"], "values": "Hardworking, Respect, Integrity", "interests": "Traveling, Technology, Fitness", "education_level": "Graduate", "religious_beliefs": "Agnostic", "politics": "Liberal", "dating_intentions": "Life partner", "relationship_type": "Monogamy", "gender": "Woman", "pronouns": "She/Her/Hers", "sexuality": "Straight", "ethnicity": "Hispanic/Latino", "has_children": false, "want_children": true, "pets": ["Dog"], "zodiac_sign": "Leo", "mbti_personality_type": "ENTJ", "drinking": "Yes", "smoking": "No", "marijuana": "No", "drugs": "No", "exercise": "Active", "partner_preferences": {"minimum_age": 28, "maximum_age": 40, "minimum_height": "5'5\"", "maximum_height": "6'5\"", "has_children": false, "want_children": true, "sexuality": "Straight", "drinking": "Sometimes", "smoking": "No", "marijuana": "No", "drugs": "No", "exercise": "Sometimes"}, "summary": "Alessia Romano is a hardworking and respectful 30-year-old product manager in the technology industry. She is from Toronto but currently lives in Los Angeles, California. Alessia is multilingual, speaking English, Italian, and Spanish. Having graduated from Oracle University, she is looking for a life partner who matches her monogamous type of relationship. Alessia identifies as a straight woman, using the pronouns She/Her/Hers. She is of Hispanic or Latino ethnicity and is a liberal agnostic Leo. Her Myers-Briggs personality type is ENTJ. Leading an active lifestyle, Alessia enjoys traveling, technology, and fitness. She is a dog-owner who drinks socially but does not smoke or use marijuana or illicit drugs. Alessia doesn't currently have children, but she would like to in the future. Her preferred partner would be a straight man aged 28 to 40, who doesn't smoke or use drugs but who might drink occasionally and partake in exercise sometimes. Like her, her prospective partner must also want children in future.", "user_id": "3d6fa327-4322-440f-b8e4-6bb4e6ce5190"}
{"name": "Kendra Smith", "age": 27, "height": "5'5\"", "school": "Columbia University", "job_industry": "Tech", "job_title": "Software Engineer", "hometown_location": "Chicago, Illinois", "dating_location": "Los Angeles, California", "languages_spoken": ["English", "Spanish"], "values": "Family, Culture, Learning new things", "interests": "Technology, Music, Travelling, Cooking", "education_level": "Graduate", "religious_beliefs": "Buddhist", "politics": "Liberal", "dating_intentions": "Life partner", "relationship_type": "Monogamy", "gender": "Woman", "pronouns": "She/Her/Hers", "sexuality": "Straight", "ethnicity": "Black African Descent", "has_children": false, "want_children": true, "pets": ["Dog"], "zodiac_sign": "Leo", "mbti_personality_type": "INFJ", "drinking": "Sometimes", "smoking": "No", "marijuana": "No", "drugs": "No", "exercise": "Active", "partner_preferences": {"minimum_age": 27, "maximum_age": 35, "minimum_height": "5'8\"", "maximum_height": "6'3\"", "has_children": false, "want_children": true, "sexuality": "Straight", "drinking": "Sometimes", "smoking": "No", "marijuana": "No", "drugs": "No", "exercise": "Active"}, "summary": "Kendra Smith is a 27-year-old software engineer from Chicago, Illinois, currently living in Los Angeles, California. She is educated with a graduate degree from Columbia University and is fluent in both English and Spanish. She is a woman of Black African descent who uses the pronouns \"She/Her/Hers\", identifies as straight and is interested in finding a life partner.\n\nHer beliefs revolve around the values of family and culture and she has a keen interest in learning new things. In her leisure time, she enjoys engaging with technology, listening to music, traveling, and cooking. Her major personality traits conform to the MBTI type INFJ and zodiac sign Leo. Additionally, she considers herself part of the liberal political movement and practices Buddhism.\n\nKendra enjoys living an active lifestyle and sometimes partakes in drinking but abstains from smoking, marijuana, and other drugs. She is an animal lover, owning a dog, and with definite intentions of having children in the future.\n\nAs for partner preferences, Kendra prefers someone with a minimum height of 5'8\" and a maximum height of 6'3\" in the age range of 27-35 years. Her ideal partner would also be interested in having children, live an active lifestyle, occasionally drink but avoid smoking and drugs.", "user_id": "82434c24-927c-469b-a5a6-84d961da2397"}
{"name": "Amara Singh", "age": 32, "height": "5'8\"", "school": "University of California, Berkeley", "job_industry": "Healthcare", "job_title": "Pharmacist", "hometown_location": "San Francisco, California", "dating_location": "Los Angeles, California", "languages_spoken": ["English", "Punjabi", "Spanish"], "values": "Family, health, and continual learning are all deeply important to me. I try to live my life with a deep sense of empathy and understanding for others.", "interests": "I enjoy reading, hiking, yoga, and exploring the culinary scene in LA. I'm also a huge fan of indie music and film festivals.", "education_level": "Graduate", "religious_beliefs": "Sikh", "politics": "Liberal", "dating_intentions": "Life partner", "relationship_type": "Monogamy", "gender": "Woman", "pronouns": "She/Her/Hers", "sexuality": "Straight", "ethnicity": "South Asian", "has_children": false, "want_children": true, "pets": ["None"], "zodiac_sign": "Leo", "mbti_personality_type": "INFJ", "drinking": "Sometimes", "smoking": "No", "marijuana": "No", "drugs": "No", "exercise": "Active", "partner_preferences": {"minimum_age": 30, "maximum_age": 40, "minimum_height": "5'10\"", "maximum_height": "6'5\"", "has_children": false, "want_children": true, "sexuality": "Straight", "drinking": "Sometimes", "smoking": "No", "marijuana": "No", "drugs": "No", "exercise": "Active"}, "summary": "Amara Singh is a 32-year-old, 5'8\" woman who is a pharmacist. She is a graduate from the University of California, Berkeley. Originally from San Francisco, she currently resides in Los Angeles. Amara is fluent in English, Punjabi, and Spanish. Her core values are family, health, and lifelong learning, and she approaches life with empathy and understanding. Amara enjoys reading, hiking, yoga, exploring LA's food scene, and appreciates indie music and films. She is a Sikh and leans liberal politically. Amara is looking for a life partner and prefers monogamous relationships. She identifies as straight, uses she/her pronouns, and is of South Asian ethnicity. Amara does not have any children currently but would like to have them in the future. Her trasharoo sign is Leo and her MBTI personality type is INFJ. She occasionally drinks but doesn't smoke or use drugs.  She leads an active lifestyle and doesn't have any pets. When it comes to a partner, she is open to men between the ages of 30 to 40, who are 5'10” to 6’5”, do not currently have children, wish to have children, and lead an active lifestyle. Her partner should be a non-smoker, a moderate drinker at most, and refrain from drugs.", "user_id": "5b0c95fc-ae29-4657-80b2-380711055b56"}
{"name": "Aria James", "age": 32, "height": "5'7\"", "school": "University of California, Berkeley", "job_industry": "Tech", "job_title": "Software Engineer", "hometown_location": "San Francisco, California", "dating_location": "Los Angeles, California", "languages_spoken": ["English", "Spanish", "Mandarin"], "values": "Honesty, Hardworking, Kindness", "interests": "Reading, Writing, hiking, yoga, sustainable fashion", "education_level": "Graduate", "religious_beliefs": "Agnostic", "politics": "Liberal", "dating_intentions": "Long term", "relationship_type": "Monogamy", "gender": "Woman", "pronouns": "She/Her/Hers", "sexuality": "Straight", "ethnicity": "South Asian", "has_children": false, "want_children": true, "pets": ["Cat"], "zodiac_sign": "Virgo", "mbti_personality_type": "INTJ", "drinking": "Sometimes", "smoking": "No", "marijuana": "No", "drugs": "No", "exercise": "Active", "partner_preferences": {"minimum_age": 30, "maximum_age": 40, "minimum_height": "5'7\"", "maximum_height": "6'5\"", "has_children": false, "want_children": true, "sexuality": "Straight", "drinking": "Yes", "smoking": "No", "marijuana": "No", "drugs": "No", "exercise": "Active"}, "summary": "Aria James is a 32-year-old straight South Asian woman based in Los Angeles, California. She is a software engineer in the tech industry, having studied at the University of California, Berkeley. She voices honesty, hardworking, and kindness as her core values. Aria's interests include reading, writing, hiking, and practicing yoga as well as being an advocate of sustainable fashion. \n\nShe is an agnostic and liberal individual who finds joy in both English and Hispanic cultures, evident by her fluency in English, Spanish, and Mandarin. Aria currently doesn't have children but is open to having them in the future. She has a cat as a pet and identifies herself as an active individual. \n\nHer dating intentions lean towards long-term relationships, and she values a monogamous relationship archetype. Aria is an INTJ Virgo who occasionally indulges in drinking but doesn't use any tobacco or illicit substances. Desirable traits in a potential partner include a straight man aged between 30 and 40, who is active, doesn't smoke, and is open to the idea of having children.\n", "user_id": "2883af73-b6d2-4b98-8bd4-0666b7adfaee"}
{"name": "Alex Johnson", "age": 30, "height": "6'0\"", "school": "UCLA", "job_industry": "Marketing", "job_title": "Social Media Specialist", "hometown_location": "Austin, Texas", "dating_location": "Los Angeles, California", "languages_spoken": ["English", "Spanish"], "values": "Authenticity, kindness, and creativity", "interests": "Photography, nature hikes, and acoustic music", "education_level": "Undergraduate", "religious_beliefs": "Agnostic", "politics": "Liberal", "dating_intentions": "Long term", "relationship_type": "Monogamy", "gender": "Non binary", "pronouns": "They/Them/Their", "sexuality": "Other", "ethnicity": "Hispanic/Latino", "has_children": false, "want_children": true, "pets": ["Dog"], "zodiac_sign": "Cancer", "mbti_personality_type": "INFJ", "drinking": "Sometimes", "smoking": "No", "marijuana": "No", "drugs": "No", "exercise": "Active", "partner_preferences": {"minimum_age": 26, "maximum_age": 35, "minimum_height": "5'5\"", "maximum_height": "6'2\"", "has_children": false, "want_children": true, "sexuality": "Other", "drinking": "No", "smoking": "No", "marijuana": "No", "drugs": "No", "exercise": "Active"}, "summary": "This dating profile belongs to a 30-year-old non-binary social media specialist named Alex Johnson. Alex identifies as Hispanic/Latino and uses they/them pronouns. Despite being from Austin, Texas, they are currently located in Los Angeles, California and are fluent in both English and Spanish. They studied at UCLA and align with liberal political views. Alex is agnostic and doesn't currently have children but wishes to have some in the future. They have a dog, do not smoke but drink occasionally, are quite active, and don't use marijuana or other drugs.\n\nAlex is an INFJ as per the Myer-Briggs personality type and their zodiac sign is Cancer. They seek a long-term monogamous relationship. Their interests include photography, nature hikes, and acoustic music whereas they value authenticity, kindness, and creativity.\n\nFor a partner, Alex prefers someone who doesn't smoke or use drugs, and is an active person between 26 and 35 years old. The prospective partner should also be interested in having children in the future and doesn't have any currently.", "user_id": "7dd43b81-ca74-459f-ac1c-701898f7bf2e"}
{"name": "Aaliyah Smith", "age": 28, "height": "5'6\"", "school": "Harvard University", "job_industry": "Tech Industry", "job_title": "Software Engineer", "hometown_location": "Chicago, Illinois", "dating_location": "Los Angeles, California", "languages_spoken": ["English", "Spanish"], "values": "Family, ambition, creativity, and kindness", "interests": "Reading, painting, hiking, and exploring new cultures", "education_level": "Graduate", "religious_beliefs": "Atheist", "politics": "Liberal", "dating_intentions": "Long term", "relationship_type": "Monogamy", "gender": "Woman", "pronouns": "She/Her/Hers", "sexuality": "Gay", "ethnicity": "Black African Descent", "has_children": false, "want_children": true, "pets": ["Dog", "Cat"], "zodiac_sign": "Leo", "mbti_personality_type": "INFJ", "drinking": "Sometimes", "smoking": "No", "marijuana": "No", "drugs": "No", "exercise": "Active", "partner_preferences": {"minimum_age": 26, "maximum_age": 35, "minimum_height": "5'0\"", "maximum_height": "6'0\"", "has_children": false, "want_children": true, "sexuality": "Gay", "drinking": "Yes", "smoking": "No", "marijuana": "No", "drugs": "No", "exercise": "Active"}, "summary": "Aaliyah Smith is a 28-year-old software engineer in the tech industry, currently residing in Los Angeles, California. She completed her education at Harvard University. She identifies as a woman, uses she/her pronouns and is a gay person of Black African descent. Aaliyah doesn't have any children but plans to in the future. She is interested in a long-term monogamous relationship. Her values revolve around family, ambition, creativity, and kindness with interests in reading, painting, hiking, and exploring new cultures. Aaliyah speaks both English and Spanish fluently, and her political views lean toward liberal ideologies. She occasionally consumes alcohol but abstains from smoking or using any drugs. She owns a dog and a cat, remains physically active and her MBTI personality type is INFJ. She is a Leo and prefers a partner aged between 26 and 35 who is gay, does not smoke, and leads an active lifestyle. Her potential partner should also want children in the future.", "user_id": "b659c133-1d9f-4004-b10a-dd04ea948c48"}
{"name": "Priya Patel", "age": 30, "height": "5'5\"", "school": "University of California, Los Angeles", "job_industry": "Tech", "job_title": "Software Engineer", "hometown_location": "San Francisco, California", "dating_location": "Los Angeles, California", "languages_spoken": ["English", "Hindi", "Spanish"], "values": "Family, Ambition, Creativity", "interests": "Programming, Hiking, Cooking, Travelling, Reading", "education_level": "Graduate", "religious_beliefs": "Hindu", "politics": "Liberal", "dating_intentions": "Life partner", "relationship_type": "Monogamy", "gender": "Woman", "pronouns": "She/Her/Hers", "sexuality": "Straight", "ethnicity": "South Asian", "has_children": false, "want_children": true, "pets": ["Cat", "Fish"], "zodiac_sign": "Scorpio", "mbti_personality_type": "INTP", "drinking": "Sometimes", "smoking": "No", "marijuana": "No", "drugs": "No", "exercise": "Active", "partner_preferences": {"minimum_age": 29, "maximum_age": 35, "minimum_height": "5'5\"", "maximum_height": "6'3\"", "has_children": false, "want_children": true, "sexuality": "Straight", "drinking": "Yes", "smoking": "No", "marijuana": "No", "drugs": "No", "exercise": "Active"}, "summary": "Priya Patel is a 30-year-old Software Engineer who resides in Los Angeles, California. She values family, ambition, and creativity while enjoying interests, such as programming, hiking, cooking, traveling, and reading. Originally from San Francisco, Priya is a graduate from the University of California, Los Angeles. \n\nDespite being busy in the tech industry, she incorporates active routine into her lifestyle. She is a multilingual, confidently communicating in English, Hindi, and Spanish. Priya follows Hindu beliefs and leans politically liberal. She identifies as a straight woman using She/Her/Hers pronouns. Her ethnicity reflects her South Asian roots. \n\nAs a Scorpio, according to the zodiac, and INTP type according to MBTI, she adds an interesting mix to her personality. She is open to drinking occasionally but refrains from smoking, marijuana, and other drugs. Animal lover, she has a cat and a fish as pets. Currently childless, she’s hopeful for having children in the future. \n\nShe is seeking a life partner for a monogamous relationship, preferably a straight man who is active, non-smoker, matching her drink habits, wanting children, and falls in between an age range of 29 and 35, with a height somewhere between 5'5\\\" and 6'3\\\".\n", "user_id": "12053f9a-a0c8-44c8-94d6-8cfccbb683a6"}
{"name": "Aaliyah Smith", "age": 28, "height": "5'6\"", "school": "University of California, Los Angeles", "job_industry": "Tech", "job_title": "Software Engineer", "hometown_location": "San Francisco, California", "dating_location": "Los Angeles, California", "languages_spoken": ["English", "French", "Arabic"], "values": "Diversity, Equality, and Integrity", "interests": "Cooking, Yoga, and Coding", "education_level": "Graduate", "religious_beliefs": "Muslim", "politics": "Liberal", "dating_intentions": "Long term", "relationship_type": "Monogamy", "gender": "Woman", "pronouns": "She/Her/Hers", "sexuality": "Gay", "ethnicity": "Black African Descent", "has_children": false, "want_children": true, "pets": ["Cat"], "zodiac_sign": "Gemini", "mbti_personality_type": "ENFP", "drinking": "Sometimes", "smoking": "No", "marijuana": "No", "drugs": "No", "exercise": "Active", "partner_preferences": {"minimum_age": 26, "maximum_age": 35, "minimum_height": "5'4\"", "maximum_height": "6'2\"", "has_children": true, "want_children": true, "sexuality": "Gay", "drinking": "Sometimes", "smoking": "No", "marijuana": "No", "drugs": "No", "exercise": "Active"}, "summary": "Aaliyah Smith is a 28 year old software engineer who identifies as a gay woman. She is from San Francisco and currently lives in Los Angeles. Aaliyah holds a graduate degree from the University of California, Los Angeles and works within the tech industry. Known for valuing diversity, equality, and integrity, she is interested in various hobbies like cooking, yoga, and coding. She is articulate in English, French, and Arabic. Aaliyah follows Muslim faith and holds liberal political views. She is relationship-oriented and prefers monogamy. Despite not having children, she would like to be a mother in the future. She has a pet cat, indulges in drinking occasionally, and is committed to an active lifestyle. She is specifically seeking a gay woman between the ages of 26 and 35 who doesn't smoke, drinks sometimes, and maintains an active lifestyle. Someone who already has children and wants more in the future would be ideal. As an ENFP, Aaliyah is outgoing, enthusiastic, and resourceful.\n", "user_id": "f714c3b0-d76c-4c28-b704-71522bcb6e68"}
{"name": "Alex Johnson", "age": 34, "height": "6'0\"", "school": "Stanford University", "job_industry": "Technology", "job_title": "Software Engineer", "hometown_location": "Albuquerque, New Mexico", "dating_location": "Los Angeles, California", "languages_spoken": ["English", "Spanish", "German"], "values": "Respect, honesty, and integrity", "interests": "Hiking, cooking, and artificial intelligence", "education_level": "Graduate", "religious_beliefs": "Agnostic", "politics": "Liberal", "dating_intentions": "Long term", "relationship_type": "Monogamy", "gender": "Non binary", "pronouns": "They/Them/Their", "sexuality": "Other", "ethnicity": "Hispanic/Latino", "has_children": false, "want_children": true, "pets": ["Dog", "Fish"], "zodiac_sign": "Aquarius", "mbti_personality_type": "ENTJ", "drinking": "Sometimes", "smoking": "No", "marijuana": "No", "drugs": "No", "exercise": "Active", "partner_preferences": {"minimum_age": 28, "maximum_age": 40, "minimum_height": "5'2\"", "maximum_height": "6'4\"", "has_children": false, "want_children": true, "sexuality": "Other", "drinking": "Sometimes", "smoking": "No", "marijuana": "No", "drugs": "No", "exercise": "Active"}, "summary": "Alex Johnson is a 34-year-old non-binary software engineer from Albuquerque, New Mexico who now lives in Los Angeles, California. They are highly educated, having graduated from Stanford University and are fluent in English, Spanish, and German. Alex values honesty, respect, and integrity and enjoys hiking, cooking, and artificial intelligence. Holding liberal political views and identifying as agnostic, they are interested in long term, monogamous relationships. Alex belongs to the Hispanic/Latino ethnicity and uses they/them/their pronouns. They have a dog and a fish, and although they currently don't have children, they desire to have some in the future. Alex prefers a partner who is aged between 28 and 40, and appreciates an active lifestyle similar to theirs. They avoid smoking and drug use and occasionally enjoy a drink. With their Aquarius zodiac sign and their ENTJ personality type, Alex brings a unique perspective to relationships.\n", "user_id": "cb2b54b7-25cf-4944-a9ce-47b19d93669a"}
{"name": "Aisha Patel", "age": 28, "height": "5'6\"", "school": "University of California, Berkeley", "job_industry": "Healthcare", "job_title": "Physical Therapist", "hometown_location": "San Francisco, California", "dating_location": "Los Angeles, California", "languages_spoken": ["English", "Hindi", "Spanish"], "values": "Compassion, Growth, Family, Creativity", "interests": "Traveling, Reading, Cooking, Yoga", "education_level": "Graduate", "religious_beliefs": "Hindu", "politics": "Liberal", "dating_intentions": "Life partner", "relationship_type": "Monogamy", "gender": "Woman", "pronouns": "She/Her/Hers", "sexuality": "Straight", "ethnicity": "South Asian", "has_children": false, "want_children": true, "pets": ["Dog", "Cat"], "zodiac_sign": "Pisces", "mbti_personality_type": "INFJ", "drinking": "Sometimes", "smoking": "No", "marijuana": "No", "drugs": "No", "exercise": "Active", "partner_preferences": {"minimum_age": 27, "maximum_age": 35, "minimum_height": "5'4\"", "maximum_height": "6'2\"", "has_children": false, "want_children": true, "sexuality": "Straight", "drinking": "Yes", "smoking": "No", "marijuana": "No", "drugs": "No", "exercise": "Active"}, "summary": "Aisha Patel is a 28 years old woman, who is heterosexually oriented and identifies herself with 'she/her' pronouns. Standing at the height of 5'6\", she originates from San Francisco, currently residing in Los Angeles. She is a Physical Therapist in the healthcare sector, and a Graduate from the University of California, Berkeley. She is a multilingual communicator speaking English, Hindi, and Spanish.\n\nAisha is a Hindu and liberal-minded, wrapped with the values of compassion, continuous growth, family bonds, and creativity. Her interests include traveling the world, indulging in books, experimenting with cooking, and practicing yoga.\n\nShe does not have any children but desires to have some in the future. Aisha owns a cat and a dog, and is a Pisces with an INFJ personality type per the MBTI classification.\n\nIn terms of lifestyle, she occasionally enjoys a drink but maintains a distance from smoking, marijuana, and drugs. She leads an active lifestyle with regular exercise.\n\nAisha is in search of a life partner with whom she desires to engage in a monogamous relationship. Her preference is a straight male between the ages of 27 to 35, who shares the same vision towards children, and impracticalities related to smoking, marijuana, and drugs. She prefers a partner who drinks and follows an active fitness schedule, similar to her.\n", "user_id": "7cbac161-e052-489a-be20-b3e2536a7350"}
{"name": "Ariana Martinez", "age": 31, "height": "5'6\"", "school": "University of California, Santa Cruz", "job_industry": "Technology", "job_title": "Software Engineer", "hometown_location": "San Diego, California", "dating_location": "Los Angeles, California", "languages_spoken": ["English", "Spanish"], "values": "Family, Health, Creativity", "interests": "Hiking, Reading, Cooking, Coding", "education_level": "Graduate", "religious_beliefs": "Atheist", "politics": "Liberal", "dating_intentions": "Long term", "relationship_type": "Monogamy", "gender": "Woman", "pronouns": "She/Her/Hers", "sexuality": "Straight", "ethnicity": "Hispanic/Latino", "has_children": false, "want_children": true, "pets": ["Dog"], "zodiac_sign": "Taurus", "mbti_personality_type": "INTP", "drinking": "Sometimes", "smoking": "No", "marijuana": "No", "drugs": "No", "exercise": "Active", "partner_preferences": {"minimum_age": 30, "maximum_age": 40, "minimum_height": "5'8\"", "maximum_height": "6'4\"", "has_children": false, "want_children": true, "sexuality": "Straight", "drinking": "Yes", "smoking": "No", "marijuana": "No", "drugs": "No", "exercise": "Active"}, "summary": "Ariana Martinez is a 31-year-old Hispanic/Latino woman, currently residing in Los Angeles, California. She is a Software Engineer in the tech industry who attributes great value to family, health, and creativity. Ariana graduated from the University of California, Santa Cruz and enjoys pastimes, such as hiking, reading, cooking. Despite being an Atheist and a Liberal, she is looking for a long-term, monogamous relationship. She is fluent in both English and Spanish.\n\nAriana leads an active lifestyle, drinks occasionally, and does not smoke or use marijuana or other drugs. As a proud dog owner and a Taurus, she does not have children but definitely wants to in the future. She identifies with the \"INTP\" MBTI personality type.\n\nIn terms of partner preferences, Ariana is looking for a straight man, aged between 30 and 40, tall (between 5'8\" and 6'4\"). Her ideal partner should not already have children but should want some in the future. He should be an active individual who drinks occasionally, but avoids smoking or drug use.", "user_id": "0271a4c2-9c0a-4046-92fb-a6488b99ebcb"}
{"name": "Jane Smith", "age": 34, "height": "5'6\"", "school": "Harvard University", "job_industry": "Technology", "job_title": "Software Engineer", "hometown_location": "Houston, Texas", "dating_location": "Los Angeles, California", "languages_spoken": ["English", "Spanish", "Mandarin Chinese"], "values": "Family, inclusivity, personal growth", "interests": "Coding, hiking, photography, cooking", "education_level": "Doctoral", "religious_beliefs": "Buddhist", "politics": "Liberal", "dating_intentions": "Long term", "relationship_type": "Monogamy", "gender": "Woman", "pronouns": "She/Her/Hers", "sexuality": "Straight", "ethnicity": "Asian", "has_children": true, "want_children": false, "pets": ["Cat", "Dog"], "zodiac_sign": "Aries", "mbti_personality_type": "INTJ", "drinking": "Sometimes", "smoking": "No", "marijuana": "No", "drugs": "No", "exercise": "Active", "partner_preferences": {"minimum_age": 30, "maximum_age": 40, "minimum_height": "5'6\"", "maximum_height": "6'2\"", "has_children": true, "want_children": false, "sexuality": "Straight", "drinking": "Yes", "smoking": "No", "marijuana": "No", "drugs": "No", "exercise": "Active"}, "summary": "Jane Smith is a successful 34-year-old Software Engineer based in Los Angeles, California. Originally from Houston, Texas, she is multilingual, speaking English, Spanish, and Mandarin Chinese. She highly values family, inclusivity, and personal growth.\n\nJane holds a doctoral degree from Harvard University and works in the technology industry. She identifies as a straight Asian woman and adheres to Buddhist religious beliefs. Politically, she leans towards liberal ideologies.\n\nWhen she's not working, Jane enjoys a wide range of activities like coding, hiking, photography, and cooking. She is active, with exercise being part of her regular routine. She occasionally drinks, but doesn't smoke or do drugs.\n\nShe is a single mother who is not looking to have more children. Her household is lively with a cat and a dog. She is an Aries and an INTJ personality type.\n\nJane is looking for a long-term, monogamous relationship with a straight man who is between the ages 30 and 40, and active like her. Her potential partner should also accept that she already has a child, and should not plan on having more children. He should have the same stance as Jane on smoking, drinking, and drug use.", "user_id": "10a80b1d-ea88-4d10-b3e5-c355fcbd6246"}
{"name": "Jamie Robinson", "age": 32, "height": "5'7\"", "school": "Johns Hopkins University", "job_industry": "Film", "job_title": "Storyboard Artist", "hometown_location": "Austin, Texas", "dating_location": "Los Angeles, California", "languages_spoken": ["English", "Chinese"], "values": "Family is very important to me, alongside creativity and openness in all things.", "interests": "Drawing, music, exploring new places and trying different food.", "education_level": "Graduate", "religious_beliefs": "Buddhist", "politics": "Liberal", "dating_intentions": "Long term", "relationship_type": "Monogamy", "gender": "Non binary", "pronouns": "They/Them/Their", "sexuality": "Other", "ethnicity": "Pacific Islander", "has_children": false, "want_children": true, "pets": ["Cat", "Fish"], "zodiac_sign": "Libra", "mbti_personality_type": "INFP", "drinking": "Sometimes", "smoking": "No", "marijuana": "No", "drugs": "No", "exercise": "Active", "partner_preferences": {"minimum_age": 29, "maximum_age": 38, "minimum_height": "5'4\"", "maximum_height": "6'2\"", "has_children": false, "want_children": true, "sexuality": "Other", "drinking": "Sometimes", "smoking": "No", "marijuana": "No", "drugs": "No", "exercise": "Active"}, "summary": "Jamie Robinson, a 32-year-old Non binary individual residing in Los Angeles, California, primarily speaks English and Chinese. Originating from Austin, Texas, they highly value family, creativity and openness. Jamie, a Storyboard Artist in the film industry, enjoys interests that include drawing, music, and exploring new places while trying different foods. They pursued a higher educated level by graduating from John Hopkins University. They are Buddhists with liberal political views. They are looking for a long-term relationship and prefers monogamy. Without children currently, but Jamie is open to having kids in future. Jamie has pets including a cat and a fish. A Libra with an INFP personality type, who sometimes drinks but does not smoke or do drugs. They live an active lifestyle. Jamie’s ideal partner is someone aged between 29 and 38, and who shares similar habits and values, including an active lifestyle, a preference for non-smoking, and a willingness to have children.", "user_id": "555d9d2d-307b-49b8-84b9-db4e49bdb662"}
{"name": "Jordan Sullivan", "age": 35, "height": "5'8\"", "school": "Harvard University", "job_industry": "Technology", "job_title": "Software Engineer", "hometown_location": "New York, New York", "dating_location": "Los Angeles, California", "languages_spoken": ["English", "Spanish"], "values": "Equality, Family, Ambition", "interests": "Coding, Music, Hiking, Cooking", "education_level": "Graduate", "religious_beliefs": "Agnostic", "politics": "Liberal", "dating_intentions": "Long term", "relationship_type": "Monogamy", "gender": "Non binary", "pronouns": "They/Them/Their", "sexuality": "Other", "ethnicity": "Black African Descent", "has_children": false, "want_children": true, "pets": ["Dog"], "zodiac_sign": "Aquarius", "mbti_personality_type": "ENFJ", "drinking": "Sometimes", "smoking": "No", "marijuana": "No", "drugs": "No", "exercise": "Active", "partner_preferences": {"minimum_age": 30, "maximum_age": 40, "minimum_height": "5'0\"", "maximum_height": "6'0\"", "has_children": false, "want_children": true, "sexuality": "Other", "drinking": "Sometimes", "smoking": "No", "marijuana": "No", "drugs": "No", "exercise": "Active"}, "summary": "Jordan Sullivan is a 35-year-old non-binary software engineer located in Los Angeles, California. Originally from New York City, they graduated from Harvard University and currently work in the technology sector. They identify themselves as agnostic and politically liberal. \n\nJordan is deeply invested in core values of equality, family, and ambition. They have a range of interests that include coding, music, hiking, and cooking. They are fluent in English and Spanish. \n\nAs per their lifestyle habits, Jordan is an active individual who exercises regularly. They drink occasionally and opt to keep away from smoking and drugs. They have a dog and wish to have children in future despite not having any currently. As an Aquarius and an ENFJ, Jordan hopes for long-term, monogamous relationships and shows an openness to dating someone who is also active, doesn't smoke, and is potentially interested in having children.", "user_id": "29e10806-fbae-4b39-8869-fd523e077869"}
{"name": "Alex Johnson", "age": 34, "height": "5'8\"", "school": "Columbia University", "job_industry": "Technology", "job_title": "Software Developer", "hometown_location": "Chicago, Illinois", "dating_location": "Los Angeles, California", "languages_spoken": ["English", "Spanish"], "values": "Family, Equality, Personal Growth", "interests": "Traveling, Coding, Video Games, Cooking", "education_level": "Graduate", "religious_beliefs": "Agnostic", "politics": "Liberal", "dating_intentions": "Life partner", "relationship_type": "Monogamy", "gender": "Non binary", "pronouns": "They/Them/Their", "sexuality": "Other", "ethnicity": "Black African Descent", "has_children": false, "want_children": true, "pets": ["Dog"], "zodiac_sign": "Gemini", "mbti_personality_type": "ENFP", "drinking": "Sometimes", "smoking": "No", "marijuana": "Yes", "drugs": "No", "exercise": "Active", "partner_preferences": {"minimum_age": 30, "maximum_age": 40, "minimum_height": "5'0\"", "maximum_height": "6'0\"", "has_children": false, "want_children": true, "sexuality": "Other", "drinking": "Yes", "smoking": "No", "marijuana": "Yes", "drugs": "No", "exercise": "Sometimes"}, "summary": "Alex Johnson, a 34-year-old non-binary individual, works as a Software Developer in the technology industry. They graduated from Columbia University and currently reside in Los Angeles, California but hail from Chicago, Illinois. Alex, who is of Black African Descent, is an ENFP Gemini who is fluent in English and Spanish. They are agnostic, lean towards liberal politics, and highly value family, equality, and personal growth. Their interests include traveling, coding, video games, and cooking. While they do not currently have children, they do want them in the future. Alex is a pet parent to a dog and their lifestyle habits include being active, drinking occasionally, smoking marijuana, but refraining from cigarettes and other drugs. In terms of a partner, they're looking for someone else who is between 30-40, doesn't smoke, is open to having children, and enjoys exercising from time to time.\n", "user_id": "420a78b6-5ee1-4b88-9819-c5380dcd6e67"}
{"name": "Alex Gomez", "age": 32, "height": "5'10\"", "school": "University of Texas at Austin", "job_industry": "Technology", "job_title": "Software Engineer", "hometown_location": "San Antonio, Texas", "dating_location": "Los Angeles, California", "languages_spoken": ["English", "Spanish"], "values": "Sustainability, equity and personal freedom", "interests": "Outdoor activities, reading, coding and traveling", "education_level": "Graduate", "religious_beliefs": "Agnostic", "politics": "Moderate", "dating_intentions": "Long term, open to short", "relationship_type": "Monogamy", "gender": "Man", "pronouns": "He/Him/His", "sexuality": "Straight", "ethnicity": "Hispanic/Latino", "has_children": false, "want_children": true, "pets": ["Dog", "Fish"], "zodiac_sign": "Aquarius", "mbti_personality_type": "INTP", "drinking": "Sometimes", "smoking": "No", "marijuana": "No", "drugs": "No", "exercise": "Active", "partner_preferences": {"minimum_age": 25, "maximum_age": 35, "minimum_height": "5'0\"", "maximum_height": "6'0\"", "has_children": false, "want_children": true, "sexuality": "Straight", "drinking": "Yes", "smoking": "No", "marijuana": "No", "drugs": "No", "exercise": "Sometimes"}, "summary": "Alex Gomez is a 32-year-old straight, Hispanic/Latino man who is 5'10\", speaks both English and Spanish, and resides in Los Angeles, originating from San Antonio, Texas. Professionally, he works as a software engineer in the technology industry, with a graduate degree from the University of Texas at Austin. He identifies as an agnostic moderate in terms of religion and politics. \n\nAlex has a variety of interests including outdoor activities, reading, coding, and traveling, and places high value on sustainability, equity, and personal freedom. His personality type is INTP, representing Introverted, Intuitive, Thinking, and Prospecting traits, and his zodiac sign is Aquarius. \n\nAlex's lifestyle includes owning a dog and a fish, being active and occasionally drinking, but abstains from smoking or drug use. Presently, he doesn't have children but anticipates having kids in the future. \n\nFor potential partners, Alex prefers a straight woman who is between the ages of 25 and 35, and ranges in height from 5'0\" to 6'0\". He expects that the person doesn't have, but wants children. Alex would also prefer a partner who exercises occasionally, drinks, but doesn't smoke or consume marijuana or drugs. He is open for both short term and long term relationships that are monogamous in nature.", "user_id": "01dd5480-86e6-42d1-b851-e6159aa0d837"}
{"name": "Aisha Johnson", "age": 28, "height": "5'7\"", "school": "Howard University", "job_industry": "Tech", "job_title": "Software Engineer", "hometown_location": "Houston, Texas", "dating_location": "Los Angeles, California", "languages_spoken": ["English", "Spanish"], "values": "Family-oriented, believes in personal growth and empowerment", "interests": "Coding, hiking, cooking, yoga", "education_level": "Graduate", "religious_beliefs": "Muslim", "politics": "Liberal", "dating_intentions": "Life partner", "relationship_type": "Monogamy", "gender": "Woman", "pronouns": "She/Her/Hers", "sexuality": "Straight", "ethnicity": "Black African Descent", "has_children": false, "want_children": true, "pets": ["Cat", "Dog"], "zodiac_sign": "Gemini", "mbti_personality_type": "ENFJ", "drinking": "Sometimes", "smoking": "No", "marijuana": "No", "drugs": "No", "exercise": "Active", "partner_preferences": {"minimum_age": 26, "maximum_age": 35, "minimum_height": "5'6\"", "maximum_height": "6'5\"", "has_children": false, "want_children": true, "sexuality": "Straight", "drinking": "Yes", "smoking": "No", "marijuana": "No", "drugs": "No", "exercise": "Active"}, "summary": "Aisha Johnson is a 28-year-old woman of Black African descent who is straight, hailing from Houston, Texas. Currently residing in Los Angeles, California, she works as a software engineer in the tech industry. Beside fluent English, she also speaks Spanish. As a graduate from Howard University, she values not only family bonding but also personal growth and empowerment. \n\nBeing family-oriented, Aisha wants to start a family someday, but currently, she does not have any children. She enjoys bonding with her cat and dog while fostering a healthy lifestyle with frequent exercise and cooking sessions. Besides, Aisha loves coding outside of work, and is passionate about hiking and yoga. \n\nSpiritually, Aisha associates herself with the Muslim faith. Politically, she holds liberal views. According to astrology, her zodiac sign is Gemini and her personality type is ENFJ according to the MBTI.\n\nWhen it comes to her lifestyle choices, Aisha only drinks occasionally and stands against smoking, marijuana and drug usage. Finally, she is in search of a life partner who aligns with her beliefs and lifestyle and wants to also start a family. Her potential partner would ideally be a straight man between 26 and 35 years old, somewhat taller than her, who drinks but does not smoke or use recreational drugs, and actively exercises.", "user_id": "cf2d8bed-dd89-47be-b173-6350df2563d7"}
{"name": "Anne Garcia", "age": 31, "height": "5'3\"", "school": "University of California, Los Angeles", "job_industry": "Technology", "job_title": "Software Developer", "hometown_location": "Santa Fe, New Mexico", "dating_location": "Los Angeles, California", "languages_spoken": ["English", "Spanish"], "values": "Environmental conservation, Social equality, Lifelong learning", "interests": "Coding, Biking, Travel, Cooking", "education_level": "Graduate", "religious_beliefs": "Agnostic", "politics": "Liberal", "dating_intentions": "Life partner", "relationship_type": "Monogamy", "gender": "Woman", "pronouns": "She/Her/Hers", "sexuality": "Straight", "ethnicity": "Hispanic/Latino", "has_children": false, "want_children": true, "pets": ["Dog"], "zodiac_sign": "Virgo", "mbti_personality_type": "INTJ", "drinking": "Yes", "smoking": "No", "marijuana": "No", "drugs": "No", "exercise": "Active", "partner_preferences": {"minimum_age": 30, "maximum_age": 40, "minimum_height": "5'3\"", "maximum_height": "6'4\"", "has_children": false, "want_children": true, "sexuality": "Straight", "drinking": "Yes", "smoking": "No", "marijuana": "No", "drugs": "No", "exercise": "Active"}, "summary": "Anne Garcia is a 31-year-old software developer working in the technology sector. She is Latino/Hispanic and identifies as a straight woman, using the pronouns she/her. Anne completed her graduate studies at the University of California, Los Angeles and currently lives in LA. She hails from Santa Fe, New Mexico and speaks both English and Spanish. \n\nHer interests include coding, biking, traveling, and cooking, with values rooted in environmental conservation, social equality, and lifelong learning. Anne is politically liberal, agnostic and is looking for a life partner in a monogamous relationship. She does not currently have children but is open to having them in the future. \n\nAnne also leads an active lifestyle, drinks socially, doesn't smoke or use marijuana. She owns a pet dog, falls under the Virgo zodiac sign, and identifies as an INTJ personality type.\n\nHer desired partner would be a straight man, within the age range of 30 to 40 years. He should lead an active lifestyle, be open to having children, and prefer not to smoke or use marijuana. Drinking is acceptable to her.", "user_id": "ce702fc6-4b78-4bfd-8ebe-1cf5e8f2f2c5"}
{"name": "Alex Lopez", "age": 32, "height": "5'9\"", "school": "University of Washington", "job_industry": "Tech", "job_title": "Software Engineer", "hometown_location": "Seattle, Washington", "dating_location": "Los Angeles, California", "languages_spoken": ["English", "Spanish", "Japanese"], "values": "Honesty, Equality, Respect", "interests": "Skiing, Reading, Coding, Cooking", "education_level": "Graduate", "religious_beliefs": "Agnostic", "politics": "Liberal", "dating_intentions": "Long term, open to short", "relationship_type": "Monogamy", "gender": "Man", "pronouns": "He/Him/His", "sexuality": "Gay", "ethnicity": "Hispanic/Latino", "has_children": false, "want_children": true, "pets": ["Dog"], "zodiac_sign": "Gemini", "mbti_personality_type": "INTP", "drinking": "Yes", "smoking": "No", "marijuana": "Yes", "drugs": "No", "exercise": "Active", "partner_preferences": {"minimum_age": 27, "maximum_age": 35, "minimum_height": "5'5\"", "maximum_height": "6'2\"", "has_children": false, "want_children": true, "sexuality": "Gay", "drinking": "Yes", "smoking": "No", "marijuana": "Yes", "drugs": "No", "exercise": "Active"}, "summary": "Alex Lopez is a 32-year-old gay man based in Los Angeles, California. He studied at the University of Washington and currently works as a software engineer. Alex is originally from Seattle, Washington, and is fluent in English, Spanish, and Japanese. He values honesty, respect, and equality. \n\nHis interests range from skiing and reading to coding and cooking. He also enjoys staying active. Politically, Alex is liberal and he identifies as agnostic. Alex is a Gemini with an INTP personality type.\n\nAlex is interested in forming a long-term relationship, but is open to short-term dating as well. He practices monogamy and is interested in partners who are 27-35 years old. Alex doesn't currently have children, but he hopes to become a father in the future. His other partner preferences include non-smokers who enjoy drinking and may partake in marijuana. Alex has a dog and being active is also an essential part of his lifestyle.\n", "user_id": "fcaec365-ba21-4630-a82a-418eed9ce804"}
{"name": "Taylor Lee", "age": 28, "height": "5'7\"", "school": "University of Michigan", "job_industry": "Tech", "job_title": "Graphic Designer", "hometown_location": "Detroit, Michigan", "dating_location": "Los Angeles, California", "languages_spoken": ["English", "Spanish"], "values": "Adventurous spirit, Empathy, Humor, Equality", "interests": "Hiking, Playing guitar, Comic book collecting, Painting, Learning languages", "education_level": "Undergraduate", "religious_beliefs": "Agnostic", "politics": "Liberal", "dating_intentions": "Long term", "relationship_type": "Monogamy", "gender": "Non binary", "pronouns": "They/Them/Their", "sexuality": "Gay", "ethnicity": "East Asian", "has_children": false, "want_children": false, "pets": ["Cat"], "zodiac_sign": "Leo", "mbti_personality_type": "ENFP", "drinking": "Sometimes", "smoking": "No", "marijuana": "No", "drugs": "No", "exercise": "Active", "partner_preferences": {"minimum_age": 25, "maximum_age": 35, "minimum_height": "5'4\"", "maximum_height": "6'3\"", "has_children": false, "want_children": false, "sexuality": "Gay", "drinking": "Yes", "smoking": "No", "marijuana": "No", "drugs": "No", "exercise": "Active"}, "summary": "The user, Taylor Lee, is a 28-year-old non-binary individual who is gay and resides in Los Angeles, California. They are a graduate of the University of Michigan and work as a Graphic Designer in the tech industry. They love to go hiking, play guitar, collect comic books, paint, and learn languages. They identify as agnostic and politically liberal. Although they currently do not have children and do not wish to have any, they share their home with a cat. \n\nTaylor is interested in a long-term monogamous relationship with gay individuals between the ages of 25 to 35. They appreciate a partner who does not smoke and maintains an active lifestyle. They themselves follow a similar lifestyle - exercising regularly and indulging in alcoholic beverages occasionally while refraining from smoking and use of marijuana or other drugs. They are an adventurous, empathetic, humorous and equality-valuing Leo-born ENFP in Myers-Briggs Typology.", "user_id": "dc4fb346-15a6-476c-93cf-8fa563b1d67f"}
{"name": "Jamie Patel", "age": 35, "height": "5'8\"", "school": "University of California, Berkeley", "job_industry": "Technology", "job_title": "Software Developer", "hometown_location": "San Diego, California", "dating_location": "Los Angeles, California", "languages_spoken": ["English", "Spanish", "Hindi"], "values": "Integrity, kindness and ambition", "interests": "Hiking, reading science fiction, and cooking", "education_level": "Graduate", "religious_beliefs": "Agnostic", "politics": "Liberal", "dating_intentions": "Long term", "relationship_type": "Monogamy", "gender": "Non binary", "pronouns": "They/Them/Their", "sexuality": "Gay", "ethnicity": "South Asian", "has_children": false, "want_children": true, "pets": ["Cat"], "zodiac_sign": "Aquarius", "mbti_personality_type": "INFJ", "drinking": "Sometimes", "smoking": "No", "marijuana": "No", "drugs": "No", "exercise": "Active", "partner_preferences": {"minimum_age": 30, "maximum_age": 40, "minimum_height": "5'6\"", "maximum_height": "6'0\"", "has_children": false, "want_children": true, "sexuality": "Gay", "drinking": "Sometimes", "smoking": "No", "marijuana": "No", "drugs": "No", "exercise": "Active"}, "summary": "Jamie Patel, a 35-year-old non-binary software developer from San Diego and currently located in Los Angeles. They had their education at the University of California, Berkeley and work in technology. Jamie identifies as gay and speaks three languages: English, Spanish, and Hindi. They value integrity, kindness, and ambition, with interests in hiking, science fiction, and cooking. Jamie is agnostic and politically liberal. They're seeking a long-term, monogamous relationship and have a preference for a gay partner between 30-40 years who is active and shares their stance on drinking, smoking, and drug use. Their love for animals is demonstrated by their pet cat, and they harbor aspirations of having kids in the future. Jamie's zodiac sign is Aquarius, and they are an astute INFJ by the MBTI classification.", "user_id": "6b631840-aa62-4fdc-be53-72f7a6d81ad6"}
{"name": "Sam Johnson", "age": 35, "height": "5'8\"", "school": "Harvard University", "job_industry": "Tech", "job_title": "Software Engineer", "hometown_location": "New York, New York", "dating_location": "Los Angeles, California", "languages_spoken": ["English", "French", "Spanish"], "values": "Open-minded, adventurous, value friendships and family", "interests": "Traveling, hiking, coding, playing guitar", "education_level": "Graduate", "religious_beliefs": "Agnostic", "politics": "Liberal", "dating_intentions": "Long term", "relationship_type": "Monogamy", "gender": "Non binary", "pronouns": "They/Them/Their", "sexuality": "Gay", "ethnicity": "Hispanic/Latino", "has_children": false, "want_children": true, "pets": ["Dog", "Cat"], "zodiac_sign": "Capricorn", "mbti_personality_type": "INFJ", "drinking": "Sometimes", "smoking": "No", "marijuana": "Yes", "drugs": "No", "exercise": "Active", "partner_preferences": {"minimum_age": 30, "maximum_age": 40, "minimum_height": "5'4\"", "maximum_height": "6'0\"", "has_children": false, "want_children": true, "sexuality": "Gay", "drinking": "Yes", "smoking": "No", "marijuana": "Yes", "drugs": "No", "exercise": "Active"}, "summary": "Sam Johnson is a 35-year-old non-binary individual who hails from New York and currently resides in Los Angeles. They're a software engineer in the tech industry and hold a degree from Harvard University. Identifying as gay, Sam aims to find a long-term partner who shares similar values of open-mindedness, adventure, and importance of family and friends.\n\nEngaging in activities such as traveling and hiking together is crucial to Sam, who also loves coding and playing the guitar. Although agnostic, Sam leans towards liberal views politically. They do not have children but are open to having them in the future. Their fondness for pets is evident from their ownership of a dog and a cat.\n\nExpressing themselves in English, French, and Spanish, they expect their partner to be gay, moderately active, and comfortable with occasional social drinking, but be against smoking. Sam's partner should also echo the same sentiment towards having children in the future. Committed to monogamous relationships, Sam identifies as an INFJ according to the MBTI personality type, and is a Capricorn by zodiac sign.\n", "user_id": "7e3cbdbd-84dd-4df5-95a1-77720f4ad2c6"}
{"name": "Dana Rodriguez", "age": 34, "height": "5'4\"", "school": "Stanford University", "job_industry": "Tech Industry", "job_title": "Software Engineer", "hometown_location": "Santa Fe, New Mexico", "dating_location": "Los Angeles, California", "languages_spoken": ["English", "Spanish"], "values": "Honesty, Humor, Ambition", "interests": "Travel, Coding, Photography, Yoga", "education_level": "Graduate", "religious_beliefs": "Agnostic", "politics": "Liberal", "dating_intentions": "Long term", "relationship_type": "Monogamy", "gender": "Woman", "pronouns": "She/Her/Hers", "sexuality": "Straight", "ethnicity": "Hispanic/Latino", "has_children": false, "want_children": true, "pets": ["Dog"], "zodiac_sign": "Taurus", "mbti_personality_type": "ENTP", "drinking": "Sometimes", "smoking": "No", "marijuana": "No", "drugs": "No", "exercise": "Active", "partner_preferences": {"minimum_age": 30, "maximum_age": 40, "minimum_height": "5'7\"", "maximum_height": "6'2\"", "has_children": false, "want_children": true, "sexuality": "Straight", "drinking": "Sometimes", "smoking": "No", "marijuana": "No", "drugs": "No", "exercise": "Active"}, "summary": "Dana Rodriguez is a 34-year-old software engineer in the tech industry who currently lives in Los Angeles, California. Originally from Santa Fe, New Mexico, she studied at Stanford University. Dana is bilingual, speaking both English and Spanish. Dana's values are honesty, humor, and ambition, and she is keen on photography, yoga, and travel. She identifies as a woman, uses she/her/hers pronouns and is straight. Although she currently doesn't have children, she hopes to in the future. Dana has a pet dog and is a Taurus and ENTP. She occasionally indulges in a drink but is a non-smoker and doesn't use marijuana or other drugs. Dana leads an active lifestyle and is interested in a long-term monogamous relationship. Her ideal partner would be a straight man between 30 and 40, having a height between 5'7\" and 6'2\", who shares similar lifestyle habits and wants children in the future.", "user_id": "86d453ff-0834-4699-a5a0-aba35303d4aa"}
{"name": "Ramona Diaz", "age": 34, "height": "5'7\"", "school": "University of California, Berkeley", "job_industry": "Entertainment", "job_title": "Production Assistant", "hometown_location": "Sacramento, California", "dating_location": "Los Angeles, California", "languages_spoken": ["English", "Spanish"], "values": "Family, ambition, creativity", "interests": "Filmmaking, hiking, photography, cooking", "education_level": "Undergraduate", "religious_beliefs": "Agnostic", "politics": "Liberal", "dating_intentions": "Long term", "relationship_type": "Monogamy", "gender": "Woman", "pronouns": "She/Her/Hers", "sexuality": "Straight", "ethnicity": "Hispanic/Latino", "has_children": false, "want_children": true, "pets": ["Dog"], "zodiac_sign": "Gemini", "mbti_personality_type": "ENFP", "drinking": "Yes", "smoking": "No", "marijuana": "No", "drugs": "No", "exercise": "Active", "partner_preferences": {"minimum_age": 30, "maximum_age": 40, "minimum_height": "5'8\"", "maximum_height": "6'3\"", "has_children": false, "want_children": true, "sexuality": "Straight", "drinking": "Sometimes", "smoking": "No", "marijuana": "No", "drugs": "No", "exercise": "Active"}, "summary": "Ramona Diaz is a 34-year-old Spanish-English bilingual woman who is active and ambitious. She identifies as straight and follows liberal politics. She is a Gemini and an ENFP. She studied at the University of California, Berkeley, and works in the entertainment industry as a Production Assistant. She's from Sacramento, California, but is looking for dating opportunities in Los Angeles. Her main interests are filmmaking, hiking, photography, and cooking. She defines her key values as her family, ambition, and creativity. Ramona doesn't have children but hopes to have them in the future. She enjoys a drink occasionally, but she does not smoke or use marijuana. She has a dog and enjoys an active lifestyle. She's looking for a long term, monogamous relationship with a straight man between 30 and 40 years old, who leads an active lifestyle, might want children, and who does not smoke.", "user_id": "2ce3f994-b405-4533-8517-545545ff72ff"}
{"name": "Dev Patel", "age": 30, "height": "5'10\"", "school": "University of California, Berkeley", "job_industry": "Information Technology", "job_title": "Software Engineer", "hometown_location": "Fremont, California", "dating_location": "Los Angeles, California", "languages_spoken": ["English", "Hindi"], "values": "Family, Career Success, Helping Others", "interests": "Programming, Hiking, Photography, Cooking", "education_level": "Graduate", "religious_beliefs": "Hindu", "politics": "Moderate", "dating_intentions": "Long term", "relationship_type": "Monogamy", "gender": "Man", "pronouns": "He/Him/His", "sexuality": "Straight", "ethnicity": "South Asian", "has_children": false, "want_children": true, "pets": ["None"], "zodiac_sign": "Scorpio", "mbti_personality_type": "INTJ", "drinking": "Sometimes", "smoking": "No", "marijuana": "No", "drugs": "No", "exercise": "Active", "partner_preferences": {"minimum_age": 25, "maximum_age": 35, "minimum_height": "5'2\"", "maximum_height": "5'10\"", "has_children": false, "want_children": true, "sexuality": "Straight", "drinking": "Yes", "smoking": "No", "marijuana": "No", "drugs": "No", "exercise": "Active"}, "summary": "Dev Patel is a 30-year-old Software Engineer based in Los Angeles, California. He values family, career success, and helping others. His interests include programming, hiking, photography, and cooking. Fluent in English and Hindi, he is a graduate from the University of California and holds moderate political views. As a dedicated Hindu and an INTJ Scorpio, he is looking for a long-term, monogamous relationship. He is a straight man using he/him/his pronouns and identifies as South Asian. He doesn't have children but wants to in the future. He's an active individual who sometimes drinks but doesn't smoke or use marijuana or other drugs. Dev is seeking a straight woman, aged 25-35, who is also active, wants children in the future, and doesn't smoke.", "user_id": "1399e596-63a1-454c-a553-d9da1ce370c4"}
{"name": "Amara Nelson", "age": 28, "height": "5'6\"", "school": "Stanford University", "job_industry": "Technology", "job_title": "Software Engineer", "hometown_location": "Seattle, Washington", "dating_location": "Los Angeles, California", "languages_spoken": ["English", "Spanish", "French"], "values": "Family, Professional growth, Spirituality", "interests": "Hiking, Cooking, Reading, Tech conferences", "education_level": "Graduate", "religious_beliefs": "Spiritual", "politics": "Liberal", "dating_intentions": "Long term", "relationship_type": "Monogamy", "gender": "Woman", "pronouns": "She/Her/Hers", "sexuality": "Straight", "ethnicity": "Black African Descent", "has_children": false, "want_children": true, "pets": ["Dog"], "zodiac_sign": "Cancer", "mbti_personality_type": "ENFJ", "drinking": "Sometimes", "smoking": "No", "marijuana": "No", "drugs": "No", "exercise": "Active", "partner_preferences": {"minimum_age": 28, "maximum_age": 35, "minimum_height": "5'6\"", "maximum_height": "6'3\"", "has_children": false, "want_children": true, "sexuality": "Straight", "drinking": "Yes", "smoking": "No", "marijuana": "No", "drugs": "No", "exercise": "Active"}, "summary": "Amara Nelson is a 28-year-old woman of Black African descent, based in Los Angeles, California, and originally from Seattle, Washington. Professionally, she works as a Software Engineer in the tech industry, having graduated from Stanford University. Amara is a spiritual woman with a political inclination towards liberalism. She is looking for a long-term monogamous relationship with someone who also wants children in the future, just like her. She speaks English, Spanish, and French, showing her linguistic diversity. Amara lights up her leisure time with interests such as hiking, cooking, reading, and attending tech conferences. She is an active ENFJ-type Cancerian who indulges in alcohol occasionally but prefers to stay away from smoking, marijuana, and other drugs. She has a pet dog. Amara's prospective partner preferences keep them within a 28 to 35 age range, with a height between 5'6 and 6'3, who leads an active lifestyle, appreciates a good drink, and who doesn't smoke or take marijuana or drugs. Also, Amara would prefer a man who doesn't have children yet but hopes to have them in the future. Amara uses the pronouns, She/Her/Hers.", "user_id": "d8e87396-8109-4003-a34f-44283baae87f"}
{"name": "Alex Johnson", "age": 30, "height": "5'8\"", "school": "Stanford University", "job_industry": "Technology", "job_title": "Software Developer", "hometown_location": "Seattle, Washington", "dating_location": "Los Angeles, California", "languages_spoken": ["English", "Spanish", "Mandarin"], "values": "Passionate about social justice and environmental sustainability", "interests": "Hiking, rock climbing, playing guitar, reading, coding", "education_level": "Graduate", "religious_beliefs": "Agnostic", "politics": "Liberal", "dating_intentions": "Long term, open to short", "relationship_type": "Monogamy", "gender": "Non binary", "pronouns": "They/Them/Their", "sexuality": "Other", "ethnicity": "Hispanic/Latino", "has_children": false, "want_children": true, "pets": ["Cat", "Fish"], "zodiac_sign": "Aquarius", "mbti_personality_type": "INFP", "drinking": "Sometimes", "smoking": "No", "marijuana": "No", "drugs": "No", "exercise": "Active", "partner_preferences": {"minimum_age": 25, "maximum_age": 35, "minimum_height": "5'2\"", "maximum_height": "6'2\"", "has_children": false, "want_children": true, "sexuality": "Other", "drinking": "Sometimes", "smoking": "No", "marijuana": "No", "drugs": "No", "exercise": "Active"}, "summary": "Alex Johnson is a 30-year-old non-binary software developer based in Los Angeles, California. They are originally from Seattle, Washington. Alex attended Stanford University and speaks three languages - English, Spanish, and Mandarin. They are passionate about social justice and environmental sustainability, and their interests include hiking, rock climbing, playing guitar, reading, and coding. \n\nIdentifying as agnostic and politically liberal, Alex is interested in a long-term relationship but is open to short ones too. They believe in monogamy and are interested in having children someday despite not having any currently. Their ethnicity is Hispanic/Latino and they're an Aquarius as per the zodiac. They identify as an INFP in the MBTI personality type.\n\nAlex has a cat and a fish as pets. They drink occasionally but are not smokers or drug users. Being actively engaged in physical activities, Alex anticipates their partner to also lead an active life and prefer them to lead a non-smoking lifestyle and have no children, although they're open to those who want children.", "user_id": "24f6954d-8392-469f-aaf5-3fce0430b8a5"}
{"name": "Soha Patel", "age": 29, "height": "5'7\"", "school": "University of California, Berkeley", "job_industry": "Healthcare", "job_title": "Registered Nurse", "hometown_location": "San Diego, California", "dating_location": "Los Angeles, California", "languages_spoken": ["English", "Hindi", "Gujarati"], "values": "Family, Integrity, Compassion", "interests": "Traveling, Cooking, Yoga", "education_level": "Graduate", "religious_beliefs": "Hindu", "politics": "Liberal", "dating_intentions": "Life partner", "relationship_type": "Monogamy", "gender": "Woman", "pronouns": "She/Her/Hers", "sexuality": "Straight", "ethnicity": "South Asian", "has_children": false, "want_children": true, "pets": ["Dog"], "zodiac_sign": "Scorpio", "mbti_personality_type": "ENFJ", "drinking": "Yes", "smoking": "No", "marijuana": "No", "drugs": "No", "exercise": "Active", "partner_preferences": {"minimum_age": 28, "maximum_age": 35, "minimum_height": "5'7\"", "maximum_height": "6'4\"", "has_children": false, "want_children": true, "sexuality": "Straight", "drinking": "Sometimes", "smoking": "No", "marijuana": "No", "drugs": "No", "exercise": "Active"}, "summary": "Soha Patel is a 29-year-old straight woman of South Asian ethnicity. As a Registered Nurse, she values family, integrity, and compassion, and enjoys traveling, cooking, and yoga in her leisure time. She is based in Los Angeles, California and is fluent in English, Hindi, and Gujarati. Soha attained her degree from the University of California, Berkeley. She identifies as liberal and Hindu, and her pronouns are she/her/hers. Soha is a non-smoker who doesn't use recreational marijuana or drugs, though she does enjoy social drinking. She leads an active lifestyle and is a dog lover. Soha is interested in monogamous relationships with the intention of finding a life partner, preferably a straight man with no children between the ages of 28 and 35 who also wishes to have children in the future. He should be non-smoker, not into drugs, who drinks occasionally and leads an active lifestyle.", "user_id": "07427405-9f52-407a-9f8f-fc17761822cb"}
{"name": "Alex Kim", "age": 30, "height": "5'11\"", "school": "University of Southern California", "job_industry": "Technology", "job_title": "Software Developer", "hometown_location": "San Jose, California", "dating_location": "Los Angeles, California", "languages_spoken": ["English", "Korean"], "values": "Openness, Curiosity, Diversity, Inclusion", "interests": "Reading, Traveling, Food-Tasting, Coding", "education_level": "Graduate", "religious_beliefs": "Agnostic", "politics": "Liberal", "dating_intentions": "Life partner", "relationship_type": "Monogamy", "gender": "Man", "pronouns": "He/Him/His", "sexuality": "Gay", "ethnicity": "East Asian", "has_children": false, "want_children": true, "pets": ["Dog"], "zodiac_sign": "Leo", "mbti_personality_type": "INTP", "drinking": "Sometimes", "smoking": "No", "marijuana": "No", "drugs": "No", "exercise": "Active", "partner_preferences": {"minimum_age": 27, "maximum_age": 35, "minimum_height": "5'7\"", "maximum_height": "6'2\"", "has_children": false, "want_children": true, "sexuality": "Gay", "drinking": "Sometimes", "smoking": "No", "marijuana": "No", "drugs": "No", "exercise": "Active"}, "summary": "Alex Kim is a 30-year-old man, living in Los Angeles, California. Originally from San Jose, he works in the technology sector as a Software Developer and holds a graduate degree from the University of Southern California. An Agnostic and a Liberal, Alex speaks English and Korean. His hobbies include reading, traveling, and food tasting. He is an openly gay individual who identifies himself with 'He/Him/His' pronouns. He’s diverse and inclusive with values centered on openness and curiosity. His relationship preference is monogamous, looking for a life partner who is between 27 to 35 years of age. Alex doesn't have children but is open to having some in the future. He maintains an active lifestyle with an interest in having a dog. He is a Leo and an INTP, who occasionally likes to drink but doesn't smoke or do drugs.", "user_id": "dfe62cb1-1dbf-4622-8d33-4af7be228bd5"}
{"name": "Sam Toro", "age": 28, "height": "5'9\"", "school": "University of Southern California", "job_industry": "Technology", "job_title": "UI/UX Designer", "hometown_location": "Seattle, Washington", "dating_location": "Los Angeles, California", "languages_spoken": ["English", "Spanish", "Chinese"], "values": "Community, Diversity, Creativity", "interests": "Traveling, Cooking exotic cuisines, Hiking, Digital art", "education_level": "Graduate", "religious_beliefs": "Agnostic", "politics": "Liberal", "dating_intentions": "Life partner", "relationship_type": "Monogamy", "gender": "Non binary", "pronouns": "They/Them/Their", "sexuality": "Other", "ethnicity": "Hispanic/Latino", "has_children": false, "want_children": true, "pets": ["Cat", "Fish"], "zodiac_sign": "Taurus", "mbti_personality_type": "ENFJ", "drinking": "Sometimes", "smoking": "No", "marijuana": "No", "drugs": "No", "exercise": "Active", "partner_preferences": {"minimum_age": 25, "maximum_age": 35, "minimum_height": "5'4\"", "maximum_height": "6'2\"", "has_children": false, "want_children": true, "sexuality": "Other", "drinking": "Sometimes", "smoking": "No", "marijuana": "No", "drugs": "No", "exercise": "Active"}, "summary": "Sam Toro is a 28-year-old, non-binary UI/UX Designer from Seattle, WA, now living in Los Angeles, CA. They're fluent in English, Spanish, and Chinese and highly value community, diversity, and creativity. They enjoy traveling, cooking exotic cuisines, hiking, and digital art. Sam is open minded as they hold agnostic religious beliefs and liberal political views. A graduate from the University of Southern California, Sam is interested in finding a life partner and prefers a monogamous relationship. They hope to have children in the future, and have a cat and fish as pets. As a Taurus and ENFJ personality type, Sam leads an active lifestyle and occasionally enjoys a drink. In a partner, they would like to interact with someone who shares their active lifestyle and has no exposure to drugs or smoking. They would prefer someone who never had children but is open to starting a family.", "user_id": "ce5e8624-32b4-4b35-970d-ca3ab01f265d"}
{"name": "Ava Martinez", "age": 32, "height": "5'7\"", "school": "University of Southern California", "job_industry": "Technology", "job_title": "Software Engineer", "hometown_location": "Austin, Texas", "dating_location": "Los Angeles, California", "languages_spoken": ["English", "Spanish"], "values": "Family, Career, Health, Education", "interests": "Cooking, Coding, Photography, Traveling", "education_level": "Graduate", "religious_beliefs": "Agnostic", "politics": "Liberal", "dating_intentions": "Long term", "relationship_type": "Monogamy", "gender": "Woman", "pronouns": "She/Her/Hers", "sexuality": "Straight", "ethnicity": "Hispanic/Latino", "has_children": false, "want_children": true, "pets": ["Dog"], "zodiac_sign": "Aquarius", "mbti_personality_type": "INTP", "drinking": "Sometimes", "smoking": "No", "marijuana": "No", "drugs": "No", "exercise": "Active", "partner_preferences": {"minimum_age": 30, "maximum_age": 40, "minimum_height": "5'8\"", "maximum_height": "6'2\"", "has_children": false, "want_children": true, "sexuality": "Straight", "drinking": "Yes", "smoking": "No", "marijuana": "No", "drugs": "No", "exercise": "Active"}, "summary": "Ava Martinez is a 32-year-old woman who identifies as straight and uses she/her pronouns. She is an accomplished software engineer in the technology sector, based in Los Angeles, California. A graduate from the University of Southern California, Ava values family, career, health, education and is fluent in English and Spanish. In her leisure time, she enjoys cooking, coding, photography, and traveling.\n\nReligiously, Ava identifies as agnostic and holds liberal political views. She is interested in long-term, monogamous relationships, and while she doesn't currently have any children, she would like to in the future. She’s a devoted dog owner and a fitness enthusiast. She prefers non-smokers and is personally not a recreational drug user, although she drinks occasionally.\n\nAva is interested in straight men between the ages of 30 and 40, who doesn’t have children but wants them in future. She appreciates partners who are active, exercise regularly, and shares her view on drinking, smoking, and drug use.\n", "user_id": "d92ada50-ad08-42cb-b519-d47269e10fda"}
{"name": "James Harding", "age": 37, "height": "6'2\"", "school": "University of California, Berkeley", "job_industry": "Tech", "job_title": "Software Engineer", "hometown_location": "Oakland, California", "dating_location": "Los Angeles, California", "languages_spoken": ["English", "Spanish", "Mandarin"], "values": "Diversity, social justice, environment", "interests": "Mountain biking, coding, cultural cuisine", "education_level": "Doctoral", "religious_beliefs": "Spiritual", "politics": "Liberal", "dating_intentions": "Life partner", "relationship_type": "Monogamy", "gender": "Non binary", "pronouns": "They/Them/Their", "sexuality": "Other", "ethnicity": "Hispanic/Latino", "has_children": false, "want_children": true, "pets": ["Dog", "None"], "zodiac_sign": "Aquarius", "mbti_personality_type": "INFJ", "drinking": "Sometimes", "smoking": "No", "marijuana": "Yes", "drugs": "No", "exercise": "Active", "partner_preferences": {"minimum_age": 27, "maximum_age": 45, "minimum_height": "5'0\"", "maximum_height": "6'6\"", "has_children": false, "want_children": true, "sexuality": "Other", "drinking": "Sometimes", "smoking": "No", "marijuana": "Yes", "drugs": "No", "exercise": "Active"}, "summary": "James Harding is a 37-year-old non-binary individual who identifies as Hispanic or Latino. Residing in Los Angeles, but originally from Oakland, California, they work as a software engineer in the tech industry. James holds a doctoral degree from the University of California, Berkeley, shows a commitment to diversity, social justice, and the environment, and speaks three languages: English, Spanish, and Mandarin. They enjoy mountain biking, coding, and exploring different cultural cuisines.\n\nSpiritually inclined and politically liberal, James is in search of a life partner and practices monogamy. They are open to having children in the future even though they do not have any currently. They are an Aquarius with an INFJ personality type. James is a sometimes-drinker, doesn’t smoke, indulges in marijuana occasionally, keeps no pets, and leads an active lifestyle.\n\nTheir potential partner should be between the ages 27 and 45, into an active lifestyle, not a smoker, and open to the occasional use of marijuana. They are also open to someone that wants to have children. This individual does not necessarily need to have children already and should be no more than 6'6\" in height. James's partner should also recognize and respect their sexuality.", "user_id": "c3fa8ca0-09ff-47bc-a813-62b8865e4125"}
{"name": "Aisha Patel", "age": 32, "height": "5'6\"", "school": "Yale University", "job_industry": "Healthcare", "job_title": "Physician", "hometown_location": "Houston, Texas", "dating_location": "Los Angeles, California", "languages_spoken": ["English", "Hindi", "Spanish"], "values": "Family, Compassion, Social Justice", "interests": "Traveling, Yoga, Reading Fiction", "education_level": "Graduate", "religious_beliefs": "Hindu", "politics": "Liberal", "dating_intentions": "Life partner", "relationship_type": "Monogamy", "gender": "Woman", "pronouns": "She/Her/Hers", "sexuality": "Straight", "ethnicity": "South Asian", "has_children": false, "want_children": true, "pets": ["None"], "zodiac_sign": "Libra", "mbti_personality_type": "INFJ", "drinking": "Sometimes", "smoking": "No", "marijuana": "No", "drugs": "No", "exercise": "Active", "partner_preferences": {"minimum_age": 30, "maximum_age": 40, "minimum_height": "5'8\"", "maximum_height": "6'4\"", "has_children": false, "want_children": true, "sexuality": "Straight", "drinking": "Yes", "smoking": "No", "marijuana": "No", "drugs": "No", "exercise": "Active"}, "summary": "Aisha Patel is a 32-year-old woman of South Asian ethnicity who identifies as straight. She is a physician in the healthcare industry. A graduate of Yale University, Aisha is keen on finding a life partner who also values family, compassion, and social justice. She speaks English, Hindi, and Spanish, and enjoys traveling, yoga, and reading fiction. Aisha is Hindu, with liberal political views. Additionally, she's a non-smoker and occasionally enjoys a drink. She resides in Los Angeles but hails from Houston, Texas. She leans active on the exercise scale. Aisha's potential partner should be a non-smoking, straight male between 30-40 years, who is active, and open to having children.", "user_id": "a1e5f0e4-6d13-4ba2-824c-f54727baacc3"}
{"name": "Alexis Martinez", "age": 31, "height": "5'7\"", "school": "California State University", "job_industry": "Technology", "job_title": "Software Engineer", "hometown_location": "San Diego, California", "dating_location": "Los Angeles, California", "languages_spoken": ["English", "Spanish"], "values": "Honesty, Empathy, Respect for diversity", "interests": "Hiking, Photography, Coding, Cooking", "education_level": "Undergraduate", "religious_beliefs": "Agnostic", "politics": "Liberal", "dating_intentions": "Long term", "relationship_type": "Monogamy", "gender": "Non binary", "pronouns": "They/Them/Their", "sexuality": "Other", "ethnicity": "Hispanic/Latino", "has_children": false, "want_children": true, "pets": ["Dog", "Fish"], "zodiac_sign": "Aries", "mbti_personality_type": "INTP", "drinking": "Sometimes", "smoking": "No", "marijuana": "No", "drugs": "No", "exercise": "Active", "partner_preferences": {"minimum_age": 27, "maximum_age": 37, "minimum_height": "5'4\"", "maximum_height": "6'2\"", "has_children": false, "want_children": true, "sexuality": "Other", "drinking": "Yes", "smoking": "No", "marijuana": "No", "drugs": "No", "exercise": "Active"}, "summary": "Alexis Martinez is a 31-year-old non-binary software engineer based in Los Angeles, originally from San Diego. They work in the technology industry and have an undergrad degree from California State University. They are multilingual and can speak English and Spanish. \n\nIn their personal values, honesty, empathy, and respect for diversity play a significant role. Their hobbies include hiking, photography, cooking, and coding. They are an active person who enjoys occasional drinks but refrains from smoking and drug use. They are an Aries under the zodiac sign with an INTP personality type according to the Myers Briggs Type Indicator.\n\nDespite being agnostic and having liberal political views, they respect all religious and political beliefs. Alexis is planning for long-term relationship and is open to having children in the future. They currently do not have any children but have a pet dog and fish. \n\nFor a potential partner, they prefer someone aged between 27 to 37, who is active, doesn't smoke, and is open to having children. Height preferences are between 5'4\" and 6'2\". They are open to partners of diverse sexual orientations.", "user_id": "facbfb88-9177-41b5-8ad8-f6304305ef5f"}
{"name": "Aaliyah Johnson", "age": 32, "height": "5'8\"", "school": "University of California, Los Angeles", "job_industry": "Tech", "job_title": "Software Engineer", "hometown_location": "Seattle, Washington", "dating_location": "Los Angeles, California", "languages_spoken": ["English", "Spanish", "French"], "values": "Open-mindedness, compassion, and equality", "interests": "Cooking, hiking, and coding", "education_level": "Graduate", "religious_beliefs": "Agnostic", "politics": "Liberal", "dating_intentions": "Long term", "relationship_type": "Monogamy", "gender": "Woman", "pronouns": "She/Her/Hers", "sexuality": "Gay", "ethnicity": "Black African Descent", "has_children": false, "want_children": true, "pets": ["Dog", "Fish"], "zodiac_sign": "Sagittarius", "mbti_personality_type": "ENFJ", "drinking": "Sometimes", "smoking": "No", "marijuana": "No", "drugs": "No", "exercise": "Active", "partner_preferences": {"minimum_age": 30, "maximum_age": 40, "minimum_height": "5'6\"", "maximum_height": "6'2\"", "has_children": false, "want_children": true, "sexuality": "Gay", "drinking": "Sometimes", "smoking": "No", "marijuana": "No", "drugs": "No", "exercise": "Active"}, "summary": "Aaliyah Johnson is a 32-year-old gay woman from Seattle, Washington, currently living in Los Angeles, California. She is 5'8\" and a Software Engineer working in the tech industry. She is educated to graduate level and fluent in English, Spanish, and French. Open-mindedness, compassion, and equality are her core values, and she enjoys cooking, hiking, and coding. Aaliyah is an agnostic with liberal political beliefs. She is interested in a monogamous, long-term relationship and is open to having children in the future. As a pet lover, she has a dog and a fish. She identifies as an ENFJ Sagittarius who is in favor of an active lifestyle, an occasional drinker, and does not smoke, consume marijuana, or other drugs. Her ideal partner should be between the age of 30 and 40, with a height between 5'6\" and 6'2\", have no children but open to having them, an active lifestyle, and should not smoke or consume drugs.", "user_id": "2d40d7fd-a5dd-456d-959d-a1b89057b945"}
{"name": "Kim Lopez", "age": 31, "height": "5'5\"", "school": "UC Berkeley", "job_industry": "Finance", "job_title": "Financial Analyst", "hometown_location": "Houston, Texas", "dating_location": "Los Angeles, California", "languages_spoken": ["English", "Spanish"], "values": "Family, Work-Life Balance, Empathy", "interests": "Hiking, Reading, Traveling, Cooking", "education_level": "Graduate", "religious_beliefs": "Agnostic", "politics": "Moderate", "dating_intentions": "Life partner", "relationship_type": "Monogamy", "gender": "Woman", "pronouns": "She/Her/Hers", "sexuality": "Straight", "ethnicity": "Hispanic/Latino", "has_children": false, "want_children": true, "pets": ["None"], "zodiac_sign": "Libra", "mbti_personality_type": "ISFJ", "drinking": "Sometimes", "smoking": "No", "marijuana": "No", "drugs": "No", "exercise": "Active", "partner_preferences": {"minimum_age": 30, "maximum_age": 40, "minimum_height": "5'5\"", "maximum_height": "6'2\"", "has_children": false, "want_children": true, "sexuality": "Straight", "drinking": "Yes", "smoking": "No", "marijuana": "No", "drugs": "No", "exercise": "Sometimes"}, "summary": "Kim Lopez is a 31-year-old Financial Analyst living in Los Angeles. She is originally from Houston, Texas and is a graduate of UC Berkeley. Kim identifies as a straight woman and lists her pronouns as she/her/hers. She values family, work-life balance, and empathy. Kim is an active advocate of a healthy lifestyle. Besides her work, she likes to spend her time hiking, reading, travelling, and cooking. Kim is a moderate and identifies as agnostic. She does not have children, but she is open to having some in the future. She specifies that she does not smoke or use drugs and only occasionally drinks. Kim is an ISFJ and a Libra. She is looking for a life partner aged between 30-40, who shares similar interests and values, does not smoke or use drugs but is okay with drinking sometimes.", "user_id": "49e1b768-96b4-4f3a-a135-4e50828fd5aa"}
{"name": "Alex Johnson", "age": 32, "height": "5'9\"", "school": "Yale University", "job_industry": "Technology", "job_title": "Software Engineer", "hometown_location": "Chicago, Illinois", "dating_location": "Los Angeles, California", "languages_spoken": ["English", "Mandarin", "Spanish"], "values": "Loyalty, ambition, and humility.", "interests": "Cooking, hiking, programming, and travelling.", "education_level": "Graduate", "religious_beliefs": "Agnostic", "politics": "Liberal", "dating_intentions": "Long term", "relationship_type": "Monogamy", "gender": "Non binary", "pronouns": "They/Them/Their", "sexuality": "Gay", "ethnicity": "Black African Descent", "has_children": false, "want_children": true, "pets": ["Cat"], "zodiac_sign": "Aquarius", "mbti_personality_type": "ENFP", "drinking": "Sometimes", "smoking": "No", "marijuana": "No", "drugs": "No", "exercise": "Active", "partner_preferences": {"minimum_age": 28, "maximum_age": 40, "minimum_height": "5'5\"", "maximum_height": "6'0\"", "has_children": false, "want_children": true, "sexuality": "Gay", "drinking": "Yes", "smoking": "No", "marijuana": "No", "drugs": "No", "exercise": "Active"}, "summary": "Alex Johnson is a 32-year-old non-binary individual of Black African descent, who identifies as gay and uses they/them pronouns. They are a software engineer in the technology industry and possess a graduate degree from Yale University. Alex is located in Los Angeles, California, but originates from their hometown Chicago, Illinois. They are fluent in English, Mandarin, and Spanish. \n\nAlex does not currently have children but hopes to in the future. They are a proud cat owner and enjoy cooking, hiking, programming, and travelling in their spare time. Alex identifies as an agnostic and politically liberal. Their relationship approach is monogamous, and they are looking for a long-term dating relationship. \n\nAlex places high importance on loyalty, ambition, and humility. They are sometimes socially drinking, but they do not smoke or use marijuana or drugs. They live an active lifestyle and their MBTI personality type is ENFP. \n\nIn a partner, they prefer individuals who are between the ages of 28 and 40, who don't have children but want them in the future, and who are also active like them. Preferred partners should also be open to social drinking but abstain from smoking, marijuana, and drugs.", "user_id": "7ca9750f-f6d5-4926-bc1c-83fd084f09c3"}
{"name": "Samira Patel", "age": 28, "height": "5'6\"", "school": "Stanford University", "job_industry": "Technology", "job_title": "Software Engineer", "hometown_location": "Mumbai, India", "dating_location": "Los Angeles, California", "languages_spoken": ["English", "Hindi"], "values": "Equity, Inclusion, Social Justice", "interests": "Coding, Reading, Cooking, Hiking", "education_level": "Graduate", "religious_beliefs": "Hindu", "politics": "Liberal", "dating_intentions": "Long term", "relationship_type": "Monogamy", "gender": "Woman", "pronouns": "She/Her/Hers", "sexuality": "Straight", "ethnicity": "South Asian", "has_children": false, "want_children": true, "pets": ["Dog"], "zodiac_sign": "Scorpio", "mbti_personality_type": "ISFJ", "drinking": "Sometimes", "smoking": "No", "marijuana": "No", "drugs": "No", "exercise": "Active", "partner_preferences": {"minimum_age": 28, "maximum_age": 35, "minimum_height": "5'6\"", "maximum_height": "6'2\"", "has_children": false, "want_children": true, "sexuality": "Straight", "drinking": "Yes", "smoking": "No", "marijuana": "No", "drugs": "No", "exercise": "Active"}, "summary": "Samira Patel is a 28-year-old woman who works as a software engineer in the tech industry. She currently lives in Los Angeles, California but hails from Mumbai, India. She is a graduate of Stanford University. She identifies as heterosexual and speaks both English and Hindi. Her core values are Equity, Inclusion, and Social Justice. Her interests mainly revolve around coding, reading, cooking, and hiking. She follows the Hindu faith and politically leans liberal. Samira is seeking a long-term monogamous relationship. She does not currently have children but wishes to in the future. She owns a dog and is moderately active, sometimes indulging in drinks but refrains from smoking and drug use. Her personality type is ISFJ, and her zodiac sign is Scorpio. She hopes to meet a man aged between 28 and 35 who does not currently have children but also wants them in the future, leads an active lifestyle, indulges in occasional drinking, and abstains from smoking and drug use.", "user_id": "50cf53a7-b786-49aa-8503-a7daf2a382af"}
{"name": "Jasmine Morgan", "age": 30, "height": "5'6\"", "school": "Stanford University", "job_industry": "Healthcare", "job_title": "Pediatrician", "hometown_location": "New York, New York", "dating_location": "Los Angeles, California", "languages_spoken": ["English", "Spanish"], "values": "Caring, ambitious, empathetic, and proactive", "interests": "Reading, traveling, yoga, and photography", "education_level": "Doctoral", "religious_beliefs": "Buddhist", "politics": "Liberal", "dating_intentions": "Life partner", "relationship_type": "Monogamy", "gender": "Woman", "pronouns": "She/Her/Hers", "sexuality": "Straight", "ethnicity": "Black African Descent", "has_children": false, "want_children": true, "pets": ["Dog"], "zodiac_sign": "Libra", "mbti_personality_type": "ENFJ", "drinking": "Yes", "smoking": "No", "marijuana": "No", "drugs": "No", "exercise": "Active", "partner_preferences": {"minimum_age": 30, "maximum_age": 40, "minimum_height": "5'8\"", "maximum_height": "6'3\"", "has_children": false, "want_children": true, "sexuality": "Straight", "drinking": "Sometimes", "smoking": "No", "marijuana": "No", "drugs": "No", "exercise": "Active"}, "summary": "This profile belongs to a 30-year-old woman named Jasmine Morgan from New York, currently residing in Los Angeles. She is a caring, ambitious, empathetic, and proactive pediatrician, representing the healthcare industry. Jasmine is a Stanford University graduate and possesses a doctoral degree. She is fluent in English and Spanish. Her interests include reading, traveling, yoga, and photography.\n\nAs a committed Buddhist with liberal political views, she is seeking a life partner and prefers a monogamous relationship. Jasmine identifies as straight and prefers the pronouns She/Her/Hers. Her ethnicity is Black African descent, and she doesn't have any children, but wants to have some in the future. She owns a dog, doesn't smoke, doesn't use drugs or marijuana, but does enjoy drinking occasionally. Jasmine is active in terms of exercise and identifies herself as an ENFJ from the MBTI personality types. She is a Libra by zodiac sign.\n\nFor a partner, Jasmine prefers a man between the ages of 30 to 40, with a height ranging from 5'8\\\" to 6'3\\\". Her potential match should be a straight individual who is interested in having children, prefers not to smoke, and only drinks occasionally. She would like someone active who doesn't use marijuana or drugs.", "user_id": "7dee0326-58e5-41f6-aba6-e485b0501c29"}
{"name": "Alex Johnson", "age": 34, "height": "6'1\"", "school": "University of Texas at Austin", "job_industry": "Tech", "job_title": "Software Developer", "hometown_location": "Houston, Texas", "dating_location": "Los Angeles, California", "languages_spoken": ["English", "Spanish"], "values": "Honesty, kindness, and respect for all people and environments.", "interests": "Tech gadgets, yoga, hiking and photography", "education_level": "Graduate", "religious_beliefs": "Agnostic", "politics": "Liberal", "dating_intentions": "Long term", "relationship_type": "Monogamy", "gender": "Non binary", "pronouns": "They/Them/Their", "sexuality": "Other", "ethnicity": "Hispanic/Latino", "has_children": false, "want_children": true, "pets": ["Dog"], "zodiac_sign": "Libra", "mbti_personality_type": "ENTP", "drinking": "Yes", "smoking": "No", "marijuana": "No", "drugs": "No", "exercise": "Active", "partner_preferences": {"minimum_age": 28, "maximum_age": 40, "minimum_height": "5'5\"", "maximum_height": "6'5\"", "has_children": false, "want_children": true, "sexuality": "Other", "drinking": "Yes", "smoking": "No", "marijuana": "No", "drugs": "No", "exercise": "Active"}, "summary": "Alex Johnson is a 34-year-old non-binary software developer from Houston, Texas, currently living in Los Angeles, California. Fluent in English and Spanish, they value honesty, kindness, and respect. Their interests include tech gadgets, yoga, hiking, and photography. A graduate of the University of Technology at Austin, Alex identifies as agnostic and leans towards liberal politics. They are interested in long-term, monogamous relationships and though they don't currently have children, they intend to have some in the future. Alex doesn’t smoke or use drugs, but does enjoy a drink occasionally and maintain an active lifestyle. They are a dog owner, a Libra, and an ENTP personality type. In their partner, they are looking for someone aged between 28 and 40, who is at least 5'5\" tall, doesn't have children but would like to in the future, and leads an active lifestyle. They prefer hangouts with no smoking or drug use, but are okay with their partner drinking.", "user_id": "d808c5bd-7ffa-4c3f-917c-72729d5e6c5b"}
{"name": "Amanda Johnson", "age": 32, "height": "5'6\"", "school": "University of Southern California", "job_industry": "Healthcare", "job_title": "Registered Nurse", "hometown_location": "Atlanta, Georgia", "dating_location": "Los Angeles, California", "languages_spoken": ["English", "Spanish"], "values": "Family, career, health and fitness", "interests": "Hiking, photography, cooking, environmental activism", "education_level": "Graduate", "religious_beliefs": "Christian", "politics": "Liberal", "dating_intentions": "Long term", "relationship_type": "Monogamy", "gender": "Woman", "pronouns": "She/Her/Hers", "sexuality": "Straight", "ethnicity": "Black African Descent", "has_children": false, "want_children": true, "pets": ["Dog"], "zodiac_sign": "Gemini", "mbti_personality_type": "ENFP", "drinking": "Sometimes", "smoking": "No", "marijuana": "No", "drugs": "No", "exercise": "Active", "partner_preferences": {"minimum_age": 30, "maximum_age": 40, "minimum_height": "5'8\"", "maximum_height": "6'3\"", "has_children": false, "want_children": true, "sexuality": "Straight", "drinking": "Yes", "smoking": "No", "marijuana": "No", "drugs": "No", "exercise": "Sometimes"}, "summary": "Amanda Johnson is a 32-year-old registered nurse from Atlanta, Georgia, currently based in Los Angeles, California. She's a graduate from the University of Southern California. Amanda is a heterosexual Christian woman of Black African descent who uses She/Her pronouns. She values family, career, health, and fitness and enjoys hiking, photography, cooking and is actively involved in environmental activism. \n\nAmanda does not have children but desires to have some in the future. A dog owner, Gemini, and an ENFP, she aligns with liberal political views. Although she drinks occasionally, she doesn't smoke or take drugs or marijuana. Amanda is very active and seeks a long-term, monogamous relationship. \n\nIn terms of partner preferences, Amanda is interested in straight men who are between the ages of 30 and 40, and who value fitness. Importantly, they should not smoke or use drugs or marijuana, but occasional drinking is okay. Her ideal partner does not have children but also wishes to have some in the future.", "user_id": "5e784139-3d42-4901-ab9a-586ac1a55554"}
{"name": "Alexis Rodriguez", "age": 27, "height": "5'5\"", "school": "University of California, Los Angeles", "job_industry": "Tech", "job_title": "Software Engineer", "hometown_location": "Miami, Florida", "dating_location": "Los Angeles, California", "languages_spoken": ["English", "Spanish"], "values": "Hard work, family, education", "interests": "Traveling, reading, coding", "education_level": "Undergraduate", "religious_beliefs": "Atheist", "politics": "Liberal", "dating_intentions": "Long term", "relationship_type": "Monogamy", "gender": "Woman", "pronouns": "She/Her/Hers", "sexuality": "Straight", "ethnicity": "Hispanic/Latino", "has_children": false, "want_children": true, "pets": ["Dog"], "zodiac_sign": "Gemini", "mbti_personality_type": "ENFP", "drinking": "Sometimes", "smoking": "No", "marijuana": "No", "drugs": "No", "exercise": "Active", "partner_preferences": {"minimum_age": 25, "maximum_age": 35, "minimum_height": "5'6\"", "maximum_height": "6'3\"", "has_children": false, "want_children": true, "sexuality": "Straight", "drinking": "Sometimes", "smoking": "No", "marijuana": "No", "drugs": "No", "exercise": "Active"}, "summary": "Alexis Rodriguez, a 27-year-old woman who identifies as straight, currently resides in Los Angeles, California. Originally from Miami, Florida, she is a software engineer in the tech industry after completing her undergraduate studies at UCLA. She is a fluent speaker of English and Spanish and upholds the values of hard work, family, and education. Her interests are traveling, reading, and coding. Although Alexis identifies as an atheist and holds liberal political views, she is looking for a long-term, monogamous relationship. She does not currently have children, but is open to having them in the future. Alexis is a Gemini and ENFP personality type who occasionally enjoys a drink but does not smoke or use marijuana or drugs. She is physically active and has a pet dog. Her ideal partner would be a straight man, aged between 25 and 35, who leads a healthy lifestyle, does not use substances, and has the same outlook towards having children.", "user_id": "6afca6f6-f1d7-41ea-93f2-11c7628f3c3a"}
{"name": "Jamie Johnson", "age": 27, "height": "5'8\"", "school": "UCLA", "job_industry": "Entertainment", "job_title": "Sound Technician", "hometown_location": "Austin, Texas", "dating_location": "Los Angeles, California", "languages_spoken": ["English", "Spanish"], "values": "Creativity, Equality, Empathy", "interests": "Music, Hiking, Cooking, Video Games", "education_level": "Undergraduate", "religious_beliefs": "Agnostic", "politics": "Liberal", "dating_intentions": "Life partner", "relationship_type": "Monogamy", "gender": "Non binary", "pronouns": "They/Them/Their", "sexuality": "Gay", "ethnicity": "Hispanic/Latino", "has_children": false, "want_children": true, "pets": ["Dog", "Fish"], "zodiac_sign": "Gemini", "mbti_personality_type": "ENFP", "drinking": "Sometimes", "smoking": "No", "marijuana": "No", "drugs": "No", "exercise": "Active", "partner_preferences": {"minimum_age": 24, "maximum_age": 35, "minimum_height": "5'0\"", "maximum_height": "6'0\"", "has_children": false, "want_children": true, "sexuality": "Gay", "drinking": "Sometimes", "smoking": "No", "marijuana": "No", "drugs": "No", "exercise": "Active"}, "summary": "Jamie Johnson is a 27-year-old non-binary individual who resides in Los Angeles and Works as a sound technician in the entertainment industry. They have an undergraduate degree from UCLA and they can speak both English and Spanish fluently. Jamie identifies as gay, with their political leanings tilted towards the liberal side.\n\nThey are exceptionally keen on creativity, empathy, and equality. Their interests include music, hiking, cooking, and video games. Jamie's looking for a life partner in a monogamous relationship, is agnostic, and aims to have children in the future. \n\nThey're a non-smoker who drinks occasionally, and stays active. Born under the zodiac sign of Gemini and possessing the personality type of ENFP, Jamie is a dog and fish lover. When it comes to a prospective partner, Jamie prefers someone who is between the ages of 24 and 35, active, non-smoker, drinks occasionally and is interested in having children.", "user_id": "8daaebfc-9b4c-4ae4-98e2-a6958b07dd8c"}
{"name": "Darien Henderson", "age": 32, "height": "6'1\"", "school": "University of Washington", "job_industry": "Technology", "job_title": "Software Engineer", "hometown_location": "Seattle, Washington", "dating_location": "Los Angeles, California", "languages_spoken": ["English", "Mandarin"], "values": "Integrity, accountability, and respect for diversity are values that drive me.", "interests": "Art installations, coding contests, cryptology, mindful meditation, and basketball.", "education_level": "Graduate", "religious_beliefs": "Agnostic", "politics": "Liberal", "dating_intentions": "Long term", "relationship_type": "Monogamy", "gender": "Man", "pronouns": "He/Him/His", "sexuality": "Straight", "ethnicity": "Black African Descent", "has_children": false, "want_children": true, "pets": ["Dog"], "zodiac_sign": "Leo", "mbti_personality_type": "ENTJ", "drinking": "Sometimes", "smoking": "No", "marijuana": "No", "drugs": "No", "exercise": "Active", "partner_preferences": {"minimum_age": 25, "maximum_age": 35, "minimum_height": "5'2\"", "maximum_height": "6'0\"", "has_children": false, "want_children": true, "sexuality": "Straight", "drinking": "Yes", "smoking": "No", "marijuana": "No", "drugs": "No", "exercise": "Active"}, "summary": "Darien Henderson is a 32-year-old straight man, of black African descent, currently located in Los Angeles but originally from Seattle. He is a Software Engineer in the tech industry and is educated to graduate level. Fluent in English and Mandarin, Darien highly values integrity, respect for diversity, and accountability. He enjoys art installations, coding contests, cryptology, mindful meditation, and basketball. Darien is politically liberal, agnostic, and identifies as an ENTJ personality type according to the Myers-Briggs Type Indicator. He sometimes drinks, doesn't smoke or use drugs, and leads an active lifestyle. His dating intentions are long term, leaning toward monogamy. He does not have children, but wishes to in the future. He enjoys the company of his dog. Darien's potential partner would ideally be a straight woman between 25 and 35 years old, who doesn't smoke or use drugs, enjoys an active lifestyle and also wishes to have kids.", "user_id": "07ee038c-de97-4d0b-964a-da8a890c1c1d"}
{"name": "Aisha Patel", "age": 28, "height": "5'6\"", "school": "Stanford University", "job_industry": "Tech", "job_title": "Software Engineer", "hometown_location": "Atlanta, Georgia", "dating_location": "Los Angeles, California", "languages_spoken": ["English", "Hindi"], "values": "Family, Mindfulness, Ambition", "interests": "Technology, Traveling, Painting", "education_level": "Graduate", "religious_beliefs": "Hindu", "politics": "Liberal", "dating_intentions": "Long term", "relationship_type": "Monogamy", "gender": "Woman", "pronouns": "She/Her/Hers", "sexuality": "Straight", "ethnicity": "South Asian", "has_children": false, "want_children": true, "pets": ["None"], "zodiac_sign": "Leo", "mbti_personality_type": "INTJ", "drinking": "No", "smoking": "No", "marijuana": "No", "drugs": "No", "exercise": "Active", "partner_preferences": {"minimum_age": 28, "maximum_age": 35, "minimum_height": "5'6\"", "maximum_height": "6'2\"", "has_children": false, "want_children": true, "sexuality": "Straight", "drinking": "No", "smoking": "No", "marijuana": "No", "drugs": "No", "exercise": "Active"}, "summary": "Aisha Patel is a 28-year-old woman who works in the tech industry as a Software Engineer. She values family, mindfulness, and ambition. Aisha is interested in technology, traveling, and painting. Hailing from Atlanta, Georgia, Aisha currently lives in Los Angeles, California, and is looking for a long-term, monogamous relationship. She speaks English and Hindi and has a graduate-level education. Aisha follows Hindu religion and is politically liberal. She identifies as straight and uses She/Her/Hers pronouns. Aisha belongs to a South Asian ethnicity. She does not have children but wants to in the future. She does not smoke or drink, and she leads an active lifestyle. Her ideal partner would be a man between the ages of 28 to 35, who does not have children but is open to having them in the future, and leads an active, smoke-free, and alcohol-free lifestyle.", "user_id": "13eebd8b-d355-432b-a147-85100df55f06"}
{"name": "Jamie Smith", "age": 32, "height": "5'7\"", "school": "University of California", "job_industry": "Creative Arts", "job_title": "Graphic Designer", "hometown_location": "Oakland, California", "dating_location": "Los Angeles, California", "languages_spoken": ["English", "Spanish", "American Sign Language"], "values": "Charity work, environmentalism, equal rights", "interests": "Sculpting, hiking, cooking, volunteering at local animal shelter", "education_level": "Graduate", "religious_beliefs": "Spiritual", "politics": "Liberal", "dating_intentions": "Life partner", "relationship_type": "Monogamy", "gender": "Non binary", "pronouns": "They/Them/Their", "sexuality": "Other", "ethnicity": "Hispanic/Latino", "has_children": false, "want_children": true, "pets": ["Dog", "Cat"], "zodiac_sign": "Leo", "mbti_personality_type": "ENFP", "drinking": "No", "smoking": "No", "marijuana": "No", "drugs": "No", "exercise": "Active", "partner_preferences": {"minimum_age": 30, "maximum_age": 40, "minimum_height": "5'5\"", "maximum_height": "6'2\"", "has_children": false, "want_children": true, "sexuality": "Other", "drinking": "No", "smoking": "No", "marijuana": "No", "drugs": "No", "exercise": "Active"}, "summary": "Jamie Smith is a non-binary, 32-year-old graphic designer based in Los Angeles, California. They are of Hispanic/Latino ethnicity and are fluent in English, Spanish, and American Sign Language. Jamie holds a graduate degree from the University of California and carries a passion for charitable work, environmentalism, and equal rights. They are looking for a life partner while preferring monogamy.\n\nIn their leisure time, Jamie enjoys sculpting, hiking, and cooking. They also volunteer at a local animal shelter. Jamie identifies as spiritual, maintains liberal political views, and has a love for pets, having a cat and a dog. They are non-drinkers and non-smokers with an active lifestyle. Jamie does not have children but has expressed a desire to have them in the future. \n\nTheir potential partner preferences include someone aged between 30-40, who also enjoys an active lifestyle, is a non-smoker, and non-drinker with no kids. However, this ideal partner should also want children in the future.", "user_id": "f59a6cbf-08aa-4505-843d-91b7957fb504"}
{"name": "Alex Kelly", "age": 28, "height": "5'10\"", "school": "University of Washington", "job_industry": "Healthcare", "job_title": "Registered Nurse", "hometown_location": "Seattle, Washington", "dating_location": "Los Angeles, California", "languages_spoken": ["English", "Spanish"], "values": "Compassion, personal growth, community service, and maintaining a balanced life.", "interests": "Travelling, hiking, yoga, reading and participating in charity runs.", "education_level": "Graduate", "religious_beliefs": "Agnostic", "politics": "Liberal", "dating_intentions": "Life partner", "relationship_type": "Monogamy", "gender": "Non binary", "pronouns": "They/Them/Their", "sexuality": "Gay", "ethnicity": "Hispanic/Latino", "has_children": false, "want_children": true, "pets": ["Dog"], "zodiac_sign": "Cancer", "mbti_personality_type": "ENFJ", "drinking": "Sometimes", "smoking": "No", "marijuana": "No", "drugs": "No", "exercise": "Active", "partner_preferences": {"minimum_age": 25, "maximum_age": 35, "minimum_height": "5'5\"", "maximum_height": "6'5\"", "has_children": false, "want_children": true, "sexuality": "Gay", "drinking": "Yes", "smoking": "No", "marijuana": "No", "drugs": "No", "exercise": "Active"}, "summary": "Alex Kelly is a 28-year-old, non-binary, Spanish and English speaking registered nurse from Seattle, Washington. They currently live in Los Angeles, California, where they are ready to meet a potential life partner. Politically liberal and agnostic by religion, they hold values such as compassion, personal growth, community service, and maintaining a balanced life in high regard. In their free time, they enjoy traveling, hiking, yoga, reading, and participating in charity runs. They identify as Gay and are interested in monogamy. Although they currently do not have children, they would like to have them in the future. They own a dog and lead an active lifestyle. They occasionally drink, but do not smoke or use marijuana or other drugs. Their match preferences feature a partner aged 25-35 years, who has an active lifestyle, doesn't smoke, drinks occasionally, and shares the desire to have children in the future.", "user_id": "7314b53c-7fa6-47b3-b571-f81a6966c391"}
{"name": "Alexis Rodriguez", "age": 30, "height": "5'6\"", "school": "New York University", "job_industry": "Finance", "job_title": "Financial Analyst", "hometown_location": "New York, New York", "dating_location": "Los Angeles, California", "languages_spoken": ["English", "Spanish"], "values": "Family, hard work, and curiosity", "interests": "Traveling, learning new languages, culinary arts", "education_level": "Graduate", "religious_beliefs": "Catholic", "politics": "Liberal", "dating_intentions": "Life partner", "relationship_type": "Monogamy", "gender": "Woman", "pronouns": "She/Her/Hers", "sexuality": "Straight", "ethnicity": "Hispanic/Latino", "has_children": false, "want_children": true, "pets": ["Cat"], "zodiac_sign": "Aquarius", "mbti_personality_type": "ENFJ", "drinking": "Yes", "smoking": "No", "marijuana": "No", "drugs": "No", "exercise": "Active", "partner_preferences": {"minimum_age": 28, "maximum_age": 35, "minimum_height": "5'8\"", "maximum_height": "6'3\"", "has_children": false, "want_children": true, "sexuality": "Straight", "drinking": "Yes", "smoking": "No", "marijuana": "No", "drugs": "No", "exercise": "Active"}, "summary": "Alexis Rodriguez is a 30-year-old Financial Analyst based in Los Angeles, originally from New York. She identifies as a straight female using she/her/hers pronouns. Alexis graduated from New York University and works in the finance industry. She values family, hard work, and curiosity, and enjoys traveling, learning new languages, and the culinary arts. Religion is important to her as a Catholic, and she leans more on the liberal side politically. She is seeking a life partner and is open to having children in the future. Alexis owns a cat, doesn't use drugs, but enjoys a drink occasionally. Her partner preferences are a straight man between the ages of 28 and 35 who does not smoke or use drugs. He should also be active and open to having children.\n", "user_id": "59e765b4-c416-4b67-a9cb-a49631799e13"}
{"name": "Muhammad Aaliyah", "age": 30, "height": "5'8\"", "school": "London School of Economics", "job_industry": "Financial Services", "job_title": "Investment Banker", "hometown_location": "London, United Kingdom", "dating_location": "Los Angeles, California", "languages_spoken": ["English", "Arabic"], "values": ["Family", "Ambition", "Generosity"], "interests": ["Travelling", "Reading", "Cooking"], "education_level": "Graduate", "religious_beliefs": "Muslim", "politics": "Liberal", "dating_intentions": "Life partner", "relationship_type": "Monogamy", "gender": "Man", "pronouns": "He/Him/His", "sexuality": "Straight", "ethnicity": "Middle Eastern", "has_children": false, "want_children": true, "pets": ["Cat"], "zodiac_sign": "Leo", "mbti_personality_type": "INTJ", "drinking": "No", "smoking": "No", "marijuana": "No", "drugs": "No", "exercise": "Active", "partner_preferences": {"minimum_age": 25, "maximum_age": 35, "minimum_height": "5'4\"", "maximum_height": "6'0\"", "has_children": false, "want_children": true, "sexuality": "Straight", "drinking": "No", "smoking": "No", "marijuana": "No", "drugs": "No", "exercise": "Active"}, "summary": "Muhammad Aaliyah is a 30-year-old Investment Banker of Middle Eastern ethnicity, currently living in Los Angeles, California. Originally from London, UK, he is 5'8\" tall, is a graduate of the London School of Economics and speaks English and Arabic fluently. His interests include traveling, reading, and cooking, and he values family, ambition, and generosity. Muhammad, who uses the pronouns he/him/his, is a Muslim, politically liberal, and is an INTJ personality type. He is a straight, monogamous man who doesn't drink, smoke, or use drugs. He is physically active and a proud cat owner. In terms of his future partner, Muhammad is looking for a straight woman aged 25 to 35, who also doesn't drink or smoke, leads an active lifestyle, and, like him, wants children but does not currently have any.", "user_id": "bb356a3d-6992-4e57-bed5-d35d8d7d7ab1"}
{"name": "Natalia Kuznetsova", "age": 29, "height": "5'8\"", "school": "University of Moscow", "job_industry": "Finance", "job_title": "Risk Analyst", "hometown_location": "Moscow, Russia", "dating_location": "Los Angeles, California", "languages_spoken": ["Russian", "English"], "values": ["Hard work", "Family", "Independence"], "interests": ["Traveling", "Cooking", "Hiking"], "education_level": "Graduate", "religious_beliefs": "Orthodox Christian", "politics": "Moderate", "dating_intentions": "Long term", "relationship_type": "Monogamy", "gender": "Woman", "pronouns": "She/Her/Hers", "sexuality": "Straight", "ethnicity": "White Caucasian", "has_children": false, "want_children": true, "pets": ["Cat"], "zodiac_sign": "Virgo", "mbti_personality_type": "ISTJ", "drinking": "Sometimes", "smoking": "No", "marijuana": "No", "drugs": "No", "exercise": "Active", "partner_preferences": {"minimum_age": 30, "maximum_age": 40, "minimum_height": "5'10\"", "maximum_height": "6'4\"", "has_children": false, "want_children": true, "sexuality": "Straight", "drinking": "Yes", "smoking": "No", "marijuana": "No", "drugs": "No", "exercise": "Active"}, "summary": "Natalia Kuznetsova is a 29-year-old risk analyst working in the finance industry. She stands at 5'8\" and is a graduate of the University of Moscow. Originally from Moscow, Russia, Natalia now resides in Los Angeles, California. She speaks Russian and English and values hard work, family, and independence. \n\nHer interests include traveling, cooking, and hiking. As an Orthodox Christian, Natalia is moderately politically inclined. She is interested in long-term relationships and is committed to monogamy. Natalia identifies as a straight woman using the pronouns She/Her/Hers.\n\nShe does not currently have children but is open to having them in the future. Natalia has a pet cat and is a Virgo by zodiac sign. She has an ISTJ MBTI personality type. In terms of lifestyle, Natalia occasionally drinks, does not smoke or use marijuana or other drugs, and is physically active.\n\nThe type of partner Natalia is looking for should be a straight man aged between 30 and 40, taller than her (between 5'10\" and 6'4\"), who does not have children currently but wants them in the future. He should be an active drinker, non-smoker, does not use marijuana or other drugs, and leads an active lifestyle.", "user_id": "f93cd081-d01d-4c5f-bd4c-cd16ae7bed59"}
{"name": "Zara Abubakar", "age": 27, "height": "5'6\"", "school": "University of California, Berkeley", "job_industry": "Tech Industry", "job_title": "Software Engineer", "hometown_location": "Houston, Texas", "dating_location": "Los Angeles, California", "languages_spoken": ["English", "Arabic"], "values": ["Family", "Ambition", "Creativity"], "interests": ["Programming", "Photography", "Traveling"], "education_level": "Graduate", "religious_beliefs": "Muslim", "politics": "Liberal", "dating_intentions": "Life partner", "relationship_type": "Monogamy", "gender": "Woman", "pronouns": "She/Her/Hers", "sexuality": "Straight", "ethnicity": "Middle Eastern", "has_children": false, "want_children": true, "pets": ["Cat"], "zodiac_sign": "Libra", "mbti_personality_type": "INTJ", "drinking": "No", "smoking": "No", "marijuana": "No", "drugs": "No", "exercise": "Active", "partner_preferences": {"minimum_age": 27, "maximum_age": 35, "minimum_height": "5'8\"", "maximum_height": "6'2\"", "has_children": false, "want_children": true, "sexuality": "Straight", "drinking": "No", "smoking": "No", "marijuana": "No", "drugs": "No", "exercise": "Active"}, "summary": "Zara Abubakar is a 27-year-old straight woman living in Los Angeles, California. She is 5'6\" tall, of Middle Eastern ethnicity, and a software engineer in the tech industry. Identifying with liberal political views and the Muslim faith, she values family, ambition, and creativity.\n \nShe takes pride in her INTJ personality type and being a Libra. Her main interests are programming, photography, and traveling, and she is proficient both in English and Arabic. Healthy living is important to Zara, and she maintains an active lifestyle while avoiding drinking, smoking, and drug use.\n\nZara is seeking a life partner who values monogamy. She would prefer someone over 27 but younger than 35, between 5'8\" and 6'2\". Similar to her lifestyle choices, she wishes for a partner who does not smoke, drink, or use drugs, and maintains an active lifestyle. Her love for family extends to her desires for the future, as she does not currently have children but wishes to do so with her life partner.", "user_id": "5d479074-6587-46b5-a0b0-e260a7324ccb"}
{"name": "Anna Kuznetsova", "age": 29, "height": "5'7\"", "school": "University of California, Los Angeles", "job_industry": "Tech", "job_title": "Software Engineer", "hometown_location": "Moscow, Russia", "dating_location": "Los Angeles, California", "languages_spoken": ["English", "Russian"], "values": ["Education", "Hard work", "Independence"], "interests": ["Coding", "Fitness", "Music", "Traveling"], "education_level": "Graduate", "religious_beliefs": "Atheist", "politics": "Liberal", "dating_intentions": "Long term", "relationship_type": "Monogamy", "gender": "Woman", "pronouns": "She/Her/Hers", "sexuality": "Straight", "ethnicity": "White Caucasian", "has_children": false, "want_children": true, "pets": ["Cat"], "zodiac_sign": "Virgo", "mbti_personality_type": "INTP", "drinking": "Sometimes", "smoking": "No", "marijuana": "No", "drugs": "No", "exercise": "Active", "partner_preferences": {"minimum_age": 30, "maximum_age": 40, "minimum_height": "5'10\"", "maximum_height": "6'5\"", "has_children": false, "want_children": true, "sexuality": "Straight", "drinking": "Yes", "smoking": "No", "marijuana": "No", "drugs": "No", "exercise": "Active"}, "summary": "Anna Kuznetsova, a Russian native, is a currently residing in Los Angeles, California. At 29 years old and 5'7'' tall, she works as a Software Engineer in the tech industry, having graduated from the University of California, Los Angeles. Anna can speak both English and Russian fluently. She values education, hard work and independence, and enjoys coding, fitness, music and traveling.\n\nAnna identifies herself as a straight woman and uses 'she/her' pronouns. She's an atheist with liberal political views. Although she doesn't have any children right now, she looks forward to motherhood in the future. Anna's personality type is classified as 'INTP' by the MBTI. While she occasionally indulges in drinking, she does not smoke or use marijuana or other drugs. She is a committed exerciser and the proud owner of a cat.\n\nWhen it comes to her partner preferences, Anna is interested in a straight man who is between the ages of 30 and 40 and anywhere from 5'10'' to 6'5'' tall. She prefers a companion who also wants children, does not smoke or use drugs, and likes to stay active. While it's okay for her match to be a drinker, she would prefer if he did not partake in the consumption of marijuana.", "user_id": "22d87af7-4097-4069-8191-bef416575b72"}
{"name": "Anaya Naidoo", "age": 28, "height": "5'5\"", "school": "University of Pretoria", "job_industry": "Software", "job_title": "Software Engineer", "hometown_location": "Durban, South Africa", "dating_location": "Los Angeles, California", "languages_spoken": ["English", "Afrikaans", "Zulu"], "values": ["Family", "Ambition", "Kindness"], "interests": ["Cooking", "Hiking", "Art"], "education_level": "Graduate", "religious_beliefs": "Hindu", "politics": "Liberal", "dating_intentions": "Long term", "relationship_type": "Monogamy", "gender": "Woman", "pronouns": "She/Her/Hers", "sexuality": "Straight", "ethnicity": "South Asian", "has_children": false, "want_children": true, "pets": ["None"], "zodiac_sign": "Libra", "mbti_personality_type": "INFJ", "drinking": "Sometimes", "smoking": "No", "marijuana": "No", "drugs": "No", "exercise": "Active", "partner_preferences": {"minimum_age": 27, "maximum_age": 35, "minimum_height": "5'7\"", "maximum_height": "6'2\"", "has_children": false, "want_children": true, "sexuality": "Straight", "drinking": "Sometimes", "smoking": "No", "marijuana": "No", "drugs": "No", "exercise": "Active"}, "summary": "Anaya Naidoo is a 28-year-old Software Engineer originally from Durban, South Africa, and currently living in Los Angeles, California. She pursued her higher education at the University of Pretoria. She fluidly speaks English, Afrikaans, and Zulu. \n\nDescribed as a person who values family, ambition, and kindness, Anaya finds her joy in cooking, hiking, and art. She identifies as a Hindu and holds liberal political views. She is looking for a long-term relationship and prefers monogamy.\n\nIn terms of identity, Anaya is a straight South Asian woman who uses She/Her/Hers pronouns. She doesn't have any children but expresses a desire to have them in the future. She does not have any pets. As a Libra and an INFJ, Anaya perhaps exhibits a sense of balance, harmony, and introspective nature in her relations.\n\nShe does consume alcohol occasionally but refrains from smoking, and drug usage, including marijuana. Anay is active when it comes to maintaining her fitness.\n\nAnaya values similar habits and qualities in a potential partner. She prefers someone who is between the ages of 27 and 35, and who is at least 5'7\" tall. She desires someone who is active, does not smoke or use drugs, and is looking forward to having children just like her.", "user_id": "8415c02f-08db-418a-9ecb-10df70c71093"}
{"name": "Charles Johnson", "age": 33, "height": "6'2\"", "school": "University of California", "job_industry": "Tech", "job_title": "Software Engineer", "hometown_location": "Charlotte, North Carolina", "dating_location": "Los Angeles, California", "languages_spoken": ["English", "Spanish"], "values": ["Family", "Career progression", "Spirituality"], "interests": ["Movies", "Outdoor activities", "Cooking"], "education_level": "Graduate", "religious_beliefs": "Christian", "politics": "Conservative", "dating_intentions": "Long term", "relationship_type": "Monogamy", "gender": "Man", "pronouns": "He/Him/His", "sexuality": "Straight", "ethnicity": "Black African Descent", "has_children": false, "want_children": true, "pets": ["Dog"], "zodiac_sign": "Cancer", "mbti_personality_type": "INTJ", "drinking": "Sometimes", "smoking": "No", "marijuana": "No", "drugs": "No", "exercise": "Active", "partner_preferences": {"minimum_age": 27, "maximum_age": 35, "minimum_height": "5'4\"", "maximum_height": "6'0\"", "has_children": false, "want_children": true, "sexuality": "Straight", "drinking": "Sometimes", "smoking": "No", "marijuana": "No", "drugs": "No", "exercise": "At least Sometimes"}, "summary": "Charles Johnson is a 33-year-old straight man of Black African descent who currently resides in Los Angeles, California. He is a 6'2\" Software Engineer in the tech industry and a graduate of the University of California. Born and raised in Charlotte, North Carolina, he speaks English and Spanish and identifies as Christian and politically conservative. He values family, career progression, and spirituality. His interests include movies, outdoor activities, and cooking. He doesn't have children but wants them in the future and enjoys the company of his dog. He is a Cancer zodiac sign with an INTJ personality type. He is looking for a long-term monogamous relationship. He drinks occasionally but is a non-smoker and against drug usage. Charles leads an active lifestyle and his partner preferences are a straight woman aged between 27 and 35 who has no children but wants them, drinks occasionally, doesn't smoke, is against drug usage, and exercises at least occasionally.", "user_id": "4e6cfe35-235c-4034-9a9c-ceab7005ed0b"}
{"name": "Chen Li", "age": 30, "height": "5'10\"", "school": "Tsinghua University", "job_industry": "Technology", "job_title": "Software Engineer", "hometown_location": "Beijing, China", "dating_location": "Los Angeles, California", "languages_spoken": ["English", "Mandarin", "Cantonese"], "values": ["Honesty", "Hard work", "Creativity"], "interests": ["Coding", "Traveling", "Hiking", "Cinema"], "education_level": "Graduate", "religious_beliefs": "Buddhist", "politics": "Moderate", "dating_intentions": "Long term", "relationship_type": "Monogamy", "gender": "Man", "pronouns": "He/Him/His", "sexuality": "Straight", "ethnicity": "East Asian", "has_children": false, "want_children": true, "pets": ["None"], "zodiac_sign": "Virgo", "mbti_personality_type": "INTJ", "drinking": "Sometimes", "smoking": "No", "marijuana": "No", "drugs": "No", "exercise": "Active", "partner_preferences": {"minimum_age": 24, "maximum_age": 34, "minimum_height": "5'2\"", "maximum_height": "5'11\"", "has_children": false, "want_children": true, "sexuality": "Straight", "drinking": "Yes", "smoking": "No", "marijuana": "No", "drugs": "No", "exercise": "Active"}, "summary": "Chen Li is a 30-year-old straight male residing in Los Angeles, California. He's a Software Engineer by profession and graduated from Tsinghua University. He hails from Beijing, China and is bilingual with proficiency in English, Mandarin, and Cantonese. He values honesty, hard work, and creativity, and enjoys activities such as coding, traveling, hiking, and watching movies. Chen is a Buddhist and politically moderate. He's interested in a long-term, monogamous relationship, has no children but wants to have them in the future. He has a Virgo zodiac sign and is an INTJ, indicating a rational and strategic mindset. He occasionally drinks, does not smoke or use marijuana, and leads an active lifestyle. Chen's ideal partner would be a straight woman between the ages of 24 and 34, who shares similar lifestyle preferences and has no children, but is open to having them in the future.\n", "user_id": "4b8d7b27-15af-4cfb-b234-6b74b4823164"}
{"name": "Amina Abdi", "age": 27, "height": "5'4\"", "school": "Stanford University", "job_industry": "Tech", "job_title": "Software Engineer", "hometown_location": "Minneapolis, Minnesota", "dating_location": "Los Angeles, California", "languages_spoken": ["English", "Somali"], "values": ["Honesty", "Family", "Hard Work"], "interests": ["Coding", "Photography", "Travelling"], "education_level": "Graduate", "religious_beliefs": "Muslim", "politics": "Liberal", "dating_intentions": "Life partner", "relationship_type": "Monogamy", "gender": "Woman", "pronouns": "She/Her/Hers", "sexuality": "Straight", "ethnicity": "Black African Descent", "has_children": false, "want_children": true, "pets": ["None"], "zodiac_sign": "Gemini", "mbti_personality_type": "INTJ", "drinking": "No", "smoking": "No", "marijuana": "No", "drugs": "No", "exercise": "Active", "partner_preferences": {"minimum_age": 27, "maximum_age": 35, "minimum_height": "5'7\"", "maximum_height": "6'3\"", "has_children": false, "want_children": true, "sexuality": "Straight", "drinking": "No", "smoking": "No", "marijuana": "No", "drugs": "No", "exercise": "Active"}, "summary": "Amina Abdi is a 27 year old software engineer, originally from Minneapolis, Minnesota, but currently residing in Los Angeles, California. She works in the tech industry after graduating from Stanford University. She speaks both English and Somali, and is characterized by her values of honesty, family, and hard work. Amina has a diverse range of interests, including coding, photography, and traveling. \n\nA devout Muslim with liberal political views, Amina is a straight woman who is looking for a life partner. She is of the INTJ personality type and is active in terms of physical health. Amina does not smoke, drink, or use any substances.\n\nShe prefers her partner to be between the ages of 27 and 35, at least 5'7\" in height, and to share her views on lifestyle habits and family planning. Amina does not have any children currently, but she desires to have children in the future. Also, she prefers her partner to have the same views on substance use and to be active.", "user_id": "40f863e1-2b44-4b27-b68d-f5f5c043d194"}
{"name": "Eduardo Martinez", "age": 34, "height": "5'9\"", "school": "Stanford University", "job_industry": "Tech", "job_title": "Software Engineer", "hometown_location": "Austin, Texas", "dating_location": "Los Angeles, California", "languages_spoken": ["English", "Spanish"], "values": ["Family", "Honesty", "Education", "Diversity"], "interests": ["Photography", "Travel", "Cooking", "Tech"], "education_level": "Graduate", "religious_beliefs": "Agnostic", "politics": "Liberal", "dating_intentions": "Long term", "relationship_type": "Monogamy", "gender": "Man", "pronouns": "He/Him/His", "sexuality": "Straight", "ethnicity": "Hispanic/Latino", "has_children": false, "want_children": true, "pets": ["Dog"], "zodiac_sign": "Pisces", "mbti_personality_type": "INTJ", "drinking": "Sometimes", "smoking": "No", "marijuana": "No", "drugs": "No", "exercise": "Active", "partner_preferences": {"minimum_age": 28, "maximum_age": 36, "minimum_height": "5'5\"", "maximum_height": "6'0\"", "has_children": false, "want_children": true, "sexuality": "Straight", "drinking": "Yes", "smoking": "No", "marijuana": "No", "drugs": "No", "exercise": "Active"}, "summary": "Eduardo Martinez is a 34-year-old software engineer based in Los Angeles, California. He originally hails from Austin, Texas and is an alumnus of Stanford University. Eduardo can fluently converse in English and Spanish. He is a man of values, emphasizing family, honesty, education, and diversity. \n\nEduardo has an active interest in photography, travel, cooking, and technology. A liberal in terms of politics, he identifies himself as an agnostic. He is in search of a long-term monogamous relationship. \n\nEduardo, a Pisces, identifies as a straight Hispanic/Latino man using 'He/Him/His' pronouns. He doesn't have children but hopes to in the future. He enjoys the company of his dog at home. \n\nEduardo is a non-smoker and does not use recreational drugs but does enjoy alcohol occasionally. Pursuing a healthy lifestyle, he exercises regularly. \n\nHe seeks a woman aged between 28 to 36 who leads an active lifestyle, doesn't smoke, and is open to having children. His potential partner may drink, but he prefers someone who also refrains from recreational drug use.", "user_id": "eef2dc84-3b7d-42d0-a8d4-97ff63dffe81"}
{"name": "Hiroshi Tanaka", "age": 32, "height": "5'9\"", "school": "Tokyo University", "job_industry": "Technology", "job_title": "Software Engineer", "hometown_location": "Kyoto, Japan", "dating_location": "Los Angeles, California", "languages_spoken": ["Japanese", "English"], "values": ["Hard work", "Family", "Humor"], "interests": ["Travelling", "Cooking", "Reading", "Video Games"], "education_level": "Graduate", "religious_beliefs": "Buddhist", "politics": "Moderate", "dating_intentions": "Long term", "relationship_type": "Monogamy", "gender": "Man", "pronouns": "He/Him/His", "sexuality": "Straight", "ethnicity": "East Asian", "has_children": false, "want_children": true, "pets": ["None"], "zodiac_sign": "Taurus", "mbti_personality_type": "INTJ", "drinking": "Sometimes", "smoking": "No", "marijuana": "No", "drugs": "No", "exercise": "Active", "partner_preferences": {"minimum_age": 25, "maximum_age": 35, "minimum_height": "5'0\"", "maximum_height": "5'9\"", "has_children": false, "want_children": true, "sexuality": "Straight", "drinking": "No", "smoking": "No", "marijuana": "No", "drugs": "No", "exercise": "Active"}, "summary": "Hiroshi Tanaka is a 32-year-old straight man who is currently living in Los Angeles, California. He hails originally from Kyoto, Japan, and speaks both Japanese and English fluently. His profession is in the technology industry as a software engineer, having graduated from Tokyo University. Hiroshi is a hardworking, family-centric, fun-loving individual who enjoys travelling, cooking, reading, and video games in his free time.\n\nIdentifying as a practicing Buddhist and holding moderate political views, he is looking for a long-term, monogamous relationship. Hiroshi is an East Asian individual who prefers the pronouns He/Him/His. He doesn't have any children now but hopes to have them in the future.\n\nDespite having no pets, Hiroshi enjoys an active lifestyle and occasionally enjoys a drink but doesn't smoke or partake in drug use. Hiroshi's partner preferences include a straight woman between the ages of 25 and 35 who doesn't smoke or do drugs, leads an active lifestyle, and is interested in having children in the future.", "user_id": "327d63d4-56c8-45a3-8803-682eb520e561"}
{"name": "Sofia Perez", "age": 29, "height": "5'6\"", "school": "University of California", "job_industry": "Technology", "job_title": "Software Engineer", "hometown_location": "San Diego, California", "dating_location": "Los Angeles, California", "languages_spoken": ["English", "Spanish"], "values": ["Ambition", "Family", "Independence"], "interests": ["Travelling", "Cooking", "Reading"], "education_level": "Graduate", "religious_beliefs": "Agnostic", "politics": "Liberal", "dating_intentions": "Life partner", "relationship_type": "Monogamy", "gender": "Woman", "pronouns": "She/Her/Hers", "sexuality": "Straight", "ethnicity": "Hispanic/Latino", "has_children": false, "want_children": true, "pets": ["Cat"], "zodiac_sign": "Libra", "mbti_personality_type": "ENFP", "drinking": "Sometimes", "smoking": "No", "marijuana": "No", "drugs": "No", "exercise": "Active", "partner_preferences": {"minimum_age": 29, "maximum_age": 35, "minimum_height": "5'6\"", "maximum_height": "6'0\"", "has_children": false, "want_children": true, "sexuality": "Straight", "drinking": "Sometimes", "smoking": "No", "marijuana": "No", "drugs": "No", "exercise": "Active"}, "summary": "Sofia Perez is a 29-year-old Software Engineer from San Diego, California, currently living in Los Angeles. She is a graduate of the University of California who values ambition, family, and independence. Sofia is a multi-lingual woman who speaks both English and Spanish fluently. She identifies as a straight woman with a Hispanic/Latino ethnicity. Her interests include traveling, cooking, and reading. Even though she is agnostic and politically Liberal, she is looking for a life partner who believes in monogamy. Sofia doesn't have children but is open to starting a family. A Libra at heart, she prefers the company of people who are energetic and active like her. Her love for animals is evident as she owns a cat. Although she enjoys an occasional drink, Sofia remains firm about her non-smoking status and doesn't partake in marijuana use or drugs. She prefers a partner who is between 29 and 35 years old, exercises regularly, and does not smoke or use drugs.", "user_id": "20723afd-19b0-49a1-b51f-dcf84d2b3ca5"}
{"name": "Rajan Singh", "age": 35, "height": "5'10\"", "school": "University of Delhi", "job_industry": "Tech", "job_title": "Software Engineer", "hometown_location": "Delhi, India", "dating_location": "Los Angeles, California", "languages_spoken": ["English", "Hindi"], "values": ["Family", "Adventure", "Respect"], "interests": ["Cooking", "Hiking", "Coding"], "education_level": "Graduate", "religious_beliefs": "Sikh", "politics": "Liberal", "dating_intentions": "Long term", "relationship_type": "Monogamy", "gender": "Man", "pronouns": "He/Him/His", "sexuality": "Straight", "ethnicity": "South Asian", "has_children": false, "want_children": true, "pets": ["Dog"], "zodiac_sign": "Capricorn", "mbti_personality_type": "INTJ", "drinking": "Yes", "smoking": "No", "marijuana": "No", "drugs": "No", "exercise": "Active", "partner_preferences": {"minimum_age": 26, "maximum_age": 36, "minimum_height": "5'0\"", "maximum_height": "6'0\"", "has_children": false, "want_children": true, "sexuality": "Straight", "drinking": "Yes", "smoking": "No", "marijuana": "No", "drugs": "No", "exercise": "Active"}, "summary": "Rajan Singh, a 35-year-old software engineer in the tech industry, is seeking a long-term relationship. He values family, adventure, and respect. He enjoys cooking, hiking, and coding in his spare time. He hails from Delhi, India, but is currently living in Los Angeles, California. His spoken languages are English and Hindi. He is a Sikh and identifies politically as liberal. Rajan is open to monogamy and wants children in the future. His pronouns are he/him/his and he identifies as straight. He is a proud dog owner, an active Capricorn and identifies as INTJ in Myers-Briggs personality types. \n\nRajan's partner preferences include a straight female between the ages of 26 to 36 who values an active lifestyle. She should not already have children, but wants them in the future, and preferable to have a healthy lifestyle in regards to drinking, smoking, marijuana, and other drugs.", "user_id": "9b8e031c-372e-4841-b268-aef4e47aef32"}
{"name": "Beatrice Liu", "age": 28, "height": "5'5\"", "school": "University of California, Los Angeles", "job_industry": "Technology", "job_title": "Software Engineer", "hometown_location": "San Diego, California", "dating_location": "Los Angeles, California", "languages_spoken": ["English", "Mandarin"], "values": ["Hard Work", "Family", "Honesty"], "interests": ["Reading", "Coding", "Yoga"], "education_level": "Graduate", "religious_beliefs": "Atheist", "politics": "Liberal", "dating_intentions": "Long term", "relationship_type": "Monogamy", "gender": "Woman", "pronouns": "She/Her/Hers", "sexuality": "Straight", "ethnicity": "East Asian", "has_children": false, "want_children": true, "pets": ["Cat"], "zodiac_sign": "Libra", "mbti_personality_type": "INTJ", "drinking": "Sometimes", "smoking": "No", "marijuana": "No", "drugs": "No", "exercise": "Active", "partner_preferences": {"minimum_age": 28, "maximum_age": 35, "minimum_height": "5'7\"", "maximum_height": "6'2\"", "has_children": false, "want_children": true, "sexuality": "Straight", "drinking": "Yes", "smoking": "No", "marijuana": "No", "drugs": "No", "exercise": "Active"}, "summary": "Beatrice Liu is a straight, single, 28 year-old woman of East Asian descent. She is a software engineer in the tech industry and resides in Los Angeles, California. Beatrice prides herself on her values, which include hard work, family, and honesty. She enjoys reading, coding, and yoga as her hobbies. Beatrice was educated to a graduate level at the University of California and identifies herself as an atheist with liberal political views. She is interested in a long-term, monogamous relationship and intends to have children in the future. Beatrice speaks English and Mandarin fluently. She occasionally enjoys a drink, doesn't smoke, and refrains from drug use. Beatrice is physically active and she owns a cat. Her MBTI personality type is INTJ and she is a Libra. In terms of her relationship preferences, she is interested in a straight man aged between 28 and 35 who leads an active lifestyle, does not smoke, and is open to having children.", "user_id": "8f4e2072-3ed0-4f9e-8353-66394f262fbd"}
{"name": "Sophia Ngugi", "age": 28, "height": "5'4\"", "school": "University of Cape Town", "job_industry": "Healthcare", "job_title": "Occupational Therapist", "hometown_location": "Nairobi, Kenya", "dating_location": "Los Angeles, California", "languages_spoken": ["English", "Swahili"], "values": ["Hard work", "Family", "Personal Development"], "interests": ["Traveling", "Reading", "Yoga"], "education_level": "Graduate", "religious_beliefs": "Christian", "politics": "Liberal", "dating_intentions": "Life partner", "relationship_type": "Monogamy", "gender": "Woman", "pronouns": "She/Her/Hers", "sexuality": "Straight", "ethnicity": "Black African Descent", "has_children": false, "want_children": true, "pets": ["Dog"], "zodiac_sign": "Virgo", "mbti_personality_type": "ISFJ", "drinking": "Sometimes", "smoking": "No", "marijuana": "No", "drugs": "No", "exercise": "Active", "partner_preferences": {"minimum_age": 28, "maximum_age": 35, "minimum_height": "5'8\"", "maximum_height": "6'2\"", "has_children": false, "want_children": true, "sexuality": "Straight", "drinking": "Yes", "smoking": "No", "marijuana": "No", "drugs": "No", "exercise": "Active"}, "summary": "Sophia Ngugi, a 28-year-old Occupational Therapist, hails from Nairobi, Kenya, but is currently located in Los Angeles, California. She's a highly educated individual who graduated from the University of Cape Town. She is passionate about languages and speaks both English and Swahili. Her personal values include hard work, family, and personal development. Sophia enjoys traveling, reading, and yoga in her free time. She identifies as a Christian, leans liberal in her political views, and her ultimate goal is to find a life partner. Sophia prefers monogamy, identifies as a straight woman and uses She/Her/Hers pronouns. She belongs to a Black African Descent ethnicity. She doesn't currently have children but wants to in the future. It's also worth mentioning that she is a proud dog owner. Sophia’s zodiac sign is Virgo and her MBTI personality type is ISFJ. She doesn't smoke, uses drugs, or marijuana, but does enjoy a drink occasionally. She enjoys an active lifestyle. Her ideal partner would be a straight man between the ages of 28 and 35, who doesn't smoke or use marijuana or drugs but should enjoy a drink occasionally. Her partner should also want to have children in the future and prefer an active lifestyle.", "user_id": "8f63a98b-871d-451f-87ff-f76e12adbbb3"}
{"name": "Anastasia Papadopoulos", "age": 29, "height": "5'6\"", "school": "New York University", "job_industry": "Marketing", "job_title": "Content Strategy Manager", "hometown_location": "Athens, Greece", "dating_location": "Los Angeles, California", "languages_spoken": ["English", "Greek", "Spanish"], "values": ["Creativity", "Independence", "Compassion"], "interests": ["Painting", "Traveling", "Yoga"], "education_level": "Graduate", "religious_beliefs": "Orthodox", "politics": "Liberal", "dating_intentions": "Long term", "relationship_type": "Monogamy", "gender": "Woman", "pronouns": "She/Her/Hers", "sexuality": "Straight", "ethnicity": "White Caucasian", "has_children": false, "want_children": true, "pets": ["Cat"], "zodiac_sign": "Scorpio", "mbti_personality_type": "ENFJ", "drinking": "Sometimes", "smoking": "No", "marijuana": "No", "drugs": "No", "exercise": "Active", "partner_preferences": {"minimum_age": 30, "maximum_age": 36, "minimum_height": "5'8\"", "maximum_height": "6'2\"", "has_children": false, "want_children": true, "sexuality": "Straight", "drinking": "None", "smoking": "No", "marijuana": "No", "drugs": "No", "exercise": "Active"}, "summary": "Anastasia Papadopoulos, a 29-year-old woman, is seeking a long-term, monogamous relationship. She works as a Content Strategy Manager in the marketing industry and is a graduate of New York University. Based in Los Angeles, Anastasia is originally from Athens, Greece. She speaks English, Greek, and Spanish, and her key values are creativity, independence, and compassion. \n\nRegarding her interests, Anastasia enjoys painting, traveling, and yoga. She identifies as a liberal and practices the Orthodox faith. Anastasia is a straight white Caucasian woman with Scorpio as her zodiac sign, and she identifies as an ENFJ, according to the MBTI personality scale.\n\nShe does not smoke or use marijuana or other drugs. She does, however, consume alcohol occasionally and maintains an active lifestyle. Anastasia does not have children but wants to have them in the future. She has a cat as a pet and prefers a partner in the age range of 30 to 36 years who shares similar interests and values. Her desired partner would ideally not have children yet but is open to having children in future. They should also lead an active lifestyle and not smoke, use marijuana or other drugs. Responsible alcohol consumption is acceptable.", "user_id": "bb6e6d94-cc2c-4cd9-b14e-5facdeb58405"}
{"name": "Toshiko Tanaka", "age": 32, "height": "5'5\"", "school": "Kyoto University", "job_industry": "Technology", "job_title": "Software Developer", "hometown_location": "Tokyo, Japan", "dating_location": "Los Angeles, California", "languages_spoken": ["Japanese", "English"], "values": ["Honesty", "Family", "Personal Growth"], "interests": ["Travel", "Reading", "Hiking", "Cooking"], "education_level": "Graduate", "religious_beliefs": "Buddhist", "politics": "Liberal", "dating_intentions": "Long term", "relationship_type": "Monogamy", "gender": "Woman", "pronouns": "She/Her/Hers", "sexuality": "Straight", "ethnicity": "East Asian", "has_children": false, "want_children": true, "pets": ["None"], "zodiac_sign": "Libra", "mbti_personality_type": "INFJ", "drinking": "Yes", "smoking": "No", "marijuana": "No", "drugs": "No", "exercise": "Active", "partner_preferences": {"minimum_age": 28, "maximum_age": 36, "minimum_height": "5'7\"", "maximum_height": "6'0\"", "has_children": false, "want_children": true, "sexuality": "Straight", "drinking": "Yes", "smoking": "No", "marijuana": "No", "drugs": "No", "exercise": "Active"}, "summary": "Toshiko Tanaka, a 32-year-old woman originally from Tokyo, is actively seeking a long-term relationship while residing in Los Angeles, California. She is a software developer in the tech industry and a graduate of Kyoto University. Standing 5'5\" tall, she identifies herself as a straight East Asian woman, who uses the 'She/Her/Hers' pronouns. She is a Buddhist and expresses liberal political views. Toshiko is multilingual, speaking both Japanese and English. Honesty, family, and personal growth are principles she highly values. In her free time, she loves traveling, reading, hiking, and cooking. Non-smoker Toshiko is socially comfortable with drinking but does not use marijuana or drugs. She is quite active and exercises regularly. She does not have children but desires to have them in the future. According to the zodiac, Toshiko is a harmonious Libra and her MBTI personality type is the insightful and empathetic INFJ.  \n\nToshiko is interested in a straight man that falls within the age range of 28-36 years and stands between 5'7'' and 6'0''. Like her, he should have no children but be open to the idea of having them. Further, he should be respectful of her habits which are social drinking, not smoking, and no marijuana or other drug use. He should also be physically active.", "user_id": "49f73675-72a2-45b8-a17a-299523d70dc0"}
{"name": "Akshay Patel", "age": 28, "height": "5'9\"", "school": "University of California, Berkeley", "job_industry": "Technology", "job_title": "Software Engineer", "hometown_location": "San Francisco, California", "dating_location": "Los Angeles, California", "languages_spoken": ["English", "Hindi", "Gujarati"], "values": ["Hard work", "Family", "Respect for all"], "interests": ["Coding", "Hiking", "Photography"], "education_level": "Graduate", "religious_beliefs": "Hindu", "politics": "Liberal", "dating_intentions": "Life partner", "relationship_type": "Monogamy", "gender": "Man", "pronouns": "He/Him/His", "sexuality": "Straight", "ethnicity": "South Asian", "has_children": false, "want_children": true, "pets": ["None"], "zodiac_sign": "Aries", "mbti_personality_type": "INTJ", "drinking": "Sometimes", "smoking": "No", "marijuana": "No", "drugs": "No", "exercise": "Active", "partner_preferences": {"minimum_age": 24, "maximum_age": 32, "minimum_height": "5'2\"", "maximum_height": "6'0\"", "has_children": false, "want_children": true, "sexuality": "Straight", "drinking": "Yes", "smoking": "No", "marijuana": "No", "drugs": "No", "exercise": "Active"}, "summary": "Akshay Patel is a 28-year-old Software Engineer in the Technology industry based in Los Angeles, California. He graduated from the University of California, Berkeley, and values hard work, family, and respect for all. Akshay speaks English, Hindi, and Gujarati, and seeks a life partner who shares his love for coding, hiking, and photography. As a Hindu and liberal, Akshay intends to find a life partner through monogamous dating. Akshay identifies as a straight man, is of South Asian ethnicity, has no children but wants to have them in the future. He is an Aries with an INTJ personality type who occasionally drinks but does not smoke or use drugs. Akshay prefers an active lifestyle and seeks a partner aged between 24 to 32, who is 5'2\" to 6'0\", has no children but wants them, shares his state of health, and does not smoke or use drugs.\n", "user_id": "c6570c74-3283-48fb-82b1-864459840a35"}
{"name": "Hikaru Sato", "age": 30, "height": "5'7\"", "school": "Tokyo University", "job_industry": "Technology", "job_title": "Software Engineer", "hometown_location": "Tokyo, Japan", "dating_location": "Los Angeles, California", "languages_spoken": ["English", "Japanese"], "values": ["Integrity", "Hard Work", "Creativity", "Friendship"], "interests": ["Coding", "Animation", "Cooking", "Nature"], "education_level": "Graduate", "religious_beliefs": "Atheist", "politics": "Moderate", "dating_intentions": "Long term", "relationship_type": "Monogamy", "gender": "Man", "pronouns": "He/Him/His", "sexuality": "Straight", "ethnicity": "East Asian", "has_children": false, "want_children": true, "pets": ["None"], "zodiac_sign": "Scorpio", "mbti_personality_type": "INTJ", "drinking": "Sometimes", "smoking": "No", "marijuana": "No", "drugs": "No", "exercise": "Active", "partner_preferences": {"minimum_age": 24, "maximum_age": 35, "minimum_height": "5'2\"", "maximum_height": "5'8\"", "has_children": false, "want_children": true, "sexuality": "Straight", "drinking": "Sometimes", "smoking": "No", "marijuana": "No", "drugs": "No", "exercise": "Active"}, "summary": "Hikaru Sato is a 30-year-old man from Tokyo, Japan. He's currently based in Los Angeles, California, and works as a Software Engineer in the technology sector. Fluent in both English and Japanese, he values integrity, hard work, creativity, and friendship. With interests in coding, animation, cooking, and nature, Hikaru is a well-rounded and diverse individual.\n\nHe's an atheist and stands with moderate political views, and he's ready for a long-term, monogamous relationship. He identifies as straight, doesn't have any children, but wishes to have some in the future. He doesn't own any pets and has a Scorpio star sign. As an INTJ (Introverted, Intuitive, Thinking, and Judging) personality type, Hikaru enjoys deep thinking and values efficiency.\n\nIn terms of lifestyle, Hikaru drinks occasionally and doesn't smoke or use marijuana or drugs. He is active and maintains an exercise routine. \n\nHe is looking for a straight female partner, aged between 24-35, who doesn't have children yet but wants some in the future. His potential partner leads an active lifestyle, drinks occasionally, and doesn't smoke or use drugs or marijuana.", "user_id": "a7e0dd34-a93c-408f-96d6-4a82ced2a7a6"}
{"name": "Naomi Mwangi", "age": 29, "height": "5'7\"", "school": "University of Nairobi", "job_industry": "Healthcare", "job_title": "Registered Nurse", "hometown_location": "Nairobi, Kenya", "dating_location": "Los Angeles, California", "languages_spoken": ["English", "Swahili"], "values": ["Family", "Career", "Health"], "interests": ["Reading", "Yoga", "Cooking", "Travel"], "education_level": "Graduate", "religious_beliefs": "Christian", "politics": "Moderate", "dating_intentions": "Long term", "relationship_type": "Monogamy", "gender": "Woman", "pronouns": "She/Her/Hers", "sexuality": "Straight", "ethnicity": "Black African Descent", "has_children": false, "want_children": true, "pets": ["None"], "zodiac_sign": "Virgo", "mbti_personality_type": "ISFJ", "drinking": "Sometimes", "smoking": "No", "marijuana": "No", "drugs": "No", "exercise": "Active", "partner_preferences": {"minimum_age": 30, "maximum_age": 40, "minimum_height": "5'7\"", "maximum_height": "6'3\"", "has_children": false, "want_children": true, "sexuality": "Straight", "drinking": "Sometimes", "smoking": "No", "marijuana": "No", "drugs": "No", "exercise": "Active"}, "summary": "Naomi Mwangi is a 29-year-old Registered Nurse who values family, career, and health. She is from Nairobi, Kenya but is currently based in Los Angeles, California. She speaks English and Swahili. She enjoys reading, yoga, cooking, and travel in her leisure time. She has a graduate degree and is a Christian. She falls on the moderate spectrum politically. \n\nNaomi is seeking a long-term monogamous relationship and does not currently have children, but desires to have them in the future. She identifies as a woman, using she/her/hers pronouns and is straight. Naomi is of Black African descent. \n\nShe does not have any pets, and her zodiac sign is Virgo while her MBTI personality type is ISFJ. Naomi occasionally drinks, however, does not smoke, consume marijuana, or other drugs. Her exercise level is active. \n\nShe is looking for a partner who falls within the age range of 30-40 and who stands between 5'7\" and 6'3\" in height. Naomi's prospective partner should not have children currently but wish to have them eventually. The prospective partner's habits should align with hers like occasional drinking but no smoking, no marijuana, or drug use, and paralleling activity levels.", "user_id": "b5b46af1-6edd-440d-9236-2b1014a1961b"}
{"name": "Rosa Fernandez", "age": 35, "height": "5'6\"", "school": "University of California, Los Angeles", "job_industry": "Medical", "job_title": "Nurse Practitioner", "hometown_location": "San Diego, California", "dating_location": "Los Angeles, California", "languages_spoken": ["English", "Spanish"], "values": ["Family", "Honesty", "Kindness"], "interests": ["Traveling", "Cooking", "Photography"], "education_level": "Graduate", "religious_beliefs": "Catholic", "politics": "Moderate", "dating_intentions": "Long term", "relationship_type": "Monogamy", "gender": "Woman", "pronouns": "She/Her/Hers", "sexuality": "Straight", "ethnicity": "Hispanic/Latino", "has_children": false, "want_children": true, "pets": ["Dog"], "zodiac_sign": "Libra", "mbti_personality_type": "ISFJ", "drinking": "Sometimes", "smoking": "No", "marijuana": "No", "drugs": "No", "exercise": "Active", "partner_preferences": {"minimum_age": 35, "maximum_age": 45, "minimum_height": "5'7\"", "maximum_height": "6'5\"", "has_children": false, "want_children": true, "sexuality": "Straight", "drinking": "Yes", "smoking": "No", "marijuana": "No", "drugs": "No", "exercise": "Active"}, "summary": "Rosa Fernandez is a 35-year-old Nurse Practitioner living in Los Angeles, California, originally from San Diego. A graduate from UCLA, Rosa is bilingual, fluent in both English and Spanish. As a Hispanic/Latino woman, she values family, honesty, and kindness. While she is Catholic, Rosa has a moderate political stance. \n\nShe enjoys traveling, cooking and photography in her leisure time. Rosa identifies as a straight woman and uses “She/Her/Hers” pronouns. Rosa is interested in a long-term monogamous relationship and although she doesn't have children, she is open to having them in the future. \n\nIn terms of lifestyle, Rosa is active and occasionally enjoys a drink but refrains from smoking or using any recreational drugs. She owns a dog and is a Libra by zodiac sign. Her MBTI personality type is ISFJ.\n\nIn a partner, Rosa prefers someone who respects her need for monogamy, is between the ages of 35-45, and at least 5'7\" tall. She is open to partners who enjoy drinking but prefers non-smokers. Her potential partner should also be active, childless but open to the idea of having children in the future.", "user_id": "da34d567-2862-420a-941b-e9224c80ea59"}
{"name": "Diego Smith", "age": 29, "height": "5'10\"", "school": "University of California, Los Angeles", "job_industry": "Technology", "job_title": "Software Developer", "hometown_location": "Boyle Heights, Los Angeles, California", "dating_location": "Los Angeles, California", "languages_spoken": ["English", "Spanish"], "values": ["Honesty", "Respect", "Empathy"], "interests": ["Coding", "Mountain Biking", "Photography", "Cooking"], "education_level": "Undergraduate", "religious_beliefs": "Agnostic", "politics": "Moderate", "dating_intentions": "Long term, open to short", "relationship_type": "Monogamy", "gender": "Man", "pronouns": "He/Him/His", "sexuality": "Straight", "ethnicity": "Hispanic/Latino", "has_children": false, "want_children": true, "pets": ["Dog", "Cat"], "zodiac_sign": "Aries", "mbti_personality_type": "INTP", "drinking": "Sometimes", "smoking": "No", "marijuana": "No", "drugs": "No", "exercise": "Active", "partner_preferences": {"minimum_age": 24, "maximum_age": 35, "minimum_height": "5'3\"", "maximum_height": "6'0\"", "has_children": false, "want_children": true, "sexuality": "Straight", "drinking": "Yes", "smoking": "No", "marijuana": "No", "drugs": "No", "exercise": "Active"}, "summary": "Diego Smith is a 29-year-old man from Boyle Heights, Los Angeles. He is a software developer who graduated from the University of California, Los Angeles. He values honesty, respect, and empathy and is keenly interested in coding, mountain biking, photography, and cooking. Diego identifies as agnostic, holds moderate political views, and intends to form a long-term relationship but is open to short-term ones as well. He is oriented to monogamy and is straight. As for his preferences, he expects his partner to be an active non-smoker, aged between 24 and 35, without children but open to having some. Despite being quite active, he enjoys spending free time with his pets: a dog and a cat.", "user_id": "9c1dade9-9084-4d12-8211-ccc94c6a364c"}
{"name": "Hiroshi Tanaka", "age": 32, "height": "5'8\"", "school": "Tokyo University", "job_industry": "Tech", "job_title": "Software Engineer", "hometown_location": "Tokyo, Japan", "dating_location": "Los Angeles, California", "languages_spoken": ["Japanese", "English"], "values": ["Hard work", "Loyalty", "Creativity"], "interests": ["Traveling", "Cooking", "Reading Fiction"], "education_level": "Graduate", "religious_beliefs": "Buddhist", "politics": "Liberal", "dating_intentions": "Long term", "relationship_type": "Monogamy", "gender": "Man", "pronouns": "He/Him/His", "sexuality": "Straight", "ethnicity": "East Asian", "has_children": false, "want_children": true, "pets": ["Cat"], "zodiac_sign": "Capricorn", "mbti_personality_type": "INTJ", "drinking": "Sometimes", "smoking": "No", "marijuana": "No", "drugs": "No", "exercise": "Active", "partner_preferences": {"minimum_age": 25, "maximum_age": 35, "minimum_height": "5'2\"", "maximum_height": "5'9\"", "has_children": false, "want_children": true, "sexuality": "Straight", "drinking": "Yes", "smoking": "No", "marijuana": "No", "drugs": "No", "exercise": "Active"}, "summary": "Hiroshi Tanaka is a 32-year-old man looking for a long-term relationship. He identifies as straight and practices monogamy. Although he doesn't have children, he is keen on starting a family someday. Professionally, he works as a Software Engineer in the tech industry. Hiroshi is a graduate from Tokyo University and fluent in Japanese and English. \n\nOriginally from Tokyo, Japan, Hiroshi now lives in Los Angeles, California. His values include hard work, loyalty, and creativity, while his hobbies are cooking, traveling, and reading fiction. He identifies as a Buddhist and is politically liberal. He occasionally drinks but does not indulge in smoking or drugs.\n\nHiroshi's prospective partner should be between 25 and 35, straight, and share his interest in having children in the future. The ideal partner for him would also value physical activity as Hiroshi leads an active lifestyle himself. Hiroshi also prefers that his potential partner is a social drinker, but not smoking, marijuana or drug user.", "user_id": "e86fdf75-6f96-44a9-89be-d86a1f326dee"}
{"name": "Keisha Robinson", "age": 31, "height": "5'7\"", "school": "University of California, Los Angeles", "job_industry": "Entertainment", "job_title": "Production Coordinator", "hometown_location": "Chicago, Illinois", "dating_location": "Los Angeles, California", "languages_spoken": ["English", "Spanish"], "values": ["Integrity", "Community", "Creativity"], "interests": ["Movies", "Cycling", "Traveling"], "education_level": "Graduate", "religious_beliefs": "Christian", "politics": "Moderate", "dating_intentions": "Long term", "relationship_type": "Monogamy", "gender": "Woman", "pronouns": "She/Her/Hers", "sexuality": "Straight", "ethnicity": "Black African Descent", "has_children": false, "want_children": true, "pets": ["Cat", "None"], "zodiac_sign": "Virgo", "mbti_personality_type": "ENFJ", "drinking": "Sometimes", "smoking": "No", "marijuana": "No", "drugs": "No", "exercise": "Active", "partner_preferences": {"minimum_age": 30, "maximum_age": 40, "minimum_height": "5'8\"", "maximum_height": "6'3\"", "has_children": false, "want_children": true, "sexuality": "Straight", "drinking": "Yes", "smoking": "No", "marijuana": "No", "drugs": "No", "exercise": "Active"}, "summary": "Keisha Robinson is a 31-year-old woman from Chicago, Illinois who currently lives in Los Angeles, California. She is a Production Coordinator in the Entertainment industry and is a graduate of the University of California, Los Angeles. Keisha is 5'7\", values integrity, community, and creativity, and enjoys movies, cycling, and traveling.\n\nShe is Christian and politically moderate, seeking a long-term, monogamous relationship. She identifies as straight, uses the pronouns She/Her/Hers, and is of Black African descent. She doesn't have children but wants to have them in the future. She has a cat, enjoys the occasional drink but doesn't smoke or use marijuana or drugs.\n\nKeisha prefers a straight man aged between 30 to 40 years, standing 5'8\" to 6'3\" tall. Her ideal partner would want children, enjoy a drink but abstain from smoking, marijuana, and drugs. Keisha embraces the active lifestyle and appreciates a partner who does the same.", "user_id": "4ea3725b-dc6c-4ed1-b6d0-e8511971afc1"}
{"name": "Juliet Nkosi", "age": 28, "height": "5'6\"", "school": "Stanford University", "job_industry": "Software", "job_title": "Software Developer", "hometown_location": "Johannesburg, South Africa", "dating_location": "Los Angeles, California", "languages_spoken": ["English", "Zulu", "Afrikaans", "Japanese"], "values": ["Hard work", "Respect", "Empathy", "Sincerity", "Independence"], "interests": ["Technology", "Yoga", "Music", "Outdoor Adventure", "Cooking", "Reading"], "education_level": "Graduate", "religious_beliefs": "Agnostic", "politics": "Liberal", "dating_intentions": "Long term", "relationship_type": "Monogamy", "gender": "Woman", "pronouns": "She/Her/Hers", "sexuality": "Straight", "ethnicity": "Black African Descent", "has_children": false, "want_children": true, "pets": ["None"], "zodiac_sign": "Cancer", "mbti_personality_type": "INFJ", "drinking": "Sometimes", "smoking": "No", "marijuana": "No", "drugs": "No", "exercise": "Active", "partner_preferences": {"minimum_age": 26, "maximum_age": 35, "minimum_height": "5'6\"", "maximum_height": "6'3\"", "has_children": false, "want_children": true, "sexuality": "Straight", "drinking": "Yes", "smoking": "No", "marijuana": "No", "drugs": "No", "exercise": "Active"}, "summary": "Juliet Nkosi is a 28-year-old woman from Johannesburg, South Africa currently living in Los Angeles, California. She's straight, identifies with the pronouns She/Her/Hers, and is interested in a monogamous, long-term relationship with a man. Juliet is a Software Developer in the tech industry and a graduate from Stanford University.\n\nWhile being a dedicated professional, Juliet also enjoys yoga, music, outdoor adventure, cooking, and reading. She speaks multiple languages that include English, Zulu, Afrikaans, and Japanese. She holds close to her heart values of hard work, respect, empathy, sincerity, and independence.\n\nShe is liberal and agnostic. She has no pets and does not have any children yet, but she does want children in the future. She often drinks socially, but she does not smoke or use marijuana or other drugs.\n\nFor a potential partner, she prefers someone who does not currently have kids but wants them in the future. Similarly, a potential partner should be active and wouldn't mind a drink socially but not indulge in smoking or drug use.\n\nWith a Cancer zodiac sign and her INFJ Myers–Briggs personality type, Juliet prefers to make her relationships personal, meaningful, and long-lasting. She's looking for someone between 26 and 35, with a height ranging from 5'6\" to 6'3\".", "user_id": "25d3add9-2653-4bac-a604-6012c2bbc866"}
{"name": "Naomi Desai", "age": 28, "height": "5'7\"", "school": "University of Michigan", "job_industry": "Healthcare", "job_title": "Registered Nurse", "hometown_location": "Saginaw, Michigan", "dating_location": "Los Angeles, California", "languages_spoken": ["English", "Gujarati"], "values": ["Family-oriented", "Ambitious", "Charitable"], "interests": ["Hiking", "Dancing", "Yoga"], "education_level": "Undergraduate", "religious_beliefs": "Hindu", "politics": "Liberal", "dating_intentions": "Life partner", "relationship_type": "Monogamy", "gender": "Woman", "pronouns": "She/Her/Hers", "sexuality": "Straight", "ethnicity": "South Asian", "has_children": false, "want_children": true, "pets": ["Dog"], "zodiac_sign": "Libra", "mbti_personality_type": "ESFJ", "drinking": "Sometimes", "smoking": "No", "marijuana": "No", "drugs": "No", "exercise": "Active", "partner_preferences": {"minimum_age": 27, "maximum_age": 35, "minimum_height": "5'8\"", "maximum_height": "6'2\"", "has_children": false, "want_children": true, "sexuality": "Straight", "drinking": "Sometimes", "smoking": "No", "marijuana": "No", "drugs": "No", "exercise": "Sometimes"}, "summary": "Naomi Desai is a straight 28-year-old woman who values being family-oriented, ambitious, and charitable. She hails from Saginaw, Michigan and is currently in Los Angeles, California. Trilingual, Naomi speaks English and Gujarati. She has a diverse range of interests that include hiking, dancing, and yoga. \n\nA University of Michigan undergrad, she's currently working as a Registered Nurse in the Healthcare industry. By aligning with liberal politics and following the Hindu religion, Naomi represents an empathetic, holistic worldview. \n\nShe prefers monogamous dating and is looking for a life partner between 27 to 35, at least 5'8\" tall. Shared interests, attitudes towards health, desire to build a family, and a pet-loving nature, specifically towards dogs, are ideal in her potential partner. \n\nNaomi identifies her astrological sign as Libra, personality type as ESFJ (Extraverted, Sensing, Feeling, Judging type) and prefers to sometimes engage in social drinking. With a clear stand against smoking, marijuana, and drugs, she enjoys staying active and healthy.", "user_id": "593ec133-577b-432c-8284-8e6e60c6a4fc"}
{"name": "Claire Adhiambo", "age": 27, "height": "5'6\"", "school": "University of Nairobi", "job_industry": "Healthcare", "job_title": "Registered Nurse", "hometown_location": "Nairobi, Kenya", "dating_location": "Los Angeles, California", "languages_spoken": ["English", "Swahili"], "values": ["Family", "Fitness", "Adventure"], "interests": ["Traveling", "Cooking", "Reading"], "education_level": "Undergraduate", "religious_beliefs": "Christian", "politics": "Moderate", "dating_intentions": "Long term", "relationship_type": "Monogamy", "gender": "Woman", "pronouns": "She/Her/Hers", "sexuality": "Straight", "ethnicity": "Black African Descent", "has_children": false, "want_children": true, "pets": ["None"], "zodiac_sign": "Virgo", "mbti_personality_type": "ISFJ", "drinking": "Sometimes", "smoking": "No", "marijuana": "No", "drugs": "No", "exercise": "Active", "partner_preferences": {"minimum_age": 27, "maximum_age": 35, "minimum_height": "5'8\"", "maximum_height": "6'3\"", "has_children": false, "want_children": true, "sexuality": "Straight", "drinking": "Yes", "smoking": "No", "marijuana": "No", "drugs": "No", "exercise": "Active"}, "summary": "Claire Adhiambo is a 27-year-old woman who is a Registered Nurse in the healthcare industry. She originates from Nairobi, Kenya, and is now living in Los Angeles, California. Claire is highly educated, having attended the University of Nairobi. She's fluent in English and Swahili. Claire identifies herself as Christian, holds moderate political views and is aiming for a long-term, monogamous relationship.\n\nHer interests include traveling, cooking, reading, while she values family, fitness, and adventure. Despite being active and sometimes enjoying a drink, she does not smoke or consume drugs or marijuana. Claire, straight and identifying with the pronouns 'she/her/hers', belongs to the Black African Descent community. She doesn't have children but looks forward to having one in the future. \n\nClaire prefers a straight male partner between the ages of 27 to 35, who is at least 5'8\" tall. She is inclined towards a partner who is active, enjoys a drink but is not into smoking or drugs, and who doesn't have but is open to having kids.", "user_id": "7674faa9-209a-492b-a35b-c25e8fece735"}
{"name": "Mai Nguyen", "age": 28, "height": "5'6\"", "school": "University of California, Berkeley", "job_industry": "Technology", "job_title": "Software Developer", "hometown_location": "San Diego, California", "dating_location": "Los Angeles, California", "languages_spoken": ["English", "Vietnamese"], "values": ["Family", "Equality", "Creativity"], "interests": ["Reading", "Coding", "Hiking", "Cooking"], "education_level": "Graduate", "religious_beliefs": "Buddhist", "politics": "Liberal", "dating_intentions": "Long term", "relationship_type": "Monogamy", "gender": "Woman", "pronouns": "She/Her/Hers", "sexuality": "Straight", "ethnicity": "Southeast Asian", "has_children": false, "want_children": true, "pets": ["Cat"], "zodiac_sign": "Scorpio", "mbti_personality_type": "INTJ", "drinking": "Sometimes", "smoking": "No", "marijuana": "No", "drugs": "No", "exercise": "Active", "partner_preferences": {"minimum_age": 27, "maximum_age": 35, "minimum_height": "5'8\"", "maximum_height": "6'2\"", "has_children": false, "want_children": true, "sexuality": "Straight", "drinking": "Yes", "smoking": "No", "marijuana": "No", "drugs": "No", "exercise": "Active"}, "summary": "Mai Nguyen is a 28-year-old software developer from San Diego, California, currently living in Los Angeles. She studied at the University of California, Berkeley and speaks both English and Vietnamese. Her core values incorporate the importance of family, equality, and creativity. \n\nMai enjoys a diverse array of activities including reading, coding, hiking, and cooking. She is a Buddhist and identifies with a liberal political ideology. Mai seeks a long-term monogamous relationship. She identifies as a straight woman and uses the pronouns she/her/hers. \n\nMai, being of Southeast Asian background, does not have children but does wish to start a family in the future. She has a cat and her zodiac sign is Scorpio. According to the Myers-Briggs Type Indicator (MBTI), she is an INTJ type personality. She enjoys having a drink occasionally but does not smoke or use marijuana or other drugs. Mai remains active through regular exercise.\n\nAs for her preferences in a partner, Mai is interested in straight men between the ages of 27 and 35, with a height between 5'8\" and 6'2\". Her partner should not have children but should want them in the future. He should be comfortable with drinking occasionally but not smoke or use marijuana or other drugs. A commitment to an active lifestyle is also important to Mai.", "user_id": "42baf210-e103-4f8c-86f9-73f49a7d3137"}
{"name": "Elena Ivanova", "age": 35, "height": "5'6\"", "school": "Moscow State University", "job_industry": "Healthcare", "job_title": "Physician", "hometown_location": "Moscow, Russia", "dating_location": "Los Angeles, California", "languages_spoken": ["Russian", "English"], "values": ["Education", "Honesty", "Adventure"], "interests": ["Cooking", "Reading", "Music", "Hiking"], "education_level": "Doctoral", "religious_beliefs": "Agnostic", "politics": "Liberal", "dating_intentions": "Life partner", "relationship_type": "Monogamy", "gender": "Woman", "pronouns": "She/Her/Hers", "sexuality": "Straight", "ethnicity": "White Caucasian", "has_children": false, "want_children": true, "pets": ["Cat"], "zodiac_sign": "Virgo", "mbti_personality_type": "INFJ", "drinking": "Sometimes", "smoking": "No", "marijuana": "No", "drugs": "No", "exercise": "Active", "partner_preferences": {"minimum_age": 33, "maximum_age": 45, "minimum_height": "5'8\"", "maximum_height": "6'3\"", "has_children": false, "want_children": true, "sexuality": "Straight", "drinking": "Yes", "smoking": "No", "marijuana": "No", "drugs": "No", "exercise": "Active"}, "summary": "Elena Ivanova is a 35 year old woman and healthcare professional from Moscow, Russia, currently residing in Los Angeles, California. Professionally, she serves as a Physician and appreciates the virtues of education, honesty, and adventure. Elena holds a doctoral degree and identifies as agnostic and liberal in her religious and political affiliations. She is seeking a life partner and is open to starting a family in the future as she doesn't have any children but desires to have some. Her interests are diverse and include cooking, reading, music, and hiking. A lover of cats, Elena exercises religiously, doesn't smoke, and indulges in drinks occasionally. As a Virgo and an INFJ, Elena is looking for a straight man between the ages of 33-45 who is also active, a non-smoker, open to having children, and shares her love for cats.\n", "user_id": "03527613-fa9e-4b08-b433-5d41e5b15738"}
{"name": "Sophia Sanchez", "age": 28, "height": "5'6\"", "school": "University of California, Los Angeles", "job_industry": "Healthcare", "job_title": "Nurse Practitioner", "hometown_location": "San Gabriel, California", "dating_location": "Los Angeles, California", "languages_spoken": ["English", "Spanish"], "values": ["Family", "Ethics", "Work-life balance"], "interests": ["Hiking", "Photography", "Yoga"], "education_level": "Graduate", "religious_beliefs": "Catholic", "politics": "Moderate", "dating_intentions": "Life partner", "relationship_type": "Monogamy", "gender": "Woman", "pronouns": "She/Her/Hers", "sexuality": "Straight", "ethnicity": "Hispanic/Latino", "has_children": false, "want_children": true, "pets": ["Dog"], "zodiac_sign": "Virgo", "mbti_personality_type": "INFJ", "drinking": "Sometimes", "smoking": "No", "marijuana": "No", "drugs": "No", "exercise": "Active", "partner_preferences": {"minimum_age": 28, "maximum_age": 35, "minimum_height": "5'8\"", "maximum_height": "6'2\"", "has_children": false, "want_children": true, "sexuality": "Straight", "drinking": "Yes", "smoking": "No", "marijuana": "No", "drugs": "No", "exercise": "Active"}, "summary": "Sophia Sanchez is a 28-year-old woman based in Los Angeles, California. She is a Nurse Practitioner in the Healthcare industry and a graduate of the University of California, Los Angeles. Sophia comes from a Hispanic/Latino background, and she speaks both English and Spanish. Her values range from family orientation to maintaining a concentration on work-life balance.\n\nSophia identifies as a straight woman (pronouns are She/Her/Hers), and she's focused on potentially finding a life partner for a monogamous relationship. She doesn't currently have children but is open to having them in the future. She is an active person, often found hiking, doing yoga, or indulging her love of photography.\n\nA Catholic with moderate political beliefs, she's a non-smoking occasional social drinker who doesn't use marijuana or other drugs. Sophia shares her life with her dog, and her ideal partner would share similar habits regarding lifestyle choices and future goals. They would be a heterosexual man aged between 28 and 35, leading an active lifestyle and sharing Sophia's wish for children. He preferably wouldn't already have children, would be a non-smoker, and wouldn't use recreational drugs.", "user_id": "898ba6da-0242-4e03-8466-8e0674fee1c8"}
{"name": "Liang Wu", "age": 28, "height": "5'8\"", "school": "University of Pennsylvania", "job_industry": "Technology", "job_title": "Software Engineer", "hometown_location": "Beijing, China", "dating_location": "Los Angeles, California", "languages_spoken": ["English", "Mandarin"], "values": ["Integrity", "Creativeness", "Hard work"], "interests": ["Coding Hackathons", "Listening to Music", "Painting"], "education_level": "Graduate", "religious_beliefs": "Buddhist", "politics": "Liberal", "dating_intentions": "Long term", "relationship_type": "Monogamy", "gender": "Man", "pronouns": "He/Him/His", "sexuality": "Straight", "ethnicity": "East Asian", "has_children": false, "want_children": true, "pets": ["None"], "zodiac_sign": "Libra", "mbti_personality_type": "INTJ", "drinking": "Sometimes", "smoking": "No", "marijuana": "No", "drugs": "No", "exercise": "Active", "partner_preferences": {"minimum_age": 23, "maximum_age": 30, "minimum_height": "5'1\"", "maximum_height": "5'9\"", "has_children": false, "want_children": true, "sexuality": "Straight", "drinking": "No", "smoking": "No", "marijuana": "No", "drugs": "No", "exercise": "Active"}, "summary": "Liang Wu is a 28-year-old Software Engineer living in Los Angeles, California, originally from Beijing, China, and is fluent in English and Mandarin. He studied at the University of Pennsylvania and is now working in the technology industry. Liang describes himself as a man with a hardworking nature who values integrity and creativeness. In his free time, he enjoys coding hackathons, listening to music, and painting. He is open about his liberal political views and his Buddhist religious beliefs. \n\nDespite being busy, Liang maintains an active lifestyle and occasionally enjoys a drink yet steers clear of smoking or drugs. A straight, Libra, INTJ personality type man, Liang has a preference for monogamous relationships with intentions of finding a long-term partner. He currently has no children but hopes to become a father in the future. His desired partner is a woman aged 23 to 30, who doesn't smoke or drink, leads an active lifestyle, and shares Liang's desire to start a family.", "user_id": "4b397e31-73c1-4256-adf2-c72b8edb302b"}
{"name": "Cecilia Dawson", "age": 29, "height": "5'7\"", "school": "Stanford University", "job_industry": "Technology", "job_title": "Software Engineer", "hometown_location": "Brooklyn, New York", "dating_location": "Los Angeles, California", "languages_spoken": ["English", "Spanish"], "values": ["Honesty", "Loyalty", "Kindness"], "interests": ["Nature", "Photography", "World Travel"], "education_level": "Graduate", "religious_beliefs": "Agnostic", "politics": "Liberal", "dating_intentions": "Long term", "relationship_type": "Monogamy", "gender": "Woman", "pronouns": "She/Her/Hers", "sexuality": "Straight", "ethnicity": "Hispanic/Latino", "has_children": false, "want_children": true, "pets": ["Dog"], "zodiac_sign": "Leo", "mbti_personality_type": "ENFP", "drinking": "Sometimes", "smoking": "No", "marijuana": "No", "drugs": "No", "exercise": "Active", "partner_preferences": {"minimum_age": 28, "maximum_age": 35, "minimum_height": "5'7\"", "maximum_height": "6'4\"", "has_children": false, "want_children": true, "sexuality": "Straight", "drinking": "Yes", "smoking": "No", "marijuana": "No", "drugs": "No", "exercise": "Active"}, "summary": "Cecilia Dawson is a 29-year-old software engineer residing in Los Angeles, California. Originally from Brooklyn, New York, she's a proud graduate of Stanford University. Apart from English, Cecilia speaks fluent Spanish. She is an ENFP personality type, identified in the Myers-Briggs Type Indicator, who highly values honesty, loyalty, and kindness.\n\nIn her leisure time, Cecilia enjoys embracing nature, photography, and travel. She's a dog lover with an ambitious approach towards her career in the technology industry. Cecilia identifies as an agnostic with liberal political views and aims for a long-term, monogamous relationship.\n\nAs a Leo and straight woman, she has no children but intends to in the future. She doesn't smoke or consume any drugs whereas, drinking is occasional. Cecilia leads an active lifestyle and has a preference for a partner who also holds an approach towards health and fitness.\n\nHer ideal partner would be a straight man between 28 and 35 years of age who doesn't have children but wishes to have some in the future. He must share a similar lifestyle specifically with regards to exercising, moderate drinking, and no smoking.", "user_id": "fa40e780-5e95-4b7b-aa82-a16fe1824f0a"}
{"name": "Maxwell Baxter", "age": 30, "height": "5'10\"", "school": "University of California, Los Angeles", "job_industry": "Technology", "job_title": "Software Engineer", "hometown_location": "San Francisco, California", "dating_location": "Los Angeles, California", "languages_spoken": ["English", "Spanish"], "values": ["Honesty", "Kindness", "Patience"], "interests": ["Reading", "Cycling", "Gourmet cooking"], "education_level": "Graduate", "religious_beliefs": "Agnostic", "politics": "Liberal", "dating_intentions": "Long term", "relationship_type": "Monogamy", "gender": "Man", "pronouns": "He/Him/His", "sexuality": "Straight", "ethnicity": "White Caucasian", "has_children": false, "want_children": true, "pets": ["None"], "zodiac_sign": "Cancer", "mbti_personality_type": "INTJ", "drinking": "Sometimes", "smoking": "No", "marijuana": "No", "drugs": "No", "exercise": "Active", "partner_preferences": {"minimum_age": 25, "maximum_age": 35, "minimum_height": "5'0\"", "maximum_height": "6'0\"", "has_children": false, "want_children": true, "sexuality": "Straight", "drinking": "Yes", "smoking": "No", "marijuana": "No", "drugs": "No", "exercise": "Active"}, "summary": "Maxwell Baxter is a 30-year-old man, standing 5'10\" tall. He is educated with a degree from the University of California, Los Angeles and works as a Software Engineer in the technology industry. He hails from San Francisco, California, but nowadays he operates from Los Angeles. He is fluent in English and Spanish. \n\nMaxwell considers honest, kindness, and patience as core values. He spends his free time reading, cycling, and cooking gourmet meals. He is agnostic and leans politically liberal. \n\nMaxwell is in search of a long-term, monogamous relationship. He is straight, uses he/him/his pronouns, and declares as a White Caucasian. He doesn't have any children but is open to having some in the future. He doesn't have any pets currently. \n\nMaxwell is born under Cancer zodiac sign and fits the INTJ personality type. He occasionally drinks but doesn't smoke or do marijuana or other drugs. \n\nMaxwell stays active and prefers a partner who leads a similar lifestyle. He is looking to date women,  between the ages 25 and 35. His prospective partner should ideally not have any children yet but should be comfortable with the idea of having children in the future. He prefers a non-smoker and someone who drinks.", "user_id": "4d77828b-c43f-4a63-9e70-22ffaa8266c1"}
{"name": "Olivia Nichols", "age": 29, "height": "5'6\"", "school": "University of California, Berkeley", "job_industry": "Tech", "job_title": "Software Engineer", "hometown_location": "Portland, Oregon", "dating_location": "Los Angeles, California", "languages_spoken": ["English", "French"], "values": ["Hard work", "Ambition", "Compassion"], "interests": ["Hiking", "Music", "Cooking"], "education_level": "Graduate", "religious_beliefs": "Agnostic", "politics": "Liberal", "dating_intentions": "Long term", "relationship_type": "Monogamy", "gender": "Woman", "pronouns": "She/Her/Hers", "sexuality": "Straight", "ethnicity": "White Caucasian", "has_children": false, "want_children": true, "pets": ["Dog"], "zodiac_sign": "Cancer", "mbti_personality_type": "ENTJ", "drinking": "Sometimes", "smoking": "No", "marijuana": "No", "drugs": "No", "exercise": "Active", "partner_preferences": {"minimum_age": 27, "maximum_age": 35, "minimum_height": "5'7\"", "maximum_height": "6'4\"", "has_children": false, "want_children": true, "sexuality": "Straight", "drinking": "Yes", "smoking": "No", "marijuana": "No", "drugs": "No", "exercise": "Active"}, "summary": "Olivia Nichols is a 29-year-old ambitious, compassionate, and hard-working software engineer based in Los Angeles who originated from Portland, Oregon. She graduated from the University of California, Berkeley. She can converse in English and French and loves hiking, listening to music, and cooking.\n\nOlivia is a straight woman who goes by the pronouns she/her/hers and is comfortable in monogamous relationships. She prefers long-term relationships and plans to have children in the future. Currently, she does not have any kids. She's an animal lover who owns a dog.\n\nPolitically, Olivia leans liberal, is agnostic, and identifies her ethnicity as White Caucasian. Her lifestyle is an active one, with an occasional inclination towards drinking; however, Olivia steers clear from smoking, marijuana, and drugs. Her zodiac sign is Cancer and her MBTI type is ENTJ.\n\nShe likes her potential partner to be a straight man, between 27 to 35 years old, who does not smoke or use marijuana or drugs. The preferred partner should be atleast 5'7\" tall, childless, and also wants children. Expectedly, Olivia wants her partner to lead an active lifestyle and appreciates if he also enjoys occasional drinking.", "user_id": "6bce0e1e-1718-476d-94ce-87801e1614a7"}
{"name": "Oliver Nichols", "age": 31, "height": "5'10\"", "school": "University of Washington", "job_industry": "Tech", "job_title": "Software Developer", "hometown_location": "Seattle, Washington", "dating_location": "Los Angeles, California", "languages_spoken": ["English", "Spanish"], "values": ["Honesty", "Charity", "Humor"], "interests": ["Hiking", "Cooking", "Programming"], "education_level": "Graduate", "religious_beliefs": "Agnostic", "politics": "Liberal", "dating_intentions": "Long term", "relationship_type": "Monogamy", "gender": "Man", "pronouns": "He/Him/His", "sexuality": "Straight", "ethnicity": "White Caucasian", "has_children": false, "want_children": true, "pets": ["Dog"], "zodiac_sign": "Leo", "mbti_personality_type": "INTJ", "drinking": "Sometimes", "smoking": "No", "marijuana": "No", "drugs": "No", "exercise": "Active", "partner_preferences": {"minimum_age": 25, "maximum_age": 35, "minimum_height": "5'0\"", "maximum_height": "6'0\"", "has_children": false, "want_children": true, "sexuality": "Straight", "drinking": "Yes", "smoking": "No", "marijuana": "No", "drugs": "No", "exercise": "Sometimes"}, "summary": "Oliver Nichols is a 31-year-old straight male based in Los Angeles, California. He originates from Seattle, Washington, and completed graduate studies at the University of Washington. In his career, Oliver is employed as a software developer in the tech industry, showing his intellectual capabilities. He speaks both English and Spanish, and his personal values are honesty, charity, and humor. He loves hiking, cooking, and programming and holds liberal political views. Religious belief-wise, he identifies as an agnostic. Regarding relationships, Oliver intends to enter a long-term monogamous relationship. His dating intentions appear to include plans for future parenthood as he does not currently have children but is open to having them. Oliver is a pet owner, specifically to a dog, and his fitness is well looked after as he someone who exercises regularly. The preferences for his partner include an age range of 25-35 years, non-smoker and is open to occasional drinking.\n", "user_id": "74b5edd5-971f-4d06-8cb1-9156823a0610"}
{"name": "Emily Vaughn", "age": 29, "height": "5'6\"", "school": "University of California, Los Angeles", "job_industry": "Technology", "job_title": "Software Engineer", "hometown_location": "Seattle, Washington", "dating_location": "Los Angeles, California", "languages_spoken": ["English", "Spanish"], "values": ["Honesty", "Kindness", "Creativity"], "interests": ["Writing", "Coding", "Long drives"], "education_level": "Graduate", "religious_beliefs": "Agnostic", "politics": "Liberal", "dating_intentions": "Long term", "relationship_type": "Monogamy", "gender": "Woman", "pronouns": "She/Her/Hers", "sexuality": "Straight", "ethnicity": "White Caucasian", "has_children": false, "want_children": true, "pets": ["Cat"], "zodiac_sign": "Pisces", "mbti_personality_type": "INFJ", "drinking": "Sometimes", "smoking": "No", "marijuana": "No", "drugs": "No", "exercise": "Active", "partner_preferences": {"minimum_age": 29, "maximum_age": 35, "minimum_height": "5'6\"", "maximum_height": "6'2\"", "has_children": false, "want_children": true, "sexuality": "Straight", "drinking": "Sometimes", "smoking": "No", "marijuana": "No", "drugs": "No", "exercise": "Active"}, "summary": "Emily Vaughn is a 29-year-old software engineer based in Los Angeles, California, originally from Seattle, Washington. She attained her graduate education from the University of California, Los Angeles. Fluent in both English and Spanish, she values honesty, kindness, and creativity. Outside of work, her interests include writing and long drives.\n\nEmily identifies as a straight woman; she uses she/her pronouns and is looking for a monogamous long-term relationship. Though she doesn't have children, she wants to have them in the future. Her only pet is a cat. Pisces by zodiac and INFJ by Myers-Briggs, she is a sober, active woman who occasionally enjoys a drink. \n\nAs for partner preferences, Emily prefers straight men between the ages of 29 and 35 who are at least 5'6\". Ideally, her partner does not have children but is open to having them in the future, lives an active lifestyle, and drinks occasionally while avoiding smoking and drugs.", "user_id": "8657bdf1-8ade-42f6-8d8f-b08032cc1a38"}
{"name": "Carter Montgomery", "age": 27, "height": "5'10\"", "school": "University of California", "job_industry": "IT", "job_title": "Software Developer", "hometown_location": "San Francisco, California", "dating_location": "Los Angeles, California", "languages_spoken": ["English", "Spanish"], "values": ["Honesty", "Hard Work", "Kindness"], "interests": ["Tech gadgets", "Photography", "Outdoor activities"], "education_level": "Graduate", "religious_beliefs": "Agnostic", "politics": "Moderate", "dating_intentions": "Long term", "relationship_type": "Monogamy", "gender": "Man", "pronouns": "He/Him/His", "sexuality": "Straight", "ethnicity": "White Caucasian", "has_children": false, "want_children": true, "pets": ["Dog"], "zodiac_sign": "Aries", "mbti_personality_type": "ENFJ", "drinking": "Yes", "smoking": "No", "marijuana": "No", "drugs": "No", "exercise": "Active", "partner_preferences": {"minimum_age": 25, "maximum_age": 31, "minimum_height": "5'0\"", "maximum_height": "6'3\"", "has_children": false, "want_children": true, "sexuality": "Straight", "drinking": "No", "smoking": "No", "marijuana": "No", "drugs": "No", "exercise": "Active"}, "summary": "Carter Montgomery is a 27-year-old straight man who identifies with he/him/his pronouns. He's 5'10\" tall, is a software developer in the IT industry, and has a graduate degree from the University of California. Carter is originally from San Francisco, California, but is currently based in Los Angeles. \n\nHe speaks both English and Spanish and embraces values such as honesty, hard work, and kindness. An active outdoorsy type, Carter enjoys technology, photography, and outdoor activities. He is also a proud dog owner. \n\nCarter is an agnostic Aries and an ENFJ personality type. Politically, he leans moderate. He's seeking a monogamous, long-term relationship and he wants to have children in the future. A smoker and drug user he's not, but he does drink alcohol.\n\nIn his search for a partner, he prefers an active woman aged between 25 to 31, who doesn't currently have children but wants them in the future, doesn't smoke, use marijuana or other drugs, and doesn't drink alcohol. She should be between the heights of 5'0\" and 6'3\".", "user_id": "419691e4-2b0f-4469-bad4-2321e51dd65f"}
{"name": "Oliver Barrett", "age": 32, "height": "5'11\"", "school": "MIT", "job_industry": "Technology", "job_title": "Software Engineer", "hometown_location": "Chicago, Illinois", "dating_location": "Los Angeles, California", "languages_spoken": ["English", "Spanish"], "values": ["Honesty", "Creativity", "Learning"], "interests": ["Coding", "Visual Arts", "Hiking"], "education_level": "Graduate", "religious_beliefs": "Agnostic", "politics": "Moderate", "dating_intentions": "Long term", "relationship_type": "Monogamy", "gender": "Man", "pronouns": "He/Him/His", "sexuality": "Straight", "ethnicity": "White Caucasian", "has_children": false, "want_children": true, "pets": ["Dog"], "zodiac_sign": "Libra", "mbti_personality_type": "ENTP", "drinking": "Sometimes", "smoking": "No", "marijuana": "No", "drugs": "No", "exercise": "Active", "partner_preferences": {"minimum_age": 27, "maximum_age": 36, "minimum_height": "5'0\"", "maximum_height": "6'0\"", "has_children": false, "want_children": true, "sexuality": "Straight", "drinking": "Not bothered", "smoking": "No", "marijuana": "No", "drugs": "No", "exercise": "Active"}, "summary": "Oliver Barrett, a 32-year-old straight man located in Los Angeles, California, is looking for a long-term, monogamous relationship. He is a software engineer who values honesty, creativity, and continual learning. Apart from coding, his interests include visual arts and hiking. He identifies as a white Caucasian with agnostic beliefs and moderate political views. Oliver speaks both English and Spanish, does not have any children but aims for some in the future. His serious approach towards health is apparent from his active lifestyle, occasional drinking habits, and a no to smoking as well as any kind of drug use. ILegal or otherwise. His ideal match is a straight woman aged between 27 and 36, who preferably does not have any kids at present but desires to have them, doesn't smoke and also maintains an active lifestyle. As for the drinking habits and choosing to use marijuana or not, Oliiver seems pretty open-minded.\n", "user_id": "65f21c83-92b6-4fd3-8d71-7484e4b6ae61"}
{"name": "Olivia Cedarfield", "age": 28, "height": "5'7\"", "school": "University of California, Los Angeles", "job_industry": "Technology", "job_title": "Software Engineer", "hometown_location": "Seattle, Washington", "dating_location": "Los Angeles, California", "languages_spoken": ["English", "Spanish"], "values": ["Creativity", "Career Progress", "Travel/exploration"], "interests": ["Yoga", "Cooking", "Programming"], "education_level": "Graduate", "religious_beliefs": "Atheist", "politics": "Liberal", "dating_intentions": "Long term", "relationship_type": "Monogamy", "gender": "Woman", "pronouns": "She/Her/Hers", "sexuality": "Straight", "ethnicity": "White Caucasian", "has_children": false, "want_children": true, "pets": ["Cat"], "zodiac_sign": "Gemini", "mbti_personality_type": "INTJ", "drinking": "Sometimes", "smoking": "No", "marijuana": "No", "drugs": "No", "exercise": "Active", "partner_preferences": {"minimum_age": 28, "maximum_age": 35, "minimum_height": "5'10\"", "maximum_height": "6'4\"", "has_children": false, "want_children": true, "sexuality": "Straight", "drinking": "No", "smoking": "No", "marijuana": "No", "drugs": "No", "exercise": "Active"}, "summary": "Olivia Cedarfield is a 28-year-old Software Engineer hailing from Seattle, Washington, but is currently residing in Los Angeles, California. An alumnus of the University of California, this creative woman is fluent in the languages of English and Spanish. Olivia enjoys activities like yoga, cooking, and programming and highly values creativity, career progression, and travel.\n\nComing off as an atheist, Olivia boats liberal political views. While she is straight, Olivia's dating interests lie in men between ages 28 to 35 and preferably the height between 5'10\" and 6'4\". Currently single with no kids, she is looking forward to monogamous, long-term relationships, and open to having kids in the future. Olivia adores her cat and desires a partner who respects her pet love.\n\nA pitch-perfect Gemini, Olivia identifies herself as an INTJ on Myers-Briggs Type Indicator. Talking about lifestyle habits, Olivia feasts healthy, occasionally drinks, and refrains from smoking or using drugs. Converting her passion for yoga into a healthy lifestyle, Olivia is a fitness enthusiast. Equally she prefers her partner to keep a fit lifestyle, and resonate with her views against smoking, drinking, marijuana, and drugs.", "user_id": "7b74c474-fdf9-42ce-aabc-8bd54d1d71d0"}
{"name": "Penelope Brooks", "age": 34, "height": "5'6\"", "school": "University of California, Berkeley", "job_industry": "Tech", "job_title": "Software Engineer", "hometown_location": "San Francisco, California", "dating_location": "Los Angeles, California", "languages_spoken": ["English", "Spanish"], "values": ["Integrity", "Hard Work", "Compassion"], "interests": ["Data Science", "Yoga", "Traveling"], "education_level": "Graduate", "religious_beliefs": "Atheist", "politics": "Liberal", "dating_intentions": "Long term", "relationship_type": "Monogamy", "gender": "Woman", "pronouns": "She/Her/Hers", "sexuality": "Straight", "ethnicity": "Hispanic/Latino", "has_children": false, "want_children": true, "pets": ["Dog"], "zodiac_sign": "Gemini", "mbti_personality_type": "ENFP", "drinking": "Sometimes", "smoking": "No", "marijuana": "No", "drugs": "No", "exercise": "Active", "partner_preferences": {"minimum_age": 30, "maximum_age": 40, "minimum_height": "5'9\"", "maximum_height": "6'2\"", "has_children": false, "want_children": true, "sexuality": "Straight", "drinking": "Sometimes", "smoking": "No", "marijuana": "No", "drugs": "No", "exercise": "Active"}, "summary": "Penelope Brooks is a 34-year-old woman who identifies as straight. Standing at 5'6\", she is a software engineer in the tech industry. She currently lives in Los Angeles but grew up in San Francisco, California. She obtained her graduate degree from the University of California, Berkeley. She firmly believes in the values of integrity, hard work, and compassion. Her interests include data science, yoga, and travel. Although an atheist and liberal at heart, she tends to openly show respect for others' belief systems. \n\nShe has no children but hopes to start a family one day. She owns a dog and exercises regularly to keep active. She doesn't smoke, doesn't use marijuana, or any other drugs but does consume alcohol occasionally. Being a keen follower of astrology, she belongs to the Gemini zodiac sign. Her Myers-Briggs personality type is ENFP which assigns her as an extroverted, intuitive, feeling, and perceiving individual. \n\nWhen it comes to her ideal partner, Penelope seeks a straight man who is between the ages of 30 and 40. A height between 5'9\" and 6'2, a non-smoker, and someone leading an active lifestyle appeals to her. She is also interested in someone who is willing to have children someday but does not have any at present. Being a moderate drinker himself is acceptable but she draws the line at use of marijuana or other drugs. She envisions a monogamous, long-term relationship with her partner.", "user_id": "bcd550a3-f4d7-4e1c-b9dd-e9f017feb450"}
{"name": "Isabella Dawson", "age": 30, "height": "5'7\"", "school": "Harvard University", "job_industry": "Science", "job_title": "Research Scientist", "hometown_location": "Boston, Massachusetts", "dating_location": "Los Angeles, California", "languages_spoken": ["English", "Spanish"], "values": ["Honesty", "Loyalty", "Creativity"], "interests": ["Hiking", "Reading", "Art"], "education_level": "Graduate", "religious_beliefs": "Atheist", "politics": "Liberal", "dating_intentions": "Long term", "relationship_type": "Monogamy", "gender": "Woman", "pronouns": "She/Her/Hers", "sexuality": "Straight", "ethnicity": "White Caucasian", "has_children": false, "want_children": true, "pets": ["Cat"], "zodiac_sign": "Aquarius", "mbti_personality_type": "INFJ", "drinking": "Yes", "smoking": "No", "marijuana": "No", "drugs": "No", "exercise": "Active", "partner_preferences": {"minimum_age": 28, "maximum_age": 35, "minimum_height": "5'8\"", "maximum_height": "6'2\"", "has_children": false, "want_children": true, "sexuality": "Straight", "drinking": "Sometimes", "smoking": "No", "marijuana": "No", "drugs": "No", "exercise": "Active"}, "summary": "Isabella Dawson, a 30-year-old research scientist based in Los Angeles, stands 5'7\" tall and holds a graduate degree from Harvard University. Originally from Boston, she identifies as a straight woman using she/her pronouns. She has an active lifestyle and enjoys activities such as hiking and reading. She also is a fan of art.\n\nIsabella highly values honesty, loyalty, and creativity. She identifies her political standing as liberal and religious belief as atheist. Bearing Aquarius star sign, she is categorized as an INFJ in the Myers-Briggs Type Indicator.\n\nCurrently, she doesn't have children but wishes to in the future. As for pets, she shares her home with a cat. In terms of substance use, Isabella drinks regularly, but refrains from smoking and other drug use.\n\nOn the dating front, Isabella seeks a long-term, monogamous relationship. She prefers to date men aged between 28 and 35 who are at least 5'8\", leading an active lifestyle, and do not have children from previous relationships. They also hold an interest in having children in the future. Restrictive practices regarding smoking, marijuana and drug use are vital aspects she looks for in her potential match while occasional drinking is permissible.", "user_id": "575b6df4-8485-401d-abdb-ffc649c231fd"}
{"name": "Adrian Howard", "age": 35, "height": "6'1\"", "school": "University of Southern California", "job_industry": "Technology", "job_title": "Software Engineer", "hometown_location": "Austin, Texas", "dating_location": "Los Angeles, California", "languages_spoken": ["English", "Spanish"], "values": ["Hard work", "Family", "Fitness"], "interests": ["Running", "Reading", "Coding"], "education_level": "Graduate", "religious_beliefs": "Agnostic", "politics": "Liberal", "dating_intentions": "Long term", "relationship_type": "Monogamy", "gender": "Man", "pronouns": "He/Him/His", "sexuality": "Straight", "ethnicity": "Black African Descent", "has_children": true, "want_children": true, "pets": ["Dog"], "zodiac_sign": "Gemini", "mbti_personality_type": "INTJ", "drinking": "Yes", "smoking": "No", "marijuana": "No", "drugs": "No", "exercise": "Active", "partner_preferences": {"minimum_age": 28, "maximum_age": 40, "minimum_height": "5'4\"", "maximum_height": "6'0\"", "has_children": true, "want_children": true, "sexuality": "Straight", "drinking": "Yes", "smoking": "No", "marijuana": "No", "drugs": "No", "exercise": "Active"}, "summary": "Adrian Howard is a 35-year-old software engineer residing in Los Angeles, California. He graduated from the University of Southern California and originally hails from Austin, Texas. Adrian speaks both English and Spanish. As someone who values hard work, family, and fitness, he has a keen interest in running, reading, and coding. Although he identifies as an agnostic and leans towards liberal politics, Adrian is serious about finding a long-term relationship and is a staunch believer in monogamy. As a straight man of Black African descent, he is a proud father who also desires more children in the future. He's a dog owner and a Gemini who identifies as an INTJ personality type. Adrian is a drinker but doesn't partake in smoking or usage of marijuana or other drugs. He is active and exercises regularly. Adrian prefers a straight woman who is between 28-40 years old, stands 5'4\" to 6'0\" in height, shares his enthusiasm for parenthood, drinks socially but refrains from smoking or drug use, and maintains an active lifestyle.", "user_id": "afc5c205-c898-4216-8be0-d14a2e0f4ed4"}
{"name": "Amelia Larson", "age": 30, "height": "5'6\"", "school": "University of Southern California", "job_industry": "Healthcare", "job_title": "Nurse Practitioner", "hometown_location": "Sacramento, California", "dating_location": "Los Angeles, California", "languages_spoken": ["English", "Spanish"], "values": ["Honesty", "Hard work", "Family"], "interests": ["Hiking", "Photography", "Traveling"], "education_level": "Graduate", "religious_beliefs": "Catholic", "politics": "Moderate", "dating_intentions": "Long term", "relationship_type": "Monogamy", "gender": "Woman", "pronouns": "She/Her/Hers", "sexuality": "Straight", "ethnicity": "White Caucasian", "has_children": false, "want_children": true, "pets": ["Dog"], "zodiac_sign": "Gemini", "mbti_personality_type": "ENFJ", "drinking": "Sometimes", "smoking": "No", "marijuana": "No", "drugs": "No", "exercise": "Active", "partner_preferences": {"minimum_age": 28, "maximum_age": 38, "minimum_height": "5'8\"", "maximum_height": "6'3\"", "has_children": false, "want_children": true, "sexuality": "Straight", "drinking": "Yes", "smoking": "No", "marijuana": "No", "drugs": "No", "exercise": "Active"}, "summary": "Amelia Larson is a 30-year-old woman based in Los Angeles, California. She's a graduate from the University of Southern California and currently works in the Healthcare industry as a Nurse Practitioner. She maintains an active lifestyle and enjoys interests such as hiking, photography, and traveling. She places great importance on honesty, hard work, and family, while identifying as a moderate Catholic. Amelia is a straight, English and Spanish speaking white Caucasian woman who uses \"she/her/hers\" pronouns. She doesn't have children but desires to have them in the future. A dog lover, she occasionally drinks, doesn't smoke, and abstains from marijuana and other drugs. A Gemini and an ENFJ personality type, she seeks a monogamous, long-term relationship with a man aged between 28 and 38, who doesn't have children but wants them, is active, and doesn't indulge in smoking, drugs, or marijuana, but is okay with drinking.", "user_id": "f61b053c-621b-47fa-ad44-8866e1074ffe"}
{"name": "Isabella Greenwood", "age": 28, "height": "5'4\"", "school": "Stanford University", "job_industry": "Healthcare", "job_title": "Physician Assistant", "hometown_location": "Austin, Texas", "dating_location": "Los Angeles, California", "languages_spoken": ["English", "Spanish"], "values": ["Hard work", "Family", "Honesty"], "interests": ["Cooking", "Traveling", "Hiking"], "education_level": "Graduate", "religious_beliefs": "Spiritual", "politics": "Liberal", "dating_intentions": "Long term", "relationship_type": "Monogamy", "gender": "Woman", "pronouns": "She/Her/Hers", "sexuality": "Straight", "ethnicity": "Hispanic/Latino", "has_children": false, "want_children": true, "pets": ["Cat"], "zodiac_sign": "Virgo", "mbti_personality_type": "ENFJ", "drinking": "Sometimes", "smoking": "No", "marijuana": "No", "drugs": "No", "exercise": "Active", "partner_preferences": {"minimum_age": 28, "maximum_age": 35, "minimum_height": "5'7\"", "maximum_height": "6'2\"", "has_children": false, "want_children": true, "sexuality": "Straight", "drinking": "Sometimes", "smoking": "No", "marijuana": "No", "drugs": "No", "exercise": "Active"}, "summary": "Isabella Greenwood is a hardworking and honest 28-year-old woman from Austin, Texas, who currently resides in Los Angeles, California. Standing at 5'4'', she is a Physician Assistant in the healthcare industry. Bilingual in English and Spanish, she values family and holds honesty in high regard. Isabella enjoys cooking, traveling, and hiking in her free time. She is spiritually inclined, with a liberal political ideology, and is looking for a long-term, monogamous relationship. Isabella identifies as straight. She is of Hispanic/Latino ethnicity and has no children yet, but would want some in the future. Isabella is a proud cat owner, a Virgo, and her MBTI personality type is ENFJ. She occasionally drinks but refrains from smoking, marijuana, and other drugs. Isabella maintains an active lifestyle. For her partner, she is looking for a straight man aged between 28 and 35 years who shares similar lifestyle habits. The man should preferably not have children, but, like Isabella, he should want them in the future. A non-smoker who's occasionally up for a drink would be perfect for her. Isabella's ideal partner leads an active lifestyle as well.", "user_id": "2cb3f9a4-59e1-4b8e-bc08-0bd6c3ebeee2"}
{"name": "Amelia Turner", "age": 30, "height": "5'6\"", "school": "University of California, Berkeley", "job_industry": "Biotechnology", "job_title": "Biochemical Engineer", "hometown_location": "Seattle, Washington", "dating_location": "Los Angeles, California", "languages_spoken": ["English", "Spanish"], "values": ["Intellectual curiosity", "Compassion", "Fitness"], "interests": ["Hiking", "Reading", "Cooking"], "education_level": "Graduate", "religious_beliefs": "Agnostic", "politics": "Liberal", "dating_intentions": "Long term", "relationship_type": "Monogamy", "gender": "Woman", "pronouns": "She/Her/Hers", "sexuality": "Straight", "ethnicity": "White Caucasian", "has_children": false, "want_children": true, "pets": ["Cat"], "zodiac_sign": "Virgo", "mbti_personality_type": "INFJ", "drinking": "Sometimes", "smoking": "No", "marijuana": "No", "drugs": "No", "exercise": "Active", "partner_preferences": {"minimum_age": 28, "maximum_age": 35, "minimum_height": "5'8\"", "maximum_height": "6'2\"", "has_children": false, "want_children": true, "sexuality": "Straight", "drinking": "Yes", "smoking": "No", "marijuana": "No", "drugs": "No", "exercise": "Sometimes"}, "summary": "Amelia Turner is a 30-year-old — a health-conscious, compassionate, and intellectually curious Biochemical Engineer, currently residing in Los Angeles, California, originally from Seattle, Washington. She graduated from the University of California, Berkeley, and works in the Biotechnology industry. Amelia speaks English and Spanish and leads an active lifestyle, enjoying hobbies like hiking, reading, and cooking.\n\nIdentifying as a straight white Caucasian woman, she uses she/her/hers pronouns. She holds liberal political views and categorizes herself as agnostic. She's a Virgo and an INFJ personality type who occasionally indulges in a drink but doesn't smoke or use recreational drugs. Amelia loves cats and currently doesn't have children but is open to the possibility in the future.\n\nShe’s seeking a long-term, monogamous relationship with a man aged 28-35 who values health and fits her partner preferences. Similar to her, her ideal partner would want to have children in the future. Enjoying a drink is acceptable for her potential partner, but smoking and drug usage are not.", "user_id": "9e6f094d-aa48-4f3a-8a6d-4db1b22a378e"}
{"name": "Amelia Griffiths", "age": 27, "height": "5'6\"", "school": "University of Pennsylvania", "job_industry": "Engineering", "job_title": "Software Engineer", "hometown_location": "Seattle, Washington", "dating_location": "Los Angeles, California", "languages_spoken": ["English", "Spanish", "Italian"], "values": ["Honesty", "Hard Work", "Family"], "interests": ["Reading", "Yoga", "Cooking", "Coding"], "education_level": "Graduate", "religious_beliefs": "Spiritual", "politics": "Moderate", "dating_intentions": "Long term", "relationship_type": "Monogamy", "gender": "Woman", "pronouns": "She/Her/Hers", "sexuality": "Straight", "ethnicity": "White Caucasian", "has_children": false, "want_children": true, "pets": ["None"], "zodiac_sign": "Gemini", "mbti_personality_type": "INFJ", "drinking": "Sometimes", "smoking": "No", "marijuana": "No", "drugs": "No", "exercise": "Active", "partner_preferences": {"minimum_age": 25, "maximum_age": 35, "minimum_height": "5'8\"", "maximum_height": "6'2\"", "has_children": false, "want_children": true, "sexuality": "Straight", "drinking": "Yes", "smoking": "No", "marijuana": "No", "drugs": "No", "exercise": "Sometimes"}, "summary": "Amelia Griffiths is a 27-year-old straight woman with the pronouns she/her/hers. She hails from Seattle, Washington but currently resides in Los Angeles, California. Amelia is a Software Engineer in the field of Engineering and has a graduate degree from the University of Pennsylvania. Bilingual, she can communicate in English, Spanish, and can speak a bit of Italian too. Amelia identifies herself as spiritually inclined and politically moderate.\n\nShe places a great deal of value on honesty, hard work, and family. She enjoys reading, yoga, cooking, and coding in her free time. Amelia is a Gemini as per astrology and is an INFJ personality type according to Myers-Briggs Type Indicator. She does not have children yet but is open to having them in the future. She doesn't own any pets yet.\n\nAmelia enjoys occasional drinking, but she doesn't smoke or use marijuana or other drugs. Keeping herself physically active is also a part of her routine. \n\nAs for her partner, Amelia prefers a man between the ages of 25 and 35, with a height ranging from 5'8\" to 6'2\". She hopes to find someone who doesn't have children of their own but would be open to having kids in the future. Similarly to her, Amelia would prefer her partner to be a non-smoker, not use marijuana or other drugs, also be physically active, and enjoy an occasional drink as she does.", "user_id": "3f7556d8-c770-440a-9c06-be2316d5f072"}
{"name": "Lincoln Hayes", "age": 29, "height": "6'1\"", "school": "Cornell University", "job_industry": "Technology", "job_title": "Software Engineer", "hometown_location": "Chicago, Illinois", "dating_location": "Los Angeles, California", "languages_spoken": ["English", "Spanish"], "values": ["Equality", "Sustainability"], "interests": ["Hiking", "Coding", "Photography"], "education_level": "Graduate", "religious_beliefs": "Agnostic", "politics": "Liberal", "dating_intentions": "Life partner", "relationship_type": "Monogamy", "gender": "Man", "pronouns": "He/Him/His", "sexuality": "Straight", "ethnicity": "White Caucasian", "has_children": false, "want_children": true, "pets": ["Dog"], "zodiac_sign": "Virgo", "mbti_personality_type": "INTP", "drinking": "Sometimes", "smoking": "No", "marijuana": "No", "drugs": "No", "exercise": "Active", "partner_preferences": {"minimum_age": 24, "maximum_age": 33, "minimum_height": "5'4\"", "maximum_height": "6'2\"", "has_children": false, "want_children": true, "sexuality": "Straight", "drinking": "Sometimes", "smoking": "No", "marijuana": "No", "drugs": "No", "exercise": "Active"}, "summary": "Lincoln Hayes is a 29-year-old software engineer based in Los Angeles, originally from Chicago. He completed his graduate studies at Cornell University and works in the technology industry. Lincoln speaks English and Spanish, values equality and sustainability, and enjoys hiking, coding, and photography. He identifies as a straight man using the pronouns he/him/his. His religious belief is agnostic and he has liberal political views. \n\nAlthough currently without children, Lincoln is eager to have them in the future. As a dog owner, he is also likely a pet lover. He exercises regularly and sometimes drinks but does not smoke or use drugs. His MBTI personality type is INTP, he's a Virgo, and he's seeking a life partner in monogamy. \n\nAs for his potential partner, Lincoln is interested in a straight woman who is between 24 and 33 years old, ranges in height from 5'4\" to 6'2\", is active, sometimes drinks, does not smoke or use drugs, and also wants to have children in the future.", "user_id": "142fe878-ec71-4e75-96a0-c57986a5ddeb"}
{"name": "Emily Underwood", "age": 30, "height": "5'8\"", "school": "Harvard University", "job_industry": "Tech", "job_title": "Software engineer", "hometown_location": "Seattle, Washington", "dating_location": "Los Angeles, California", "languages_spoken": ["English", "Spanish"], "values": ["Hardwork", "Honesty", "Kindness"], "interests": ["Hiking", "Reading", "Traveling"], "education_level": "Graduate", "religious_beliefs": "Agnostic", "politics": "Liberal", "dating_intentions": "Life partner", "relationship_type": "Monogamy", "gender": "Woman", "pronouns": "She/Her/Hers", "sexuality": "Straight", "ethnicity": "White Caucasian", "has_children": false, "want_children": true, "pets": ["Dog"], "zodiac_sign": "Taurus", "mbti_personality_type": "INTJ", "drinking": "Sometimes", "smoking": "No", "marijuana": "No", "drugs": "No", "exercise": "Active", "partner_preferences": {"minimum_age": 28, "maximum_age": 35, "minimum_height": "5'8\"", "maximum_height": "6'3\"", "has_children": false, "want_children": true, "sexuality": "Straight", "drinking": "Sometimes", "smoking": "No", "marijuana": "No", "drugs": "No", "exercise": "Active"}, "summary": "Emily Underwood is a 30-year-old woman from Seattle, now living in Los Angeles. She is a software engineer in the tech industry and a graduate from Harvard University. Emily speaks English and Spanish fluently, stands tall at 5'8\", and identifies herself as straight and white Caucasian. She values hard work, honesty, and kindness. Emily loves to spend her free time hiking, reading, and traveling. \n\nShe is an agnostic and leans liberal politically. Her relationship intentions are to find a life partner for a monogamous relationship. She doesn't have children yet but plans to in the future. Emily is a proud dog owner and her zodiac sign is Taurus. \n\nShe maintains an active lifestyle, drinks sometimes, but is a non-smoker and doesn't use marijuana or drugs at all. Emily is an INTJ according to the MBTI personality type.\n\nIn terms of a partner, Emily is looking for a straight man between the ages of 28-35, who is at least 5'8\" tall. Her ideal partner does not have children but wants them in the future. They share her active lifestyle, occasionally drink but don't smoke or use marijuana or other drugs.", "user_id": "0585c124-352b-48ba-973a-ae6389906367"}
{"name": "Alexander Patel", "age": 32, "height": "6'1\"", "school": "Stanford University", "job_industry": "Technology", "job_title": "Software Engineer", "hometown_location": "Austin, Texas", "dating_location": "Los Angeles, California", "languages_spoken": ["English", "Hindi"], "values": ["Integrity", "Empathy", "Passion"], "interests": ["Traveling", "Reading", "Cycling"], "education_level": "Graduate", "religious_beliefs": "Hindu", "politics": "Liberal", "dating_intentions": "Life partner", "relationship_type": "Monogamy", "gender": "Man", "pronouns": "He/Him/His", "sexuality": "Straight", "ethnicity": "South Asian", "has_children": false, "want_children": true, "pets": ["Dog"], "zodiac_sign": "Gemini", "mbti_personality_type": "INTJ", "drinking": "Sometimes", "smoking": "No", "marijuana": "No", "drugs": "No", "exercise": "Active", "partner_preferences": {"minimum_age": 26, "maximum_age": 35, "minimum_height": "5'4\"", "maximum_height": "6'0\"", "has_children": false, "want_children": true, "sexuality": "Straight", "drinking": "Sometimes", "smoking": "No", "marijuana": "No", "drugs": "No", "exercise": "Active"}, "summary": "Alexander Patel is a 32-year-old man, standing 6'1\" tall, and a straight South Asian individual who prefers the pronouns He/Him/His. He is a software engineer in the technology industry, and a graduate of Stanford University. Originally from Austin, Texas, he currently lives in Los Angeles, California. \n\nAlexander speaks both English and Hindi, identifies as a Hindu, and leans liberal in his political views. He embodies values such as integrity, empathy, and passion. In his spare time, he enjoys traveling, reading, and cycling. His Zodiac sign is Gemini and he boasts an INTJ personality type. \n\nAlexander does not currently have any children but hopes to in the future. He owns a dog and lives an active lifestyle, drinking only sometimes and abstaining from smoking and drugs. \n\nHe is seeking a straight woman between the ages of 26 and 35, who leads an active lifestyle, doesn't smoke, and drinks sometimes. His ideal partner should not have children but should be open to having them in the future.\n", "user_id": "0a939378-1d49-413d-974d-7cd239d5421d"}
{"name": "Devin Sanford", "age": 32, "height": "6'0\"", "school": "New York University", "job_industry": "Technology", "job_title": "Software Developer", "hometown_location": "Chicago, Illinois", "dating_location": "Los Angeles, California", "languages_spoken": ["English", "Spanish"], "values": ["Kindness", "Academic Knowledge"], "interests": ["Cycling", "Cooking", "Reading", "Coding"], "education_level": "Graduate", "religious_beliefs": "Atheist", "politics": "Liberal", "dating_intentions": "Long term", "relationship_type": "Monogamy", "gender": "Man", "pronouns": "He/Him/His", "sexuality": "Straight", "ethnicity": "Black African Descent", "has_children": false, "want_children": true, "pets": ["Dog"], "zodiac_sign": "Aries", "mbti_personality_type": "INTJ", "drinking": "Sometimes", "smoking": "No", "marijuana": "No", "drugs": "No", "exercise": "Active", "partner_preferences": {"minimum_age": 26, "maximum_age": 34, "minimum_height": "5'4\"", "maximum_height": "6'0\"", "has_children": false, "want_children": true, "sexuality": "Straight", "drinking": "Yes", "smoking": "No", "marijuana": "No", "drugs": "No", "exercise": "Active"}, "summary": "Devin Sanford is a 32-year-old man who stands at 6'0\". He identifies as straight and goes by the pronouns He/Him/His. Currently residing in Los Angeles, California, Devin hails from Chicago, Illinois. He works as a Software Developer in the technology industry and has a graduate degree from New York University. \n\nDevin values kindness and academic knowledge. In his free time, he enjoys cycling, cooking, reading, and coding. Fluent in English and Spanish, he is of Black African descent and is an atheist with liberal political views.\n\nHe has categorically expressed his intention towards long-term dating and prefers monogamous relationships. Although he currently doesn't have any children, he would like to in the future. A dog owner, he isactive physically, is an occasional drinker, and does not smoke or use marijuana or other drugs.\n\nDevin is open to connecting with a straight woman who ranges in age from 26 to 34 and stands anywhere between 5'4\" to 6'0\". His potential match should have no children but be open to having some in the future. In terms of lifestyle, he desires a non-smoking, active woman who enjoys an occasional drink but abstains from marijuana and drugs.", "user_id": "fd20ee95-c72a-4bfa-b627-3faced85ecb5"}
{"name": "Oliver Kemp", "age": 33, "height": "6'1\"", "school": "New York University", "job_industry": "Technology", "job_title": "Software Engineer", "hometown_location": "Rochester, New York", "dating_location": "Los Angeles, California", "languages_spoken": ["English", "Spanish"], "values": ["Intellectuality", "Compassion", "Honesty"], "interests": ["Hiking", "Coding", "Photography"], "education_level": "Graduate", "religious_beliefs": "Agnostic", "politics": "Liberal", "dating_intentions": "Long term", "relationship_type": "Monogamy", "gender": "Man", "pronouns": "He/Him/His", "sexuality": "Straight", "ethnicity": "White Caucasian", "has_children": false, "want_children": true, "pets": ["Dog", "None"], "zodiac_sign": "Gemini", "mbti_personality_type": "ENTJ", "drinking": "Sometimes", "smoking": "No", "marijuana": "No", "drugs": "No", "exercise": "Active", "partner_preferences": {"minimum_age": 27, "maximum_age": 35, "minimum_height": "5'4\"", "maximum_height": "5'9\"", "has_children": false, "want_children": true, "sexuality": "Straight", "drinking": "Sometimes", "smoking": "No", "marijuana": "No", "drugs": "No", "exercise": "Active"}, "summary": "Oliver Kemp is a 33-year-old Straight Man who works as a Software Engineer in the Technology Industry. He is a graduate of New York University and currently resides in Los Angeles, California. Originally from Rochester, New York, Oliver speaks fluent English and Spanish. Standing tall at 6'1\", he identifies as a White Caucasian Gemini with an ENTJ personality type.\n\nOliver believes in Intellectuality, Compassion, and Honesty and enjoys Hiking, Coding, and Photography as hobbies. He identifies as an Agnostic and holds Liberal political views. A non-smoker and occasional drinker, Oliver is an active person and doesn't use drugs or marijuana.\n\nAs for his relationship values, Oliver is interested in Monogamy and is looking to date for the Long-term. He doesn't have any children yet but would like to have kids in the future. He is comfortable with dogs but currently doesn't have any pets.\n\nWhen it comes to partner preferences, Oliver is hoping to meet a straight woman between the ages of 27 and 35. His ideal partner would share his active lifestyle, non-smoking habits, and interest in having children. He is okay with occasional drinking but prefers someone not involved with drugs or marijuana.", "user_id": "9b76f553-ead9-4c0b-a0d0-3dd6396f5d5c"}
{"name": "Natalie Briggs", "age": 29, "height": "5'6\"", "school": "Harvard University", "job_industry": "Tech", "job_title": "Software Engineer", "hometown_location": "Seattle, Washington", "dating_location": "Los Angeles, California", "languages_spoken": ["English", "Spanish", "Japanese"], "values": ["Honesty", "Kindness", "Independence"], "interests": ["Tech conferences", "Jazz music", "Travelling"], "education_level": "Graduate", "religious_beliefs": "Agnostic", "politics": "Liberal", "dating_intentions": "Long term", "relationship_type": "Monogamy", "gender": "Woman", "pronouns": "She/Her/Hers", "sexuality": "Straight", "ethnicity": "White Caucasian", "has_children": false, "want_children": true, "pets": ["Dog", "Cat"], "zodiac_sign": "Aquarius", "mbti_personality_type": "ENFP", "drinking": "Sometimes", "smoking": "No", "marijuana": "No", "drugs": "No", "exercise": "Active", "partner_preferences": {"minimum_age": 27, "maximum_age": 35, "minimum_height": "5'8\"", "maximum_height": "6'4\"", "has_children": false, "want_children": true, "sexuality": "Straight", "drinking": "No", "smoking": "No", "marijuana": "No", "drugs": "No", "exercise": "Active"}, "summary": "Natalie Briggs is a 29-year-old software engineer originally from Seattle and currently resides in Los Angeles. She is a graduate of Harvard University and speaks English, Spanish, and Japanese. Driven by values of honesty, kindness, and independence, Natalie enjoys attending tech conferences, listening to jazz music, and traveling. As an agnostic liberal, she identifies as a straight, White Caucasian female with pronouns of She/Her. Currently, she does not have any children, but she is open to the possibility in the future. She is an active woman, who occasionally drinks but does not smoke or use any sort of drugs. She has pets — a dog and a cat. Natalie is looking for a long term monogamous relationship with a man who is between 27 and 35 years old, at least 5'8\", and leads an active lifestyle. He should be a non-smoker, non-drinker, with no children but open to having some in the future. Natalie is an Aquarius and identifies her personality type as ENFP (Extraversion, Intuition, Feeling, Perception).", "user_id": "87b0804d-aab3-48ee-98c6-3c8fee8d7f82"}
{"name": "Elias Richards", "age": 31, "height": "6'1\"", "school": "University of California, Los Angeles", "job_industry": "Technology", "job_title": "Software Engineer", "hometown_location": "Sacramento, California", "dating_location": "Los Angeles, California", "languages_spoken": ["English", "Spanish", "French"], "values": ["Hard work", "Honesty", "Creativity"], "interests": ["Coding", "Music", "Traveling", "Fitness"], "education_level": "Graduate", "religious_beliefs": "Agnostic", "politics": "Liberal", "dating_intentions": "Life partner", "relationship_type": "Monogamy", "gender": "Man", "pronouns": "He/Him/His", "sexuality": "Straight", "ethnicity": "White Caucasian", "has_children": false, "want_children": true, "pets": ["Dog"], "zodiac_sign": "Leo", "mbti_personality_type": "ENTJ", "drinking": "Yes", "smoking": "No", "marijuana": "No", "drugs": "No", "exercise": "Active", "partner_preferences": {"minimum_age": 25, "maximum_age": 35, "minimum_height": "5'4\"", "maximum_height": "6'0\"", "has_children": false, "want_children": true, "sexuality": "Straight", "drinking": "Sometimes", "smoking": "No", "marijuana": "No", "drugs": "No", "exercise": "Active"}, "summary": "Elias Richards is a 31-year-old man living in Los Angeles, California. He is a Software Engineer in the Technology industry and holds a degree from the University of California, Los Angeles. Elias speaks three languages including English, Spanish and French and highly values hard work, honesty, and creativity. His interests are coding, music, traveling and staying fit. He does not currently have children but is open to the idea in the future. Elias is seeking a life partner who matches his active lifestyle. He prefers to date a woman aged between 25 and 35, is at least 5'4\" tall, does not smoke, and leads an active life.", "user_id": "0bcffaad-8fc4-4396-abe0-acd6fd9c3874"}
{"name": "Emma Barnes", "age": 28, "height": "5'6\"", "school": "University of California", "job_industry": "Tech", "job_title": "Software Engineer", "hometown_location": "San Francisco, California", "dating_location": "Los Angeles, California", "languages_spoken": ["English", "Spanish"], "values": ["Honesty", "Kindness", "Humor"], "interests": ["Traveling", "Cooking", "Hiking"], "education_level": "Graduate", "religious_beliefs": "Agnostic", "politics": "Liberal", "dating_intentions": "Long term", "relationship_type": "Monogamy", "gender": "Woman", "pronouns": "She/Her/Hers", "sexuality": "Straight", "ethnicity": "White Caucasian", "has_children": false, "want_children": true, "pets": ["Cat"], "zodiac_sign": "Virgo", "mbti_personality_type": "INFJ", "drinking": "Sometimes", "smoking": "No", "marijuana": "No", "drugs": "No", "exercise": "Active", "partner_preferences": {"minimum_age": 27, "maximum_age": 35, "minimum_height": "5'8\"", "maximum_height": "6'2\"", "has_children": false, "want_children": true, "sexuality": "Straight", "drinking": "Yes", "smoking": "No", "marijuana": "No", "drugs": "No", "exercise": "Active"}, "summary": "Emma Barnes is a 28-year-old Software Engineer who works in the tech industry and lives in Los Angeles, California. She is a graduate from the University of California and fluent in English and Spanish. Standing at 5'6\", she identifies as a straight white woman who uses she/her pronouns. She doesn't have children but is interested in having some in the future. \n\nHer interests include traveling, cooking, and hiking. Her core values are honesty, kindness, and humor. She owns a cat and is in good shape with an active exercise routine. She is an occasional drinker, doesn't smoke, and is against drugs. She identifies as an INFJ and her zodiac sign is Virgo.\n\nAs for her partner preferences, she is looking for a monogamous relationship and intends to date long-term. She is interested in straight men aged between 27 and 35, who are taller than her (5'8\" to 6'2\"), don't have children currently but want to in the future. The partner should also have an active lifestyle, be a drinker but not a smoker or a drug user.", "user_id": "e90cc19d-dd7a-41c6-82d9-969d8230f134"}
{"name": "Simone Chen", "age": 28, "height": "5'7\"", "school": "University of California, Berkeley", "job_industry": "Tech", "job_title": "Software Engineer", "hometown_location": "San Francisco, California", "dating_location": "Los Angeles, California", "languages_spoken": ["English", "Mandarin", "Spanish"], "values": ["Honesty", "Adventurous", "Creativity", "Intelligence"], "interests": ["Traveling", "Photography", "Rock climbing", "Cooking", "Live concerts"], "education_level": "Graduate", "religious_beliefs": "Agnostic", "politics": "Liberal", "dating_intentions": "Long term", "relationship_type": "Monogamy", "gender": "Woman", "pronouns": "She/Her/Hers", "sexuality": "Straight", "ethnicity": "East Asian", "has_children": false, "want_children": true, "pets": ["Dog"], "zodiac_sign": "Leo", "mbti_personality_type": "ENFJ", "drinking": "Yes", "smoking": "No", "marijuana": "No", "drugs": "No", "exercise": "Active", "partner_preferences": {"minimum_age": 28, "maximum_age": 35, "minimum_height": "6'0\"", "maximum_height": "6'7\"", "has_children": false, "want_children": true, "sexuality": "Straight", "drinking": "Yes", "smoking": "No", "marijuana": "No", "drugs": "No", "exercise": "Active"}, "summary": "Simone Chen is a 28-year-old software engineer who currently resides in Los Angeles, California but originally hails from San Francisco. She's a graduate from the University of California Berkeley, and she's particularly passionate about traveling, photography, rock climbing, cooking, and live concerts. Simone values honesty, adventurousness, creativity, and intelligence. She speaks Spanish, Mandarin, and English fluently.\n\nIdentifying as an Agnostic, she leans liberal politically. Simone aligns herself with the monogamous relationship type and is considering a long-term relationship, specifically with a man of similar age and taller height. Although she currently does not have children, she hopes to start a family someday. She enjoys the company of her dog and is an active ENFJ Leo woman who enjoys a good drink on occasion yet abstains from smoking, marijuana, or drug use.\n\nShe's looking for a man aged between 28 to 35 who's also interested in a long-term, monogamous relationship. Her potential match would ideally be an active non-smoker who does not have children already but is also open to having kids in the future.", "user_id": "37baa0cd-34d2-49ce-a523-38e6963f8d97"}
{"name": "Lerato Dlamini", "age": 28, "height": "5'7\"", "school": "University of Cape Town", "job_industry": "Tech", "job_title": "Software Developer", "hometown_location": "Durban, South Africa", "dating_location": "Los Angeles, California", "languages_spoken": ["English", "Zulu", "Afrikaans"], "values": ["Family", "Career", "Adventure"], "interests": ["Coding", "Hiking", "Listening to music"], "education_level": "Graduate", "religious_beliefs": "Christian", "politics": "Liberal", "dating_intentions": "Long term", "relationship_type": "Monogamy", "gender": "Woman", "pronouns": "She/Her/Hers", "sexuality": "Straight", "ethnicity": "Black African Descent", "has_children": false, "want_children": true, "pets": ["None"], "zodiac_sign": "Virgo", "mbti_personality_type": "INTJ", "drinking": "Sometimes", "smoking": "No", "marijuana": "No", "drugs": "No", "exercise": "Active", "partner_preferences": {"minimum_age": 27, "maximum_age": 35, "minimum_height": "5'8\"", "maximum_height": "6'5\"", "has_children": false, "want_children": true, "sexuality": "Straight", "drinking": "Yes", "smoking": "No", "marijuana": "No", "drugs": "No", "exercise": "Active"}, "summary": "Lerato Dlamini is a 28-year-old Christian woman of Black African descent. She is a software developer and a graduate of the University of Cape Town. Lerato is 5'7\" tall and hails from Durban, South Africa but is currently living in Los Angeles, California. She values her family, her career, and adventuring. In her free time, she enjoys coding, hiking, and listening to music. \n\nShe is straight, operates with the pronouns She/Her/Hers, and identifies as an INTJ on the Meyers-Briggs personality type chart. She enjoys an active lifestyle and occasionally drinks alcohol but does not smoke or use marijuana. She doesn't have children, but wants to have in the future.\n\nLerato is seeking a long-term, monogamous relationship and her partner preferences include a straight man between 27 and 35. Her ideal partner is someone who shares her active lifestyle, wishes for similar life goals such as having children, and respects her boundaries related to drug use and smoking.", "user_id": "79e215f0-c3be-4d20-9939-40d0fb57ae66"}
{"name": "Evelyn Sinclair", "age": 29, "height": "5'8\"", "school": "University of California, Los Angeles", "job_industry": "Technology", "job_title": "Software Developer", "hometown_location": "San Francisco, California", "dating_location": "Los Angeles, California", "languages_spoken": ["English", "Spanish"], "values": ["Hard work", "Kindness", "Honesty"], "interests": ["Reading", "Traveling", "Cooking"], "education_level": "Graduate", "religious_beliefs": "Agnostic", "politics": "Liberal", "dating_intentions": "Life partner", "relationship_type": "Monogamy", "gender": "Woman", "pronouns": "She/Her/Hers", "sexuality": "Straight", "ethnicity": "White Caucasian", "has_children": false, "want_children": true, "pets": ["Dog"], "zodiac_sign": "Gemini", "mbti_personality_type": "INTJ", "drinking": "Sometimes", "smoking": "No", "marijuana": "No", "drugs": "No", "exercise": "Active", "partner_preferences": {"minimum_age": 28, "maximum_age": 35, "minimum_height": "5'8\"", "maximum_height": "6'2\"", "has_children": false, "want_children": true, "sexuality": "Straight", "drinking": "Sometimes", "smoking": "No", "marijuana": "No", "drugs": "No", "exercise": "Active"}, "summary": "Evelyn Sinclair is a 29-year-old woman from San Francisco, currently residing in Los Angeles, California. She speaks both English and Spanish and values hard work, kindness, and honesty. Fancying reading, traveling, and cooking, Evelyn works as a Software Developer in the technology industry, after graduating from the University of California, Los Angeles.\n\nEvelyn describes herself as an agnostic and overtime, has assumed a liberal political stance. She's interested in monogamous relationships and is seeking a life partner. As a straight, white Caucasian woman who refers to herself with She/Her/Hers pronouns, she doesn't have any children yet but definitely wants them in the future. She is the proud owner of a dog and is an active Gemini INTJ who occasionally indulges in drinking but refrains from smoking or drug use.\n\nWhen it comes to a potential match, her preferences are quite clear. She would like to meet a straight man, aged between 28 and 35, who is at least as tall as her (5'8). Her potential partner should have no children but a willingness to have ones in future. Like her, he should be a non-smoker, not into drugs or marijuana, occasionally enjoys a drink, and keeps active.", "user_id": "ab18159f-c15c-4294-af0c-ca074ceb87fa"}
{"name": "Hannah Goldberg", "age": 28, "height": "5'6\"", "school": "University of California, Berkeley", "job_industry": "Technology", "job_title": "Software Engineer", "hometown_location": "San Francisco, California", "dating_location": "Los Angeles, California", "languages_spoken": ["English", "Spanish"], "values": ["Honesty", "Hard Work", "Compassion"], "interests": ["Yoga", "Reading", "Coding", "Hiking", "Cooking"], "education_level": "Graduate", "religious_beliefs": "Jewish", "politics": "Liberal", "dating_intentions": "Long term", "relationship_type": "Monogamy", "gender": "Woman", "pronouns": "She/Her/Hers", "sexuality": "Straight", "ethnicity": "White Caucasian", "has_children": false, "want_children": true, "pets": ["Cat"], "zodiac_sign": "Aquarius", "mbti_personality_type": "INFJ", "drinking": "Sometimes", "smoking": "No", "marijuana": "No", "drugs": "No", "exercise": "Active", "partner_preferences": {"minimum_age": 26, "maximum_age": 34, "minimum_height": "5'8\"", "maximum_height": "6'4\"", "has_children": false, "want_children": true, "sexuality": "Straight", "drinking": "Sometimes", "smoking": "No", "marijuana": "No", "drugs": "No", "exercise": "Active"}, "summary": "Hannah Goldberg, a 28-year-old woman, works as a Software Engineer in the technology industry. She is based in Los Angeles, California, but originally comes from San Francisco. She is a graduate of the University of California, Berkeley. Honesty, hard work, and compassion are her central values. Hannah loves yoga, reading, coding, hiking, and cooking in her free time. Fluent in English and Spanish, she identifies herself as Jewish and liberal. \n\nHannah is interested in monogamous, long-term relationships. She doesn't have children but would like to start a family in the future. She owns a cat and appreciates people who are passionate about their fitness. Hannah's preferred partner should be a straight man, between ages 26-34 and taller than her. His lifestyle must align with hers - social drinking only, non-smoking, and doesn't consume marijuana or drugs.", "user_id": "b0e99aa0-5949-424f-bdc0-2710d998f176"}
{"name": "Oliver Thomsen", "age": 29, "height": "6'1\"", "school": "University of California, Los Angeles", "job_industry": "Technology", "job_title": "Software Engineer", "hometown_location": "San Francisco, California", "dating_location": "Los Angeles, California", "languages_spoken": ["English", "German"], "values": ["Hard work", "Honesty", "Independence"], "interests": ["Music", "Movies", "Traveling"], "education_level": "Graduate", "religious_beliefs": "Agnostic", "politics": "Liberal", "dating_intentions": "Life partner", "relationship_type": "Monogamy", "gender": "Man", "pronouns": "He/Him/His", "sexuality": "Straight", "ethnicity": "White Caucasian", "has_children": false, "want_children": true, "pets": ["Dog"], "zodiac_sign": "Scorpio", "mbti_personality_type": "INTJ", "drinking": "Sometimes", "smoking": "No", "marijuana": "No", "drugs": "No", "exercise": "Active", "partner_preferences": {"minimum_age": 25, "maximum_age": 34, "minimum_height": "5'2\"", "maximum_height": "6'0\"", "has_children": false, "want_children": true, "sexuality": "Straight", "drinking": "Sometimes", "smoking": "No", "marijuana": "No", "drugs": "No", "exercise": "Active"}, "summary": "Oliver Thomsen is a 29-year-old man who studied at the University of California, Los Angeles and works as a Software Engineer in the technology industry. He identifies as straight, and he's looking for a life partner interested in a monogamous relationship. He's currently based in Los Angeles, California, and hails originally from San Francisco. Apart from English, he speaks German, enjoys music, movies, and traveling, and values hard work, honesty, and independence. His political views lean towards liberalism, and he identifies as an agnostic. Oliver has no children, but he would like to have them in the future. He also owns a dog. His habits include being active with exercise, occasionally drinking, and he is a non-smoker. His preference for a partner is a straight woman between the ages of 25 and 34 with no children, who leads an active lifestyle and shares similar habits.", "user_id": "52b6ba11-bd74-463f-a598-f33f55e5a53a"}
{"name": "Marisol Rodriguez", "age": 32, "height": "5'5\"", "school": "University of Southern California", "job_industry": "Marketing", "job_title": "Digital Marketing Specialist", "hometown_location": "San Juan, Puerto Rico", "dating_location": "Los Angeles, California", "languages_spoken": ["Spanish", "English"], "values": ["Family", "Hard Work", "Creativity"], "interests": ["Reading", "Cooking", "Hiking"], "education_level": "Graduate", "religious_beliefs": "Catholic", "politics": "Moderate", "dating_intentions": "Long term", "relationship_type": "Monogamy", "gender": "Woman", "pronouns": "She/Her/Hers", "sexuality": "Straight", "ethnicity": "Hispanic/Latino", "has_children": false, "want_children": true, "pets": ["Dog"], "zodiac_sign": "Virgo", "mbti_personality_type": "ISFJ", "drinking": "Sometimes", "smoking": "No", "marijuana": "No", "drugs": "No", "exercise": "Active", "partner_preferences": {"minimum_age": 30, "maximum_age": 40, "minimum_height": "5'8\"", "maximum_height": "6'3\"", "has_children": false, "want_children": true, "sexuality": "Straight", "drinking": "Yes", "smoking": "No", "marijuana": "No", "drugs": "No", "exercise": "Active"}, "summary": "Marisol Rodriguez is a 32-year-old Digital Marketing Specialist from San Juan, Puerto Rico, currently living in Los Angeles, California. She is a Graduate of the University of Southern California and speaks both Spanish and English. She values family, hard work, and creativity and enjoys reading, cooking, and hiking. As a Catholic and political moderate, she is seeking a long-term, monogamous relationship with a straight man. Marisol is a straight woman who uses She/Her pronouns, identifies as Hispanic/Latino and does not have any children but is open to having in the future. She has a pet dog and exercises regularly; occasionally enjoys a drink, but does not smoke or use marijuana or other drugs. Her zodiac sign is Virgo, and her MBTI personality type is ISFJ. She prefers a partner between the ages of 30 and 40, with a height between 5'8\" and 6'3\". Preferably, her potential partner does not have children, wants children in the future, is active physically, enjoys a drink occasionally but does not smoke or use drugs.", "user_id": "8bb4a941-8940-4cd4-8818-95da8689dd42"}
{"name": "Oliver Patterson", "age": 32, "height": "6'2\"", "school": "University of California, Berkeley", "job_industry": "Technology", "job_title": "Software Engineer", "hometown_location": "San Francisco, California", "dating_location": "Los Angeles, California", "languages_spoken": ["English", "Spanish"], "values": ["Hard work", "Honesty", "Kindness"], "interests": ["Traveling", "Hiking", "Reading", "Gaming"], "education_level": "Graduate", "religious_beliefs": "Agnostic", "politics": "Liberal", "dating_intentions": "Life partner", "relationship_type": "Monogamy", "gender": "Man", "pronouns": "He/Him/His", "sexuality": "Straight", "ethnicity": "White Caucasian", "has_children": false, "want_children": true, "pets": ["Dog", "None"], "zodiac_sign": "Gemini", "mbti_personality_type": "INTJ", "drinking": "Sometimes", "smoking": "No", "marijuana": "No", "drugs": "No", "exercise": "Active", "partner_preferences": {"minimum_age": 26, "maximum_age": 35, "minimum_height": "5'2\"", "maximum_height": "6'0\"", "has_children": false, "want_children": true, "sexuality": "Straight", "drinking": "Sometimes", "smoking": "No", "marijuana": "No", "drugs": "No", "exercise": "Active"}, "summary": "Oliver Patterson is a 32-year-old Software Engineer living in Los Angeles but originally from San Francisco. He is 6'2\", a graduate of the University of California, Berkeley, and works in the technology industry. He speaks two languages: English and Spanish. His key values are hard work, honesty, and kindness. \n\nIn his free time, Oliver enjoys traveling, hiking, reading, and gaming. While he does not adhere to any particular religious beliefs, he leans towards liberal politics. \n\nHe is currently looking for a life partner in a monogamous relationship. Describing himself as an agnostic, straight, white Caucasian man, he does not have children but hopes to in the future. He doesn't own any pets yet and his zodiac sign is Gemini. \n\nOliver identifies as an INTJ personality type, enjoys an active lifestyle, and sometimes drinks alcohol but does not smoke or use marijuana or other drugs. \n\nAs for his partner preferences, he is seeking a straight woman aged between 26-35 who does not smoke, partakes in alcohol occasionally, does not use marijuana or other drugs, and has an active lifestyle. She should ideally not have children yet but desire them in the future.", "user_id": "28835c92-2ea8-4b7e-a85c-78a074055ed7"}
{"name": "Keiko Yoshida", "age": 28, "height": "5'4\"", "school": "University of Tokyo", "job_industry": "Tech Industry", "job_title": "Software Developer", "hometown_location": "Tokyo, Japan", "dating_location": "Los Angeles, California", "languages_spoken": ["Japanese", "English"], "values": ["Family", "Career", "Art"], "interests": ["Travelling", "Cooking", "Software Coding", "Fine Art"], "education_level": "Graduate", "religious_beliefs": "Agnostic", "politics": "Liberal", "dating_intentions": "Life partner", "relationship_type": "Monogamy", "gender": "Woman", "pronouns": "She/Her/Hers", "sexuality": "Straight", "ethnicity": "East Asian", "has_children": false, "want_children": true, "pets": ["None"], "zodiac_sign": "Aquarius", "mbti_personality_type": "INTJ", "drinking": "Sometimes", "smoking": "No", "marijuana": "No", "drugs": "No", "exercise": "Active", "partner_preferences": {"minimum_age": 28, "maximum_age": 35, "minimum_height": "5'6\"", "maximum_height": "6'2\"", "has_children": false, "want_children": true, "sexuality": "Straight", "drinking": "Yes", "smoking": "No", "marijuana": "No", "drugs": "No", "exercise": "Active"}, "summary": "Keiko Yoshida is a 28-year-old woman originally from Tokyo, Japan, and currently resides in Los Angeles, California. She is a software developer in the tech industry and holds a graduate degree from the University of Tokyo. Keiko values family, career, and art, and is especially interested in traveling, cooking, software coding, and fine art. She is an agnostic and politically liberal.\n\nKeiko seeks a life partner and prefers a monogamous relationship. Although she doesn't currently have children, she is open to having them in the future. She is an Aquarius and her MBTI personality type is INTJ.\n\nIn her leisure time, Keiko maintains an active lifestyle. While she enjoys an occasional drink, she does not smoke or use marijuana or drugs. Speaking English and Japanese fluently, she is seeking a straight man aged between 28 and 35 who also values an active lifestyle and does not smoke or use drugs. Similar to Keiko, her ideal partner will also be open to the idea of having children.", "user_id": "bc4059bd-e1a4-403b-a4f4-b2c73bd02fd7"}
{"name": "Mohammad Patel", "age": 31, "height": "6'1\"", "school": "University of California, Berkeley", "job_industry": "Engineering", "job_title": "Software Engineer", "hometown_location": "Austin, Texas", "dating_location": "Los Angeles, California", "languages_spoken": ["English", "Gujarati", "Hindi"], "values": ["Honesty", "Hard-Work", "Family"], "interests": ["Hiking", "Video Gaming", "Reading"], "education_level": "Graduate", "religious_beliefs": "Muslim", "politics": "Liberal", "dating_intentions": "Long term", "relationship_type": "Monogamy", "gender": "Man", "pronouns": "He/Him/His", "sexuality": "Straight", "ethnicity": "South Asian", "has_children": false, "want_children": true, "pets": ["Cat"], "zodiac_sign": "Gemini", "mbti_personality_type": "INTJ", "drinking": "No", "smoking": "No", "marijuana": "No", "drugs": "No", "exercise": "Active", "partner_preferences": {"minimum_age": 25, "maximum_age": 35, "minimum_height": "5'3\"", "maximum_height": "6'0\"", "has_children": false, "want_children": true, "sexuality": "Straight", "drinking": "No", "smoking": "No", "marijuana": "No", "drugs": "No", "exercise": "Active"}, "summary": "Mohammad Patel is a 31 year old South Asian man from Austin, Texas, currently living in Los Angeles. He is a Software Engineer, and an alumnus of the University of California, Berkeley. Mohammad is tall, standing at 6'1\", and is quite active. His languages include English, Gujarati, and Hindi.\n\nPrincipal in his life are honesty, hard work, and family. His leisure activities include hiking, video gaming, and reading. As a Muslim, he holds deep faith. Politically, he leans liberal.\n\nMohammad is looking for a woman between the ages of 25 and 35 who values an active lifestyle, does not drink or smoke, and wants children in the future, just like him. A fellow non-drinker and non-smoker would align well with him. His zodiac sign is Gemini and his personality type is INTJ. He currently has a pet cat and is open to welcoming more pets.", "user_id": "c1ce95ef-7bd3-4f1d-974b-e2907eafcc08"}
{"name": "Sophia Baxter", "age": 29, "height": "5'7\"", "school": "University of California, Berkeley", "job_industry": "Tech", "job_title": "Software Engineer", "hometown_location": "San Francisco, California", "dating_location": "Los Angeles, California", "languages_spoken": ["English", "Spanish"], "values": ["Honesty", "Independence", "Creativity", "Kindness", "Ambition"], "interests": ["Reading", "Hiking", "Coding", "Traveling", "Cooking"], "education_level": "Graduate", "religious_beliefs": "Agnostic", "politics": "Liberal", "dating_intentions": "Long term", "relationship_type": "Monogamy", "gender": "Woman", "pronouns": "She/Her/Hers", "sexuality": "Straight", "ethnicity": "White Caucasian", "has_children": false, "want_children": true, "pets": ["Cat"], "zodiac_sign": "Cancer", "mbti_personality_type": "INTP", "drinking": "Yes", "smoking": "No", "marijuana": "Sometimes", "drugs": "No", "exercise": "Active", "partner_preferences": {"minimum_age": 28, "maximum_age": 35, "minimum_height": "5'8\"", "maximum_height": "6'2\"", "has_children": false, "want_children": true, "sexuality": "Straight", "drinking": "Yes", "smoking": "No", "marijuana": "Sometimes", "drugs": "No", "exercise": "Active"}, "summary": "Sophia Baxter is a 29 year old woman living in Los Angeles, California. She is a graduate of the University of California, Berkeley and works as a Software Engineer in the tech industry. Originally from San Francisco, she is fluent in English and Spanish. Sophia values honesty, independence, creativity, kindness, and ambition. In her spare time, she enjoys reading, hiking, coding, traveling, and cooking. \n\nIn terms of her personal beliefs, Sophia is Agnostic and politically leans liberal. Her intention in the dating scene is to find a long-term, monogamous relationship. Although she currently does not have children, she does want them in the future. She also has a cat. \n\nShe is a Cancer by zodiac sign and her Myers-Briggs personality type is INTP. She drinks alcohol occasionally, uses marijuana sometimes, but does not smoke or use other drugs. Sophia is active and enjoys regular exercise. \n\nSophia prefers a partner between the ages of 28 and 35, whose height is between 5'8\" and 6'2\". She prefers a partner who does not yet have children but wants them in the future. Ideally, her partner would also enjoy alcohol occasionally, use marijuana sometimes, but does not smoke or use drugs. They should also value regular exercise.", "user_id": "ccaa9fdd-698e-41d5-8a88-6762a010d2ff"}
{"name": "Kenyatta Njoroge", "age": 32, "height": "5'8\"", "school": "University of Nairobi", "job_industry": "Healthcare", "job_title": "Nurse Practitioner", "hometown_location": "Nairobi, Kenya", "dating_location": "Los Angeles, California", "languages_spoken": ["English", "Swahili", "Kikuyu"], "values": ["Family", "Work-life balance", "Spirituality"], "interests": ["Outdoor Exercises", "Reading", "Traveling"], "education_level": "Graduate", "religious_beliefs": "Christian", "politics": "Moderate", "dating_intentions": "Life partner", "relationship_type": "Monogamy", "gender": "Man", "pronouns": "He/Him/His", "sexuality": "Straight", "ethnicity": "Black African Descent", "has_children": false, "want_children": true, "pets": ["Dog"], "zodiac_sign": "Leo", "mbti_personality_type": "ENFJ", "drinking": "Sometimes", "smoking": "No", "marijuana": "No", "drugs": "No", "exercise": "Active", "partner_preferences": {"minimum_age": 27, "maximum_age": 35, "minimum_height": "5'2\"", "maximum_height": "6'0\"", "has_children": false, "want_children": true, "sexuality": "Straight", "drinking": "Sometimes", "smoking": "No", "marijuana": "No", "drugs": "No", "exercise": "Active"}, "summary": "Kenyatta Njoroge, a 32-year-old man, is currently living in Los Angeles, California. He originally comes from Nairobi, Kenya, and is fluent in English, Swahili, and Kikuyu. Kenyatta is a dedicated Nurse Practitioner in the Healthcare industry, and as a University of Nairobi graduate, he values work-life balance, family, and spirituality. As a man of Black African descent, he identifies as Christian and follows a moderate political viewpoint.\n\nKenyatta enjoys outdoor exercise, reading, and travelling. A Leo by zodiac signs, Kenyatta exhibits ENFJ personality traits and is a straight, monogamous individual. He has no children but wishes to become a father in the future. \n\nIn terms of lifestyle, Kenyatta is an active individual who sometimes drinks but abstains from smoking, marijuana, and drugs. He has a pet dog. \n\nKenyatta is searching for a straight life partner aged between 27 and 35, who is active, sometimes drinks but doesn't smoke or consume drugs or marijuana. His preference is that they have no children but are open to having some in the future.", "user_id": "4993d701-c2c2-4a94-b4c0-bcd09eb10437"}
{"name": "Sophia Martinez", "age": 28, "height": "5'6\"", "school": "University of California, Los Angeles", "job_industry": "Technology", "job_title": "Software Developer", "hometown_location": "San Diego, California", "dating_location": "Los Angeles, California", "languages_spoken": ["English", "Spanish"], "values": ["Honesty", "Kindness", "Creativity"], "interests": ["Coding", "Hiking", "Yoga"], "education_level": "Undergraduate", "religious_beliefs": "Agnostic", "politics": "Liberal", "dating_intentions": "Long term", "relationship_type": "Monogamy", "gender": "Woman", "pronouns": "She/Her/Hers", "sexuality": "Straight", "ethnicity": "Hispanic/Latino", "has_children": false, "want_children": true, "pets": ["Cat"], "zodiac_sign": "Taurus", "mbti_personality_type": "INTJ", "drinking": "Sometimes", "smoking": "No", "marijuana": "No", "drugs": "No", "exercise": "Active", "partner_preferences": {"minimum_age": 28, "maximum_age": 35, "minimum_height": "5'8\"", "maximum_height": "6'2\"", "has_children": false, "want_children": true, "sexuality": "Straight", "drinking": "Yes", "smoking": "No", "marijuana": "No", "drugs": "No", "exercise": "Active"}, "summary": "Sophia Martinez is a 28-year-old software developer from San Diego, currently living in Los Angeles. She is multilingual, speaking both English and Spanish. Her values include honesty, kindness, and creativity. Sophia holds a degree from the University of California, Los Angeles and is interested in activities such as coding, hiking, and yoga. \n\nShe identifies as a straight woman and uses she/her pronouns. Sophia is Hispanic/Latino and leans towards liberal politics. Her religious beliefs skew towards agnosticism. Sophia tends to lead an active lifestyle and enjoys drinks socially, but she does not smoke or use drugs.\n\nSophia is looking for a long-term monogamous relationship and wants to have children in the future. Her ideal partner would be someone between the ages of 28 and 35, who is at least 5'8\" in height, does not smoke, leads an active lifestyle, and shares her interest in starting a family. This suitor can enjoy social drinking but should not use other drugs.", "user_id": "05a89129-86e2-49e0-ac79-1773d2239ff2"}
{"name": "Serena Preston", "age": 30, "height": "5'7\"", "school": "University of California, Berkeley", "job_industry": "Media", "job_title": "Digital Content Producer", "hometown_location": "Seattle, Washington", "dating_location": "Los Angeles, California", "languages_spoken": ["English", "Spanish"], "values": ["Creativity", "Passion", "Balance"], "interests": ["Music", "Festivals", "Exploring New Cultures", "Photography"], "education_level": "Graduate", "religious_beliefs": "Agnostic", "politics": "Liberal", "dating_intentions": "Life partner", "relationship_type": "Monogamy", "gender": "Woman", "pronouns": "She/Her/Hers", "sexuality": "Straight", "ethnicity": "White Caucasian", "has_children": false, "want_children": true, "pets": ["Cat"], "zodiac_sign": "Aries", "mbti_personality_type": "ENFP", "drinking": "Yes", "smoking": "No", "marijuana": "No", "drugs": "No", "exercise": "Active", "partner_preferences": {"minimum_age": 28, "maximum_age": 40, "minimum_height": "5'8\"", "maximum_height": "6'4\"", "has_children": false, "want_children": true, "sexuality": "Straight", "drinking": "Yes", "smoking": "No", "marijuana": "No", "drugs": "No", "exercise": "Active"}, "summary": "Serena Preston, a dynamic and creative 30-year-old woman, is actively seeking a life partner. Currently residing in Los Angeles, she originally hails from Seattle, Washington. Holding a graduate degree from the University of California, Berkeley, she is now forging a successful career as a Digital Content Producer in the media industry. \n\nBilingual in English and Spanish, Serena values creativity, passion, and balance in her life. Her interests are wide-ranging and include music and festivals to photography and exploring new cultures. Politically liberal and agnostic, she is looking for a partner who shares the same openness to different perspectives. \n\nSerena identifies as straight and prefers monogamous relationships. An active person, she takes part in regular exercise and enjoys a social drink now and then. She presently doesn't have children but is open to starting a family. A cat-lover, she is of Aries Zodiac sign with an ENFP personality type.\n\nIn a partner, Serena is looking for a straight man between the ages of 28-40, who is at least 5'8\" tall. He ideally shares her interest in fitness and responsible social drinking, does not smoke or use marijuana or other drugs, and is also interested in having children.", "user_id": "19dd676b-b5e0-4244-85ff-a92bd27fc609"}
{"name": "Avery Thompson", "age": 29, "height": "6'1\"", "school": "California State University", "job_industry": "Finance", "job_title": "Financial Analyst", "hometown_location": "Sacramento, California", "dating_location": "Los Angeles, California", "languages_spoken": ["English"], "values": ["Honesty", "Loyalty", "Fitness"], "interests": ["Football", "Traveling", "Cooking", "Reading"], "education_level": "Undergraduate", "religious_beliefs": "Agnostic", "politics": "Liberal", "dating_intentions": "Life partner", "relationship_type": "Monogamy", "gender": "Man", "pronouns": "He/Him/His", "sexuality": "Straight", "ethnicity": "White Caucasian", "has_children": false, "want_children": true, "pets": ["Dog"], "zodiac_sign": "Leo", "mbti_personality_type": "ENTJ", "drinking": "Sometimes", "smoking": "No", "marijuana": "No", "drugs": "No", "exercise": "Active", "partner_preferences": {"minimum_age": 24, "maximum_age": 35, "minimum_height": "5'6\"", "maximum_height": "6'0\"", "has_children": false, "want_children": true, "sexuality": "Straight", "drinking": "Yes", "smoking": "No", "marijuana": "No", "drugs": "No", "exercise": "Active"}, "summary": "Avery Thompson is a 29-year-old man who lives in Los Angeles, California. Originally from Sacramento, he is a Financial Analyst in the finance industry. He speaks English and holds an undergraduate degree from California State University. His core values are honesty, loyalty, and fitness. His interests include football, traveling, cooking, and reading. \n\nAvery identifies himself as an Agnostic and leans towards liberal political views. He is currently looking for a potential life partner and is interested in monogamous relationships. Straight in terms of sexuality, Avery doesn't have children, although he wants them in the future. He is a proud dog owner, active in exercise, and doesn't smoke. He sometimes drinks but doesn't take marijuana or other drugs. His partner preferences are a straight woman between the ages of 24 and 35, who shares similar values, does not smoke, exercises regularly, and also wants children in the future.", "user_id": "071ccc51-12b5-4ee9-a7d4-242572d02d90"}
{"name": "Leila El-Masri", "age": 28, "height": "5'4\"", "school": "University of California, Berkeley", "job_industry": "Technology", "job_title": "Software Developer", "hometown_location": "Cupertino, California", "dating_location": "Los Angeles, California", "languages_spoken": ["English", "Arabic"], "values": ["Family", "Independence", "Creativity"], "interests": ["Coding", "Hiking", "Traveling"], "education_level": "Graduate", "religious_beliefs": "Muslim", "politics": "Liberal", "dating_intentions": "Long term", "relationship_type": "Monogamy", "gender": "Woman", "pronouns": "She/Her/Hers", "sexuality": "Straight", "ethnicity": "Middle Eastern", "has_children": false, "want_children": true, "pets": ["None"], "zodiac_sign": "Scorpio", "mbti_personality_type": "INFJ", "drinking": "No", "smoking": "No", "marijuana": "No", "drugs": "No", "exercise": "Active", "partner_preferences": {"minimum_age": 28, "maximum_age": 35, "minimum_height": "5'10\"", "maximum_height": "6'4\"", "has_children": false, "want_children": true, "sexuality": "Straight", "drinking": "No", "smoking": "No", "marijuana": "No", "drugs": "No", "exercise": "Active"}, "summary": "Leila El-Masri is a 28-year-old,5'4\" tall, software developer based in Los Angeles, California. She is a graduate from the University of California, Berkeley and identifies as a straight woman. Her pronouns are She/Her/Hers and she is Middle Eastern. \n\nShe is fluent in English and Arabic, holds liberal political views, and follows Islamic religious beliefs. Leila has mentioned her values to be Family, Independence, and Creativity. She enjoys Coding, Hiking, and traveling, engages in active exercises, and does not have any pets. \n\nLeila is a Scorpio and identifies her personality type as INFJ based on the MBTI scale. She is a non-drinker and does not smoke or use other substances. Presently, she has no children but wishes to have them in the future. \n\nLeila is looking for a long-term, monogamous relationship with a straight man between the ages of 28 and 35, ranging in height from 5'10\" to 6'4\". Ideally, her partner would share similar lifestyle habits including not having children yet but wanting them in the future, not drinking, or smoking.", "user_id": "479b2457-fd79-4ad2-acba-040677db28fc"}
{"name": "Sophia Brown", "age": 29, "height": "5'6\"", "school": "Stanford University", "job_industry": "Technology", "job_title": "Software Engineer", "hometown_location": "San Francisco, California", "dating_location": "Los Angeles, California", "languages_spoken": ["English", "Spanish"], "values": ["Equality", "Hard work", "Empathy"], "interests": ["Reading", "Travel", "Cooking"], "education_level": "Graduate", "religious_beliefs": "Atheist", "politics": "Liberal", "dating_intentions": "Long term", "relationship_type": "Monogamy", "gender": "Woman", "pronouns": "She/Her/Hers", "sexuality": "Straight", "ethnicity": "White Caucasian", "has_children": false, "want_children": true, "pets": ["Dog"], "zodiac_sign": "Gemini", "mbti_personality_type": "ENFP", "drinking": "Sometimes", "smoking": "No", "marijuana": "No", "drugs": "No", "exercise": "Active", "partner_preferences": {"minimum_age": 28, "maximum_age": 38, "minimum_height": "5'8\"", "maximum_height": "6'2\"", "has_children": false, "want_children": true, "sexuality": "Straight", "drinking": "Yes", "smoking": "No", "marijuana": "No", "drugs": "No", "exercise": "Active"}, "summary": "Sophia Brown is a 29-year-old Software Engineer from San Francisco, currently living in Los Angeles. She is a Stanford graduate who values equality, hard work, and empathy. Her interests include reading, travel, and cooking. \n\nAt 5'6\", Sophia is a White Caucasian woman who uses she/her/hers pronouns. She identifies as straight and is looking for a monogamous, long-term relationship. A Gemini with an ENFP personality type, Sophia occasionally enjoys a drink but does not smoke or use marijuana or drugs.\n\nSophia has a dog, does not have any children yet, but would like to in the future. Her ideal partner would be a straight man between the ages of 28 and 38, standing between 5'8\" and 6'2\" tall. He should value an active lifestyle, not smoke, and be fine with occasional drinks. Ideally, he should also be interested in having children.", "user_id": "1da06cb3-a71e-4fab-b311-9eb89c66a0f4"}
{"name": "Olivia Blanchard", "age": 29, "height": "5'7\"", "school": "University of California, Los Angeles", "job_industry": "Technology", "job_title": "Software Engineer", "hometown_location": "Berkeley, California", "dating_location": "Los Angeles, California", "languages_spoken": ["English", "Spanish", "French"], "values": ["Hard Work", "Compassionate", "Independence"], "interests": ["Hiking", "Coding", "Photography", "Cooking", "Yoga"], "education_level": "Graduate", "religious_beliefs": "Agnostic", "politics": "Liberal", "dating_intentions": "Long term", "relationship_type": "Monogamy", "gender": "Woman", "pronouns": "She/Her/Hers", "sexuality": "Straight", "ethnicity": "White Caucasian", "has_children": false, "want_children": true, "pets": ["Dog"], "zodiac_sign": "Gemini", "mbti_personality_type": "ENFJ", "drinking": "Sometimes", "smoking": "No", "marijuana": "No", "drugs": "No", "exercise": "Active", "partner_preferences": {"minimum_age": 28, "maximum_age": 35, "minimum_height": "5'9\"", "maximum_height": "6'3\"", "has_children": false, "want_children": true, "sexuality": "Straight", "drinking": "Sometimes", "smoking": "No", "marijuana": "No", "drugs": "No", "exercise": "Active"}, "summary": "Olivia Blanchard is a 29-year-old, 5'7\" tall Software Engineer residing in Los Angeles, California, originally from Berkeley, California. She is a graduate of the University of California, Los Angeles, is an ENFJ, and identifies as a Woman with pronouns She/Her/Hers. \n\nOlivia's interests range from Hiking, Coding, and Photography to Cooking and Yoga. Her values center on hard work, compassion, and independence, matching her liberal political views. She is a white Caucasian who identifies as Straight and is currently looking for long-term dating prospects.\n\nOlivia is also fairly active, sometimes indulges in drinking but discourages smoking, marijuana, and illegal drug use. She is a dog lover who doesn’t have children but wants them in the future. \n\nAs for her partner, Olivia prefers someone between the ages of 28 and 35, a height ranging from 5'9\" to 6'3\", who doesn't have children but wants them, doesn't smoke, and is also fairly active.", "user_id": "5d6ee8bb-c758-4a91-9a13-8e9cda30bc97"}
{"name": "Mikael Johansson", "age": 32, "height": "5'11\"", "school": "Stockholm University", "job_industry": "Technology", "job_title": "Software Developer", "hometown_location": "Stockholm, Sweden", "dating_location": "Los Angeles, California", "languages_spoken": ["Swedish", "English"], "values": ["Honesty", "Family", "Adventure"], "interests": ["Hiking", "Coding", "Cooking"], "education_level": "Graduate", "religious_beliefs": "Atheist", "politics": "Liberal", "dating_intentions": "Long term", "relationship_type": "Monogamy", "gender": "Man", "pronouns": "He/Him/His", "sexuality": "Straight", "ethnicity": "White Caucasian", "has_children": false, "want_children": true, "pets": ["Dog"], "zodiac_sign": "Virgo", "mbti_personality_type": "INTP", "drinking": "Sometimes", "smoking": "No", "marijuana": "No", "drugs": "No", "exercise": "Active", "partner_preferences": {"minimum_age": 25, "maximum_age": 35, "minimum_height": "5'2\"", "maximum_height": "6'0\"", "has_children": false, "want_children": true, "sexuality": "Straight", "smoking": "No", "marijuana": "No", "drugs": "No", "exercise": "Active"}, "summary": "Mikael Johansson is a 32-year-old man from Stockholm, Sweden, currently residing in Los Angeles, California. He works as a Software Developer in the technology industry after graduating from Stockholm University. He identifies as a White Caucasian, speaks English and Swedish, and stands 5'11\" tall.\n\nHe values honesty, family, and adventure, with interests in hiking, coding, and cooking. As a man with no children, he indicates the desire to have them in the future. He also enjoys the company of his dog. He identifies as an atheist and leans liberal politically. \n\nIn terms of personality, he is an INTP (introversion, intuition, thinking, perceiving) per the Myers Briggs Type Indicator, a Virgo according to zodiac, and is active physically. \n\nHe's interested in meeting a woman aged between 25 and 35 years, preferably someone who doesn't currently have children but wants them in the future. She shouldn't be a smoker or into drugs, and should be active in her lifestyle. \n\nMikael occasionally partakes in drinking but refrains from smoking, marijuana, and other drugs. He is looking for a long-term relationship and monogamy.", "user_id": "00507317-e140-4f17-9746-c11d01a61659"}
{"name": "Victoria Collins", "age": 30, "height": "5'7\"", "school": "University of California, Berkeley", "job_industry": "Technology", "job_title": "Software Engineer", "hometown_location": "Sacramento, California", "dating_location": "Los Angeles, California", "languages_spoken": ["English", "Spanish"], "values": ["Honesty", "Fidelity", "Kindness", "Humor"], "interests": ["Biking", "Hiking", "Reading Sci-Fi Novels", "Playing Chess", "Cooking"], "education_level": "Graduate", "religious_beliefs": "Agnostic", "politics": "Liberal", "dating_intentions": "Long term", "relationship_type": "Monogamy", "gender": "Woman", "pronouns": "She/Her/Hers", "sexuality": "Straight", "ethnicity": "White Caucasian", "has_children": false, "want_children": true, "pets": ["Cat"], "zodiac_sign": "Virgo", "mbti_personality_type": "INTJ", "drinking": "Sometimes", "smoking": "No", "marijuana": "No", "drugs": "No", "exercise": "Active", "partner_preferences": {"minimum_age": 28, "maximum_age": 40, "minimum_height": "5'4\"", "maximum_height": "6'4\"", "has_children": false, "want_children": true, "sexuality": "Straight", "drinking": "Sometimes", "smoking": "No", "marijuana": "No", "drugs": "No", "exercise": "Active"}, "summary": "Victoria Collins is a 30-year-old straight woman living in Los Angeles. Located originally from Sacramento, California, she works as a Software Engineer in the Technology industry. Victoria is highly educated with a degree from the University of California, Berkeley. Fluent in English and Spanish, she values honesty, fidelity, kindness, and humor. \n\nHer hobbies include biking, hiking, reading sci-fi novels, playing chess, and cooking. Victoria considers herself an active person and exercises regularly. She's agnostic, politically liberal, and her Myers-Briggs personality type is INTJ. She's a Virgo who owns a cat. \n\nVictoria doesn't smoke or use drugs and only occasionally drinks. She doesn't have children but would like to in the future. Her intent is to find a long-term, monogamous relationship towards a partner aged between 28 and 40, actively exercises, doesn't smoke or use drugs, and who also wants children someday.", "user_id": "3b7371ff-fa58-41cc-bdd6-f2f25d00f57b"}
{"name": "Benjamin Carter", "age": 28, "height": "5'10\"", "school": "Stanford University", "job_industry": "Technology", "job_title": "Software Engineer", "hometown_location": "Boston, Massachusetts", "dating_location": "Los Angeles, California", "languages_spoken": ["English", "Spanish"], "values": ["Honesty", "Kindness", "Creativity"], "interests": ["Music", "Hiking", "Cooking", "Coding"], "education_level": "Graduate", "religious_beliefs": "Agnostic", "politics": "Liberal", "dating_intentions": "Long term", "relationship_type": "Monogamy", "gender": "Man", "pronouns": "He/Him/His", "sexuality": "Straight", "ethnicity": "White Caucasian", "has_children": false, "want_children": true, "pets": ["Dog"], "zodiac_sign": "Gemini", "mbti_personality_type": "INTJ", "drinking": "Yes", "smoking": "No", "marijuana": "No", "drugs": "No", "exercise": "Active", "partner_preferences": {"minimum_age": 24, "maximum_age": 30, "minimum_height": "5'2\"", "maximum_height": "5'10\"", "has_children": false, "want_children": true, "sexuality": "Straight", "drinking": "Yes", "smoking": "No", "marijuana": "No", "drugs": "No", "exercise": "Active"}, "summary": "Benjamin Carter is a 28-year-old man who stands 5'10\". Currently, he is working as a Software Engineer in the technology sector. He graduated from Stanford University and is now living in Los Angeles, California, originally from Boston, Massachusetts. Being bilingual, he can fluently converse in English and Spanish. He values honesty, kindness, and creativity and takes interest in music, hiking, cooking, and coding. Benjamin is an Agnostic and has liberal political beliefs. He's looking for a long-term relationship and prefers monogamy. He identifies as straight and uses the pronouns He/Him/His. Benjamin is of White Caucasian ethnicity, does not have children currently but would like to in the future. He owns a dog and is a non-smoker. He enjoys a drink sometimes, is active in exercise, does not use marijuana or other drugs and is a Gemini, with an INTJ personality type according to the Myers-Briggs Type Indicator. His ideal partner would be a straight woman aged between 24 and 30, preferably non-smoker, active, enjoys a drink occasionally and who does not have but wants children in the future.", "user_id": "326e9e8a-e897-4f41-b277-044eaf473600"}
{"name": "Benjamin Fairchild", "age": 33, "height": "6'0\"", "school": "Yale University", "job_industry": "Healthcare", "job_title": "Medical Researcher", "hometown_location": "Seattle, Washington", "dating_location": "Los Angeles, California", "languages_spoken": ["English", "Spanish"], "values": ["Open-mindedness", "Work-life balance", "Compassion", "Creativity"], "interests": ["Travelling", "Hiking", "Reading"], "education_level": "Graduate", "religious_beliefs": "Agnostic", "politics": "Moderate", "dating_intentions": "Long term", "relationship_type": "Monogamy", "gender": "Man", "pronouns": "He/Him/His", "sexuality": "Straight", "ethnicity": "White Caucasian", "has_children": false, "want_children": true, "pets": ["Dog"], "zodiac_sign": "Leo", "mbti_personality_type": "INTJ", "drinking": "Sometimes", "smoking": "No", "marijuana": "No", "drugs": "No", "exercise": "Active", "partner_preferences": {"minimum_age": 27, "maximum_age": 37, "minimum_height": "5'4\"", "maximum_height": "5'11\"", "has_children": false, "want_children": true, "sexuality": "Straight", "drinking": "Yes", "smoking": "No", "marijuana": "No", "drugs": "No", "exercise": "Active"}, "summary": "Benjamin Fairchild is a 33-year-old Medical Researcher based in Los Angeles, California. He is a graduate from Yale University. While he hails from Seattle, Washington, he is fluent in both English and Spanish. Benjamin values open-mindedness, work-life balance, compassion, and creativity. His interests include travelling, hiking, and reading.\n\nIn terms of beliefs, Benjamin is agnostic and politically moderate. He is looking for a serious, long-term relationship and is open to monogamy. He identifies as a straight man and uses he/him/his pronouns. Benjamin is of White Caucasian ethnicity, doesn't have children but wants to in future, and is a proud dog owner.\n\nHis zodiac sign is Leo and his MBTI personality type is INTJ. He drinks occasionally, but he doesn’t smoke or indulge in marijuana or drugs. Being an active individual, he also values exercise.\n\nIn his potential partner, Benjamin prefers a straight woman between 27 to 37 years old who enjoys an active lifestyle. He would prefer a non-smoker who likes to drink occasionally. She should also not have, but want children in future.", "user_id": "1a969dfb-1cb2-4a9e-83e5-37ed5feb5b5b"}
{"name": "Nathan Crawford", "age": 30, "height": "6'1\"", "school": "University of California, Berkeley", "job_industry": "Tech", "job_title": "Software Developer", "hometown_location": "Seattle, Washington", "dating_location": "Los Angeles, California", "languages_spoken": ["English", "Spanish"], "values": ["Honesty", "Loyalty", "Integrity", "Ambition"], "interests": ["Hiking", "Reading", "Traveling", "Cooking"], "education_level": "Undergraduate", "religious_beliefs": "Atheist", "politics": "Moderate", "dating_intentions": "Long term", "relationship_type": "Monogamy", "gender": "Man", "pronouns": "He/Him/His", "sexuality": "Straight", "ethnicity": "White Caucasian", "has_children": false, "want_children": true, "pets": ["Dog"], "zodiac_sign": "Leo", "mbti_personality_type": "ENTJ", "drinking": "Sometimes", "smoking": "No", "marijuana": "No", "drugs": "No", "exercise": "Active", "partner_preferences": {"minimum_age": 25, "maximum_age": 35, "minimum_height": "5'2\"", "maximum_height": "6'0\"", "has_children": false, "want_children": true, "sexuality": "Straight", "drinking": "Sometimes", "smoking": "No", "marijuana": "No", "drugs": "No", "exercise": "Active"}, "summary": "Nathan Crawford is a 30-year-old software developer based in Los Angeles, California. He's a graduate from the University of California, Berkeley. Originally from Seattle, Washington, Nathan is bilingual and speaks both English and Spanish. In his free time, he enjoys hiking, reading, traveling and cooking. \n\nNathan values honesty, loyalty, integrity, and ambition. His political views are moderate and he is an atheist. He is interested in long-term relationships, practicing monogamy. Identifying as a straight man, he uses he/his/him pronouns, and is white caucasian.\n\nNathan doesn't have children, but he is open to having them in the future. He has a dog and is an active individual when it comes to fitness. Although he sometimes drinks, he doesn't smoke or partake in drug use. He is a Leo and an ENTJ according to the Myers-Briggs Indicator. \n\nRegarding partner preference, Nathan is interested in straight women aged between 25 and 35, who lead an active lifestyle. Like him, he prefers someone who doesn't smoke, uses drugs, or consumes marijuana. He also wishes his potential partner to be open to having children in the future.", "user_id": "5c37b6f7-ff0b-43c2-9329-d609a1545ad7"}
{"name": "Riley Ainsworth", "age": 30, "height": "6'2\"", "school": "University of California, Berkley", "job_industry": "Technology", "job_title": "Software Developer", "hometown_location": "San Francisco, California", "dating_location": "Los Angeles, California", "languages_spoken": ["English", "Spanish", "Japanese"], "values": ["Creativity", "Fitness", "Environmental Conservation"], "interests": ["Hiking", "Coding", "Music"], "education_level": "Graduate", "religious_beliefs": "Agnostic", "politics": "Liberal", "dating_intentions": "Long term", "relationship_type": "Monogamy", "gender": "Man", "pronouns": "He/Him/His", "sexuality": "Straight", "ethnicity": "White Caucasian", "has_children": false, "want_children": true, "pets": ["Cat", "Dog"], "zodiac_sign": "Aquarius", "mbti_personality_type": "INTJ", "drinking": "Sometimes", "smoking": "No", "marijuana": "No", "drugs": "No", "exercise": "Active", "partner_preferences": {"minimum_age": 25, "maximum_age": 35, "minimum_height": "5'4\"", "maximum_height": "6'0\"", "has_children": false, "want_children": true, "sexuality": "Straight", "drinking": "Yes", "smoking": "No", "marijuana": "No", "drugs": "No", "exercise": "Active"}, "summary": "Riley Ainsworth is a 30-year-old man who is currently based in Los Angeles, California. He was born and raised in San Francisco and studied in University of California, Berkley. As a software developer in the Technology industry, Riley can fluently speak English, Spanish, and Japanese.\n\nRiley values creativity, fitness, and environmental conservation. He enjoys hiking, coding, and listening to music in his free time. He is an Agnostic, identifies as a liberal politically, and is seeking a long-term, monogamous relationship.\n\nRiley identifies as straight and prefers partners who are between 25 and 35 years old, have no children but want to have them in the future. He maintains an active exercise regimen and prefers non-smokers with a similar active lifestyle.\n\nRiley identifies as an INTJ on the Myers-Briggs Type Indicator and is an Aquarian. He enjoys drinking occasionally but doesn't smoke or use marijuana or drugs. He is a proud pet owner of a cat and a dog, and is excited to find a partner who shares his active lifestyle and interest in having children in the future.", "user_id": "6884f4dc-4fcd-4dcd-9fa7-90e5d7d6907e"}
{"name": "Stella Gomez", "age": 30, "height": "5'4\"", "school": "University of California, Los Angeles", "job_industry": "Healthcare", "job_title": "Registered Nurse", "hometown_location": "San Diego, California", "dating_location": "Los Angeles, California", "languages_spoken": ["English", "Spanish"], "values": ["Family", "Ambition", "Health"], "interests": ["Travel", "Books", "Yoga"], "education_level": "Graduate", "religious_beliefs": "Catholic", "politics": "Liberal", "dating_intentions": "Life partner", "relationship_type": "Monogamy", "gender": "Woman", "pronouns": "She/Her/Hers", "sexuality": "Straight", "ethnicity": "Hispanic/Latino", "has_children": false, "want_children": true, "pets": ["Dog"], "zodiac_sign": "Leo", "mbti_personality_type": "ENFJ", "drinking": "Sometimes", "smoking": "No", "marijuana": "No", "drugs": "No", "exercise": "Active", "partner_preferences": {"minimum_age": 32, "maximum_age": 40, "minimum_height": "5'8\"", "maximum_height": "6'4\"", "has_children": false, "want_children": true, "sexuality": "Straight", "drinking": "Sometimes", "smoking": "No", "marijuana": "No", "drugs": "No", "exercise": "Active"}, "summary": "Stella Gomez is a 30-year-old Registered Nurse from San Diego, currently living and working in Los Angeles. She's a graduate of the University of California, Los Angeles and places high importance on values like family, ambition, and health. Stella is fluent in English and Spanish and has interests in travel, books, and yoga. She identifies as a straight woman, is looking for a life partner, and prefers monogamous relationships. Although she doesn't currently have children, she wants to in the future. Her faith and politically she leans liberal. Stella is a Leo, and her Myers-Briggs personality type is ENFJ. She is an active person who enjoys a drink sometimes, does not smoke or use drugs. She also has a pet dog. When it comes to her ideal partner, Stella is looking for a straight man between the ages of 32 to 40, who leads an active lifestyle, envisions having children in the future, and does not smoke.", "user_id": "76ef38cd-3a5e-43f3-a1d0-bb84de12dd93"}
{"name": "Harper Rodriguez", "age": 30, "height": "5'8\"", "school": "University of California, Los Angeles", "job_industry": "Healthcare", "job_title": "Physician", "hometown_location": "Los Angeles, California", "dating_location": "Los Angeles, California", "languages_spoken": ["English", "Spanish"], "values": ["Integrity", "Compassion", "Resilience"], "interests": ["Hiking", "Reading Medical Journals", "Playing Guitar"], "education_level": "Doctoral", "religious_beliefs": "Agnostic", "politics": "Liberal", "dating_intentions": "Long term", "relationship_type": "Monogamy", "gender": "Woman", "pronouns": "She/Her/Hers", "sexuality": "Straight", "ethnicity": "Hispanic/Latino", "has_children": false, "want_children": true, "pets": ["Cat"], "zodiac_sign": "Aries", "mbti_personality_type": "INFJ", "drinking": "Sometimes", "smoking": "No", "marijuana": "No", "drugs": "No", "exercise": "Active", "partner_preferences": {"minimum_age": 30, "maximum_age": 40, "minimum_height": "5'8\"", "maximum_height": "6'2\"", "has_children": false, "want_children": true, "sexuality": "Straight", "drinking": "Sometimes", "smoking": "No", "marijuana": "No", "drugs": "No", "exercise": "Active"}, "summary": "Harper Rodriguez is a 30-year old straight woman based in Los Angeles, California. She works as a Physician in the Healthcare industry after obtaining her doctoral degree at the University of California, Los Angeles. Harper comes from a Hispanic/Latino ethnicity and identifies herself primarily through her pronouns 'She/Her/Hers'. She's an agnostic following liberal political ideologies.\n\nHarper enjoys hiking, reading medical journals, and playing the guitar. As an infrequent drinker and a non-smoker, she maintains an active lifestyle. On the romantic front, Harper is looking for a long-term, monogamous relationship. She doesn't have children, but she would like to have them in the future. Harper is a pet lover and has a cat at home.\n\nShe's an Aries and her Myers-Briggs Type Indicator is INFJ. In terms of her ideal partner, Harper prefers a straight man between the ages of 30 and 40 who is at least 5'8\" in height. Her ideal match would have no children, be eager to have children in the future, lead an active life, and have similar habits including moderate drinking and no smoking.", "user_id": "4a41e3d0-a6bc-4fc5-8947-86087cab5d90"}
{"name": "Anika Patel", "age": 30, "height": "5'6\"", "school": "University of California, Berkeley", "job_industry": "Healthcare", "job_title": "Pharmacist", "hometown_location": "San Jose, California", "dating_location": "Los Angeles, California", "languages_spoken": ["English", "Hindi"], "values": ["Family", "Ambition"], "interests": ["Traveling", "Cooking", "Reading"], "education_level": "Graduate", "religious_beliefs": "Hindu", "politics": "Liberal", "dating_intentions": "Long term", "relationship_type": "Monogamy", "gender": "Woman", "pronouns": "She/Her/Hers", "sexuality": "Straight", "ethnicity": "South Asian", "has_children": false, "want_children": true, "pets": ["Cat"], "zodiac_sign": "Leo", "mbti_personality_type": "ENFP", "drinking": "Yes", "smoking": "No", "marijuana": "No", "drugs": "No", "exercise": "Active", "partner_preferences": {"minimum_age": 28, "maximum_age": 35, "minimum_height": "5'8\"", "maximum_height": "6'2\"", "has_children": false, "want_children": true, "sexuality": "Straight", "drinking": "Yes", "smoking": "No", "marijuana": "No", "drugs": "No", "exercise": "Active"}, "summary": "Anika Patel is a 30-year-old straight woman who is actively looking for a long-term, monogamous relationship. She is a Pharmacist in the Healthcare industry, originally hailing from San Jose, California, but currently resides in Los Angeles. Anika is multilingual, fluent in both English and Hindi. She puts great importance on family and ambition. \n\nAnika's interests include traveling, cooking, and reading. She is a liberal, a Hindu, and a graduate from the University of California, Berkeley. Anika is an ENFP based on the MBTI personality test and a Leo in astrology. \n\nShe enjoys exercising and occasional drinking but does not smoke or use marijuana or other drugs. Anika has a cat and is open to the idea of having children in the future, although she currently doesn't have any.\n\nAnika is looking for a partner who is between the ages of 28 and 35, at least 5'8\" in height, childless but open to the idea of having kids. She prefers her potential partner to share her active lifestyle, occasional drinking habits, but not smoking or using marijuana/other drugs. Crucially, her partner should identify as a straight man.", "user_id": "7f6c95da-26ed-41a1-9449-94c41404df52"}
{"name": "Arthur McGregor", "age": 31, "height": "5'11\"", "school": "New York University", "job_industry": "Tech", "job_title": "Software Engineer", "hometown_location": "Chicago, Illinois", "dating_location": "Los Angeles, California", "languages_spoken": ["English", "Spanish"], "values": ["Honesty", "Adventure", "Fitness"], "interests": ["Coding", "Football", "Traveling"], "education_level": "Graduate", "religious_beliefs": "Agnostic", "politics": "Moderate", "dating_intentions": "Long term", "relationship_type": "Monogamy", "gender": "Man", "pronouns": "He/Him/His", "sexuality": "Straight", "ethnicity": "White Caucasian", "has_children": false, "want_children": true, "pets": ["Dog"], "zodiac_sign": "Gemini", "mbti_personality_type": "INTP", "drinking": "Yes", "smoking": "No", "marijuana": "No", "drugs": "No", "exercise": "Active", "partner_preferences": {"minimum_age": 25, "maximum_age": 35, "minimum_height": "5'0\"", "maximum_height": "6'0\"", "has_children": false, "want_children": true, "sexuality": "Straight", "drinking": "Yes", "smoking": "No", "marijuana": "No", "drugs": "No", "exercise": "Active"}, "summary": "Arthur McGregor is a 31-year-old Software Engineer based in Los Angeles, California. He originally hails from Chicago and studied at New York University. Being outdoorsy, he maintains an active lifestyle and places importance on fitness. Arthur values honesty, adventure, and fitness. He loves coding, watching and playing football, and traveling. Despite his love for adventures, he's looking for a long-term, monogamous relationship. \n\nArthur is an agnostic and holds moderate political views. He is fluent in both English and Spanish, and while he doesn't have kids, he'd love to in the future. He is an INTP, a Gemini, and owns a dog. He drinks socially, and doesn't use any drugs. \n\nArthur seeks a partner in the age range of 25-35 who lives an active lifestyle and who doesn't smoke or use marijuana. His potential partner should want to have children in the future.", "user_id": "f0f786cc-c6b6-4747-9d2f-bdec06adca1f"}
{"name": "Victoria Walsh", "age": 32, "height": "5'6\"", "school": "Columbia University", "job_industry": "Technology", "job_title": "Software Engineer", "hometown_location": "Austin, Texas", "dating_location": "Los Angeles, California", "languages_spoken": ["English", "Spanish", "French"], "values": ["Honesty", "Kindness", "Creativity", "Personal growth"], "interests": ["Outdoor activities", "Coding", "Photography", "Reading"], "education_level": "Graduate", "religious_beliefs": "Agnostic", "politics": "Liberal", "dating_intentions": "Long term", "relationship_type": "Monogamy", "gender": "Woman", "pronouns": "She/Her/Hers", "sexuality": "Straight", "ethnicity": "White Caucasian", "has_children": false, "want_children": true, "pets": ["Cat"], "zodiac_sign": "Cancer", "mbti_personality_type": "INTJ", "drinking": "Sometimes", "smoking": "No", "marijuana": "No", "drugs": "No", "exercise": "Active", "partner_preferences": {"minimum_age": 30, "maximum_age": 40, "minimum_height": "5'8\"", "maximum_height": "6'4\"", "has_children": false, "want_children": true, "sexuality": "Straight", "drinking": "Yes", "smoking": "No", "marijuana": "No", "drugs": "No", "exercise": "Active"}, "summary": "Victoria Walsh is a 32-year-old straight woman located in Los Angeles, California. She is a software engineer in the technology industry and graduated from Columbia University. She is originally from Austin, Texas, and speaks three languages: English, Spanish, and French. She values honesty, kindness, creativity, and personal growth. Victoria enjoys outdoor activities, coding, photography, and reading. She is agnostic and politically liberal. She is seeking a long-term, monogamous relationship. She does not currently have children but is open to having them in the future. Victoria is a cat owner, and a Cancer by astrological sign. She is an INTJ according to the Myers-Briggs Type Indicator. Victoria sometimes drinks alcohol, and she does not smoke or use marijuana. Fitness is a part of her routine. She is interested in a man between the ages of 30 to 40 who is similarly active, a non-smoker, and open to having children.", "user_id": "1fd0014b-d596-483a-ad50-31b3549eaa68"}
{"name": "Alejandro Martinez", "age": 28, "height": "5'10\"", "school": "University of California, Los Angeles", "job_industry": "Finance", "job_title": "Investment Banker", "hometown_location": "Anaheim, California", "dating_location": "Los Angeles, California", "languages_spoken": ["English", "Spanish", "Portuguese"], "values": ["Family-oriented", "Career-driven", "Fitness"], "interests": ["Traveling", "Running", "Reading"], "education_level": "Graduate", "religious_beliefs": "Catholic", "politics": "Moderate", "dating_intentions": "Life partner", "relationship_type": "Monogamy", "gender": "Man", "pronouns": "He/Him/His", "sexuality": "Straight", "ethnicity": "Hispanic/Latino", "has_children": false, "want_children": true, "pets": ["Dog"], "zodiac_sign": "Gemini", "mbti_personality_type": "ENTJ", "drinking": "Sometimes", "smoking": "No", "marijuana": "No", "drugs": "No", "exercise": "Active", "partner_preferences": {"minimum_age": 24, "maximum_age": 30, "minimum_height": "5'2\"", "maximum_height": "5'10\"", "has_children": false, "want_children": true, "sexuality": "Straight", "drinking": "Sometimes", "smoking": "No", "marijuana": "No", "drugs": "No", "exercise": "Active"}, "summary": "Alejandro Martinez is a 28-year-old straight man residing in Los Angeles, California. He is an Investment Banker in the Finance industry, having graduated from University of California, Los Angeles. He is fluent in English, Spanish, and Portuguese. He identifies as Catholic and politically moderate. Alejandro is deeply driven by family values, his career, and fitness. He has interests in traveling, running, and reading. \n\nAlejandro is a Gemini, with an MBTI personality type of ENTJ and carries an active exercise habit. He occasionally drinks but does not smoke or use marijuana or any drugs. Having no children as of now, Alejandro is looking to have children in the future. He is a proud owner of a dog. \n\nFor a future partner, Alejandro is looking for a straight woman who is within the age range of 24-30 years and height of 5'2\" - 5'10\". He prefers someone who doesn’t smoke but drinks sometimes similar to himself. His prospective partner should share the same enthusiasm for fitness and also wish to have children in the future.", "user_id": "ace21faa-8c41-4892-bb50-c6b0c5238454"}
{"name": "Akeem Williams", "age": 30, "height": "6'2\"", "school": "Columbia University", "job_industry": "Information Technology", "job_title": "Software Developer", "hometown_location": "Brooklyn, New York", "dating_location": "Los Angeles, California", "languages_spoken": ["English", "Spanish"], "values": ["Honesty", "Independence"], "interests": ["Coding", "Basketball", "Traveling"], "education_level": "Graduate", "religious_beliefs": "Agnostic", "politics": "Liberal", "dating_intentions": "Long term", "relationship_type": "Monogamy", "gender": "Man", "pronouns": "He/Him/His", "sexuality": "Straight", "ethnicity": "Black African Descent", "has_children": false, "want_children": true, "pets": ["Dog"], "zodiac_sign": "Gemini", "mbti_personality_type": "ENFP", "drinking": "Sometimes", "smoking": "No", "marijuana": "No", "drugs": "No", "exercise": "Active", "partner_preferences": {"minimum_age": 24, "maximum_age": 34, "minimum_height": "5'4\"", "maximum_height": "6'0\"", "has_children": false, "want_children": true, "sexuality": "Straight", "drinking": "Yes", "smoking": "No", "marijuana": "No", "drugs": "No", "exercise": "Active"}, "summary": "Akeem Williams is a 30-year-old software developer living in Los Angeles, California. Originally from Brooklyn, New York, he is a graduate from Columbia University and can speak both English and Spanish. His interests include coding, basketball, and traveling. He is liberal-leaning, agnostic, doesn't smoke and drinks occasionally. He is an active individual who enjoys having dogs as pets. \n\nAkeem is seeking a straight romantic relationship with long-term dating intentions. He identifies as a straight man who uses \"he/him/his\" pronouns. Though he doesn't currently have children, he desires to have them in the future. The minimum and maximum age for his potential partner is 24 and 34 respectively. She should be between the height of 5'4\" and 6'0\", and also be interested in having children. He prefers a non-smoker who drinks occasionally and leads an active lifestyle. Akeem identifies his ethnic background as of Black African descent, and he falls under the Gemini zodiac sign. His MBTI personality type is ENFP.", "user_id": "54ee2441-e250-4dc8-a7ab-027e2446dcc0"}
{"name": "Kofi Nkrumah", "age": 30, "height": "6'1\"", "school": "New York University", "job_industry": "Finance", "job_title": "Financial Analyst", "hometown_location": "Accra, Ghana", "dating_location": "Los Angeles, California", "languages_spoken": ["English", "Twi"], "values": ["Education", "Family", "Success"], "interests": ["Traveling", "Cooking", "Reading", "Soccer"], "education_level": "Graduate", "religious_beliefs": "Christian", "politics": "Moderate", "dating_intentions": "Life partner", "relationship_type": "Monogamy", "gender": "Man", "pronouns": "He/Him/His", "sexuality": "Straight", "ethnicity": "Black African Descent", "has_children": false, "want_children": true, "pets": ["Dog"], "zodiac_sign": "Leo", "mbti_personality_type": "ENTJ", "drinking": "Yes", "smoking": "No", "marijuana": "No", "drugs": "No", "exercise": "Active", "partner_preferences": {"minimum_age": 25, "maximum_age": 35, "minimum_height": "5'2\"", "maximum_height": "6'2\"", "has_children": false, "want_children": true, "sexuality": "Straight", "drinking": "Yes", "smoking": "No", "marijuana": "No", "drugs": "No", "exercise": "Active"}, "summary": "Kofi Nkrumah is a 30-year-old Financial Analyst based in Los Angeles, California. Originally from Accra, Ghana, Kofi values education, family, and success. His various interests include traveling, cooking, reading, and soccer. While a Christian who leans politically moderate, he identifies as a straight man of Black African descent who uses the pronouns, he/him/his. \n\nThough he has no children, Kofi is interested in having some in the future. He enjoys the company of his dog, and in line with his personality type (ENTJ), he seeks a balanced lifestyle, actively exercising, but also indulging in the occasional drink. However, he does not smoke or use drugs. \n\nHis ideal partner would be a woman aged between 25-35. He hopes she would share his interest in a balanced lifestyle, staying active and practicing occasional drinking, but not smoking or using drugs. It would also be ideal if she doesn't currently have children but plans to in the future.", "user_id": "4417eb1b-e990-4f67-a18a-f410feaff850"}
{"name": "Hiroshi Takahashi", "age": 28, "height": "5'10\"", "school": "Kyoto University", "job_industry": "Technology", "job_title": "Software Engineer", "hometown_location": "Kyoto, Japan", "dating_location": "Los Angeles, California", "languages_spoken": ["Japanese", "English"], "values": ["Family", "Hard work", "Personal growth"], "interests": ["Cycling", "Gaming", "Anime", "Cooking"], "education_level": "Graduate", "religious_beliefs": "Buddhist", "politics": "Liberal", "dating_intentions": "Long term", "relationship_type": "Monogamy", "gender": "Man", "pronouns": "He/Him/His", "sexuality": "Straight", "ethnicity": "East Asian", "has_children": false, "want_children": true, "pets": ["None"], "zodiac_sign": "Virgo", "mbti_personality_type": "INTJ", "drinking": "Sometimes", "smoking": "No", "marijuana": "No", "drugs": "No", "exercise": "Active", "partner_preferences": {"minimum_age": 25, "maximum_age": 30, "minimum_height": "5'4\"", "maximum_height": "5'11\"", "has_children": false, "want_children": true, "sexuality": "Straight", "drinking": "Sometimes", "smoking": "No", "marijuana": "No", "drugs": "No", "exercise": "Sometimes"}, "summary": "Hiroshi Takahashi is a 28-year-old, straight man who is a Software Engineer in the technology industry. Originally from Kyoto, Japan, he's now located in Los Angeles, California. A graduate from Kyoto University, Hiroshi is fluent in English and Japanese, values family, hard work, and personal growth, and enjoys interests such as cycling, gaming, anime, and cooking.\n\nIdentifying as a Buddhist with liberal political views, Hiroshi is in search for a long-term and monogamous relationship. He doesn't have children but is open to having them in the future. As an active individual who sometimes drinks but doesn't smoke or use drugs, Hiroshi is a Virgo by the zodiac sign and identifies as an INTJ according to the MBTI personality type.\n\nHiroshi is interested in straight women between the ages of 25 and 30, who also value an active lifestyle, occasional drinking, and don't smoke or use drugs. His potential partner should also be open to having children in the future.\n", "user_id": "a715acc9-3a24-488a-98d9-956738541ce7"}
{"name": "Amelia Green", "age": 32, "height": "5'7\"", "school": "Yale University", "job_industry": "Healthcare", "job_title": "Nurse Practitioner", "hometown_location": "New York, New York", "dating_location": "Los Angeles, California", "languages_spoken": ["English", "Spanish"], "values": ["Health & Exercise", "Helping Others", "Career & Ambition"], "interests": ["Cooking", "Music", "Running"], "education_level": "Graduate", "religious_beliefs": "Christian", "politics": "Liberal", "dating_intentions": "Life partner", "relationship_type": "Monogamy", "gender": "Woman", "pronouns": "She/Her/Hers", "sexuality": "Straight", "ethnicity": "White Caucasian", "has_children": false, "want_children": true, "pets": ["Dog"], "zodiac_sign": "Libra", "mbti_personality_type": "ENFJ", "drinking": "Sometimes", "smoking": "No", "marijuana": "No", "drugs": "No", "exercise": "Active", "partner_preferences": {"minimum_age": 30, "maximum_age": 40, "minimum_height": "5'9\"", "maximum_height": "6'2\"", "has_children": false, "want_children": true, "sexuality": "Straight", "drinking": "Yes", "smoking": "No", "marijuana": "No", "drugs": "No", "exercise": "Active"}, "summary": "Amelia Green is a 32-year-old, 5'7\" tall woman who identifies as straight. She is an ambitious, healthcare-focused Nurse Practitioner. She is from New York, New York but is currently dating in Los Angeles, California. Being bilingual, she speaks both English and Spanish fluently. Her core values include health & exercise, helping others, and career ambitions.\n\nAmelia's interests are diverse, encompassing cooking, music, and running. She is a graduate of Yale University, identifies as a Christian and leans liberal politically. She doesn't have any children but is open to having them in the future. Amelia is fond of dogs and her zodiac sign is Libra. In terms of personal health habits, Amelia is an active individual who occasionally drinks but refrains from smoking, marijuana and other drugs.\n\nShe's seeking a life partner in a monogamous relationship, preferably a straight man between 30 to 40 years old who values health & exercise, doesn't smoke and is keen on having children.", "user_id": "939db7ed-c74b-43f4-b311-29d5867877ab"}
{"name": "Eliza Sinclair", "age": 30, "height": "5'6\"", "school": "Stanford University", "job_industry": "Technology", "job_title": "Software Engineer", "hometown_location": "Portland, Oregon", "dating_location": "Los Angeles, California", "languages_spoken": ["English", "Spanish"], "values": ["Honesty", "Respect", "Ambition", "Compassion"], "interests": ["Traveling", "Reading", "Outdoor Adventures", "Coding", "Cooking"], "education_level": "Graduate", "religious_beliefs": "Agnostic", "politics": "Liberal", "dating_intentions": "Long term", "relationship_type": "Monogamy", "gender": "Woman", "pronouns": "She/Her/Hers", "sexuality": "Straight", "ethnicity": "White Caucasian", "has_children": false, "want_children": true, "pets": ["Dog"], "zodiac_sign": "Gemini", "mbti_personality_type": "ENFP", "drinking": "Sometimes", "smoking": "No", "marijuana": "No", "drugs": "No", "exercise": "Active", "partner_preferences": {"minimum_age": 28, "maximum_age": 40, "minimum_height": "5'8\"", "maximum_height": "6'4\"", "has_children": false, "want_children": true, "sexuality": "Straight", "drinking": "Yes", "smoking": "No", "marijuana": "No", "drugs": "No", "exercise": "Active"}, "summary": "Eliza Sinclair is a 30-year-old Software Engineer based in Los Angeles, California, originally from Portland, Oregon. She holds a graduate degree from Stanford University and is fluent in English and Spanish. Eliza values honesty, respect, ambition, and compassion. In her free time, she enjoys traveling, reading, outdoor adventures, coding, and cooking. \n\nAs a woman who identifies as straight, she uses \"She/Her/Hers\" pronouns. Eliza is agnostic and leans liberal politically. She doesn’t smoke or use drugs, and consumes alcohol occasionally. She leads an active lifestyle and has a beloved dog.\n\nEliza is seeking a long-term, monogamous relationship with a man who shares similar values and interests. Her preference is for someone between the ages of 28 to 40, at least 5'8\" tall, who doesn't smoke or use drugs, and also leads an active lifestyle. Like her, he should be someone who doesn't have yet kids but would like to have them in the future.", "user_id": "206c7a81-8cf8-42f3-a8e7-43b378cada31"}
{"name": "Natasha Patel", "age": 28, "height": "5'6\"", "school": "University of Southern California", "job_industry": "Tech", "job_title": "Product Manager", "hometown_location": "Sacramento, California", "dating_location": "Los Angeles, California", "languages_spoken": ["English", "Hindi"], "values": ["Honesty", "Hard work", "Compassion"], "interests": ["Hiking", "Reading", "Cooking", "Travel"], "education_level": "Graduate", "religious_beliefs": "Hindu", "politics": "Liberal", "dating_intentions": "Long term", "relationship_type": "Monogamy", "gender": "Woman", "pronouns": "She/Her/Hers", "sexuality": "Straight", "ethnicity": "South Asian", "has_children": false, "want_children": true, "pets": ["None"], "zodiac_sign": "Virgo", "mbti_personality_type": "ENFP", "drinking": "Sometimes", "smoking": "No", "marijuana": "No", "drugs": "No", "exercise": "Active", "partner_preferences": {"minimum_age": 27, "maximum_age": 35, "minimum_height": "5'8\"", "maximum_height": "6'2\"", "has_children": false, "want_children": true, "sexuality": "Straight", "drinking": "Yes", "smoking": "No", "marijuana": "No", "drugs": "No", "exercise": "Active"}, "summary": "Natasha Patel is a 28-year-old Product Manager in the tech industry, based in Los Angeles but originally from Sacramento, California. Educated at the University of Southern California, she values honesty, hard work, and compassion. Natasha enjoys hiking, reading, cooking, and traveling. She speaks English and Hindi, and identifies herself as Hindu and politically liberal. She is interested in a long-term, monogamous relationship. Natasha does not have children, but wants them in the future. She doesn't have any pets currently. Being health-conscious, she is active and refrains from smoking, while occasionally enjoys a drink. Her age preference for a partner lies between 27 and 35. Similar to herself, she prefers her partner to be active, a non-smoker, and someone who is interested in having children. She is a straight, South Asian woman, and respects Virgo qualities and as an ENFP in the MBTI personality type.", "user_id": "e29bdf42-ba06-453e-91e9-ae5bb1d748d3"}
{"name": "Gautam Sharma", "age": 34, "height": "6'0\"", "school": "University of Mumbai", "job_industry": "Finance", "job_title": "Financial Analyst", "hometown_location": "Mumbai, India", "dating_location": "Los Angeles, California", "languages_spoken": ["English", "Hindi", "Marathi"], "values": ["Honesty", "Respect", "Communication"], "interests": ["Traveling", "Gym", "Reading"], "education_level": "Graduate", "religious_beliefs": "Hindu", "politics": "Not political", "dating_intentions": "Life partner", "relationship_type": "Monogamy", "gender": "Man", "pronouns": "He/Him/His", "sexuality": "Straight", "ethnicity": "South Asian", "has_children": false, "want_children": true, "pets": ["None"], "zodiac_sign": "Leo", "mbti_personality_type": "ENTJ", "drinking": "Sometimes", "smoking": "No", "marijuana": "No", "drugs": "No", "exercise": "Active", "partner_preferences": {"minimum_age": 25, "maximum_age": 35, "minimum_height": "5'3\"", "maximum_height": "6'0\"", "has_children": false, "want_children": true, "sexuality": "Straight", "drinking": "Sometimes", "smoking": "No", "marijuana": "No", "drugs": "No", "exercise": "Active"}, "summary": "Gautam Sharma, a 34 year old financial analyst originally from Mumbai, India now living in Los Angeles, is looking to find a life partner. As a straight male with South Asian ethnicity and respect for his Hindu faith, he values honesty, communication, and respect. Fluent in English, Hindi, and Marathi, he enjoys traveling, hitting the gym and reading.\n\nCurrently, Gautam does not have any children, but hopes to have some in the future. He enjoys an active lifestyle and prefers an occasional drink, while abstaining from smoking, marijuana and drugs. Based on his preference, a suitable partner would be a straight woman between the ages of 25-35, who leads an active lifestyle, enjoys moderate drinking, and does not smoke. Future children is something he hopes for in a relationship, indicating that he is looking for a long-term commitment.", "user_id": "2cac1fa1-9c02-4953-ac82-976ec1f4e678"}
{"name": "Millie Nicholson", "age": 27, "height": "5'6\"", "school": "University of California", "job_industry": "Technology", "job_title": "Software Engineer", "hometown_location": "San Francisco, California", "dating_location": "Los Angeles, California", "languages_spoken": ["English", "Spanish"], "values": ["Trustworthiness", "Kindness", "Compassion"], "interests": ["Cooking", "Reading", "Hiking"], "education_level": "Graduate", "religious_beliefs": "Agnostic", "politics": "Liberal", "dating_intentions": "Long term", "relationship_type": "Monogamy", "gender": "Woman", "pronouns": "She/Her/Hers", "sexuality": "Straight", "ethnicity": "White Caucasian", "has_children": false, "want_children": true, "pets": ["Cat"], "zodiac_sign": "Gemini", "mbti_personality_type": "ENFJ", "drinking": "Sometimes", "smoking": "No", "marijuana": "No", "drugs": "No", "exercise": "Active", "partner_preferences": {"minimum_age": 26, "maximum_age": 35, "minimum_height": "5'0\"", "maximum_height": "6'2\"", "has_children": false, "want_children": true, "sexuality": "Straight", "drinking": "Sometimes", "smoking": "No", "marijuana": "No", "drugs": "No", "exercise": "Active"}, "summary": "Millie Nicholson is a 27 year old woman, standing 5'6\" tall and working as a Software Engineer in the technology industry in Los Angeles, California. She is a graduate from the University of California and is fluent in English and Spanish. Her hobbies include cooking, reading, and hiking and values trustworthiness, kindness, and compassion. Millie identifies herself as agnostic and leans towards liberal politics. She's interested in long-term monogamous dating. She doesn't have children but would like to have some in the future, and owns a cat. She's a Gemini and an ENFJ personality type. Millie only drinks occasionally and doesn't smoke or take drugs. She is an active person.\n\nAs for her partner, Millie prefers someone within the age range of 26 to 35 years old, with a height between 5'0\" and 6'2\". She would like her partner to not have children currently but be open to having them in the future. Millie prefers a partner who doesn't smoke or take drugs, but drinking occasionally is fine. She is looking for an equally active person.", "user_id": "0e019049-2a6a-4e23-843d-f07f09472269"}
{"name": "Isaac Voss", "age": 29, "height": "6'1\"", "school": "University of California, Berkeley", "job_industry": "Tech", "job_title": "Software Engineer", "hometown_location": "Omaha, Nebraska", "dating_location": "Los Angeles, California", "languages_spoken": ["English", "Spanish"], "values": ["Hard work", "Openness", "Creativity", "Passion for technology", "Lifelong Learning"], "interests": ["Cycling", "Reading", "Programming", "Traveling", "Cooking"], "education_level": "Graduate", "religious_beliefs": "Atheist", "politics": "Liberal", "dating_intentions": "Long term", "relationship_type": "Monogamy", "gender": "Man", "pronouns": "He/Him/His", "sexuality": "Straight", "ethnicity": "White Caucasian", "has_children": false, "want_children": true, "pets": ["Dog"], "zodiac_sign": "Gemini", "mbti_personality_type": "INTJ", "drinking": "Sometimes", "smoking": "No", "marijuana": "No", "drugs": "No", "exercise": "Active", "partner_preferences": {"minimum_age": 24, "maximum_age": 35, "minimum_height": "5'4\"", "maximum_height": "6'0\"", "has_children": false, "want_children": true, "sexuality": "Straight", "drinking": "Yes", "smoking": "No", "marijuana": "No", "drugs": "No", "exercise": "Active"}, "summary": "Isaac Voss is a 29-year-old straight man who is currently living in Los Angeles, California. Originally from Omaha, Nebraska, Isaac is a dedicated Software Engineer working in the tech industry. An alumnus of the University of California, Berkeley, Isaac believes in lifelong learning and values hard work, openness, and creativity.\n\nIn his free time, Isaac enjoys cycling, reading, coding, travelling, and exploring culinary delights. He's a Gemini and his Myers-Briggs personality type is INTJ. As a monogamist, he is looking for a long-term relationship. He does not have children yet but hopes to have them in the future. He owns a dog and is quite active when it comes to physical fitness. Despite being an atheist and politically liberal, Isaac is open-minded and respectful of others' beliefs and perspectives. \n\nWhile Isaac does enjoy a drink occasionally, he does not smoke or use marijuana or other drugs. His ideal partner should also be active, a non-smoker, and someone who likewise wishes to have children in future. He prefers his partner to be between 24 and 35 years old.", "user_id": "6d47f49d-c718-4f00-97d1-0436272b83ef"}
{"name": "Aliyah Mohammed", "age": 28, "height": "5'6\"", "school": "University of California, Los Angeles", "job_industry": "Healthcare", "job_title": "Registered Nurse", "hometown_location": "Detroit, Michigan", "dating_location": "Los Angeles, California", "languages_spoken": ["English", "Arabic"], "values": ["Family", "Career", "Faith"], "interests": ["Cooking", "Traveling", "Volunteering", "Yoga"], "education_level": "Graduate", "religious_beliefs": "Muslim", "politics": "Moderate", "dating_intentions": "Life partner", "relationship_type": "Monogamy", "gender": "Woman", "pronouns": "She/Her/Hers", "sexuality": "Straight", "ethnicity": "Middle Eastern", "has_children": false, "want_children": true, "pets": ["Cat"], "zodiac_sign": "Scorpio", "mbti_personality_type": "ISFJ", "drinking": "No", "smoking": "No", "marijuana": "No", "drugs": "No", "exercise": "Active", "partner_preferences": {"minimum_age": 28, "maximum_age": 36, "minimum_height": "5'8\"", "maximum_height": "6'3\"", "has_children": false, "want_children": true, "sexuality": "Straight", "drinking": "No", "smoking": "No", "marijuana": "No", "drugs": "No", "exercise": "Active"}, "summary": "Aliyah Mohammed is a 28-year-old Registered Nurse based in Los Angeles, California, originally from Detroit, Michigan. She is a graduate of the University of California, Los Angeles, and works in the healthcare industry. She presents herself as a family-oriented, career-focused and faithful Muslim woman. She enjoys cooking, traveling, volunteering, and yoga in her spare time. She is straight, identifies as Middle Eastern, and uses she/her pronouns. Aliyah does not currently have children, but is open to having them in the future. She owns a pet cat, is a Scorpio, and identifies as an ISFJ personality type. She lives an active lifestyle and abstains from drinking, smoking, marijuana, and drugs use. She is seeking a straight man aged between 28 to 36 who leads a healthy lifestyle, intends to have children, and shares her non-drug/no-smoking preferences.", "user_id": "9336996f-6c93-4d27-bcb0-f896362b7d5a"}
{"name": "Malaika Jabari", "age": 28, "height": "5'6\"", "school": "University of Nairobi", "job_industry": "Healthcare", "job_title": "Pediatrician", "hometown_location": "Nairobi, Kenya", "dating_location": "Los Angeles, California", "languages_spoken": ["English", "Swahili", "French"], "values": ["Family", "Health", "Career", "Faith"], "interests": ["Cooking", "Travel", "Photography", "Yoga"], "education_level": "Doctoral", "religious_beliefs": "Muslim", "politics": "Moderate", "dating_intentions": "Life partner", "relationship_type": "Monogamy", "gender": "Woman", "pronouns": "She/Her/Hers", "sexuality": "Straight", "ethnicity": "Black African Descent", "has_children": false, "want_children": true, "pets": ["Cat", "Fish"], "zodiac_sign": "Virgo", "mbti_personality_type": "INFJ", "drinking": "No", "smoking": "No", "marijuana": "No", "drugs": "No", "exercise": "Active", "partner_preferences": {"minimum_age": 28, "maximum_age": 35, "minimum_height": "5'8\"", "maximum_height": "6'4\"", "has_children": false, "want_children": true, "sexuality": "Straight", "drinking": "No", "smoking": "No", "marijuana": "No", "drugs": "No", "exercise": "Active"}, "summary": "Malaika Jabari is a 28-year-old pediatrician from Nairobi, Kenya, currently living in Los Angeles, California. She stands at 5'6\" and values her family, health, career, and faith. Her interests include cooking, traveling, photography, and practicing yoga. \n\nMalaika is a university graduate with a doctoral degree, identifies as a Muslim, and has moderate political beliefs. She is interested in finding a life partner and prefers monogamous relationships. Her preferred pronouns are she/her/hers, and she identifies as a straight woman of Black African descent. \n\nShe does not have children yet but plans to in the future. She is a proud pet owner of a cat and some fish. Malaika is a Virgo and is categorized as an INFJ in the MBTI personality type framework. \n\nShe lives a healthy lifestyle - she doesn't smoke, drink, or use marijuana or any other drugs, and she also maintains an active fitness regime. \n\nShe's looking for a partner between 28 and 35 years old, who doesn't smoke or drink, and maintains an active lifestyle like herself. Her ideal partner should also want children in the future.", "user_id": "ee0d7ec3-2ef2-449c-bdcf-f51db34b5973"}
{"name": "Henry Davis", "age": 33, "height": "6'0\"", "school": "University of Pennsylvania", "job_industry": "Technology", "job_title": "Software Engineer", "hometown_location": "Philadelphia, Pennsylvania", "dating_location": "Los Angeles, California", "languages_spoken": ["English", "Spanish"], "values": ["Honesty", "Family", "Personal Growth"], "interests": ["Movies", "Outdoor activities", "Programming", "Meditation"], "education_level": "Graduate", "religious_beliefs": "Agnostic", "politics": "Moderate", "dating_intentions": "Long term", "relationship_type": "Monogamy", "gender": "Man", "pronouns": "He/Him/His", "sexuality": "Straight", "ethnicity": "White Caucasian", "has_children": false, "want_children": true, "pets": ["Dog"], "zodiac_sign": "Taurus", "mbti_personality_type": "INTJ", "drinking": "Sometimes", "smoking": "No", "marijuana": "No", "drugs": "No", "exercise": "Active", "partner_preferences": {"minimum_age": 27, "maximum_age": 35, "minimum_height": "5'3\"", "maximum_height": "6'0\"", "has_children": false, "want_children": true, "sexuality": "Straight", "drinking": "Yes", "smoking": "No", "marijuana": "No", "drugs": "No", "exercise": "Active"}, "summary": "Henry Davis is a 33-year-old Software Engineer who values honesty, family, and personal growth. He is an active individual standing 6 feet tall. He cultivates numerous interests like movies, outdoor activities, programming and meditation. He identifies as a man, uses he/him/his pronouns, and is straight. An agnostic, he leans politically moderate. Originally from Philadelphia, Pennsylvania, he currently lives in Los Angeles, California.\n\nHe is fluent in English and Spanish and holds a graduate degree from the University of Pennsylvania. Identifying as a monogamous white Caucasian, he is interested in a long-term relationship and has the intention of having children, although he doesn't have any currently.\n\nHe's a dog-lover, sometimes enjoys drinking but does not smoke, use marijuana, or other drugs. He's a Taurus and an INTJ personality type. The kind of person he's interested in dating should be a woman, straight, between the ages of 27 and 35, active, and share similar intentions about wanting children. She should be a drinker but preferably shouldn't smoke, use marijuana, or other drugs.", "user_id": "541e9917-77c7-411b-9c8f-11d61296a3e8"}
{"name": "Keiko Yamamoto", "age": 30, "height": "5'4\"", "school": "University of Tokyo", "job_industry": "Technology", "job_title": "Software Developer", "hometown_location": "Tokyo, Japan", "dating_location": "Los Angeles, California", "languages_spoken": ["Japanese", "English"], "values": ["Honesty", "Hard work", "Creativity"], "interests": ["Coding", "Anime", "Hiking", "Yoga", "Cooking"], "education_level": "Graduate", "religious_beliefs": "Buddhist", "politics": "Liberal", "dating_intentions": "Long term", "relationship_type": "Monogamy", "gender": "Woman", "pronouns": "She/Her/Hers", "sexuality": "Straight", "ethnicity": "East Asian", "has_children": false, "want_children": true, "pets": ["Cat"], "zodiac_sign": "Pisces", "mbti_personality_type": "ISFJ", "drinking": "Yes", "smoking": "No", "marijuana": "No", "drugs": "No", "exercise": "Active", "partner_preferences": {"minimum_age": 28, "maximum_age": 35, "minimum_height": "5'6\"", "maximum_height": "6'1\"", "has_children": false, "want_children": true, "sexuality": "Straight", "drinking": "Yes", "smoking": "No", "marijuana": "No", "drugs": "No", "exercise": "Active"}, "summary": "Keiko Yamamoto is a 30-year-old software developer living in Los Angeles, California. Originally from Tokyo, Japan, she is well-educated, having graduated from the University of Tokyo. She takes pride in her work and values honesty, hard work, and creativity. Keiko enjoys a variety of activities, from coding and watching anime to hiking, yoga, and cooking. She identifies as a liberal, Buddhist woman and is fluent in both Japanese and English.\n\nKeiko is seeking a long-term, monogamous relationship and hopes to have children in the future. She shares her life currently with a pet cat. Even though Keiko is a social drinker, she doesn't smoke. She lives an active lifestyle and prefers her partner does the same. She is looking for a straight male partner between the ages of 28 and 35, who does not have children but also shares her wish to have them in the future.", "user_id": "98bf03b4-74b2-4078-967a-31c522d77f37"}
{"name": "Jason Carrington", "age": 32, "height": "6'1\"", "school": "Stanford University", "job_industry": "Technology", "job_title": "Software Engineer", "hometown_location": "San Francisco, California", "dating_location": "Los Angeles, California", "languages_spoken": ["English", "Spanish"], "values": ["Compassion", "Honesty", "Ambition"], "interests": ["Traveling", "Cooking", "Reading"], "education_level": "Graduate", "religious_beliefs": "Agnostic", "politics": "Moderate", "dating_intentions": "Long term", "relationship_type": "Monogamy", "gender": "Man", "pronouns": "He/Him/His", "sexuality": "Straight", "ethnicity": "White Caucasian", "has_children": false, "want_children": true, "pets": ["Cat"], "zodiac_sign": "Aries", "mbti_personality_type": "ISTJ", "drinking": "Sometimes", "smoking": "No", "marijuana": "No", "drugs": "No", "exercise": "Active", "partner_preferences": {"minimum_age": 26, "maximum_age": 35, "minimum_height": "5'4\"", "maximum_height": "6'0\"", "has_children": false, "want_children": true, "sexuality": "Straight", "drinking": "Sometimes", "smoking": "No", "marijuana": "No", "drugs": "No", "exercise": "Active"}, "summary": "Jason Carrington is a 32-year old straight man from San Francisco, California, who is currently living in Los Angeles. He is a successful software engineer in the technology industry and a Stanford University graduate. Fluent in English and Spanish, Jason values compassion, honesty, and ambition. He enjoys traveling, cooking, and reading in his spare time. \n\nOn a personal level, he identifies as Agnostic and politically moderate. Although he doesn't have any children, he hopes to become a father in the future. Jason is a cat owner who hardly drinks and doesn't smoke or use any sort of drugs. \n\nAs an active, health-conscious individual, he is looking for a long-term, monogamous relationship with a straight woman aged between 26 and 35 who shares similar lifestyle habits and values. This includes a preference for someone who doesn't smoke, has no children but wants them in the future, and enjoys an active lifestyle.", "user_id": "04b15de3-83a3-4313-8313-c4a930b774ae"}
{"name": "Charlotte Griffin", "age": 28, "height": "5'7\"", "school": "Columbia University", "job_industry": "Healthcare", "job_title": "Registered Nurse", "hometown_location": "Syracuse, New York", "dating_location": "Los Angeles, California", "languages_spoken": ["English", "Spanish"], "values": ["Compassion", "Creativity", "Family importance", "Spirituality"], "interests": ["Art Museums", "Running and Fitness", "Photography", "Travel"], "education_level": "Graduate", "religious_beliefs": "Christian", "politics": "Liberal", "dating_intentions": "Long term", "relationship_type": "Monogamy", "gender": "Woman", "pronouns": "She/Her/Hers", "sexuality": "Straight", "ethnicity": "White Caucasian", "has_children": false, "want_children": true, "pets": ["Dog"], "zodiac_sign": "Cancer", "mbti_personality_type": "INFJ", "drinking": "Sometimes", "smoking": "No", "marijuana": "No", "drugs": "No", "exercise": "Active", "partner_preferences": {"minimum_age": 28, "maximum_age": 35, "minimum_height": "5'8\"", "maximum_height": "6'3\"", "has_children": false, "want_children": true, "sexuality": "Straight", "drinking": "Sometimes", "smoking": "No", "marijuana": "No", "drugs": "No", "exercise": "Active"}, "summary": "Charlotte Griffin is a 28-year-old, compassionate, and creative Registered Nurse based in Los Angeles, California. Originally from Syracuse, New York, she's a Graduate from Columbia University and values her family, spirituality, creativity, and compassion. \n\nShe is fluent in English and Spanish and enjoys visiting art museums, fitness, photography, and traveling. Charlotte identifies as a Christian, is politically liberal, interested in a long-term relationship, and practices monogamy. \n\nShe is a woman, uses she/her pronouns, identifies as straight, and is of White Caucasian ethnicity. She currently doesn't have children but wishes to have some in the future. She is a dog lover and enjoys staying active. \n\nCharlotte's ideal partner would be a straight man aged between 28 and 35 who shares her interests, is active, does not smoke and is open to the idea of having children. Drinking is acceptable on occasion.", "user_id": "40e35995-f42a-490f-91c2-8980b7649825"}
{"name": "Sanjay Patel", "age": 35, "height": "5'11\"", "school": "University of Mumbai", "job_industry": "Information Technology", "job_title": "Software Engineering Manager", "hometown_location": "Mumbai, India", "dating_location": "Los Angeles, California", "languages_spoken": ["English", "Hindi"], "values": ["Hard work", "Family", "Personal growth"], "interests": ["Coding", "Hiking", "Meditation", "Reading"], "education_level": "Graduate", "religious_beliefs": "Hindu", "politics": "Liberal", "dating_intentions": "Life partner", "relationship_type": "Monogamy", "gender": "Man", "pronouns": "He/Him/His", "sexuality": "Straight", "ethnicity": "South Asian", "has_children": false, "want_children": true, "pets": ["None"], "zodiac_sign": "Virgo", "mbti_personality_type": "INTJ", "drinking": "Sometimes", "smoking": "No", "marijuana": "No", "drugs": "No", "exercise": "Active", "partner_preferences": {"minimum_age": 28, "maximum_age": 40, "minimum_height": "5'0\"", "maximum_height": "6'0\"", "has_children": false, "want_children": true, "sexuality": "Straight", "drinking": "No", "smoking": "No", "marijuana": "No", "drugs": "No", "exercise": "Active"}, "summary": "Sanjay Patel is a 35-year old man living in Los Angeles, California. He hails from Mumbai, India and works in the IT industry as a Software Engineering Manager. He attended the University of Mumbai and values hard work, family, and personal growth. Sanjay is bilingual, speaking both English and Hindi. His interests include coding, hiking, meditation, and reading. He practices Hindu by religion and identifies politically as a liberal. He's seeking a life partner in a monogamous relationship. As a straight man, he is looking for a straight woman between the ages of 28 and 40, who does not have children but would like to have some in the future. His potential partner should be a non-smoker and non-drinker, or only drinks occasionally, and someone who maintains an active lifestyle. Sanjay does not have any pets, he's a Virgo, and an INTJ on the Myers-Briggs personality scale.", "user_id": "468e634c-d824-4291-b5ab-fb58210dd004"}
{"name": "Claire Mitchell", "age": 27, "height": "5'7\"", "school": "University of Southern California", "job_industry": "Technology", "job_title": "Software Engineer", "hometown_location": "Seattle, Washington", "dating_location": "Los Angeles, California", "languages_spoken": ["English", "Spanish"], "values": ["Integrity", "Empathy", "Equality"], "interests": ["Technology", "Nature", "Hiking", "Vegan Cooking", "Reading"], "education_level": "Graduate", "religious_beliefs": "Agnostic", "politics": "Moderate", "dating_intentions": "Long term", "relationship_type": "Monogamy", "gender": "Woman", "pronouns": "She/Her/Hers", "sexuality": "Straight", "ethnicity": "White Caucasian", "has_children": false, "want_children": true, "pets": ["Cat"], "zodiac_sign": "Gemini", "mbti_personality_type": "INFJ", "drinking": "Sometimes", "smoking": "No", "marijuana": "No", "drugs": "No", "exercise": "Active", "partner_preferences": {"minimum_age": 26, "maximum_age": 35, "minimum_height": "5'8\"", "maximum_height": "6'2\"", "has_children": false, "want_children": true, "sexuality": "Straight", "drinking": "Sometimes", "smoking": "No", "marijuana": "No", "drugs": "No", "exercise": "Active"}, "summary": "Claire Mitchell is a 27-year-old Software Engineer working in the tech industry and living in Los Angeles, California. She's originally from Seattle, Washington. She speaks English and Spanish and values integrity, empathy, and equality. \n\nClaire has a keen interest in technology, nature, hiking, vegan cooking, and reading. She holds a graduate degree from the University of Southern California and identifies as agnostic. Politically, she is moderate. \n\nShe is interested in a long-term, monogamous relationship and uses she/her pronouns. Claire identifies as straight, is white Caucasian, and she doesn't have children but is open to having them in the future. Claire owns a cat and is a Gemini with an INFJ personality type as per the MBTI. \n\nShe indulges in drinking sometimes but does not smoke or use marijuana and drugs. Her exercise regimen is active. \n\nClaire is seeking a straight male partner aged between 26 and 35 years. She prefers her partner to be a non-smoker, sporadic drinker, and someone who doesn't use marijuana or drugs. They should exercise regularly, be childless but open to having children in the future. Her preferred height range for her partner is between 5'8\" and 6'2\".\n", "user_id": "b4ce4c6c-1dee-402c-90f5-27581b403ba0"}
{"name": "Emmanuel Okoye", "age": 32, "height": "6'2\"", "school": "Harvard University", "job_industry": "Tech", "job_title": "Software Engineer", "hometown_location": "Abuja, Nigeria", "dating_location": "Los Angeles, California", "languages_spoken": ["English", "Igbo"], "values": ["Family", "Career Progress", "Kindness"], "interests": ["Running", "Codejam", "Traveling", "Cooking"], "education_level": "Graduate", "religious_beliefs": "Christian", "politics": "Moderate", "dating_intentions": "Long term", "relationship_type": "Monogamy", "gender": "Man", "pronouns": "He/Him/His", "sexuality": "Straight", "ethnicity": "Black African Descent", "has_children": false, "want_children": true, "pets": ["Dog"], "zodiac_sign": "Virgo", "mbti_personality_type": "INTJ", "drinking": "Sometimes", "smoking": "No", "marijuana": "No", "drugs": "No", "exercise": "Active", "partner_preferences": {"minimum_age": 25, "maximum_age": 35, "minimum_height": "5'4\"", "maximum_height": "6'0\"", "has_children": false, "want_children": true, "sexuality": "Straight", "drinking": "Yes", "smoking": "No", "marijuana": "No", "drugs": "No", "exercise": "Active"}, "summary": "Emmanuel Okoye is a 32 year old, ambitious software engineer working in tech, currently located in Los Angeles, California. Originally from Abuja, Nigeria, he is a graduate from Harvard University who values family, career progress, and kindness. \n\nIn his free time, he enjoys running, coding, traveling, and cooking. Politically, he identifies as a moderate and, in terms of religion, he is a Christian. Emmanuel is interested in long-term, monogamous relationships. He identifies as a man, uses he/him pronouns, and is straight. Ethnicity-wise, he is of the Black African descent. \n\nHe does not have children currently but wishes to have some in the future. He loves dogs and has one as a pet. Emmanuel occasionally drinks but does not smoke or use marijuana or other drugs. When it comes to lifestyle, he is quite active. As a virgo, the 'INTJ' is his MBTI personality type.\n\nIn terms of a partner, he is looking for a woman aged between 25 and 35 who also desires children. The ideal partner would also be active, able to occasionally enjoy a drink but does not smoke or use recreational drugs.", "user_id": "45b8c7b7-ba65-4a30-a7c1-347bdfabeb0e"}
