{
    "name": "Victoria Walsh",
    "age": 32,
    "height": "5'6\"",
    "school": "Columbia University",
    "job_industry": "Technology",
    "job_title": "Software Engineer",
    "hometown_location": "Austin, Texas",
    "dating_location": "Los Angeles, California",
    "languages_spoken": [
        "English",
        "Spanish",
        "French"
    ],
    "values": [
        "Honesty",
        "Kindness",
        "Creativity",
        "Personal growth"
    ],
    "interests": [
        "Outdoor activities",
        "Coding",
        "Photography",
        "Reading"
    ],
    "education_level": "Graduate",
    "religious_beliefs": "Agnostic",
    "politics": "Liberal",
    "dating_intentions": "Long term",
    "relationship_type": "Monogamy",
    "gender": "Woman",
    "pronouns": "She/Her/Hers",
    "sexuality": "Straight",
    "ethnicity": "White Caucasian",
    "has_children": false,
    "want_children": true,
    "pets": [
        "Cat"
    ],
    "zodiac_sign": "Cancer",
    "mbti_personality_type": "INTJ",
    "drinking": "Sometimes",
    "smoking": "No",
    "marijuana": "No",
    "drugs": "No",
    "exercise": "Active",
    "partner_preferences": {
        "minimum_age": 30,
        "maximum_age": 40,
        "minimum_height": "5'8\"",
        "maximum_height": "6'4\"",
        "has_children": false,
        "want_children": true,
        "sexuality": "Straight",
        "drinking": "Yes",
        "smoking": "No",
        "marijuana": "No",
        "drugs": "No",
        "exercise": "Active"
    },
    "summary": "Victoria Walsh is a 32-year-old straight woman located in Los Angeles, California. She is a software engineer in the technology industry and graduated from Columbia University. She is originally from Austin, Texas, and speaks three languages: English, Spanish, and French. She values honesty, kindness, creativity, and personal growth. Victoria enjoys outdoor activities, coding, photography, and reading. She is agnostic and politically liberal. She is seeking a long-term, monogamous relationship. She does not currently have children but is open to having them in the future. Victoria is a cat owner, and a Cancer by astrological sign. She is an INTJ according to the Myers-Briggs Type Indicator. Victoria sometimes drinks alcohol, and she does not smoke or use marijuana. Fitness is a part of her routine. She is interested in a man between the ages of 30 to 40 who is similarly active, a non-smoker, and open to having children.",
    "user_id": "1fd0014b-d596-483a-ad50-31b3549eaa68"
}
