{
    "name": "Alyssa Tan",
    "age": 28,
    "height": "5'6\"",
    "school": "University of California, Los Angeles",
    "job_industry": "Technology",
    "job_title": "Software Engineer",
    "hometown_location": "San Francisco, California",
    "dating_location": "Los Angeles, California",
    "languages_spoken": [
        "English",
        "Mandarin"
    ],
    "values": [
        "Honesty",
        "Ambition",
        "Kindness"
    ],
    "interests": [
        "Coding",
        "Traveling",
        "Reading",
        "Hiking"
    ],
    "education_level": "Graduate",
    "religious_beliefs": "Agnostic",
    "politics": "Liberal",
    "dating_intentions": "Long term",
    "relationship_type": "Monogamy",
    "gender": "Woman",
    "pronouns": "She/Her/Hers",
    "sexuality": "Straight",
    "ethnicity": "East Asian",
    "has_children": false,
    "want_children": true,
    "pets": [
        "Cat"
    ],
    "zodiac_sign": "Taurus",
    "mbti_personality_type": "INTJ",
    "drinking": "Yes",
    "smoking": "No",
    "marijuana": "No",
    "drugs": "No",
    "exercise": "Active",
    "partner_preferences": {
        "minimum_age": 28,
        "maximum_age": 35,
        "minimum_height": "5'9\"",
        "maximum_height": "6'3\"",
        "has_children": false,
        "want_children": true,
        "sexuality": "Straight",
        "drinking": "Yes",
        "smoking": "No",
        "marijuana": "No",
        "drugs": "No",
        "exercise": "Active",
        "gender": "Man",
        "dating_intentions": "Long term",
        "relationship_type": "Monogamy",
        "ethnicities": [
            "East Asian",
            "White Caucasian",
            "Black African Descent",
            "Hispanic/Latino"
        ],
        "politics": [
            "Liberal"
        ],
        "job_industry": [
            "Technology",
            "Finance",
            "Engineering"
        ],
        "languages_spoken": [
            "English"
        ],
        "values": [
            "Honesty",
            "Ambition",
            "Kindness"
        ],
        "interests": [
            "Technology",
            "Traveling",
            "Sports"
        ],
        "education_level": [
            "Graduate",
            "Doctoral"
        ]
    },
    "profile_summary": "The user is a 28-year-old East Asian woman who is 5'6\" tall. She identifies as straight and uses the pronouns She/Her/Hers. She's a graduate from the University of California, Los Angeles and currently works as a Software Engineer in the technology industry. Although she hails from San Francisco, California, she now resides in Los Angeles, California. English and Mandarin are her spoken languages. In terms of personal values, she holds honesty, ambition, and kindness in high regard. She enjoys coding, travelling, reading and hiking. Her education experience is of a graduate level, she identifies as agnostic and is politically liberal. She's looking for a long-term monogamous relationship. She has no children at present but intends to have some in the future. She has a cat and is a Taurus as per her zodiac sign. Her Myers-Briggs Type Indicator (MBTI) personality type is INTJ. She drinks socially but does not use tobacco, marijuana or other drugs. She leads an active lifestyle.\n",
    "preferences_summary": "The user is looking for a man aged between 28 and 35 years, who is at least 5'9'' and at most 6'3'' in height. The potential partner should not have children currently, but should want children in the future. She prefers a straight, active, non-smoking man who enjoys a drink but doesn't use marijuana or drugs. He should be interested in a long-term, monogamous relationship and his ethnic background can be East Asian, White Caucasian, Black African Descent, or Hispanic/Latino. Her partner should be politically liberal, and work in the technology, finance, or engineering industries. English should be his spoken language and he should value honesty, ambition, and kindness. His interests should align with technology, travelling, and sports, and his educational level should be either a graduate or doctoral degree.",
    "user_id": "60822b5f-1ab3-472e-b4aa-780123e70a89"
}
