{
    "name": "Leila El-Masri",
    "age": 28,
    "height": "5'4\"",
    "school": "University of California, Berkeley",
    "job_industry": "Technology",
    "job_title": "Software Developer",
    "hometown_location": "Cupertino, California",
    "dating_location": "Los Angeles, California",
    "languages_spoken": [
        "English",
        "Arabic"
    ],
    "values": [
        "Family",
        "Independence",
        "Creativity"
    ],
    "interests": [
        "Coding",
        "Hiking",
        "Traveling"
    ],
    "education_level": "Graduate",
    "religious_beliefs": "Muslim",
    "politics": "Liberal",
    "dating_intentions": "Long term",
    "relationship_type": "Monogamy",
    "gender": "Woman",
    "pronouns": "She/Her/Hers",
    "sexuality": "Straight",
    "ethnicity": "Middle Eastern",
    "has_children": false,
    "want_children": true,
    "pets": [
        "None"
    ],
    "zodiac_sign": "Scorpio",
    "mbti_personality_type": "INFJ",
    "drinking": "No",
    "smoking": "No",
    "marijuana": "No",
    "drugs": "No",
    "exercise": "Active",
    "partner_preferences": {
        "minimum_age": 28,
        "maximum_age": 35,
        "minimum_height": "5'10\"",
        "maximum_height": "6'4\"",
        "has_children": false,
        "want_children": true,
        "sexuality": "Straight",
        "drinking": "No",
        "smoking": "No",
        "marijuana": "No",
        "drugs": "No",
        "exercise": "Active"
    },
    "summary": "Leila El-Masri is a 28-year-old,5'4\" tall, software developer based in Los Angeles, California. She is a graduate from the University of California, Berkeley and identifies as a straight woman. Her pronouns are She/Her/Hers and she is Middle Eastern. \n\nShe is fluent in English and Arabic, holds liberal political views, and follows Islamic religious beliefs. Leila has mentioned her values to be Family, Independence, and Creativity. She enjoys Coding, Hiking, and traveling, engages in active exercises, and does not have any pets. \n\nLeila is a Scorpio and identifies her personality type as INFJ based on the MBTI scale. She is a non-drinker and does not smoke or use other substances. Presently, she has no children but wishes to have them in the future. \n\nLeila is looking for a long-term, monogamous relationship with a straight man between the ages of 28 and 35, ranging in height from 5'10\" to 6'4\". Ideally, her partner would share similar lifestyle habits including not having children yet but wanting them in the future, not drinking, or smoking.",
    "user_id": "479b2457-fd79-4ad2-acba-040677db28fc"
}
