{
    "name": "Aisha Johnson",
    "age": 28,
    "height": "5'7\"",
    "school": "Howard University",
    "job_industry": "Tech",
    "job_title": "Software Engineer",
    "hometown_location": "Houston, Texas",
    "dating_location": "Los Angeles, California",
    "languages_spoken": [
        "English",
        "Spanish"
    ],
    "values": "Family-oriented, believes in personal growth and empowerment",
    "interests": "Coding, hiking, cooking, yoga",
    "education_level": "Graduate",
    "religious_beliefs": "Muslim",
    "politics": "Liberal",
    "dating_intentions": "Life partner",
    "relationship_type": "Monogamy",
    "gender": "Woman",
    "pronouns": "She/Her/Hers",
    "sexuality": "Straight",
    "ethnicity": "Black African Descent",
    "has_children": false,
    "want_children": true,
    "pets": [
        "Cat",
        "Dog"
    ],
    "zodiac_sign": "Gemini",
    "mbti_personality_type": "ENFJ",
    "drinking": "Sometimes",
    "smoking": "No",
    "marijuana": "No",
    "drugs": "No",
    "exercise": "Active",
    "partner_preferences": {
        "minimum_age": 26,
        "maximum_age": 35,
        "minimum_height": "5'6\"",
        "maximum_height": "6'5\"",
        "has_children": false,
        "want_children": true,
        "sexuality": "Straight",
        "drinking": "Yes",
        "smoking": "No",
        "marijuana": "No",
        "drugs": "No",
        "exercise": "Active"
    },
    "summary": "Aisha Johnson is a 28-year-old woman of Black African descent who is straight, hailing from Houston, Texas. Currently residing in Los Angeles, California, she works as a software engineer in the tech industry. Beside fluent English, she also speaks Spanish. As a graduate from Howard University, she values not only family bonding but also personal growth and empowerment. \n\nBeing family-oriented, Aisha wants to start a family someday, but currently, she does not have any children. She enjoys bonding with her cat and dog while fostering a healthy lifestyle with frequent exercise and cooking sessions. Besides, Aisha loves coding outside of work, and is passionate about hiking and yoga. \n\nSpiritually, Aisha associates herself with the Muslim faith. Politically, she holds liberal views. According to astrology, her zodiac sign is Gemini and her personality type is ENFJ according to the MBTI.\n\nWhen it comes to her lifestyle choices, Aisha only drinks occasionally and stands against smoking, marijuana and drug usage. Finally, she is in search of a life partner who aligns with her beliefs and lifestyle and wants to also start a family. Her potential partner would ideally be a straight man between 26 and 35 years old, somewhat taller than her, who drinks but does not smoke or use recreational drugs, and actively exercises.",
    "user_id": "cf2d8bed-dd89-47be-b173-6350df2563d7"
}
