{
    "name": "Carlos Rodriguez",
    "age": 33,
    "height": "5'10\"",
    "school": "University of California, Los Angeles",
    "job_industry": "Entertainment",
    "job_title": "Film Producer",
    "hometown_location": "Los Angeles, California",
    "dating_location": "Los Angeles, California",
    "languages_spoken": [
        "English",
        "Spanish"
    ],
    "values": [
        "Honesty",
        "Empathy",
        "Respect"
    ],
    "interests": [
        "Cinema",
        "Travel",
        "Hiking"
    ],
    "education_level": "Undergraduate",
    "religious_beliefs": "Christian",
    "politics": "Moderate",
    "dating_intentions": "Long term",
    "relationship_type": "Monogamy",
    "gender": "Man",
    "pronouns": "He/Him/His",
    "sexuality": "Straight",
    "ethnicity": "Hispanic/Latino",
    "has_children": false,
    "want_children": true,
    "pets": [
        "Dog"
    ],
    "zodiac_sign": "Aries",
    "mbti_personality_type": "ENTJ",
    "drinking": "Sometimes",
    "smoking": "No",
    "marijuana": "No",
    "drugs": "No",
    "exercise": "Active",
    "partner_preferences": {
        "minimum_age": 25,
        "maximum_age": 35,
        "minimum_height": "5'2\"",
        "maximum_height": "5'10\"",
        "has_children": false,
        "want_children": true,
        "sexuality": "Straight",
        "drinking": "Yes",
        "smoking": "No",
        "marijuana": "No",
        "drugs": "No",
        "exercise": "Active"
    },
    "summary": "Carlos Rodriguez is a 33-year-old film producer born and raised in Los Angeles, California. With a height of 5'10\", he is an active person who enjoys cinema, travel, and hiking. Carlos can fluently speak English and Spanish and attended the University of California, Los Angeles. Values that Carlos holds in high regard are honesty, empathy, and respect. \n\nHe is Christian, has a moderate political view, and identifies as heterosexual. Carlos uses \"he/him/his\" pronouns and comes from a Hispanic/Latino background. Although he doesn't have any children, he is open to having them in the future. He shares his home with a dog. \n\nTypical of an Aries, Carlos is an ENTJ, a decisive, ambitious, and strong-willed personality type. As for lifestyle choices, he occasionally drinks but doesn't smoke or use marijuana. \n\nCarlos is looking for a long-term, monogamous relationship with a straight woman between the ages of 25 and 35. He prefers a partner who enjoys being active, might want children in the future, and understands a smoke and drug-free lifestyle.",
    "user_id": "246686a9-e07e-45ab-9156-67c7dea0e78d"
}
