{
    "name": "Keiko Yamamoto",
    "age": 29,
    "height": "5'7\"",
    "school": "University of Tokyo",
    "job_industry": "Technology",
    "job_title": "Software Developer",
    "hometown_location": "Kyoto, Japan",
    "dating_location": "Los Angeles, California",
    "languages_spoken": [
        "Japanese",
        "English"
    ],
    "values": [
        "Hard work",
        "Empathy",
        "Independence"
    ],
    "interests": [
        "Coding",
        "Anime",
        "Rock climbing"
    ],
    "education_level": "Graduate",
    "religious_beliefs": "Atheist",
    "politics": "Moderate",
    "dating_intentions": "Long term",
    "relationship_type": "Monogamy",
    "gender": "Woman",
    "pronouns": "She/Her/Hers",
    "sexuality": "Straight",
    "ethnicity": "East Asian",
    "has_children": false,
    "want_children": true,
    "pets": [
        "Cat"
    ],
    "zodiac_sign": "Scorpio",
    "mbti_personality_type": "INTJ",
    "drinking": "No",
    "smoking": "No",
    "marijuana": "No",
    "drugs": "No",
    "exercise": "Active",
    "partner_preferences": {
        "minimum_age": 28,
        "maximum_age": 35,
        "minimum_height": "5'5\"",
        "maximum_height": "6'3\"",
        "has_children": false,
        "want_children": true,
        "sexuality": "Straight",
        "drinking": "No",
        "smoking": "No",
        "marijuana": "No",
        "drugs": "No",
        "exercise": "Active"
    },
    "summary": "Keiko Yamamoto is a 29-year-old, atheistic, straight woman, originally from Kyoto, Japan but currently living in Los Angeles, California. She's a software developer in the tech industry who values hard work, empathy, and independence. Her interests include coding, anime, and rock climbing. Keiko is a graduate of the University of Tokyo and speaks both Japanese and English. She's politically moderate and has no children but would like to have some in the future. Keiko owns a cat, is an active Scorpion woman, and her Myers-Briggs type is INTJ. She doesn't smoke, drink, or use marijuana and drugs. Through the dating platform, Keiko is looking for a long-term, monogamous relationship with a straight man between the ages of 28 and 35, at least 5'5\" and not taller than 6'3\". Her ideal partner, who should share her active lifestyle, should not currently have children but must also want them in the future and lead a life free of smoking, drinking, marijuana, and drugs.",
    "user_id": "9f2feb25-8e9e-4708-956a-98fb7a9fe64d"
}
