{
    "name": "Amina Patel",
    "age": 29,
    "height": "5'4\"",
    "school": "Stanford University",
    "job_industry": "Technology",
    "job_title": "Software Engineer",
    "hometown_location": "New York, New York",
    "dating_location": "Los Angeles, California",
    "languages_spoken": [
        "English",
        "Gujarati"
    ],
    "values": "Honesty, Positivity, Ambition",
    "interests": "Coding, Yoga, Book club, Cooking, Photography",
    "education_level": "Graduate",
    "religious_beliefs": "Hindu",
    "politics": "Liberal",
    "dating_intentions": "Long term",
    "relationship_type": "Monogamy",
    "gender": "Woman",
    "pronouns": "She/Her/Hers",
    "sexuality": "Straight",
    "ethnicity": "South Asian",
    "has_children": false,
    "want_children": true,
    "pets": [
        "Cat"
    ],
    "zodiac_sign": "Virgo",
    "mbti_personality_type": "INTJ",
    "drinking": "Yes",
    "smoking": "No",
    "marijuana": "No",
    "drugs": "No",
    "exercise": "Active",
    "partner_preferences": {
        "minimum_age": 28,
        "maximum_age": 35,
        "minimum_height": "5'6\"",
        "maximum_height": "6'2\"",
        "has_children": false,
        "want_children": true,
        "sexuality": "Straight",
        "drinking": "Yes",
        "smoking": "No",
        "marijuana": "No",
        "drugs": "No",
        "exercise": "Active"
    },
    "summary": "Amina Patel is a 29-year-old woman, South Asian by ethnicity, and stands 5'4\" tall. She is a Software Engineer in the technology industry and is based out of Los Angeles, California, though she is originally from New York. She is a graduate from Stanford University and fluent in English and Gujarati. \n\nShe lives her life by the values of honesty, positivity, and ambition. Her hobbies include coding, yoga, attending book clubs, cooking, and photography. Amina's religious belief is Hindu and she identifies herself as being politically liberal.\n\nShe is interested in monogamous and long-term relationships. She is straight and uses the pronouns - she, her, hers. Amina doesn't have children currently but looks forward to having them in the future. She is a cat person and is physically active. \n\nShe is a Virgo and identifies with the INTJ personality type in the Myers-Briggs Type Indicator. Amina is comfortable with drinking but doesn't smoke or use marijuana or other drugs.\n\nIn terms of her partner preferences, she is interested in straight men aged between 28-35, who are 5'6\" - 6'2\" tall. They should also want children in the future and be physically active. She expects her partner to be comfortable with drinking but abstain from smoking, marijuana or other drugs.\n",
    "user_id": "e59716f7-f251-4edd-a615-019a12b20640"
}
