{
    "name": "Benjamin Fairchild",
    "age": 33,
    "height": "6'0\"",
    "school": "Yale University",
    "job_industry": "Healthcare",
    "job_title": "Medical Researcher",
    "hometown_location": "Seattle, Washington",
    "dating_location": "Los Angeles, California",
    "languages_spoken": [
        "English",
        "Spanish"
    ],
    "values": [
        "Open-mindedness",
        "Work-life balance",
        "Compassion",
        "Creativity"
    ],
    "interests": [
        "Travelling",
        "Hiking",
        "Reading"
    ],
    "education_level": "Graduate",
    "religious_beliefs": "Agnostic",
    "politics": "Moderate",
    "dating_intentions": "Long term",
    "relationship_type": "Monogamy",
    "gender": "Man",
    "pronouns": "He/Him/His",
    "sexuality": "Straight",
    "ethnicity": "White Caucasian",
    "has_children": false,
    "want_children": true,
    "pets": [
        "Dog"
    ],
    "zodiac_sign": "Leo",
    "mbti_personality_type": "INTJ",
    "drinking": "Sometimes",
    "smoking": "No",
    "marijuana": "No",
    "drugs": "No",
    "exercise": "Active",
    "partner_preferences": {
        "minimum_age": 27,
        "maximum_age": 37,
        "minimum_height": "5'4\"",
        "maximum_height": "5'11\"",
        "has_children": false,
        "want_children": true,
        "sexuality": "Straight",
        "drinking": "Yes",
        "smoking": "No",
        "marijuana": "No",
        "drugs": "No",
        "exercise": "Active"
    },
    "summary": "Benjamin Fairchild is a 33-year-old Medical Researcher based in Los Angeles, California. He is a graduate from Yale University. While he hails from Seattle, Washington, he is fluent in both English and Spanish. Benjamin values open-mindedness, work-life balance, compassion, and creativity. His interests include travelling, hiking, and reading.\n\nIn terms of beliefs, Benjamin is agnostic and politically moderate. He is looking for a serious, long-term relationship and is open to monogamy. He identifies as a straight man and uses he/him/his pronouns. Benjamin is of White Caucasian ethnicity, doesn't have children but wants to in future, and is a proud dog owner.\n\nHis zodiac sign is Leo and his MBTI personality type is INTJ. He drinks occasionally, but he doesn\u2019t smoke or indulge in marijuana or drugs. Being an active individual, he also values exercise.\n\nIn his potential partner, Benjamin prefers a straight woman between 27 to 37 years old who enjoys an active lifestyle. He would prefer a non-smoker who likes to drink occasionally. She should also not have, but want children in future.",
    "user_id": "1a969dfb-1cb2-4a9e-83e5-37ed5feb5b5b"
}
