{
    "name": "Chen Li",
    "age": 30,
    "height": "5'10\"",
    "school": "Tsinghua University",
    "job_industry": "Technology",
    "job_title": "Software Engineer",
    "hometown_location": "Beijing, China",
    "dating_location": "Los Angeles, California",
    "languages_spoken": [
        "English",
        "Mandarin",
        "Cantonese"
    ],
    "values": [
        "Honesty",
        "Hard work",
        "Creativity"
    ],
    "interests": [
        "Coding",
        "Traveling",
        "Hiking",
        "Cinema"
    ],
    "education_level": "Graduate",
    "religious_beliefs": "Buddhist",
    "politics": "Moderate",
    "dating_intentions": "Long term",
    "relationship_type": "Monogamy",
    "gender": "Man",
    "pronouns": "He/Him/His",
    "sexuality": "Straight",
    "ethnicity": "East Asian",
    "has_children": false,
    "want_children": true,
    "pets": [
        "None"
    ],
    "zodiac_sign": "Virgo",
    "mbti_personality_type": "INTJ",
    "drinking": "Sometimes",
    "smoking": "No",
    "marijuana": "No",
    "drugs": "No",
    "exercise": "Active",
    "partner_preferences": {
        "minimum_age": 24,
        "maximum_age": 34,
        "minimum_height": "5'2\"",
        "maximum_height": "5'11\"",
        "has_children": false,
        "want_children": true,
        "sexuality": "Straight",
        "drinking": "Yes",
        "smoking": "No",
        "marijuana": "No",
        "drugs": "No",
        "exercise": "Active"
    },
    "summary": "Chen Li is a 30-year-old straight male residing in Los Angeles, California. He's a Software Engineer by profession and graduated from Tsinghua University. He hails from Beijing, China and is bilingual with proficiency in English, Mandarin, and Cantonese. He values honesty, hard work, and creativity, and enjoys activities such as coding, traveling, hiking, and watching movies. Chen is a Buddhist and politically moderate. He's interested in a long-term, monogamous relationship, has no children but wants to have them in the future. He has a Virgo zodiac sign and is an INTJ, indicating a rational and strategic mindset. He occasionally drinks, does not smoke or use marijuana, and leads an active lifestyle. Chen's ideal partner would be a straight woman between the ages of 24 and 34, who shares similar lifestyle preferences and has no children, but is open to having them in the future.\n",
    "user_id": "4b8d7b27-15af-4cfb-b234-6b74b4823164"
}
