{
    "name": "Miguel Rodriguez",
    "age": 32,
    "height": "5'10\"",
    "school": "University of Southern California",
    "job_industry": "Engineering",
    "job_title": "Mechanical Engineer",
    "hometown_location": "San Diego, California",
    "dating_location": "Los Angeles, California",
    "languages_spoken": [
        "English",
        "Spanish"
    ],
    "values": [
        "Hard work",
        "Family",
        "Kindness"
    ],
    "interests": [
        "Traveling",
        "Cooking",
        "Hiking"
    ],
    "education_level": "Graduate",
    "religious_beliefs": "Catholic",
    "politics": "Moderate",
    "dating_intentions": "Long term",
    "relationship_type": "Monogamy",
    "gender": "Man",
    "pronouns": "He/Him/His",
    "sexuality": "Straight",
    "ethnicity": "Hispanic/Latino",
    "has_children": false,
    "want_children": true,
    "pets": [
        "Dog"
    ],
    "zodiac_sign": "Taurus",
    "mbti_personality_type": "ISTJ",
    "drinking": "Sometimes",
    "smoking": "No",
    "marijuana": "No",
    "drugs": "No",
    "exercise": "Active",
    "partner_preferences": {
        "minimum_age": 24,
        "maximum_age": 35,
        "minimum_height": "5'2\"",
        "maximum_height": "5'10\"",
        "has_children": false,
        "want_children": true,
        "sexuality": "Straight",
        "drinking": "Sometimes",
        "smoking": "No",
        "marijuana": "No",
        "drugs": "No",
        "exercise": "Active"
    },
    "summary": "Miguel Rodriguez is a 32 year old Mechanical Engineer based in Los Angeles, California. Originally from San Diego, he holds a graduate degree from University of Southern California. Being bilingual, he speaks both English and Spanish. He values hard work, compassion, and family ties. His interests include traveling, cooking, and hiking. A Catholic by religion and moderate in politics, Miguel is interested in a monogamous, long-term relationship. He identifies as a straight man who uses he/him pronouns. Though he doesn't have children, he wants to have a family in the future. He's also a proud dog owner. Taurus by zodiac sign, an ISTJ in MBTI personality type, Miguel leads an active lifestyle. He occasionally drinks but does not smoke or use marijuana and drugs. Miguel is seeking a partner aged between 24 and 35, who shares similar lifestyle habits and wants to have children in the future.",
    "user_id": "cdd1f160-0cd1-48be-9604-feb06615b650"
}
