{
    "name": "Sasithorn Wong",
    "age": 30,
    "height": "5'7\"",
    "school": "Mahidol University",
    "job_industry": "Healthcare",
    "job_title": "Registered Nurse",
    "hometown_location": "Bangkok, Thailand",
    "dating_location": "Los Angeles, California",
    "languages_spoken": [
        "Thai",
        "English"
    ],
    "values": [
        "Hard work",
        "Integrity",
        "Family"
    ],
    "interests": [
        "Cooking",
        "Exercise",
        "Travel"
    ],
    "education_level": "Graduate",
    "religious_beliefs": "Buddhist",
    "politics": "Moderate",
    "dating_intentions": "Long term",
    "relationship_type": "Monogamy",
    "gender": "Woman",
    "pronouns": "She/Her/Hers",
    "sexuality": "Straight",
    "ethnicity": "Southeast Asian",
    "has_children": false,
    "want_children": true,
    "pets": [
        "Cat"
    ],
    "zodiac_sign": "Virgo",
    "mbti_personality_type": "ISFJ",
    "drinking": "Sometimes",
    "smoking": "No",
    "marijuana": "No",
    "drugs": "No",
    "exercise": "Active",
    "partner_preferences": {
        "minimum_age": 28,
        "maximum_age": 40,
        "minimum_height": "5'6\"",
        "maximum_height": "6'3\"",
        "has_children": false,
        "want_children": true,
        "sexuality": "Straight",
        "drinking": "Sometimes",
        "smoking": "No",
        "marijuana": "No",
        "drugs": "No",
        "exercise": "Active",
        "gender": "Man",
        "dating_intentions": "Long term",
        "relationship_type": "Monogamy",
        "ethnicities": [
            "East Asian",
            "Hispanic/Latino",
            "White Caucasian"
        ],
        "politics": [
            "Moderate"
        ],
        "job_industry": [
            "Healthcare",
            "Technology",
            "Finance"
        ],
        "languages_spoken": [
            "English"
        ],
        "values": [
            "Integrity",
            "Family"
        ],
        "interests": [
            "Exercise",
            "Outdoors"
        ],
        "education_level": [
            "Undergraduate",
            "Graduate"
        ]
    },
    "profile_summary": "This profile belongs to a 30-year-old woman who is a Registered Nurse in the Healthcare industry. She's a graduate from Mahidol University and currently resides in Los Angeles, California, originally from Bangkok, Thailand. She values hard work, integrity, and family. Apart from her profession, her interests include cooking, exercising, and traveling. As a Buddhist, she holds moderate political views. Her intention in dating is to find a long-term partner with whom she can enter into a monogamous relationship. She identifies herself as a straight woman and uses she/her pronouns. She is of Southeast Asian ethnicity and is fluent in both Thai and English. In terms of lifestyle, she enjoys an active routine featuring exercise, drinks occasionally, and doesn't smoke or use marijuana or drugs. This Virgo woman is an ISFJ according to the MBTI personality type, and shares her home with her cat. While she currently doesn't have children, she hopes to have them someday.",
    "preferences_summary": "The user is looking for a man between the ages of 28 and 40, with a height range of 5'6\" to 6'3\". Preference is for the partner not to have children, but wants to have children in the future, and identifies as straight. The ideal partner would occasionally consume alcohol, but does not smoke or use marijuana or drugs. They should lead an active lifestyle exercise-wise. The ideal partner for the user is seeking long-term dating and monogamous relationships, and might be from East Asian, Hispanic/Latino, or White Caucasian ethnicities. They could be politically moderate and work in Healthcare, Technology, or Finance industries. Speaking English is a must. Integrity and family are important values for them, and they should have interests in exercise and outdoor activities. They should have at least an undergraduate-level education.",
    "user_id": "4e7527ac-5101-4987-82cf-b61ad1b61ebc"
}
