{
    "name": "Serena Preston",
    "age": 30,
    "height": "5'7\"",
    "school": "University of California, Berkeley",
    "job_industry": "Media",
    "job_title": "Digital Content Producer",
    "hometown_location": "Seattle, Washington",
    "dating_location": "Los Angeles, California",
    "languages_spoken": [
        "English",
        "Spanish"
    ],
    "values": [
        "Creativity",
        "Passion",
        "Balance"
    ],
    "interests": [
        "Music",
        "Festivals",
        "Exploring New Cultures",
        "Photography"
    ],
    "education_level": "Graduate",
    "religious_beliefs": "Agnostic",
    "politics": "Liberal",
    "dating_intentions": "Life partner",
    "relationship_type": "Monogamy",
    "gender": "Woman",
    "pronouns": "She/Her/Hers",
    "sexuality": "Straight",
    "ethnicity": "White Caucasian",
    "has_children": false,
    "want_children": true,
    "pets": [
        "Cat"
    ],
    "zodiac_sign": "Aries",
    "mbti_personality_type": "ENFP",
    "drinking": "Yes",
    "smoking": "No",
    "marijuana": "No",
    "drugs": "No",
    "exercise": "Active",
    "partner_preferences": {
        "minimum_age": 28,
        "maximum_age": 40,
        "minimum_height": "5'8\"",
        "maximum_height": "6'4\"",
        "has_children": false,
        "want_children": true,
        "sexuality": "Straight",
        "drinking": "Yes",
        "smoking": "No",
        "marijuana": "No",
        "drugs": "No",
        "exercise": "Active"
    },
    "summary": "Serena Preston, a dynamic and creative 30-year-old woman, is actively seeking a life partner. Currently residing in Los Angeles, she originally hails from Seattle, Washington. Holding a graduate degree from the University of California, Berkeley, she is now forging a successful career as a Digital Content Producer in the media industry. \n\nBilingual in English and Spanish, Serena values creativity, passion, and balance in her life. Her interests are wide-ranging and include music and festivals to photography and exploring new cultures. Politically liberal and agnostic, she is looking for a partner who shares the same openness to different perspectives. \n\nSerena identifies as straight and prefers monogamous relationships. An active person, she takes part in regular exercise and enjoys a social drink now and then. She presently doesn't have children but is open to starting a family. A cat-lover, she is of Aries Zodiac sign with an ENFP personality type.\n\nIn a partner, Serena is looking for a straight man between the ages of 28-40, who is at least 5'8\" tall. He ideally shares her interest in fitness and responsible social drinking, does not smoke or use marijuana or other drugs, and is also interested in having children.",
    "user_id": "19dd676b-b5e0-4244-85ff-a92bd27fc609"
}
