{
    "name": "Hiroshi Tanaka",
    "age": 32,
    "height": "5'9\"",
    "school": "Tokyo University",
    "job_industry": "Technology",
    "job_title": "Software Engineer",
    "hometown_location": "Kyoto, Japan",
    "dating_location": "Los Angeles, California",
    "languages_spoken": [
        "Japanese",
        "English"
    ],
    "values": [
        "Hard work",
        "Family",
        "Humor"
    ],
    "interests": [
        "Travelling",
        "Cooking",
        "Reading",
        "Video Games"
    ],
    "education_level": "Graduate",
    "religious_beliefs": "Buddhist",
    "politics": "Moderate",
    "dating_intentions": "Long term",
    "relationship_type": "Monogamy",
    "gender": "Man",
    "pronouns": "He/Him/His",
    "sexuality": "Straight",
    "ethnicity": "East Asian",
    "has_children": false,
    "want_children": true,
    "pets": [
        "None"
    ],
    "zodiac_sign": "Taurus",
    "mbti_personality_type": "INTJ",
    "drinking": "Sometimes",
    "smoking": "No",
    "marijuana": "No",
    "drugs": "No",
    "exercise": "Active",
    "partner_preferences": {
        "minimum_age": 25,
        "maximum_age": 35,
        "minimum_height": "5'0\"",
        "maximum_height": "5'9\"",
        "has_children": false,
        "want_children": true,
        "sexuality": "Straight",
        "drinking": "No",
        "smoking": "No",
        "marijuana": "No",
        "drugs": "No",
        "exercise": "Active"
    },
    "summary": "Hiroshi Tanaka is a 32-year-old straight man who is currently living in Los Angeles, California. He hails originally from Kyoto, Japan, and speaks both Japanese and English fluently. His profession is in the technology industry as a software engineer, having graduated from Tokyo University. Hiroshi is a hardworking, family-centric, fun-loving individual who enjoys travelling, cooking, reading, and video games in his free time.\n\nIdentifying as a practicing Buddhist and holding moderate political views, he is looking for a long-term, monogamous relationship. Hiroshi is an East Asian individual who prefers the pronouns He/Him/His. He doesn't have any children now but hopes to have them in the future.\n\nDespite having no pets, Hiroshi enjoys an active lifestyle and occasionally enjoys a drink but doesn't smoke or partake in drug use. Hiroshi's partner preferences include a straight woman between the ages of 25 and 35 who doesn't smoke or do drugs, leads an active lifestyle, and is interested in having children in the future.",
    "user_id": "327d63d4-56c8-45a3-8803-682eb520e561"
}
