{
    "name": "Aria Johnson",
    "age": 28,
    "height": "5'6\"",
    "school": "University of Texas",
    "job_industry": "Tech",
    "job_title": "Software Developer",
    "hometown_location": "Houston, Texas",
    "dating_location": "Los Angeles, California",
    "languages_spoken": [
        "English",
        "Spanish"
    ],
    "values": "Family, Adventure, Creativity",
    "interests": "Traveling, Coding, Photography",
    "education_level": "Graduate",
    "religious_beliefs": "Atheist",
    "politics": "Liberal",
    "dating_intentions": "Life partner",
    "relationship_type": "Monogamy",
    "gender": "Woman",
    "pronouns": "She/Her/Hers",
    "sexuality": "Straight",
    "ethnicity": "Black African Descent",
    "has_children": false,
    "want_children": true,
    "pets": [
        "Dog"
    ],
    "zodiac_sign": "Leo",
    "mbti_personality_type": "ENFJ",
    "drinking": "Sometimes",
    "smoking": "No",
    "marijuana": "No",
    "drugs": "No",
    "exercise": "Active",
    "partner_preferences": {
        "minimum_age": 28,
        "maximum_age": 36,
        "minimum_height": "5'8\"",
        "maximum_height": "6'2\"",
        "has_children": false,
        "want_children": true,
        "sexuality": "Straight",
        "drinking": "Yes",
        "smoking": "No",
        "marijuana": "No",
        "drugs": "No",
        "exercise": "Active"
    },
    "summary": "Aria Johnson is a 28-year-old woman who identifies as straight and works as a software developer in the tech industry. She's originally from Houston, Texas, but is currently dating in Los Angeles, California. She is bilingual, speaking both English and Spanish. \n\nAria values family, adventure, and creativity and is interested in traveling, coding, and photography. She holds a graduate degree from the University of Texas and identifies as an atheist on the religious spectrum and a liberal in politics. \n\nShe is seeking a life partner and prefers monogamous relationships. She has no children but wishes to have some in the future. She has a dog and her zodiac sign is Leo. Being an ENFJ, Aria rarely drinks, does not smoke or use drugs. She leads an active lifestyle.\n\nAria welcomes straight men aged between 28 and 36 who do not smoke or use recreational drugs. Her potential partner should be active, drink socially, and open to having children in the future. He should also measure between 5'8\" and 6'2\" in height.",
    "user_id": "a01f4bb7-8b39-4997-8ebb-4d2ab742e7f4"
}
