{
    "name": "Isabella Dawson",
    "age": 30,
    "height": "5'7\"",
    "school": "Harvard University",
    "job_industry": "Science",
    "job_title": "Research Scientist",
    "hometown_location": "Boston, Massachusetts",
    "dating_location": "Los Angeles, California",
    "languages_spoken": [
        "English",
        "Spanish"
    ],
    "values": [
        "Honesty",
        "Loyalty",
        "Creativity"
    ],
    "interests": [
        "Hiking",
        "Reading",
        "Art"
    ],
    "education_level": "Graduate",
    "religious_beliefs": "Atheist",
    "politics": "Liberal",
    "dating_intentions": "Long term",
    "relationship_type": "Monogamy",
    "gender": "Woman",
    "pronouns": "She/Her/Hers",
    "sexuality": "Straight",
    "ethnicity": "White Caucasian",
    "has_children": false,
    "want_children": true,
    "pets": [
        "Cat"
    ],
    "zodiac_sign": "Aquarius",
    "mbti_personality_type": "INFJ",
    "drinking": "Yes",
    "smoking": "No",
    "marijuana": "No",
    "drugs": "No",
    "exercise": "Active",
    "partner_preferences": {
        "minimum_age": 28,
        "maximum_age": 35,
        "minimum_height": "5'8\"",
        "maximum_height": "6'2\"",
        "has_children": false,
        "want_children": true,
        "sexuality": "Straight",
        "drinking": "Sometimes",
        "smoking": "No",
        "marijuana": "No",
        "drugs": "No",
        "exercise": "Active"
    },
    "summary": "Isabella Dawson, a 30-year-old research scientist based in Los Angeles, stands 5'7\" tall and holds a graduate degree from Harvard University. Originally from Boston, she identifies as a straight woman using she/her pronouns. She has an active lifestyle and enjoys activities such as hiking and reading. She also is a fan of art.\n\nIsabella highly values honesty, loyalty, and creativity. She identifies her political standing as liberal and religious belief as atheist. Bearing Aquarius star sign, she is categorized as an INFJ in the Myers-Briggs Type Indicator.\n\nCurrently, she doesn't have children but wishes to in the future. As for pets, she shares her home with a cat. In terms of substance use, Isabella drinks regularly, but refrains from smoking and other drug use.\n\nOn the dating front, Isabella seeks a long-term, monogamous relationship. She prefers to date men aged between 28 and 35 who are at least 5'8\", leading an active lifestyle, and do not have children from previous relationships. They also hold an interest in having children in the future. Restrictive practices regarding smoking, marijuana and drug use are vital aspects she looks for in her potential match while occasional drinking is permissible.",
    "user_id": "575b6df4-8485-401d-abdb-ffc649c231fd"
}
