{
    "name": "Marcus Kingley",
    "age": 31,
    "height": "6'0\"",
    "school": "University of Chicago",
    "job_industry": "Finance",
    "job_title": "Investment Analyst",
    "hometown_location": "New York, New York",
    "dating_location": "Los Angeles, California",
    "languages_spoken": [
        "English",
        "Spanish"
    ],
    "values": [
        "Authenticity",
        "Ambition",
        "Mindfulness"
    ],
    "interests": [
        "Hiking",
        "Basketball",
        "Classic Literature",
        "Travel",
        "Dining"
    ],
    "education_level": "Graduate",
    "religious_beliefs": "Agnostic",
    "politics": "Liberal",
    "dating_intentions": "Life partner",
    "relationship_type": "Monogamy",
    "gender": "Man",
    "pronouns": "He/Him/His",
    "sexuality": "Straight",
    "ethnicity": "White Caucasian",
    "has_children": false,
    "want_children": true,
    "pets": [
        "None"
    ],
    "zodiac_sign": "Taurus",
    "mbti_personality_type": "ENTJ",
    "drinking": "Sometimes",
    "smoking": "No",
    "marijuana": "No",
    "drugs": "No",
    "exercise": "Active",
    "partner_preferences": {
        "minimum_age": 25,
        "maximum_age": 34,
        "minimum_height": "5'4\"",
        "maximum_height": "6'6\"",
        "has_children": false,
        "want_children": true,
        "sexuality": "Straight",
        "drinking": "Sometimes",
        "smoking": "No",
        "marijuana": "No",
        "drugs": "No",
        "exercise": "Active",
        "gender": "Woman",
        "dating_intentions": "Life partner",
        "relationship_type": "Monogamy",
        "ethnicities": [
            "Black African Descent",
            "East Asian",
            "Hispanic/Latino",
            "Middle Eastern",
            "Native American",
            "Pacific Islander",
            "South Asian",
            "Southeast Asian",
            "White Caucasian"
        ],
        "politics": [
            "Liberal"
        ],
        "job_industry": [
            "Healthcare",
            "Education",
            "Arts & Entertainment",
            "Science & Technology",
            "Finance"
        ],
        "languages_spoken": [
            "English",
            "Spanish"
        ],
        "values": [
            "Authenticity",
            "Hard work",
            "Kindness"
        ],
        "interests": [
            "Hiking",
            "Dancing",
            "Cooking",
            "Travel",
            "Reading"
        ],
        "education_level": [
            "Undergraduate",
            "Graduate"
        ]
    },
    "profile_summary": "The user is a 31-year-old white caucasian man, 6'0\" in height, located in Los Angeles for dating but originally from New York. He is an Investment Analyst in the finance sector and holds a graduate-level degree from the University of Chicago. The user speaks English and Spanish. His key values are authenticity, ambition, and mindfulness and his interests include hiking, traveling, reading classic literature, basketball, and dining. Currently, he subscribes to agnostic religious beliefs and liberal political views. His option for sexual orientation is straight, prefers monogamy, and is seeking a life partner. He doesn't have kids but wants them someday. User identifies with he/him/his pronouns, doesn't own any pets, and his zodiac sign is Taurus. With no smoking, no marijuana and no drug habits, he takes drinks sometimes and maintains an active exercise regime. As per MBTI, his personality type is ENTJ.",
    "preferences_summary": "The user is seeking a heterosexual woman between the age of 25 and 34, with a height range of 5'4\" to 6'6\". His preferred partner should be an active individual who drinks occasionally, and does not smoke or use marijuana or illicit drugs. He wishes for his partner, who ideally does not have children but wants them in the future, to want a monogamous life partner relationship. In relation to ethnicity, he is open to dating a woman of Black African Descent, East Asian, Hispanic/Latino, Middle Eastern, Native American, Pacific Islander, South Asian, Southeast Asian, or White Caucasian backgrounds. Politically, she should lean liberal. A potential partner should work within the fields of Healthcare, Education, Arts & Entertainment, Science & Technology, or Finance. It is important she can converse in English and Spanish. She is expected to value authenticity, hard work, and kindness and share the interests of hiking, dancing, cooking, travel, and reading. For education level, having completed an Undergraduate or a Graduate degree title would be ideal.",
    "user_id": "df3dcb78-60be-4188-977d-d8cb0cc8c894"
}
