{
    "name": "Shreya Rao",
    "age": 32,
    "height": "5'6\"",
    "school": "University of California, Berkeley",
    "job_industry": "Technology",
    "job_title": "Software Engineer",
    "hometown_location": "San Francisco, California",
    "dating_location": "Los Angeles, California",
    "languages_spoken": [
        "English",
        "Hindi"
    ],
    "values": "Compassion, Equality, Honesty, Knowledge, Family",
    "interests": "Coding, Cooking, Reading, Traveling, Running",
    "education_level": "Graduate",
    "religious_beliefs": "Hindu",
    "politics": "Liberal",
    "dating_intentions": "Life partner",
    "relationship_type": "Monogamy",
    "gender": "Woman",
    "pronouns": "She/Her/Hers",
    "sexuality": "Straight",
    "ethnicity": "South Asian",
    "has_children": false,
    "want_children": true,
    "pets": [
        "None"
    ],
    "zodiac_sign": "Virgo",
    "mbti_personality_type": "INTJ",
    "drinking": "No",
    "smoking": "No",
    "marijuana": "No",
    "drugs": "No",
    "exercise": "Active",
    "partner_preferences": {
        "minimum_age": 30,
        "maximum_age": 45,
        "minimum_height": "5'6\"",
        "maximum_height": "6'2\"",
        "has_children": false,
        "want_children": true,
        "sexuality": "Straight",
        "drinking": "No",
        "smoking": "No",
        "marijuana": "No",
        "drugs": "No",
        "exercise": "Active"
    },
    "summary": "Shreya Rao is a 32-year-old South Asian woman living in Los Angeles, California. She's a software engineer in the technology industry, having graduated from the University of California, Berkeley. Shreya is fluent in English and Hindi. Compassionate, honest, and valuing knowledge and family, she loves coding, cooking, reading, running, and traveling. Shreya is a Hindu, politically liberal, and looking for a life partner in monogamous relationship. She doesn't have children currently, but wants to in the future. Shreya doesn't own any pets. She's a Virgo and an INTJ. Healthy living is important for her as she doesn't drink, smoke or do drugs, and maintains an active exercise regime. Shreya is particularly interested in a male partner aged 30-45, who doesn't have children but is open to having them, lives a healthy lifestyle, and matches her active exercise routines.\n",
    "user_id": "55a76929-bb4e-4837-8ea7-03cd5e809970"
}
