{
    "name": "Liang Wu",
    "age": 28,
    "height": "5'8\"",
    "school": "University of Pennsylvania",
    "job_industry": "Technology",
    "job_title": "Software Engineer",
    "hometown_location": "Beijing, China",
    "dating_location": "Los Angeles, California",
    "languages_spoken": [
        "English",
        "Mandarin"
    ],
    "values": [
        "Integrity",
        "Creativeness",
        "Hard work"
    ],
    "interests": [
        "Coding Hackathons",
        "Listening to Music",
        "Painting"
    ],
    "education_level": "Graduate",
    "religious_beliefs": "Buddhist",
    "politics": "Liberal",
    "dating_intentions": "Long term",
    "relationship_type": "Monogamy",
    "gender": "Man",
    "pronouns": "He/Him/His",
    "sexuality": "Straight",
    "ethnicity": "East Asian",
    "has_children": false,
    "want_children": true,
    "pets": [
        "None"
    ],
    "zodiac_sign": "Libra",
    "mbti_personality_type": "INTJ",
    "drinking": "Sometimes",
    "smoking": "No",
    "marijuana": "No",
    "drugs": "No",
    "exercise": "Active",
    "partner_preferences": {
        "minimum_age": 23,
        "maximum_age": 30,
        "minimum_height": "5'1\"",
        "maximum_height": "5'9\"",
        "has_children": false,
        "want_children": true,
        "sexuality": "Straight",
        "drinking": "No",
        "smoking": "No",
        "marijuana": "No",
        "drugs": "No",
        "exercise": "Active"
    },
    "summary": "Liang Wu is a 28-year-old Software Engineer living in Los Angeles, California, originally from Beijing, China, and is fluent in English and Mandarin. He studied at the University of Pennsylvania and is now working in the technology industry. Liang describes himself as a man with a hardworking nature who values integrity and creativeness. In his free time, he enjoys coding hackathons, listening to music, and painting. He is open about his liberal political views and his Buddhist religious beliefs. \n\nDespite being busy, Liang maintains an active lifestyle and occasionally enjoys a drink yet steers clear of smoking or drugs. A straight, Libra, INTJ personality type man, Liang has a preference for monogamous relationships with intentions of finding a long-term partner. He currently has no children but hopes to become a father in the future. His desired partner is a woman aged 23 to 30, who doesn't smoke or drink, leads an active lifestyle, and shares Liang's desire to start a family.",
    "user_id": "4b397e31-73c1-4256-adf2-c72b8edb302b"
}
