{
    "name": "Aya Takada",
    "age": 30,
    "height": "5'6\"",
    "school": "University of Tokyo",
    "job_industry": "Technology",
    "job_title": "Software Developer",
    "hometown_location": "Tokyo, Japan",
    "dating_location": "Los Angeles, California",
    "languages_spoken": [
        "Japanese",
        "English"
    ],
    "values": [
        "Honesty",
        "Hard-Working",
        "Curiosity"
    ],
    "interests": [
        "Coding",
        "Anime",
        "Traveling",
        "Meditation"
    ],
    "education_level": "Graduate",
    "religious_beliefs": "Buddhist",
    "politics": "Not political",
    "dating_intentions": "Long term, open to short",
    "relationship_type": "Monogamy",
    "gender": "Woman",
    "pronouns": "She/Her/Hers",
    "sexuality": "Straight",
    "ethnicity": "East Asian",
    "has_children": false,
    "want_children": true,
    "pets": [
        "Cat",
        "Fish"
    ],
    "zodiac_sign": "Capricorn",
    "mbti_personality_type": "INTP",
    "drinking": "Sometimes",
    "smoking": "No",
    "marijuana": "No",
    "drugs": "No",
    "exercise": "Active",
    "partner_preferences": {
        "minimum_age": 28,
        "maximum_age": 36,
        "minimum_height": "5'4\"",
        "maximum_height": "6'2\"",
        "has_children": false,
        "want_children": true,
        "sexuality": "Straight",
        "drinking": "Sometimes",
        "smoking": "No",
        "marijuana": "No",
        "drugs": "No",
        "exercise": "Active",
        "gender": "Man",
        "dating_intentions": "Long term, open to short",
        "relationship_type": "Monogamy",
        "ethnicities": [
            "White Caucasian",
            "East Asian"
        ],
        "politics": [
            "Not political"
        ],
        "job_industry": [
            "Technology"
        ],
        "languages_spoken": [
            "English"
        ],
        "values": [
            "Honesty",
            "Hard-Working",
            "Curiosity"
        ],
        "interests": [
            "Coding",
            "Traveling",
            "Fitness",
            "Reading"
        ],
        "education_level": [
            "Undergraduate",
            "Graduate",
            "Doctoral"
        ]
    },
    "profile_summary": "The user is a 30-year-old Woman, with the pronouns She/Her/Hers, who identifies as Straight and East Asian. Standing at 5'6\", she hails from Tokyo, Japan, but is currently dating in Los Angeles, California. Academically, she is a Graduate from the University of Tokyo and is a Software Developer in the Technology industry. Knowledgeable in Japanese and English languages, she upholds the values of Honesty, Hard-Work, and Curiosity. Her spectrum of interests ranges from Coding, Anime, and Traveling, to Meditation. A devout Buddhist with no existing political inclinations, she leans towards a long-term monogamous relationship but is open to short. She has not had children but desires to in the future. An owner of Cats and Fish, she takes care of her wellbeing by being Active and sometimes unwinds via drinking, notably without a hint of Smoking, Marijuana, or Drugs. Being a Capricorn and an described INTP, she enjoys her life with positivity, predicting a shared journey with a similar admirer.",
    "preferences_summary": "The user prefers to date a man aged between 28 to 36 with a straight sexuality and preference for monogamy, while also open to short-term adventures. Her ideal partner exercises regularly and recreationally consumes alcohol. The user also expects her potential partner to not engage in smoking, marijuana, or drugs in any form. She has a preference for men who fall within the height range of 5'4'' to 6'2''. Ethnicity wise, she leans towards White Caucasian or East Asian individuals. Additionally, the partner should not have children but should want them in the future. Matches should ideally be in the Technology sector, politically apathetic, and capable of speaking English. Key personal values of honesty, hard work, and curiosity must be shared along with interests such as coding, traveling, fitness, and reading. Lastly, her suitor should have a higher education qualification at least up to undergraduate level, if not a graduate or doctoral.",
    "user_id": "59e21e27-e761-4670-9f07-5c0d0b3a7221"
}
