{
    "name": "Priyanka Nair",
    "age": 30,
    "height": "5'6\"",
    "school": "University of Mumbai",
    "job_industry": "Healthcare",
    "job_title": "Physical Therapist",
    "hometown_location": "Mumbai, India",
    "dating_location": "Los Angeles, California",
    "languages_spoken": [
        "English",
        "Hindi",
        "Marathi"
    ],
    "values": [
        "Family",
        "Health & Fitness",
        "Career"
    ],
    "interests": [
        "Reading",
        "Yoga"
    ],
    "education_level": "Graduate",
    "religious_beliefs": "Hindu",
    "politics": "Liberal",
    "dating_intentions": "Long term",
    "relationship_type": "Monogamy",
    "gender": "Woman",
    "pronouns": "She/Her/Hers",
    "sexuality": "Straight",
    "ethnicity": "South Asian",
    "has_children": false,
    "want_children": true,
    "pets": [
        "Dog"
    ],
    "zodiac_sign": "Gemini",
    "mbti_personality_type": "ENFJ",
    "drinking": "Sometimes",
    "smoking": "No",
    "marijuana": "No",
    "drugs": "No",
    "exercise": "Active",
    "partner_preferences": {
        "minimum_age": 28,
        "maximum_age": 36,
        "minimum_height": "5'7\"",
        "maximum_height": "6'3\"",
        "has_children": false,
        "want_children": true,
        "sexuality": "Straight",
        "drinking": "Sometimes",
        "smoking": "No",
        "marijuana": "No",
        "drugs": "No",
        "exercise": "Sometimes"
    },
    "summary": "Priyanka Nair is a 30-year-old Physical Therapist from Mumbai, India and is currently living in Los Angeles, California. She is a graduate from the University of Mumbai and values family, health and fitness, and her career. She enjoys reading and yoga in her leisurely time. She's primarily a speaker of English but can also converse in Hindi and Marathi. She identifies as a Hindu, with political views leaning liberally. She has no children, but would like some in the near future. She owns a dog and, according to her MBTI personality index, is an ENFJ. Priyanka drinks occasionally, doesn't smoke, and does not use drugs or marijuana. As for physical exercise, she maintains an active lifestyle.\n\nOn the partner front, Priyanka is looking for a monogamous, heterosexual relationship with an intention of being long term. The man she's looking for is also a straight individual aged between 28 and 36 years who values fitness, does not smoke, and is partial to occasional drinking at most. He should not have children but want some in the future. Ideally, he should be someone who stands at a height ranging from 5'7\" to 6'3\".",
    "user_id": "bd541401-add7-4570-ad34-e5c7a625a0b5"
}
