{
    "name": "Alex Johnson",
    "age": 32,
    "height": "5'9\"",
    "school": "Yale University",
    "job_industry": "Technology",
    "job_title": "Software Engineer",
    "hometown_location": "Chicago, Illinois",
    "dating_location": "Los Angeles, California",
    "languages_spoken": [
        "English",
        "Mandarin",
        "Spanish"
    ],
    "values": "Loyalty, ambition, and humility.",
    "interests": "Cooking, hiking, programming, and travelling.",
    "education_level": "Graduate",
    "religious_beliefs": "Agnostic",
    "politics": "Liberal",
    "dating_intentions": "Long term",
    "relationship_type": "Monogamy",
    "gender": "Non binary",
    "pronouns": "They/Them/Their",
    "sexuality": "Gay",
    "ethnicity": "Black African Descent",
    "has_children": false,
    "want_children": true,
    "pets": [
        "Cat"
    ],
    "zodiac_sign": "Aquarius",
    "mbti_personality_type": "ENFP",
    "drinking": "Sometimes",
    "smoking": "No",
    "marijuana": "No",
    "drugs": "No",
    "exercise": "Active",
    "partner_preferences": {
        "minimum_age": 28,
        "maximum_age": 40,
        "minimum_height": "5'5\"",
        "maximum_height": "6'0\"",
        "has_children": false,
        "want_children": true,
        "sexuality": "Gay",
        "drinking": "Yes",
        "smoking": "No",
        "marijuana": "No",
        "drugs": "No",
        "exercise": "Active"
    },
    "summary": "Alex Johnson is a 32-year-old non-binary individual of Black African descent, who identifies as gay and uses they/them pronouns. They are a software engineer in the technology industry and possess a graduate degree from Yale University. Alex is located in Los Angeles, California, but originates from their hometown Chicago, Illinois. They are fluent in English, Mandarin, and Spanish. \n\nAlex does not currently have children but hopes to in the future. They are a proud cat owner and enjoy cooking, hiking, programming, and travelling in their spare time. Alex identifies as an agnostic and politically liberal. Their relationship approach is monogamous, and they are looking for a long-term dating relationship. \n\nAlex places high importance on loyalty, ambition, and humility. They are sometimes socially drinking, but they do not smoke or use marijuana or drugs. They live an active lifestyle and their MBTI personality type is ENFP. \n\nIn a partner, they prefer individuals who are between the ages of 28 and 40, who don't have children but want them in the future, and who are also active like them. Preferred partners should also be open to social drinking but abstain from smoking, marijuana, and drugs.",
    "user_id": "7ca9750f-f6d5-4926-bc1c-83fd084f09c3"
}
