{
    "name": "Raymond Diaz",
    "age": 34,
    "height": "5'10\"",
    "school": "University of Southern California",
    "job_industry": "Healthcare",
    "job_title": "Emergency Room Nurse",
    "hometown_location": "San Diego, California",
    "dating_location": "Los Angeles, California",
    "languages_spoken": [
        "English",
        "Spanish",
        "French"
    ],
    "values": "Family, Career, Adventure",
    "interests": "Traveling, Photography, Cooking, Fitness",
    "education_level": "Graduate",
    "religious_beliefs": "Catholic",
    "politics": "Liberal",
    "dating_intentions": "Life partner",
    "relationship_type": "Monogamy",
    "gender": "Man",
    "pronouns": "He/Him/His",
    "sexuality": "Gay",
    "ethnicity": "Hispanic/Latino",
    "has_children": false,
    "want_children": true,
    "pets": [
        "Dog"
    ],
    "zodiac_sign": "Leo",
    "mbti_personality_type": "ENFJ",
    "drinking": "Sometimes",
    "smoking": "No",
    "marijuana": "No",
    "drugs": "No",
    "exercise": "Active",
    "partner_preferences": {
        "minimum_age": 28,
        "maximum_age": 40,
        "minimum_height": "5'5\"",
        "maximum_height": "6'2\"",
        "has_children": false,
        "want_children": true,
        "sexuality": "Gay",
        "drinking": "Sometimes",
        "smoking": "No",
        "marijuana": "No",
        "drugs": "No",
        "exercise": "Active"
    },
    "summary": "Raymond Diaz is a 34-year-old, 5'10\", Hispanic/Latino man, who identifies as gay and uses he/him/his pronouns. He is an Emergency Room Nurse working in the healthcare industry in Los Angeles, California but originally hails from San Diego. Fluent in English, Spanish, and French, he values family, career, and adventure. He enjoys traveling, photography, cooking, and fitness.\n\nRaymond is a Catholic and holds liberal political views. He is looking for a life partner and is interested in a monogamous relationship. Although he doesn't currently have children, he intends to in the future. He enjoys the company of his dog and exercises actively. He occasionally drinks but doesn't smoke or use marijuana or any drugs.\n\nHe seeks a partner who is between 28-40 years old, with a height range of 5'5\" to 6'2\", who doesn't currently have children but wants to in the future. He prefers someone who is also active, occasionally drinks, and does not smoke or use drugs.",
    "user_id": "1f7f78b8-f029-4eb1-8e9a-3cd6795f245c"
}
