{
    "name": "Lincoln Hayes",
    "age": 29,
    "height": "6'1\"",
    "school": "Cornell University",
    "job_industry": "Technology",
    "job_title": "Software Engineer",
    "hometown_location": "Chicago, Illinois",
    "dating_location": "Los Angeles, California",
    "languages_spoken": [
        "English",
        "Spanish"
    ],
    "values": [
        "Equality",
        "Sustainability"
    ],
    "interests": [
        "Hiking",
        "Coding",
        "Photography"
    ],
    "education_level": "Graduate",
    "religious_beliefs": "Agnostic",
    "politics": "Liberal",
    "dating_intentions": "Life partner",
    "relationship_type": "Monogamy",
    "gender": "Man",
    "pronouns": "He/Him/His",
    "sexuality": "Straight",
    "ethnicity": "White Caucasian",
    "has_children": false,
    "want_children": true,
    "pets": [
        "Dog"
    ],
    "zodiac_sign": "Virgo",
    "mbti_personality_type": "INTP",
    "drinking": "Sometimes",
    "smoking": "No",
    "marijuana": "No",
    "drugs": "No",
    "exercise": "Active",
    "partner_preferences": {
        "minimum_age": 24,
        "maximum_age": 33,
        "minimum_height": "5'4\"",
        "maximum_height": "6'2\"",
        "has_children": false,
        "want_children": true,
        "sexuality": "Straight",
        "drinking": "Sometimes",
        "smoking": "No",
        "marijuana": "No",
        "drugs": "No",
        "exercise": "Active"
    },
    "summary": "Lincoln Hayes is a 29-year-old software engineer based in Los Angeles, originally from Chicago. He completed his graduate studies at Cornell University and works in the technology industry. Lincoln speaks English and Spanish, values equality and sustainability, and enjoys hiking, coding, and photography. He identifies as a straight man using the pronouns he/him/his. His religious belief is agnostic and he has liberal political views. \n\nAlthough currently without children, Lincoln is eager to have them in the future. As a dog owner, he is also likely a pet lover. He exercises regularly and sometimes drinks but does not smoke or use drugs. His MBTI personality type is INTP, he's a Virgo, and he's seeking a life partner in monogamy. \n\nAs for his potential partner, Lincoln is interested in a straight woman who is between 24 and 33 years old, ranges in height from 5'4\" to 6'2\", is active, sometimes drinks, does not smoke or use drugs, and also wants to have children in the future.",
    "user_id": "142fe878-ec71-4e75-96a0-c57986a5ddeb"
}
