{
    "name": "Leo Williams",
    "age": 35,
    "height": "6'2\"",
    "school": "University of Texas at Austin",
    "job_industry": "Healthcare",
    "job_title": "Physical Therapist",
    "hometown_location": "Austin, Texas",
    "dating_location": "Los Angeles, California",
    "languages_spoken": [
        "English",
        "Spanish"
    ],
    "values": "Kindness, straightforwardness, empathy",
    "interests": "Outdoor adventures, creating art, travel, cooking, reading",
    "education_level": "Graduate",
    "religious_beliefs": "Agnostic",
    "politics": "Moderate",
    "dating_intentions": "Life partner",
    "relationship_type": "Monogamy",
    "gender": "Man",
    "pronouns": "He/Him/His",
    "sexuality": "Straight",
    "ethnicity": "Black African Descent",
    "has_children": false,
    "want_children": true,
    "pets": [
        "Dog"
    ],
    "zodiac_sign": "Leo",
    "mbti_personality_type": "ENFJ",
    "drinking": "Sometimes",
    "smoking": "No",
    "marijuana": "No",
    "drugs": "No",
    "exercise": "Active",
    "partner_preferences": {
        "minimum_age": 27,
        "maximum_age": 40,
        "minimum_height": "5'0\"",
        "maximum_height": "6'0\"",
        "has_children": false,
        "want_children": true,
        "sexuality": "Straight",
        "drinking": "Sometimes",
        "smoking": "No",
        "marijuana": "No",
        "drugs": "No",
        "exercise": "Active"
    },
    "summary": "Leo Williams is a 35-year-old straight man of Black African descent who currently lives in Los Angeles, California. He is 6'2\" tall, a University of Texas at Austin graduate, and works in the healthcare industry as a physical therapist. Leo speaks English and Spanish. His values center on kindness, straightforwardness, and empathy. His interests include outdoor adventures, creating art, travelling, cooking, and reading. He subscribes to agnostic beliefs, exhibits moderate political views, and identifies as an ENFJ. Leo doesn't smoke or use drugs and occasionally drinks. He is active and enjoys working out. \n\nHe's looking for a life partner who is also monogamous. While Leo doesn't have children, he wishes to have them in the future. On the light-hearted side, he is a Leo and a dog-lover. Leo's ideal partner, aged between 27 and 40, shares his stance on smoking, drinking, and drugs. She also values an active lifestyle, doesn't have children, but wants them in the future.\n",
    "user_id": "924fa51d-9e26-462c-b460-b5654c4cd171"
}
