{
    "name": "Keisha Robinson",
    "age": 31,
    "height": "5'7\"",
    "school": "University of California, Los Angeles",
    "job_industry": "Entertainment",
    "job_title": "Production Coordinator",
    "hometown_location": "Chicago, Illinois",
    "dating_location": "Los Angeles, California",
    "languages_spoken": [
        "English",
        "Spanish"
    ],
    "values": [
        "Integrity",
        "Community",
        "Creativity"
    ],
    "interests": [
        "Movies",
        "Cycling",
        "Traveling"
    ],
    "education_level": "Graduate",
    "religious_beliefs": "Christian",
    "politics": "Moderate",
    "dating_intentions": "Long term",
    "relationship_type": "Monogamy",
    "gender": "Woman",
    "pronouns": "She/Her/Hers",
    "sexuality": "Straight",
    "ethnicity": "Black African Descent",
    "has_children": false,
    "want_children": true,
    "pets": [
        "Cat",
        "None"
    ],
    "zodiac_sign": "Virgo",
    "mbti_personality_type": "ENFJ",
    "drinking": "Sometimes",
    "smoking": "No",
    "marijuana": "No",
    "drugs": "No",
    "exercise": "Active",
    "partner_preferences": {
        "minimum_age": 30,
        "maximum_age": 40,
        "minimum_height": "5'8\"",
        "maximum_height": "6'3\"",
        "has_children": false,
        "want_children": true,
        "sexuality": "Straight",
        "drinking": "Yes",
        "smoking": "No",
        "marijuana": "No",
        "drugs": "No",
        "exercise": "Active"
    },
    "summary": "Keisha Robinson is a 31-year-old woman from Chicago, Illinois who currently lives in Los Angeles, California. She is a Production Coordinator in the Entertainment industry and is a graduate of the University of California, Los Angeles. Keisha is 5'7\", values integrity, community, and creativity, and enjoys movies, cycling, and traveling.\n\nShe is Christian and politically moderate, seeking a long-term, monogamous relationship. She identifies as straight, uses the pronouns She/Her/Hers, and is of Black African descent. She doesn't have children but wants to have them in the future. She has a cat, enjoys the occasional drink but doesn't smoke or use marijuana or drugs.\n\nKeisha prefers a straight man aged between 30 to 40 years, standing 5'8\" to 6'3\" tall. Her ideal partner would want children, enjoy a drink but abstain from smoking, marijuana, and drugs. Keisha embraces the active lifestyle and appreciates a partner who does the same.",
    "user_id": "4ea3725b-dc6c-4ed1-b6d0-e8511971afc1"
}
