{
    "name": "Victoria Collins",
    "age": 30,
    "height": "5'7\"",
    "school": "University of California, Berkeley",
    "job_industry": "Technology",
    "job_title": "Software Engineer",
    "hometown_location": "Sacramento, California",
    "dating_location": "Los Angeles, California",
    "languages_spoken": [
        "English",
        "Spanish"
    ],
    "values": [
        "Honesty",
        "Fidelity",
        "Kindness",
        "Humor"
    ],
    "interests": [
        "Biking",
        "Hiking",
        "Reading Sci-Fi Novels",
        "Playing Chess",
        "Cooking"
    ],
    "education_level": "Graduate",
    "religious_beliefs": "Agnostic",
    "politics": "Liberal",
    "dating_intentions": "Long term",
    "relationship_type": "Monogamy",
    "gender": "Woman",
    "pronouns": "She/Her/Hers",
    "sexuality": "Straight",
    "ethnicity": "White Caucasian",
    "has_children": false,
    "want_children": true,
    "pets": [
        "Cat"
    ],
    "zodiac_sign": "Virgo",
    "mbti_personality_type": "INTJ",
    "drinking": "Sometimes",
    "smoking": "No",
    "marijuana": "No",
    "drugs": "No",
    "exercise": "Active",
    "partner_preferences": {
        "minimum_age": 28,
        "maximum_age": 40,
        "minimum_height": "5'4\"",
        "maximum_height": "6'4\"",
        "has_children": false,
        "want_children": true,
        "sexuality": "Straight",
        "drinking": "Sometimes",
        "smoking": "No",
        "marijuana": "No",
        "drugs": "No",
        "exercise": "Active"
    },
    "summary": "Victoria Collins is a 30-year-old straight woman living in Los Angeles. Located originally from Sacramento, California, she works as a Software Engineer in the Technology industry. Victoria is highly educated with a degree from the University of California, Berkeley. Fluent in English and Spanish, she values honesty, fidelity, kindness, and humor. \n\nHer hobbies include biking, hiking, reading sci-fi novels, playing chess, and cooking. Victoria considers herself an active person and exercises regularly. She's agnostic, politically liberal, and her Myers-Briggs personality type is INTJ. She's a Virgo who owns a cat. \n\nVictoria doesn't smoke or use drugs and only occasionally drinks. She doesn't have children but would like to in the future. Her intent is to find a long-term, monogamous relationship towards a partner aged between 28 and 40, actively exercises, doesn't smoke or use drugs, and who also wants children someday.",
    "user_id": "3b7371ff-fa58-41cc-bdd6-f2f25d00f57b"
}
