{
    "name": "Ashley Johnson",
    "age": 28,
    "height": "5'7\"",
    "school": "University of Southern California",
    "job_industry": "Healthcare & Medical",
    "job_title": "Nurse",
    "hometown_location": "Atlanta, Georgia",
    "dating_location": "Los Angeles, California",
    "languages_spoken": [
        "English",
        "Spanish"
    ],
    "values": "Family, Health, Equality",
    "interests": "Traveling, Hiking, Healthy living, Reading",
    "education_level": "Undergraduate",
    "religious_beliefs": "Christian",
    "politics": "Liberal",
    "dating_intentions": "Life partner",
    "relationship_type": "Monogamy",
    "gender": "Woman",
    "pronouns": "She/Her/Hers",
    "sexuality": "Straight",
    "ethnicity": "Black African Descent",
    "has_children": false,
    "want_children": true,
    "pets": [
        "Dog"
    ],
    "zodiac_sign": "Virgo",
    "mbti_personality_type": "ESFJ",
    "drinking": "Sometimes",
    "smoking": "No",
    "marijuana": "No",
    "drugs": "No",
    "exercise": "Active",
    "partner_preferences": {
        "minimum_age": 28,
        "maximum_age": 35,
        "minimum_height": "5'8\"",
        "maximum_height": "6'2\"",
        "has_children": false,
        "want_children": true,
        "sexuality": "Straight",
        "drinking": "Sometimes",
        "smoking": "No",
        "marijuana": "No",
        "drugs": "No",
        "exercise": "Active"
    },
    "summary": "Ashley Johnson is a 28-year-old woman of Black African descent based in Los Angeles, California. She is a nurse by profession and is educated up to the undergraduate level from the University of Southern California. Ashley values Family, Health, and Equality. She is interested in activities like Traveling, Hiking, Healthy Living, and Reading. She identifies as Christian with liberal political views and is seeking a life partner in a monogamous relationship. She is straight and uses she/her/hers pronouns.\n\nAshley does not have children but wishes to have them in the future. She has a dog and enjoys leading an active lifestyle. She occasionally drinks, but she stays away from smoking, marijuana, and other drugs. Her preferred partner would be a straight man who is between the age of 28 and 35, stands between 5'8\" and 6'2\", does not have children but wants them, leads an active lifestyle, occasionally drinks but doesn't smoke, use marijuana, or other drugs. Ashley is a Virgo and her MBTI personality type is recorded as \"ESFJ\".",
    "user_id": "195f0409-de0f-4ec0-afb7-74cd66efc406"
}
