{
    "name": "Jamila Thomas",
    "age": 35,
    "height": "5'7\"",
    "school": "Stanford University",
    "job_industry": "Tech Industry",
    "job_title": "Senior Software Engineer",
    "hometown_location": "Sacramento, California",
    "dating_location": "Los Angeles, California",
    "languages_spoken": [
        "English",
        "Spanish",
        "Swahili"
    ],
    "values": "Integrity, Creativity, Ambition, Kindness, Confidence",
    "interests": "Reading, Hiking, Live Music, Technology, Trail Running",
    "education_level": "Graduate",
    "religious_beliefs": "Agnostic",
    "politics": "Liberal",
    "dating_intentions": "Long term",
    "relationship_type": "Monogamy",
    "gender": "Woman",
    "pronouns": "She/Her/Hers",
    "sexuality": "Gay",
    "ethnicity": "Black African Descent",
    "has_children": false,
    "want_children": true,
    "pets": [
        "Dog"
    ],
    "zodiac_sign": "Leo",
    "mbti_personality_type": "ENFJ",
    "drinking": "Yes",
    "smoking": "No",
    "marijuana": "No",
    "drugs": "No",
    "exercise": "Active",
    "partner_preferences": {
        "minimum_age": 32,
        "maximum_age": 40,
        "minimum_height": "5'3\"",
        "maximum_height": "6'0\"",
        "has_children": false,
        "want_children": true,
        "sexuality": "Gay",
        "drinking": "Yes",
        "smoking": "No",
        "marijuana": "No",
        "drugs": "No",
        "exercise": "Active"
    },
    "summary": "Jamila Thomas is a 35-year-old Senior Software Engineer in the Tech Industry based in Los Angeles, California, originally from Sacramento. She is an educated woman from Stanford University, fluent in English, Spanish, and Swahili. Jamila is agnostic, politically liberal, and is looking for a long-term, monogamous relationship. She identifies as a woman, utilizes She/Her/Hers pronouns, identifies as gay, and is of Black African descent. She currently does not have children but hopes to in the future. Jamila is an active individual who enjoys reading, hiking, live music, technology, and trail running in her spare time. She is a dog owner, a Leo by zodiac sign, and is characterized as an ENFJ by MBTI typology. Jamila prefers drinking but is not favorable towards smoking, marijuana, or other drugs. She has a preference for women within the ages of 32 and 40 who shares the same viewpoints on alcohol consumption and substances, also values fitness, and is aspiring to have children in the future.",
    "user_id": "286b3c89-c413-46b5-91d2-69f2a5c6a4da"
}
