{
    "name": "Jasmine Patel",
    "age": 31,
    "height": "5'4\"",
    "school": "University of California, Berkeley",
    "job_industry": "Tech",
    "job_title": "Software Engineer",
    "hometown_location": "San Francisco, California",
    "dating_location": "Los Angeles, California",
    "languages_spoken": [
        "English",
        "Hindi",
        "Spanish"
    ],
    "values": "Sustainability, Authenticity, Lifelong learning",
    "interests": "Hiking, Living a green lifestyle, Coding, Playing the guitar, Cooking organic meals",
    "education_level": "Graduate",
    "religious_beliefs": "Hindu",
    "politics": "Liberal",
    "dating_intentions": "Long term, open to short",
    "relationship_type": "Monogamy",
    "gender": "Woman",
    "pronouns": "She/Her/Hers",
    "sexuality": "Straight",
    "ethnicity": "South Asian",
    "has_children": false,
    "want_children": true,
    "pets": [
        "Dog"
    ],
    "zodiac_sign": "Aries",
    "mbti_personality_type": "INFJ",
    "drinking": "Sometimes",
    "smoking": "No",
    "marijuana": "No",
    "drugs": "No",
    "exercise": "Active",
    "partner_preferences": {
        "minimum_age": 28,
        "maximum_age": 35,
        "minimum_height": "5'8\"",
        "maximum_height": "6'3\"",
        "has_children": false,
        "want_children": true,
        "sexuality": "Straight",
        "drinking": "Sometimes",
        "smoking": "No",
        "marijuana": "No",
        "drugs": "No",
        "exercise": "Active"
    },
    "summary": "Jasmine Patel is a 31-year-old woman who is 5'4\". She works in the tech industry as a software engineer and studied at the University of California, Berkeley. Jasmine currently lives in Los Angeles, California, but is originally from San Francisco. She speaks English, Hindi, and Spanish. Jasmine values sustainability, authenticity, and lifelong learning. Some of her interests include hiking, living a green lifestyle, coding, playing the guitar, and cooking organic meals. She is a Hindu, has a liberal political inclination, and seeks a long-term relationship, though she is open to short-term as well. Jasmine identifies herself as straight and is interested in monogamy. Jasmine is of South Asian ethnicity and she hopes to have children in the future. She has a pet dog, an Aries, an 'INFJ' MBTI personality type, and does not consume any type of drugs or smoke, although she drinks occasionally. Jasmine leads an active lifestyle. She prefers a straight partner between the ages of 28 and 35 who doesn't smoke or take drugs, exercises regularly, hopes to have children, and drinks occasionally.\n",
    "user_id": "5eb6607a-0a3d-49fa-89e7-c18dafc0f1cd"
}
