{
    "name": "Eliza Sinclair",
    "age": 30,
    "height": "5'6\"",
    "school": "Stanford University",
    "job_industry": "Technology",
    "job_title": "Software Engineer",
    "hometown_location": "Portland, Oregon",
    "dating_location": "Los Angeles, California",
    "languages_spoken": [
        "English",
        "Spanish"
    ],
    "values": [
        "Honesty",
        "Respect",
        "Ambition",
        "Compassion"
    ],
    "interests": [
        "Traveling",
        "Reading",
        "Outdoor Adventures",
        "Coding",
        "Cooking"
    ],
    "education_level": "Graduate",
    "religious_beliefs": "Agnostic",
    "politics": "Liberal",
    "dating_intentions": "Long term",
    "relationship_type": "Monogamy",
    "gender": "Woman",
    "pronouns": "She/Her/Hers",
    "sexuality": "Straight",
    "ethnicity": "White Caucasian",
    "has_children": false,
    "want_children": true,
    "pets": [
        "Dog"
    ],
    "zodiac_sign": "Gemini",
    "mbti_personality_type": "ENFP",
    "drinking": "Sometimes",
    "smoking": "No",
    "marijuana": "No",
    "drugs": "No",
    "exercise": "Active",
    "partner_preferences": {
        "minimum_age": 28,
        "maximum_age": 40,
        "minimum_height": "5'8\"",
        "maximum_height": "6'4\"",
        "has_children": false,
        "want_children": true,
        "sexuality": "Straight",
        "drinking": "Yes",
        "smoking": "No",
        "marijuana": "No",
        "drugs": "No",
        "exercise": "Active"
    },
    "summary": "Eliza Sinclair is a 30-year-old Software Engineer based in Los Angeles, California, originally from Portland, Oregon. She holds a graduate degree from Stanford University and is fluent in English and Spanish. Eliza values honesty, respect, ambition, and compassion. In her free time, she enjoys traveling, reading, outdoor adventures, coding, and cooking. \n\nAs a woman who identifies as straight, she uses \"She/Her/Hers\" pronouns. Eliza is agnostic and leans liberal politically. She doesn\u2019t smoke or use drugs, and consumes alcohol occasionally. She leads an active lifestyle and has a beloved dog.\n\nEliza is seeking a long-term, monogamous relationship with a man who shares similar values and interests. Her preference is for someone between the ages of 28 to 40, at least 5'8\" tall, who doesn't smoke or use drugs, and also leads an active lifestyle. Like her, he should be someone who doesn't have yet kids but would like to have them in the future.",
    "user_id": "206c7a81-8cf8-42f3-a8e7-43b378cada31"
}
