{
    "name": "Alex Johnson",
    "age": 30,
    "height": "5'8\"",
    "school": "Stanford University",
    "job_industry": "Technology",
    "job_title": "Software Developer",
    "hometown_location": "Seattle, Washington",
    "dating_location": "Los Angeles, California",
    "languages_spoken": [
        "English",
        "Spanish",
        "Mandarin"
    ],
    "values": "Passionate about social justice and environmental sustainability",
    "interests": "Hiking, rock climbing, playing guitar, reading, coding",
    "education_level": "Graduate",
    "religious_beliefs": "Agnostic",
    "politics": "Liberal",
    "dating_intentions": "Long term, open to short",
    "relationship_type": "Monogamy",
    "gender": "Non binary",
    "pronouns": "They/Them/Their",
    "sexuality": "Other",
    "ethnicity": "Hispanic/Latino",
    "has_children": false,
    "want_children": true,
    "pets": [
        "Cat",
        "Fish"
    ],
    "zodiac_sign": "Aquarius",
    "mbti_personality_type": "INFP",
    "drinking": "Sometimes",
    "smoking": "No",
    "marijuana": "No",
    "drugs": "No",
    "exercise": "Active",
    "partner_preferences": {
        "minimum_age": 25,
        "maximum_age": 35,
        "minimum_height": "5'2\"",
        "maximum_height": "6'2\"",
        "has_children": false,
        "want_children": true,
        "sexuality": "Other",
        "drinking": "Sometimes",
        "smoking": "No",
        "marijuana": "No",
        "drugs": "No",
        "exercise": "Active"
    },
    "summary": "Alex Johnson is a 30-year-old non-binary software developer based in Los Angeles, California. They are originally from Seattle, Washington. Alex attended Stanford University and speaks three languages - English, Spanish, and Mandarin. They are passionate about social justice and environmental sustainability, and their interests include hiking, rock climbing, playing guitar, reading, and coding. \n\nIdentifying as agnostic and politically liberal, Alex is interested in a long-term relationship but is open to short ones too. They believe in monogamy and are interested in having children someday despite not having any currently. Their ethnicity is Hispanic/Latino and they're an Aquarius as per the zodiac. They identify as an INFP in the MBTI personality type.\n\nAlex has a cat and a fish as pets. They drink occasionally but are not smokers or drug users. Being actively engaged in physical activities, Alex anticipates their partner to also lead an active life and prefer them to lead a non-smoking lifestyle and have no children, although they're open to those who want children.",
    "user_id": "24f6954d-8392-469f-aaf5-3fce0430b8a5"
}
