{
    "name": "Aaliyah Smith",
    "age": 28,
    "height": "5'6\"",
    "school": "Harvard University",
    "job_industry": "Tech Industry",
    "job_title": "Software Engineer",
    "hometown_location": "Chicago, Illinois",
    "dating_location": "Los Angeles, California",
    "languages_spoken": [
        "English",
        "Spanish"
    ],
    "values": "Family, ambition, creativity, and kindness",
    "interests": "Reading, painting, hiking, and exploring new cultures",
    "education_level": "Graduate",
    "religious_beliefs": "Atheist",
    "politics": "Liberal",
    "dating_intentions": "Long term",
    "relationship_type": "Monogamy",
    "gender": "Woman",
    "pronouns": "She/Her/Hers",
    "sexuality": "Gay",
    "ethnicity": "Black African Descent",
    "has_children": false,
    "want_children": true,
    "pets": [
        "Dog",
        "Cat"
    ],
    "zodiac_sign": "Leo",
    "mbti_personality_type": "INFJ",
    "drinking": "Sometimes",
    "smoking": "No",
    "marijuana": "No",
    "drugs": "No",
    "exercise": "Active",
    "partner_preferences": {
        "minimum_age": 26,
        "maximum_age": 35,
        "minimum_height": "5'0\"",
        "maximum_height": "6'0\"",
        "has_children": false,
        "want_children": true,
        "sexuality": "Gay",
        "drinking": "Yes",
        "smoking": "No",
        "marijuana": "No",
        "drugs": "No",
        "exercise": "Active"
    },
    "summary": "Aaliyah Smith is a 28-year-old software engineer in the tech industry, currently residing in Los Angeles, California. She completed her education at Harvard University. She identifies as a woman, uses she/her pronouns and is a gay person of Black African descent. Aaliyah doesn't have any children but plans to in the future. She is interested in a long-term monogamous relationship. Her values revolve around family, ambition, creativity, and kindness with interests in reading, painting, hiking, and exploring new cultures. Aaliyah speaks both English and Spanish fluently, and her political views lean toward liberal ideologies. She occasionally consumes alcohol but abstains from smoking or using any drugs. She owns a dog and a cat, remains physically active and her MBTI personality type is INFJ. She is a Leo and prefers a partner aged between 26 and 35 who is gay, does not smoke, and leads an active lifestyle. Her potential partner should also want children in the future.",
    "user_id": "b659c133-1d9f-4004-b10a-dd04ea948c48"
}
