{
    "name": "Alex Gomez",
    "age": 32,
    "height": "5'10\"",
    "school": "University of Texas at Austin",
    "job_industry": "Technology",
    "job_title": "Software Engineer",
    "hometown_location": "San Antonio, Texas",
    "dating_location": "Los Angeles, California",
    "languages_spoken": [
        "English",
        "Spanish"
    ],
    "values": "Sustainability, equity and personal freedom",
    "interests": "Outdoor activities, reading, coding and traveling",
    "education_level": "Graduate",
    "religious_beliefs": "Agnostic",
    "politics": "Moderate",
    "dating_intentions": "Long term, open to short",
    "relationship_type": "Monogamy",
    "gender": "Man",
    "pronouns": "He/Him/His",
    "sexuality": "Straight",
    "ethnicity": "Hispanic/Latino",
    "has_children": false,
    "want_children": true,
    "pets": [
        "Dog",
        "Fish"
    ],
    "zodiac_sign": "Aquarius",
    "mbti_personality_type": "INTP",
    "drinking": "Sometimes",
    "smoking": "No",
    "marijuana": "No",
    "drugs": "No",
    "exercise": "Active",
    "partner_preferences": {
        "minimum_age": 25,
        "maximum_age": 35,
        "minimum_height": "5'0\"",
        "maximum_height": "6'0\"",
        "has_children": false,
        "want_children": true,
        "sexuality": "Straight",
        "drinking": "Yes",
        "smoking": "No",
        "marijuana": "No",
        "drugs": "No",
        "exercise": "Sometimes"
    },
    "summary": "Alex Gomez is a 32-year-old straight, Hispanic/Latino man who is 5'10\", speaks both English and Spanish, and resides in Los Angeles, originating from San Antonio, Texas. Professionally, he works as a software engineer in the technology industry, with a graduate degree from the University of Texas at Austin. He identifies as an agnostic moderate in terms of religion and politics. \n\nAlex has a variety of interests including outdoor activities, reading, coding, and traveling, and places high value on sustainability, equity, and personal freedom. His personality type is INTP, representing Introverted, Intuitive, Thinking, and Prospecting traits, and his zodiac sign is Aquarius. \n\nAlex's lifestyle includes owning a dog and a fish, being active and occasionally drinking, but abstains from smoking or drug use. Presently, he doesn't have children but anticipates having kids in the future. \n\nFor potential partners, Alex prefers a straight woman who is between the ages of 25 and 35, and ranges in height from 5'0\" to 6'0\". He expects that the person doesn't have, but wants children. Alex would also prefer a partner who exercises occasionally, drinks, but doesn't smoke or consume marijuana or drugs. He is open for both short term and long term relationships that are monogamous in nature.",
    "user_id": "01dd5480-86e6-42d1-b851-e6159aa0d837"
}
