{
    "name": "Akeem Williams",
    "age": 30,
    "height": "6'2\"",
    "school": "Columbia University",
    "job_industry": "Information Technology",
    "job_title": "Software Developer",
    "hometown_location": "Brooklyn, New York",
    "dating_location": "Los Angeles, California",
    "languages_spoken": [
        "English",
        "Spanish"
    ],
    "values": [
        "Honesty",
        "Independence"
    ],
    "interests": [
        "Coding",
        "Basketball",
        "Traveling"
    ],
    "education_level": "Graduate",
    "religious_beliefs": "Agnostic",
    "politics": "Liberal",
    "dating_intentions": "Long term",
    "relationship_type": "Monogamy",
    "gender": "Man",
    "pronouns": "He/Him/His",
    "sexuality": "Straight",
    "ethnicity": "Black African Descent",
    "has_children": false,
    "want_children": true,
    "pets": [
        "Dog"
    ],
    "zodiac_sign": "Gemini",
    "mbti_personality_type": "ENFP",
    "drinking": "Sometimes",
    "smoking": "No",
    "marijuana": "No",
    "drugs": "No",
    "exercise": "Active",
    "partner_preferences": {
        "minimum_age": 24,
        "maximum_age": 34,
        "minimum_height": "5'4\"",
        "maximum_height": "6'0\"",
        "has_children": false,
        "want_children": true,
        "sexuality": "Straight",
        "drinking": "Yes",
        "smoking": "No",
        "marijuana": "No",
        "drugs": "No",
        "exercise": "Active"
    },
    "summary": "Akeem Williams is a 30-year-old software developer living in Los Angeles, California. Originally from Brooklyn, New York, he is a graduate from Columbia University and can speak both English and Spanish. His interests include coding, basketball, and traveling. He is liberal-leaning, agnostic, doesn't smoke and drinks occasionally. He is an active individual who enjoys having dogs as pets. \n\nAkeem is seeking a straight romantic relationship with long-term dating intentions. He identifies as a straight man who uses \"he/him/his\" pronouns. Though he doesn't currently have children, he desires to have them in the future. The minimum and maximum age for his potential partner is 24 and 34 respectively. She should be between the height of 5'4\" and 6'0\", and also be interested in having children. He prefers a non-smoker who drinks occasionally and leads an active lifestyle. Akeem identifies his ethnic background as of Black African descent, and he falls under the Gemini zodiac sign. His MBTI personality type is ENFP.",
    "user_id": "54ee2441-e250-4dc8-a7ab-027e2446dcc0"
}
