{
    "name": "Alexis Rodriguez",
    "age": 29,
    "height": "5'5\"",
    "school": "University of California, Berkeley",
    "job_industry": "Healthcare",
    "job_title": "Registered Nurse",
    "hometown_location": "Santa Ana, California",
    "dating_location": "Los Angeles, California",
    "languages_spoken": [
        "English",
        "Spanish"
    ],
    "values": "Honesty, compassion, and love for family are fundamental values in my life. I also have a deep respect for cultural diversity.",
    "interests": "I love exploring local farmers markets, hiking, trying new food recipes, reading self-development books, and practicing yoga.",
    "education_level": "Undergraduate",
    "religious_beliefs": "Catholic",
    "politics": "Liberal",
    "dating_intentions": "Life partner",
    "relationship_type": "Monogamy",
    "gender": "Woman",
    "pronouns": "She/Her/Hers",
    "sexuality": "Straight",
    "ethnicity": "Hispanic/Latino",
    "has_children": false,
    "want_children": true,
    "pets": [
        "Dog"
    ],
    "zodiac_sign": "Gemini",
    "mbti_personality_type": "ENFJ",
    "drinking": "Sometimes",
    "smoking": "No",
    "marijuana": "No",
    "drugs": "No",
    "exercise": "Active",
    "partner_preferences": {
        "minimum_age": 27,
        "maximum_age": 35,
        "minimum_height": "5'6\"",
        "maximum_height": "6'2\"",
        "has_children": false,
        "want_children": true,
        "sexuality": "Straight",
        "drinking": "Yes",
        "smoking": "No",
        "marijuana": "No",
        "drugs": "No",
        "exercise": "Active"
    },
    "summary": "Alexis Rodriguez is a 29-year-old straight woman looking for a life partner. She stands 5'5\" tall, works as a registered nurse, and lives in Los Angeles, California. She is Hispanic/Latino and speaks both English and Spanish. With a background in healthcare, she graduated from the University of California, Berkeley. She identifies as Catholic and holds liberal political beliefs. Her important values are honesty, compassion, and love for family, and she has a deep appreciation for cultural diversity.\n\nIn her free time, Alexis enjoys exploring local farmers markets, hiking, cooking new recipes, reading self-development books, and practicing yoga. She's into fitness and is active in exercising. As a Gemini and an ENFJ, she does not smoke or use drugs but occasionally enjoys a drink.\n\nAlexis doesn't have children but wants them in the future. She does, however, have a pet dog. Her preferred partner should be a straight male, aged between 27 and 35, who doesn't smoke or use drugs, and is active. He should be between 5'6\" and 6'2\" in height, have no children but wants them in the future, and enjoys drinking occasionally.",
    "user_id": "320ddc2a-11e8-4874-9863-1e1cc5415ff1"
}
