{
    "name": "Maria Flora Sanchez",
    "age": 33,
    "height": "5'6\"",
    "school": "University of California, Berkeley",
    "job_industry": "Education",
    "job_title": "Secondary School Teacher",
    "hometown_location": "San Diego, California",
    "dating_location": "Los Angeles, California",
    "languages_spoken": [
        "English",
        "Spanish"
    ],
    "values": [
        "Family",
        "Education",
        "Honesty"
    ],
    "interests": [
        "Cooking",
        "Yoga",
        "Hiking"
    ],
    "education_level": "Graduate",
    "religious_beliefs": "Catholic",
    "politics": "Liberal",
    "dating_intentions": "Life partner",
    "relationship_type": "Monogamy",
    "gender": "Woman",
    "pronouns": "She/Her/Hers",
    "sexuality": "Straight",
    "ethnicity": "Hispanic/Latino",
    "has_children": false,
    "want_children": true,
    "pets": [
        "Cat"
    ],
    "zodiac_sign": "Leo",
    "mbti_personality_type": "ENFJ",
    "drinking": "Sometimes",
    "smoking": "No",
    "marijuana": "No",
    "drugs": "No",
    "exercise": "Active",
    "partner_preferences": {
        "minimum_age": 30,
        "maximum_age": 40,
        "minimum_height": "5'8\"",
        "maximum_height": "6'2\"",
        "has_children": false,
        "want_children": true,
        "sexuality": "Straight",
        "drinking": "Yes",
        "smoking": "No",
        "marijuana": "No",
        "drugs": "No",
        "exercise": "Active",
        "gender": "Man",
        "dating_intentions": "Life partner",
        "relationship_type": "Monogamy",
        "ethnicities": [
            "Hispanic/Latino",
            "White Caucasian"
        ],
        "politics": [
            "Liberal"
        ],
        "job_industry": [
            "Education",
            "Healthcare",
            "Technology"
        ],
        "languages_spoken": [
            "English",
            "Spanish"
        ],
        "values": [
            "Family",
            "Education",
            "Honesty"
        ],
        "interests": [
            "Cooking",
            "Fitness",
            "Outdoors"
        ],
        "education_level": [
            "Undergraduate",
            "Graduate"
        ]
    },
    "profile_summary": "The user is a 33-year-old straight woman of Hispanic/Latino ethnicity, who stands at a height of 5'6\". She identifies her pronouns as She/Her/Hers. She is an education professional working as a Secondary School Teacher. She graduated from the University of California, Berkeley and her education level is Graduate. The user is based in Los Angeles, but her hometown is in San Diego, California. She speaks English and Spanish. Her core values are family, education, and honesty with main interests in cooking, yoga, and hiking. She follows Catholic religious beliefs and votes liberal. She is aiming to find a life partner, preferring monogamy. She does not have children but wishes to in the future. She has a cat as her pet. Born under the Leo star sign, her personality type is listed as ENFJ. A health-conscious individual, she is active in exercise, occasionally drinks, and doesn't smoke, use marijuana, or drugs.\n",
    "preferences_summary": "The user is seeking a man aged between 30 to 40 years old, who is straight and interested in monogamy. He should be between 5'8\" to 6'2\" in height and actively exercises. His drinking habits can include alcohol but he should not smoke or use marijuana or other drugs. His ethnicity should be either Hispanic, Latino or White Caucasian. The man should not have children but should want them in the future. He should be working in the fields of Education, Healthcare, or Technology. Speaking both English and Spanish is a must, with values focusing on family, education, and honesty. He should share interests in cooking, fitness, and outdoor activities. As for education level, he should have an undergraduate or a graduate degree. Moreover, the man should hold Liberal political views. This is all with the intention of finding a life partner.",
    "user_id": "12583079-e389-4967-96be-c690ebd065c1"
}
