{
    "name": "Anika Patel",
    "age": 30,
    "height": "5'6\"",
    "school": "University of California, Berkeley",
    "job_industry": "Healthcare",
    "job_title": "Pharmacist",
    "hometown_location": "San Jose, California",
    "dating_location": "Los Angeles, California",
    "languages_spoken": [
        "English",
        "Hindi"
    ],
    "values": [
        "Family",
        "Ambition"
    ],
    "interests": [
        "Traveling",
        "Cooking",
        "Reading"
    ],
    "education_level": "Graduate",
    "religious_beliefs": "Hindu",
    "politics": "Liberal",
    "dating_intentions": "Long term",
    "relationship_type": "Monogamy",
    "gender": "Woman",
    "pronouns": "She/Her/Hers",
    "sexuality": "Straight",
    "ethnicity": "South Asian",
    "has_children": false,
    "want_children": true,
    "pets": [
        "Cat"
    ],
    "zodiac_sign": "Leo",
    "mbti_personality_type": "ENFP",
    "drinking": "Yes",
    "smoking": "No",
    "marijuana": "No",
    "drugs": "No",
    "exercise": "Active",
    "partner_preferences": {
        "minimum_age": 28,
        "maximum_age": 35,
        "minimum_height": "5'8\"",
        "maximum_height": "6'2\"",
        "has_children": false,
        "want_children": true,
        "sexuality": "Straight",
        "drinking": "Yes",
        "smoking": "No",
        "marijuana": "No",
        "drugs": "No",
        "exercise": "Active"
    },
    "summary": "Anika Patel is a 30-year-old straight woman who is actively looking for a long-term, monogamous relationship. She is a Pharmacist in the Healthcare industry, originally hailing from San Jose, California, but currently resides in Los Angeles. Anika is multilingual, fluent in both English and Hindi. She puts great importance on family and ambition. \n\nAnika's interests include traveling, cooking, and reading. She is a liberal, a Hindu, and a graduate from the University of California, Berkeley. Anika is an ENFP based on the MBTI personality test and a Leo in astrology. \n\nShe enjoys exercising and occasional drinking but does not smoke or use marijuana or other drugs. Anika has a cat and is open to the idea of having children in the future, although she currently doesn't have any.\n\nAnika is looking for a partner who is between the ages of 28 and 35, at least 5'8\" in height, childless but open to the idea of having kids. She prefers her potential partner to share her active lifestyle, occasional drinking habits, but not smoking or using marijuana/other drugs. Crucially, her partner should identify as a straight man.",
    "user_id": "7f6c95da-26ed-41a1-9449-94c41404df52"
}
