{
    "name": "James McGregor",
    "age": 32,
    "height": "6'1\"",
    "school": "University of Glasgow",
    "job_industry": "Technology",
    "job_title": "Software Engineer",
    "hometown_location": "Glasgow, Scotland",
    "dating_location": "Los Angeles, California",
    "languages_spoken": [
        "English",
        "Gaelic"
    ],
    "values": [
        "Honesty",
        "Kindness",
        "Ambition"
    ],
    "interests": [
        "Hiking",
        "Music",
        "Philosophy"
    ],
    "education_level": "Graduate",
    "religious_beliefs": "Agnostic",
    "politics": "Liberal",
    "dating_intentions": "Long term",
    "relationship_type": "Monogamy",
    "gender": "Man",
    "pronouns": "He/Him/His",
    "sexuality": "Straight",
    "ethnicity": "White Caucasian",
    "has_children": false,
    "want_children": true,
    "pets": [
        "Dog"
    ],
    "zodiac_sign": "Aquarius",
    "mbti_personality_type": "INTP",
    "drinking": "Sometimes",
    "smoking": "No",
    "marijuana": "No",
    "drugs": "No",
    "exercise": "Active",
    "partner_preferences": {
        "minimum_age": 28,
        "maximum_age": 35,
        "minimum_height": "5'0\"",
        "maximum_height": "6'2\"",
        "has_children": false,
        "want_children": true,
        "sexuality": "Straight",
        "drinking": "Sometimes",
        "smoking": "No",
        "marijuana": "No",
        "drugs": "No",
        "exercise": "Active"
    },
    "summary": "James McGregor is a 32-year-old straight man living in Los Angeles, California. Originally from Glasgow, Scotland, he is fluent in English and Gaelic. He works in the tech industry as a Software Engineer and is a graduate of the University of Glasgow. Key values for James include honesty, kindness, and ambition. \n\nIn his free time, he enjoys hiking, music, and philosophy. Politically, he identifies as liberal and religiously as agnostic. He is interested in a long-term, monogamous relationship and wants children in the future. He is an Aquarius and an INTP personality type.\n\nHis lifestyle is active, though he occasionally enjoys a drink, he does not indulge in smoking tobacco or marijuana, and does not use drugs. His ideal partner would be someone aged between 28 and 35 who shares his aspiration for kids and his active, non-smoking lifestyle.",
    "user_id": "0a4150c7-007b-44ff-b903-cebe4f2c3b3b"
}
