{
    "name": "Claire Adhiambo",
    "age": 27,
    "height": "5'6\"",
    "school": "University of Nairobi",
    "job_industry": "Healthcare",
    "job_title": "Registered Nurse",
    "hometown_location": "Nairobi, Kenya",
    "dating_location": "Los Angeles, California",
    "languages_spoken": [
        "English",
        "Swahili"
    ],
    "values": [
        "Family",
        "Fitness",
        "Adventure"
    ],
    "interests": [
        "Traveling",
        "Cooking",
        "Reading"
    ],
    "education_level": "Undergraduate",
    "religious_beliefs": "Christian",
    "politics": "Moderate",
    "dating_intentions": "Long term",
    "relationship_type": "Monogamy",
    "gender": "Woman",
    "pronouns": "She/Her/Hers",
    "sexuality": "Straight",
    "ethnicity": "Black African Descent",
    "has_children": false,
    "want_children": true,
    "pets": [
        "None"
    ],
    "zodiac_sign": "Virgo",
    "mbti_personality_type": "ISFJ",
    "drinking": "Sometimes",
    "smoking": "No",
    "marijuana": "No",
    "drugs": "No",
    "exercise": "Active",
    "partner_preferences": {
        "minimum_age": 27,
        "maximum_age": 35,
        "minimum_height": "5'8\"",
        "maximum_height": "6'3\"",
        "has_children": false,
        "want_children": true,
        "sexuality": "Straight",
        "drinking": "Yes",
        "smoking": "No",
        "marijuana": "No",
        "drugs": "No",
        "exercise": "Active"
    },
    "summary": "Claire Adhiambo is a 27-year-old woman who is a Registered Nurse in the healthcare industry. She originates from Nairobi, Kenya, and is now living in Los Angeles, California. Claire is highly educated, having attended the University of Nairobi. She's fluent in English and Swahili. Claire identifies herself as Christian, holds moderate political views and is aiming for a long-term, monogamous relationship.\n\nHer interests include traveling, cooking, reading, while she values family, fitness, and adventure. Despite being active and sometimes enjoying a drink, she does not smoke or consume drugs or marijuana. Claire, straight and identifying with the pronouns 'she/her/hers', belongs to the Black African Descent community. She doesn't have children but looks forward to having one in the future. \n\nClaire prefers a straight male partner between the ages of 27 to 35, who is at least 5'8\" tall. She is inclined towards a partner who is active, enjoys a drink but is not into smoking or drugs, and who doesn't have but is open to having kids.",
    "user_id": "7674faa9-209a-492b-a35b-c25e8fece735"
}
