{
    "name": "Carter Montgomery",
    "age": 27,
    "height": "5'10\"",
    "school": "University of California",
    "job_industry": "IT",
    "job_title": "Software Developer",
    "hometown_location": "San Francisco, California",
    "dating_location": "Los Angeles, California",
    "languages_spoken": [
        "English",
        "Spanish"
    ],
    "values": [
        "Honesty",
        "Hard Work",
        "Kindness"
    ],
    "interests": [
        "Tech gadgets",
        "Photography",
        "Outdoor activities"
    ],
    "education_level": "Graduate",
    "religious_beliefs": "Agnostic",
    "politics": "Moderate",
    "dating_intentions": "Long term",
    "relationship_type": "Monogamy",
    "gender": "Man",
    "pronouns": "He/Him/His",
    "sexuality": "Straight",
    "ethnicity": "White Caucasian",
    "has_children": false,
    "want_children": true,
    "pets": [
        "Dog"
    ],
    "zodiac_sign": "Aries",
    "mbti_personality_type": "ENFJ",
    "drinking": "Yes",
    "smoking": "No",
    "marijuana": "No",
    "drugs": "No",
    "exercise": "Active",
    "partner_preferences": {
        "minimum_age": 25,
        "maximum_age": 31,
        "minimum_height": "5'0\"",
        "maximum_height": "6'3\"",
        "has_children": false,
        "want_children": true,
        "sexuality": "Straight",
        "drinking": "No",
        "smoking": "No",
        "marijuana": "No",
        "drugs": "No",
        "exercise": "Active"
    },
    "summary": "Carter Montgomery is a 27-year-old straight man who identifies with he/him/his pronouns. He's 5'10\" tall, is a software developer in the IT industry, and has a graduate degree from the University of California. Carter is originally from San Francisco, California, but is currently based in Los Angeles. \n\nHe speaks both English and Spanish and embraces values such as honesty, hard work, and kindness. An active outdoorsy type, Carter enjoys technology, photography, and outdoor activities. He is also a proud dog owner. \n\nCarter is an agnostic Aries and an ENFJ personality type. Politically, he leans moderate. He's seeking a monogamous, long-term relationship and he wants to have children in the future. A smoker and drug user he's not, but he does drink alcohol.\n\nIn his search for a partner, he prefers an active woman aged between 25 to 31, who doesn't currently have children but wants them in the future, doesn't smoke, use marijuana or other drugs, and doesn't drink alcohol. She should be between the heights of 5'0\" and 6'3\".",
    "user_id": "419691e4-2b0f-4469-bad4-2321e51dd65f"
}
