{
    "name": "Sophia Brown",
    "age": 29,
    "height": "5'6\"",
    "school": "Stanford University",
    "job_industry": "Technology",
    "job_title": "Software Engineer",
    "hometown_location": "San Francisco, California",
    "dating_location": "Los Angeles, California",
    "languages_spoken": [
        "English",
        "Spanish"
    ],
    "values": [
        "Equality",
        "Hard work",
        "Empathy"
    ],
    "interests": [
        "Reading",
        "Travel",
        "Cooking"
    ],
    "education_level": "Graduate",
    "religious_beliefs": "Atheist",
    "politics": "Liberal",
    "dating_intentions": "Long term",
    "relationship_type": "Monogamy",
    "gender": "Woman",
    "pronouns": "She/Her/Hers",
    "sexuality": "Straight",
    "ethnicity": "White Caucasian",
    "has_children": false,
    "want_children": true,
    "pets": [
        "Dog"
    ],
    "zodiac_sign": "Gemini",
    "mbti_personality_type": "ENFP",
    "drinking": "Sometimes",
    "smoking": "No",
    "marijuana": "No",
    "drugs": "No",
    "exercise": "Active",
    "partner_preferences": {
        "minimum_age": 28,
        "maximum_age": 38,
        "minimum_height": "5'8\"",
        "maximum_height": "6'2\"",
        "has_children": false,
        "want_children": true,
        "sexuality": "Straight",
        "drinking": "Yes",
        "smoking": "No",
        "marijuana": "No",
        "drugs": "No",
        "exercise": "Active"
    },
    "summary": "Sophia Brown is a 29-year-old Software Engineer from San Francisco, currently living in Los Angeles. She is a Stanford graduate who values equality, hard work, and empathy. Her interests include reading, travel, and cooking. \n\nAt 5'6\", Sophia is a White Caucasian woman who uses she/her/hers pronouns. She identifies as straight and is looking for a monogamous, long-term relationship. A Gemini with an ENFP personality type, Sophia occasionally enjoys a drink but does not smoke or use marijuana or drugs.\n\nSophia has a dog, does not have any children yet, but would like to in the future. Her ideal partner would be a straight man between the ages of 28 and 38, standing between 5'8\" and 6'2\" tall. He should value an active lifestyle, not smoke, and be fine with occasional drinks. Ideally, he should also be interested in having children.",
    "user_id": "1da06cb3-a71e-4fab-b311-9eb89c66a0f4"
}
