{
    "name": "Jamie Lopez",
    "age": 31,
    "height": "5'7\"",
    "school": "University of California, Los Angeles",
    "job_industry": "Healthcare",
    "job_title": "Registered Nurse",
    "hometown_location": "San Diego, California",
    "dating_location": "Los Angeles, California",
    "languages_spoken": [
        "English",
        "Spanish"
    ],
    "values": "Honesty, Empathy, Respect",
    "interests": "Yoga, Travel, Cooking",
    "education_level": "Graduate",
    "religious_beliefs": "Agnostic",
    "politics": "Liberal",
    "dating_intentions": "Life partner",
    "relationship_type": "Monogamy",
    "gender": "Non binary",
    "pronouns": "They/Them/Their",
    "sexuality": "Gay",
    "ethnicity": "Hispanic/Latino",
    "has_children": false,
    "want_children": true,
    "pets": [
        "Dog"
    ],
    "zodiac_sign": "Libra",
    "mbti_personality_type": "ENFP",
    "drinking": "Sometimes",
    "smoking": "No",
    "marijuana": "No",
    "drugs": "No",
    "exercise": "Active",
    "partner_preferences": {
        "minimum_age": 29,
        "maximum_age": 40,
        "minimum_height": "5'6\"",
        "maximum_height": "6'1\"",
        "has_children": false,
        "want_children": true,
        "sexuality": "Gay",
        "drinking": "Yes",
        "smoking": "No",
        "marijuana": "No",
        "drugs": "No",
        "exercise": "Active"
    },
    "summary": "Jamie Lopez is a 31-year-old, non-binary, gay individual from San Diego, California. Their ethnicity is Hispanic/Latino and their pronouns are they/them/their. Professionally, they are a Registered Nurse in the Healthcare industry after graduating from the University of California, Los Angeles. Jamie currently resides in Los Angeles and they actively speak English and Spanish. They highly value honesty, empathy, and respect. They enjoy yoga, traveling, and cooking. While they are agnostic and lean politically liberal, they are actively looking for a life partner interested in monogamy. They don\u2019t have any children but would like to have in the future. They own a dog, don't smoke but drink occasionally. With an active lifestyle, Jamie is a Libra and identifies as ENFP according to the MBTI personality type. As per their preferences, they are open to meeting gay men who are between 29 and 40 years old, are active, don't smoke, but may drink, and are considering having children in the future.",
    "user_id": "7bf8cb58-bc66-4981-89b8-a2b3f743cd20"
}
