{
    "name": "Hiroshi Takahashi",
    "age": 28,
    "height": "5'10\"",
    "school": "Kyoto University",
    "job_industry": "Technology",
    "job_title": "Software Engineer",
    "hometown_location": "Kyoto, Japan",
    "dating_location": "Los Angeles, California",
    "languages_spoken": [
        "Japanese",
        "English"
    ],
    "values": [
        "Family",
        "Hard work",
        "Personal growth"
    ],
    "interests": [
        "Cycling",
        "Gaming",
        "Anime",
        "Cooking"
    ],
    "education_level": "Graduate",
    "religious_beliefs": "Buddhist",
    "politics": "Liberal",
    "dating_intentions": "Long term",
    "relationship_type": "Monogamy",
    "gender": "Man",
    "pronouns": "He/Him/His",
    "sexuality": "Straight",
    "ethnicity": "East Asian",
    "has_children": false,
    "want_children": true,
    "pets": [
        "None"
    ],
    "zodiac_sign": "Virgo",
    "mbti_personality_type": "INTJ",
    "drinking": "Sometimes",
    "smoking": "No",
    "marijuana": "No",
    "drugs": "No",
    "exercise": "Active",
    "partner_preferences": {
        "minimum_age": 25,
        "maximum_age": 30,
        "minimum_height": "5'4\"",
        "maximum_height": "5'11\"",
        "has_children": false,
        "want_children": true,
        "sexuality": "Straight",
        "drinking": "Sometimes",
        "smoking": "No",
        "marijuana": "No",
        "drugs": "No",
        "exercise": "Sometimes"
    },
    "summary": "Hiroshi Takahashi is a 28-year-old, straight man who is a Software Engineer in the technology industry. Originally from Kyoto, Japan, he's now located in Los Angeles, California. A graduate from Kyoto University, Hiroshi is fluent in English and Japanese, values family, hard work, and personal growth, and enjoys interests such as cycling, gaming, anime, and cooking.\n\nIdentifying as a Buddhist with liberal political views, Hiroshi is in search for a long-term and monogamous relationship. He doesn't have children but is open to having them in the future. As an active individual who sometimes drinks but doesn't smoke or use drugs, Hiroshi is a Virgo by the zodiac sign and identifies as an INTJ according to the MBTI personality type.\n\nHiroshi is interested in straight women between the ages of 25 and 30, who also value an active lifestyle, occasional drinking, and don't smoke or use drugs. His potential partner should also be open to having children in the future.\n",
    "user_id": "a715acc9-3a24-488a-98d9-956738541ce7"
}
