{
    "name": "Kenyatta Njoroge",
    "age": 32,
    "height": "5'8\"",
    "school": "University of Nairobi",
    "job_industry": "Healthcare",
    "job_title": "Nurse Practitioner",
    "hometown_location": "Nairobi, Kenya",
    "dating_location": "Los Angeles, California",
    "languages_spoken": [
        "English",
        "Swahili",
        "Kikuyu"
    ],
    "values": [
        "Family",
        "Work-life balance",
        "Spirituality"
    ],
    "interests": [
        "Outdoor Exercises",
        "Reading",
        "Traveling"
    ],
    "education_level": "Graduate",
    "religious_beliefs": "Christian",
    "politics": "Moderate",
    "dating_intentions": "Life partner",
    "relationship_type": "Monogamy",
    "gender": "Man",
    "pronouns": "He/Him/His",
    "sexuality": "Straight",
    "ethnicity": "Black African Descent",
    "has_children": false,
    "want_children": true,
    "pets": [
        "Dog"
    ],
    "zodiac_sign": "Leo",
    "mbti_personality_type": "ENFJ",
    "drinking": "Sometimes",
    "smoking": "No",
    "marijuana": "No",
    "drugs": "No",
    "exercise": "Active",
    "partner_preferences": {
        "minimum_age": 27,
        "maximum_age": 35,
        "minimum_height": "5'2\"",
        "maximum_height": "6'0\"",
        "has_children": false,
        "want_children": true,
        "sexuality": "Straight",
        "drinking": "Sometimes",
        "smoking": "No",
        "marijuana": "No",
        "drugs": "No",
        "exercise": "Active"
    },
    "summary": "Kenyatta Njoroge, a 32-year-old man, is currently living in Los Angeles, California. He originally comes from Nairobi, Kenya, and is fluent in English, Swahili, and Kikuyu. Kenyatta is a dedicated Nurse Practitioner in the Healthcare industry, and as a University of Nairobi graduate, he values work-life balance, family, and spirituality. As a man of Black African descent, he identifies as Christian and follows a moderate political viewpoint.\n\nKenyatta enjoys outdoor exercise, reading, and travelling. A Leo by zodiac signs, Kenyatta exhibits ENFJ personality traits and is a straight, monogamous individual. He has no children but wishes to become a father in the future. \n\nIn terms of lifestyle, Kenyatta is an active individual who sometimes drinks but abstains from smoking, marijuana, and drugs. He has a pet dog. \n\nKenyatta is searching for a straight life partner aged between 27 and 35, who is active, sometimes drinks but doesn't smoke or consume drugs or marijuana. His preference is that they have no children but are open to having some in the future.",
    "user_id": "4993d701-c2c2-4a94-b4c0-bcd09eb10437"
}
