{
    "name": "Josephine Lane",
    "age": 29,
    "height": "5'7\"",
    "school": "University of Southern California",
    "job_industry": "Healthcare",
    "job_title": "Registered Nurse",
    "hometown_location": "Phoenix, Arizona",
    "dating_location": "Los Angeles, California",
    "languages_spoken": [
        "English",
        "Spanish"
    ],
    "values": [
        "Family",
        "Charity",
        "Health & Fitness"
    ],
    "interests": [
        "Yoga",
        "Traveling",
        "Cooking",
        "Reading"
    ],
    "education_level": "Graduate",
    "religious_beliefs": "Catholic",
    "politics": "Moderate",
    "dating_intentions": "Long term",
    "relationship_type": "Monogamy",
    "gender": "Woman",
    "pronouns": "She/Her/Hers",
    "sexuality": "Straight",
    "ethnicity": "Hispanic/Latino",
    "has_children": false,
    "want_children": true,
    "pets": [
        "Dog"
    ],
    "zodiac_sign": "Scorpio",
    "mbti_personality_type": "ENFP",
    "drinking": "Sometimes",
    "smoking": "No",
    "marijuana": "No",
    "drugs": "No",
    "exercise": "Active",
    "partner_preferences": {
        "minimum_age": 28,
        "maximum_age": 35,
        "minimum_height": "5'7\"",
        "maximum_height": "6'2\"",
        "has_children": false,
        "want_children": true,
        "sexuality": "Straight",
        "drinking": "Sometimes",
        "smoking": "No",
        "marijuana": "No",
        "drugs": "No",
        "exercise": "Active",
        "gender": "Man",
        "dating_intentions": "Long term",
        "relationship_type": "Monogamy",
        "ethnicities": [
            "Black African Descent",
            "East Asian",
            "Hispanic/Latino",
            "Middle Eastern",
            "Native American",
            "Pacific Islander",
            "South Asian",
            "Southeast Asian",
            "White Caucasian"
        ],
        "politics": [
            "Liberal",
            "Moderate",
            "Conservative"
        ],
        "job_industry": [
            "Healthcare",
            "Education",
            "Engineering",
            "Business",
            "Law Enforcement & Security"
        ],
        "languages_spoken": [
            "English"
        ],
        "values": [
            "Family",
            "Charity",
            "Health & Fitness"
        ],
        "interests": [
            "Fitness",
            "Traveling",
            "Cooking"
        ],
        "education_level": [
            "Graduate",
            "Undergraduate"
        ]
    },
    "profile_summary": "Our user is a 29-year-old woman who is a professional Registered Nurse in the Healthcare industry and has an ENFP personality type. She's originally from Phoenix, Arizona, but currently dating in Los Angeles, California. Having obtained a graduate degree from the University of Southern California, she is fluent in both English and Spanish. She identifies as a straight Hispanic/Latino, practicing Catholic with Scorpio as her zodiac sign. She values family, charity, and health & fitness strongly. Interesting activities she enjoys include yoga, cooking, reading, and travelling. Although currently without kids, she definitely wants children. She has a dog as her pet and leads an active lifestyle. Occasionally enjoys a drink but strictly says no to smoking, marijuana, and other drugs. She is specifically interested in a committed, long-term monogamous relationship.\n",
    "preferences_summary": "The user is looking for a man aged between 28 to 35 years, standing anywhere between 5'7\" and 6'2\" in height. Her potential partner should not have any children but should desire to have them in the future. She prefers a straight man who drinks occasionally but does not smoke or use marijuana or drugs. As far as physical preferences go, the man should lead an active lifestyle. The user is open to dating men from multiple ethnic backgrounds, including Black African Descent, East Asian, Hispanic/Latino, Middle Eastern, Native American, Pacific Islander, South Asian, Southeast Asian, and White Caucasian. She is okay with her partner having any political inclination (liberal, moderate, or conservative) and should be employed in sectors like healthcare, education, engineering, business, or law enforcement & security. The prospective partner should be able to communicate in English and resonate with values like family, charity, and health & fitness. She would like for him to also enjoy fitness, traveling, cooking, and should have either an undergraduate or graduate-level education.",
    "user_id": "21f83446-98e1-47af-898c-c09826584ae4"
}
