{
    "name": "Fatima Al-Mansoori",
    "age": 30,
    "height": "5'4\"",
    "school": "University of Dubai",
    "job_industry": "Healthcare",
    "job_title": "Pharmacist",
    "hometown_location": "Dubai, United Arab Emirates",
    "dating_location": "Los Angeles, California",
    "languages_spoken": [
        "Arabic",
        "English"
    ],
    "values": [
        "Charity",
        "Family",
        "Knowledge"
    ],
    "interests": [
        "Reading",
        "Fitness",
        "Cooking"
    ],
    "education_level": "Graduate",
    "religious_beliefs": "Muslim",
    "politics": "Moderate",
    "dating_intentions": "Long term",
    "relationship_type": "Monogamy",
    "gender": "Woman",
    "pronouns": "She/Her/Hers",
    "sexuality": "Straight",
    "ethnicity": "Middle Eastern",
    "has_children": false,
    "want_children": true,
    "pets": [
        "None"
    ],
    "zodiac_sign": "Aquarius",
    "mbti_personality_type": "ISFJ",
    "drinking": "No",
    "smoking": "No",
    "marijuana": "No",
    "drugs": "No",
    "exercise": "Active",
    "partner_preferences": {
        "minimum_age": 30,
        "maximum_age": 40,
        "minimum_height": "5'8\"",
        "maximum_height": "6'2\"",
        "has_children": false,
        "want_children": true,
        "sexuality": "Straight",
        "drinking": "No",
        "smoking": "No",
        "marijuana": "No",
        "drugs": "No",
        "exercise": "Active"
    },
    "summary": "Fatima Al-Mansoori is a 30-year-old woman of Middle Eastern ethnicity from Dubai, currently residing in Los Angeles. As a graduate of the University of Dubai, she has made a career in the healthcare industry as a pharmacist. Fatima is a practicing Muslim with moderate political views and her core values revolve around charity, family, and knowledge. She enjoys interests such as reading, fitness, and cooking. \n\nShe's looking for a straight man who is serious about long-term relationships, between the ages of 30 and 40. Preferred traits in her potential partner include being active, non-drinking, non-smoking, and also wanting children in the future, as she currently doesn't have children but wishes to in the future. \n\nShe's a non-smoker, doesn't drink or use drugs, and leads an active lifestyle. She's an Aquarius and identifies as an ISFJ personality type.",
    "user_id": "2183495b-137a-41d2-9668-5ee755073680"
}
