{
    "name": "Aliyah Mohammed",
    "age": 28,
    "height": "5'6\"",
    "school": "University of California, Los Angeles",
    "job_industry": "Healthcare",
    "job_title": "Registered Nurse",
    "hometown_location": "Detroit, Michigan",
    "dating_location": "Los Angeles, California",
    "languages_spoken": [
        "English",
        "Arabic"
    ],
    "values": [
        "Family",
        "Career",
        "Faith"
    ],
    "interests": [
        "Cooking",
        "Traveling",
        "Volunteering",
        "Yoga"
    ],
    "education_level": "Graduate",
    "religious_beliefs": "Muslim",
    "politics": "Moderate",
    "dating_intentions": "Life partner",
    "relationship_type": "Monogamy",
    "gender": "Woman",
    "pronouns": "She/Her/Hers",
    "sexuality": "Straight",
    "ethnicity": "Middle Eastern",
    "has_children": false,
    "want_children": true,
    "pets": [
        "Cat"
    ],
    "zodiac_sign": "Scorpio",
    "mbti_personality_type": "ISFJ",
    "drinking": "No",
    "smoking": "No",
    "marijuana": "No",
    "drugs": "No",
    "exercise": "Active",
    "partner_preferences": {
        "minimum_age": 28,
        "maximum_age": 36,
        "minimum_height": "5'8\"",
        "maximum_height": "6'3\"",
        "has_children": false,
        "want_children": true,
        "sexuality": "Straight",
        "drinking": "No",
        "smoking": "No",
        "marijuana": "No",
        "drugs": "No",
        "exercise": "Active"
    },
    "summary": "Aliyah Mohammed is a 28-year-old Registered Nurse based in Los Angeles, California, originally from Detroit, Michigan. She is a graduate of the University of California, Los Angeles, and works in the healthcare industry. She presents herself as a family-oriented, career-focused and faithful Muslim woman. She enjoys cooking, traveling, volunteering, and yoga in her spare time. She is straight, identifies as Middle Eastern, and uses she/her pronouns. Aliyah does not currently have children, but is open to having them in the future. She owns a pet cat, is a Scorpio, and identifies as an ISFJ personality type. She lives an active lifestyle and abstains from drinking, smoking, marijuana, and drugs use. She is seeking a straight man aged between 28 to 36 who leads a healthy lifestyle, intends to have children, and shares her non-drug/no-smoking preferences.",
    "user_id": "9336996f-6c93-4d27-bcb0-f896362b7d5a"
}
