{
    "name": "Alex Johnson",
    "age": 30,
    "height": "6'0\"",
    "school": "UCLA",
    "job_industry": "Marketing",
    "job_title": "Social Media Specialist",
    "hometown_location": "Austin, Texas",
    "dating_location": "Los Angeles, California",
    "languages_spoken": [
        "English",
        "Spanish"
    ],
    "values": "Authenticity, kindness, and creativity",
    "interests": "Photography, nature hikes, and acoustic music",
    "education_level": "Undergraduate",
    "religious_beliefs": "Agnostic",
    "politics": "Liberal",
    "dating_intentions": "Long term",
    "relationship_type": "Monogamy",
    "gender": "Non binary",
    "pronouns": "They/Them/Their",
    "sexuality": "Other",
    "ethnicity": "Hispanic/Latino",
    "has_children": false,
    "want_children": true,
    "pets": [
        "Dog"
    ],
    "zodiac_sign": "Cancer",
    "mbti_personality_type": "INFJ",
    "drinking": "Sometimes",
    "smoking": "No",
    "marijuana": "No",
    "drugs": "No",
    "exercise": "Active",
    "partner_preferences": {
        "minimum_age": 26,
        "maximum_age": 35,
        "minimum_height": "5'5\"",
        "maximum_height": "6'2\"",
        "has_children": false,
        "want_children": true,
        "sexuality": "Other",
        "drinking": "No",
        "smoking": "No",
        "marijuana": "No",
        "drugs": "No",
        "exercise": "Active"
    },
    "summary": "This dating profile belongs to a 30-year-old non-binary social media specialist named Alex Johnson. Alex identifies as Hispanic/Latino and uses they/them pronouns. Despite being from Austin, Texas, they are currently located in Los Angeles, California and are fluent in both English and Spanish. They studied at UCLA and align with liberal political views. Alex is agnostic and doesn't currently have children but wishes to have some in the future. They have a dog, do not smoke but drink occasionally, are quite active, and don't use marijuana or other drugs.\n\nAlex is an INFJ as per the Myer-Briggs personality type and their zodiac sign is Cancer. They seek a long-term monogamous relationship. Their interests include photography, nature hikes, and acoustic music whereas they value authenticity, kindness, and creativity.\n\nFor a partner, Alex prefers someone who doesn't smoke or use drugs, and is an active person between 26 and 35 years old. The prospective partner should also be interested in having children in the future and doesn't have any currently.",
    "user_id": "7dd43b81-ca74-459f-ac1c-701898f7bf2e"
}
