{
    "name": "Anastasia Papadopoulos",
    "age": 29,
    "height": "5'6\"",
    "school": "New York University",
    "job_industry": "Marketing",
    "job_title": "Content Strategy Manager",
    "hometown_location": "Athens, Greece",
    "dating_location": "Los Angeles, California",
    "languages_spoken": [
        "English",
        "Greek",
        "Spanish"
    ],
    "values": [
        "Creativity",
        "Independence",
        "Compassion"
    ],
    "interests": [
        "Painting",
        "Traveling",
        "Yoga"
    ],
    "education_level": "Graduate",
    "religious_beliefs": "Orthodox",
    "politics": "Liberal",
    "dating_intentions": "Long term",
    "relationship_type": "Monogamy",
    "gender": "Woman",
    "pronouns": "She/Her/Hers",
    "sexuality": "Straight",
    "ethnicity": "White Caucasian",
    "has_children": false,
    "want_children": true,
    "pets": [
        "Cat"
    ],
    "zodiac_sign": "Scorpio",
    "mbti_personality_type": "ENFJ",
    "drinking": "Sometimes",
    "smoking": "No",
    "marijuana": "No",
    "drugs": "No",
    "exercise": "Active",
    "partner_preferences": {
        "minimum_age": 30,
        "maximum_age": 36,
        "minimum_height": "5'8\"",
        "maximum_height": "6'2\"",
        "has_children": false,
        "want_children": true,
        "sexuality": "Straight",
        "drinking": "None",
        "smoking": "No",
        "marijuana": "No",
        "drugs": "No",
        "exercise": "Active"
    },
    "summary": "Anastasia Papadopoulos, a 29-year-old woman, is seeking a long-term, monogamous relationship. She works as a Content Strategy Manager in the marketing industry and is a graduate of New York University. Based in Los Angeles, Anastasia is originally from Athens, Greece. She speaks English, Greek, and Spanish, and her key values are creativity, independence, and compassion. \n\nRegarding her interests, Anastasia enjoys painting, traveling, and yoga. She identifies as a liberal and practices the Orthodox faith. Anastasia is a straight white Caucasian woman with Scorpio as her zodiac sign, and she identifies as an ENFJ, according to the MBTI personality scale.\n\nShe does not smoke or use marijuana or other drugs. She does, however, consume alcohol occasionally and maintains an active lifestyle. Anastasia does not have children but wants to have them in the future. She has a cat as a pet and prefers a partner in the age range of 30 to 36 years who shares similar interests and values. Her desired partner would ideally not have children yet but is open to having children in future. They should also lead an active lifestyle and not smoke, use marijuana or other drugs. Responsible alcohol consumption is acceptable.",
    "user_id": "bb6e6d94-cc2c-4cd9-b14e-5facdeb58405"
}
