{
    "name": "Imani Evans",
    "age": 28,
    "height": "5'7\"",
    "school": "University of Michigan",
    "job_industry": "Nonprofit",
    "job_title": "Program Coordinator",
    "hometown_location": "Chicago, Illinois",
    "dating_location": "Los Angeles, California",
    "languages_spoken": [
        "English",
        "Spanish"
    ],
    "values": "Equality, social justice, and environmental sustainability",
    "interests": "Poetry, hiking, volunteering, cooking, traveing",
    "education_level": "Graduate",
    "religious_beliefs": "Agnostic",
    "politics": "Liberal",
    "dating_intentions": "Life partner",
    "relationship_type": "Monogamy",
    "gender": "Woman",
    "pronouns": "She/Her/Hers",
    "sexuality": "Gay",
    "ethnicity": "Black African Descent",
    "has_children": false,
    "want_children": true,
    "pets": [
        "Dog"
    ],
    "zodiac_sign": "Sagittarius",
    "mbti_personality_type": "ENFJ",
    "drinking": "Yes",
    "smoking": "No",
    "marijuana": "Sometimes",
    "drugs": "No",
    "exercise": "Active",
    "partner_preferences": {
        "minimum_age": 27,
        "maximum_age": 35,
        "minimum_height": "5'4\"",
        "maximum_height": "6'0\"",
        "has_children": false,
        "want_children": true,
        "sexuality": "Gay",
        "drinking": "Yes",
        "smoking": "No",
        "marijuana": "Yes",
        "drugs": "No",
        "exercise": "Active"
    },
    "summary": "Imani Evans is a 28-year-old woman from Chicago, Illinois, who now lives in Los Angeles, California. She holds a graduate degree from the University of Michigan and currently works as a Program Coordinator in a nonprofit organization. She is bilingual, speaking both English and Spanish. \n\nImani identifies as gay and uses she/her pronouns. Passionate about poetry, hiking, volunteering, cooking, and traveling, she values equality, social justice, and environmental sustainability. She's of Black African descent, politics-relaxingly liberal, and agnostically religious. \n\nImani doesn't have children but wants them in the future, and she is a proud dog owner. A Sagittarius with an outgoing and friendly ENFJ personality type, she enjoys a social drink, sometimes uses marijuana, but doesn't smoke or use other drugs. Imani leads an active lifestyle and is looking for a life partner with similar interests.\n\nHer future partner is ideally a gay woman aged between 27 to 35, ranging from 5'4\" to 6'0\" in height. Imani prefers a partner who doesn't smoke or use drugs, occasionally enjoys alcohol or marijuana, actively exercises, doesn't currently have children but is interested in having some in the future.",
    "user_id": "e75fc35b-85b8-4dd8-bc39-6f6ce18596b8"
}
