{
    "name": "Naomi Desai",
    "age": 28,
    "height": "5'7\"",
    "school": "University of Michigan",
    "job_industry": "Healthcare",
    "job_title": "Registered Nurse",
    "hometown_location": "Saginaw, Michigan",
    "dating_location": "Los Angeles, California",
    "languages_spoken": [
        "English",
        "Gujarati"
    ],
    "values": [
        "Family-oriented",
        "Ambitious",
        "Charitable"
    ],
    "interests": [
        "Hiking",
        "Dancing",
        "Yoga"
    ],
    "education_level": "Undergraduate",
    "religious_beliefs": "Hindu",
    "politics": "Liberal",
    "dating_intentions": "Life partner",
    "relationship_type": "Monogamy",
    "gender": "Woman",
    "pronouns": "She/Her/Hers",
    "sexuality": "Straight",
    "ethnicity": "South Asian",
    "has_children": false,
    "want_children": true,
    "pets": [
        "Dog"
    ],
    "zodiac_sign": "Libra",
    "mbti_personality_type": "ESFJ",
    "drinking": "Sometimes",
    "smoking": "No",
    "marijuana": "No",
    "drugs": "No",
    "exercise": "Active",
    "partner_preferences": {
        "minimum_age": 27,
        "maximum_age": 35,
        "minimum_height": "5'8\"",
        "maximum_height": "6'2\"",
        "has_children": false,
        "want_children": true,
        "sexuality": "Straight",
        "drinking": "Sometimes",
        "smoking": "No",
        "marijuana": "No",
        "drugs": "No",
        "exercise": "Sometimes"
    },
    "summary": "Naomi Desai is a straight 28-year-old woman who values being family-oriented, ambitious, and charitable. She hails from Saginaw, Michigan and is currently in Los Angeles, California. Trilingual, Naomi speaks English and Gujarati. She has a diverse range of interests that include hiking, dancing, and yoga. \n\nA University of Michigan undergrad, she's currently working as a Registered Nurse in the Healthcare industry. By aligning with liberal politics and following the Hindu religion, Naomi represents an empathetic, holistic worldview. \n\nShe prefers monogamous dating and is looking for a life partner between 27 to 35, at least 5'8\" tall. Shared interests, attitudes towards health, desire to build a family, and a pet-loving nature, specifically towards dogs, are ideal in her potential partner. \n\nNaomi identifies her astrological sign as Libra, personality type as ESFJ (Extraverted, Sensing, Feeling, Judging type) and prefers to sometimes engage in social drinking. With a clear stand against smoking, marijuana, and drugs, she enjoys staying active and healthy.",
    "user_id": "593ec133-577b-432c-8284-8e6e60c6a4fc"
}
