{
    "name": "Akshay Patel",
    "age": 28,
    "height": "5'9\"",
    "school": "University of California, Berkeley",
    "job_industry": "Technology",
    "job_title": "Software Engineer",
    "hometown_location": "San Francisco, California",
    "dating_location": "Los Angeles, California",
    "languages_spoken": [
        "English",
        "Hindi",
        "Gujarati"
    ],
    "values": [
        "Hard work",
        "Family",
        "Respect for all"
    ],
    "interests": [
        "Coding",
        "Hiking",
        "Photography"
    ],
    "education_level": "Graduate",
    "religious_beliefs": "Hindu",
    "politics": "Liberal",
    "dating_intentions": "Life partner",
    "relationship_type": "Monogamy",
    "gender": "Man",
    "pronouns": "He/Him/His",
    "sexuality": "Straight",
    "ethnicity": "South Asian",
    "has_children": false,
    "want_children": true,
    "pets": [
        "None"
    ],
    "zodiac_sign": "Aries",
    "mbti_personality_type": "INTJ",
    "drinking": "Sometimes",
    "smoking": "No",
    "marijuana": "No",
    "drugs": "No",
    "exercise": "Active",
    "partner_preferences": {
        "minimum_age": 24,
        "maximum_age": 32,
        "minimum_height": "5'2\"",
        "maximum_height": "6'0\"",
        "has_children": false,
        "want_children": true,
        "sexuality": "Straight",
        "drinking": "Yes",
        "smoking": "No",
        "marijuana": "No",
        "drugs": "No",
        "exercise": "Active"
    },
    "summary": "Akshay Patel is a 28-year-old Software Engineer in the Technology industry based in Los Angeles, California. He graduated from the University of California, Berkeley, and values hard work, family, and respect for all. Akshay speaks English, Hindi, and Gujarati, and seeks a life partner who shares his love for coding, hiking, and photography. As a Hindu and liberal, Akshay intends to find a life partner through monogamous dating. Akshay identifies as a straight man, is of South Asian ethnicity, has no children but wants to have them in the future. He is an Aries with an INTJ personality type who occasionally drinks but does not smoke or use drugs. Akshay prefers an active lifestyle and seeks a partner aged between 24 to 32, who is 5'2\" to 6'0\", has no children but wants them, shares his state of health, and does not smoke or use drugs.\n",
    "user_id": "c6570c74-3283-48fb-82b1-864459840a35"
}
