{
    "name": "Aisha Patel",
    "age": 28,
    "height": "5'6\"",
    "school": "University of California, Berkeley",
    "job_industry": "Healthcare",
    "job_title": "Physical Therapist",
    "hometown_location": "San Francisco, California",
    "dating_location": "Los Angeles, California",
    "languages_spoken": [
        "English",
        "Hindi",
        "Spanish"
    ],
    "values": "Compassion, Growth, Family, Creativity",
    "interests": "Traveling, Reading, Cooking, Yoga",
    "education_level": "Graduate",
    "religious_beliefs": "Hindu",
    "politics": "Liberal",
    "dating_intentions": "Life partner",
    "relationship_type": "Monogamy",
    "gender": "Woman",
    "pronouns": "She/Her/Hers",
    "sexuality": "Straight",
    "ethnicity": "South Asian",
    "has_children": false,
    "want_children": true,
    "pets": [
        "Dog",
        "Cat"
    ],
    "zodiac_sign": "Pisces",
    "mbti_personality_type": "INFJ",
    "drinking": "Sometimes",
    "smoking": "No",
    "marijuana": "No",
    "drugs": "No",
    "exercise": "Active",
    "partner_preferences": {
        "minimum_age": 27,
        "maximum_age": 35,
        "minimum_height": "5'4\"",
        "maximum_height": "6'2\"",
        "has_children": false,
        "want_children": true,
        "sexuality": "Straight",
        "drinking": "Yes",
        "smoking": "No",
        "marijuana": "No",
        "drugs": "No",
        "exercise": "Active"
    },
    "summary": "Aisha Patel is a 28 years old woman, who is heterosexually oriented and identifies herself with 'she/her' pronouns. Standing at the height of 5'6\", she originates from San Francisco, currently residing in Los Angeles. She is a Physical Therapist in the healthcare sector, and a Graduate from the University of California, Berkeley. She is a multilingual communicator speaking English, Hindi, and Spanish.\n\nAisha is a Hindu and liberal-minded, wrapped with the values of compassion, continuous growth, family bonds, and creativity. Her interests include traveling the world, indulging in books, experimenting with cooking, and practicing yoga.\n\nShe does not have any children but desires to have some in the future. Aisha owns a cat and a dog, and is a Pisces with an INFJ personality type per the MBTI classification.\n\nIn terms of lifestyle, she occasionally enjoys a drink but maintains a distance from smoking, marijuana, and drugs. She leads an active lifestyle with regular exercise.\n\nAisha is in search of a life partner with whom she desires to engage in a monogamous relationship. Her preference is a straight male between the ages of 27 to 35, who shares the same vision towards children, and impracticalities related to smoking, marijuana, and drugs. She prefers a partner who drinks and follows an active fitness schedule, similar to her.\n",
    "user_id": "7cbac161-e052-489a-be20-b3e2536a7350"
}
