{
    "name": "Evelyn Summers",
    "age": 28,
    "height": "5'7\"",
    "school": "University of California, Los Angeles",
    "job_industry": "Tech",
    "job_title": "Product Manager",
    "hometown_location": "Palo Alto, California",
    "dating_location": "Los Angeles, California",
    "languages_spoken": [
        "English",
        "Spanish"
    ],
    "values": [
        "Family",
        "Ambition",
        "Independence"
    ],
    "interests": [
        "Mountain hiking",
        "Traveling",
        "Painting"
    ],
    "education_level": "Graduate",
    "religious_beliefs": "Agnostic",
    "politics": "Liberal",
    "dating_intentions": "Long term, open to short",
    "relationship_type": "Monogamy",
    "gender": "Woman",
    "pronouns": "She/Her/Hers",
    "sexuality": "Straight",
    "ethnicity": "White Caucasian",
    "has_children": false,
    "want_children": true,
    "pets": [
        "Cat"
    ],
    "zodiac_sign": "Leo",
    "mbti_personality_type": "ENFJ",
    "drinking": "Yes",
    "smoking": "No",
    "marijuana": "No",
    "drugs": "No",
    "exercise": "Active",
    "partner_preferences": {
        "minimum_age": 27,
        "maximum_age": 35,
        "minimum_height": "5'8\"",
        "maximum_height": "6'2\"",
        "has_children": false,
        "want_children": true,
        "sexuality": "Straight",
        "drinking": "Sometimes",
        "smoking": "No",
        "marijuana": "No",
        "drugs": "No",
        "exercise": "Active"
    },
    "summary": "Evelyn Summers is a 28-year-old woman living in Los Angeles, originally from Palo Alto, California. Professionally, she works in the tech industry as a Product Manager. She is educated to graduate level and speaks both English and Spanish.\n\nShe values family, ambition, and independence, and has a wide range of interests including mountain hiking, traveling, and painting. Politically, she identifies as liberal and is agnostic in terms of her religious beliefs. \n\nShe doesn't currently have children but is open to having them in the future. She is a Leo and identifies as an ENFJ according to the Myers-Briggs personality types. In terms of lifestyle, she does drink, but doesn't smoke or use marijuana or drugs, and she is actively engaged in exercise. She also has a pet cat.\n\nShe is seeking a straight man between the ages of 27 and 35, who is active, non-smoking, and also wants children in the future. Her possible partner should be someone who drinks sometimes, but doesn't use marijuana or drugs.",
    "user_id": "822e26ac-4c38-4d2d-916f-d3056e75fd0e"
}
