{
    "name": "Sophia Ngugi",
    "age": 28,
    "height": "5'4\"",
    "school": "University of Cape Town",
    "job_industry": "Healthcare",
    "job_title": "Occupational Therapist",
    "hometown_location": "Nairobi, Kenya",
    "dating_location": "Los Angeles, California",
    "languages_spoken": [
        "English",
        "Swahili"
    ],
    "values": [
        "Hard work",
        "Family",
        "Personal Development"
    ],
    "interests": [
        "Traveling",
        "Reading",
        "Yoga"
    ],
    "education_level": "Graduate",
    "religious_beliefs": "Christian",
    "politics": "Liberal",
    "dating_intentions": "Life partner",
    "relationship_type": "Monogamy",
    "gender": "Woman",
    "pronouns": "She/Her/Hers",
    "sexuality": "Straight",
    "ethnicity": "Black African Descent",
    "has_children": false,
    "want_children": true,
    "pets": [
        "Dog"
    ],
    "zodiac_sign": "Virgo",
    "mbti_personality_type": "ISFJ",
    "drinking": "Sometimes",
    "smoking": "No",
    "marijuana": "No",
    "drugs": "No",
    "exercise": "Active",
    "partner_preferences": {
        "minimum_age": 28,
        "maximum_age": 35,
        "minimum_height": "5'8\"",
        "maximum_height": "6'2\"",
        "has_children": false,
        "want_children": true,
        "sexuality": "Straight",
        "drinking": "Yes",
        "smoking": "No",
        "marijuana": "No",
        "drugs": "No",
        "exercise": "Active"
    },
    "summary": "Sophia Ngugi, a 28-year-old Occupational Therapist, hails from Nairobi, Kenya, but is currently located in Los Angeles, California. She's a highly educated individual who graduated from the University of Cape Town. She is passionate about languages and speaks both English and Swahili. Her personal values include hard work, family, and personal development. Sophia enjoys traveling, reading, and yoga in her free time. She identifies as a Christian, leans liberal in her political views, and her ultimate goal is to find a life partner. Sophia prefers monogamy, identifies as a straight woman and uses She/Her/Hers pronouns. She belongs to a Black African Descent ethnicity. She doesn't currently have children but wants to in the future. It's also worth mentioning that she is a proud dog owner. Sophia\u2019s zodiac sign is Virgo and her MBTI personality type is ISFJ. She doesn't smoke, uses drugs, or marijuana, but does enjoy a drink occasionally. She enjoys an active lifestyle. Her ideal partner would be a straight man between the ages of 28 and 35, who doesn't smoke or use marijuana or drugs but should enjoy a drink occasionally. Her partner should also want to have children in the future and prefer an active lifestyle.",
    "user_id": "8f63a98b-871d-451f-87ff-f76e12adbbb3"
}
