{
    "name": "Harper Rodriguez",
    "age": 30,
    "height": "5'8\"",
    "school": "University of California, Los Angeles",
    "job_industry": "Healthcare",
    "job_title": "Physician",
    "hometown_location": "Los Angeles, California",
    "dating_location": "Los Angeles, California",
    "languages_spoken": [
        "English",
        "Spanish"
    ],
    "values": [
        "Integrity",
        "Compassion",
        "Resilience"
    ],
    "interests": [
        "Hiking",
        "Reading Medical Journals",
        "Playing Guitar"
    ],
    "education_level": "Doctoral",
    "religious_beliefs": "Agnostic",
    "politics": "Liberal",
    "dating_intentions": "Long term",
    "relationship_type": "Monogamy",
    "gender": "Woman",
    "pronouns": "She/Her/Hers",
    "sexuality": "Straight",
    "ethnicity": "Hispanic/Latino",
    "has_children": false,
    "want_children": true,
    "pets": [
        "Cat"
    ],
    "zodiac_sign": "Aries",
    "mbti_personality_type": "INFJ",
    "drinking": "Sometimes",
    "smoking": "No",
    "marijuana": "No",
    "drugs": "No",
    "exercise": "Active",
    "partner_preferences": {
        "minimum_age": 30,
        "maximum_age": 40,
        "minimum_height": "5'8\"",
        "maximum_height": "6'2\"",
        "has_children": false,
        "want_children": true,
        "sexuality": "Straight",
        "drinking": "Sometimes",
        "smoking": "No",
        "marijuana": "No",
        "drugs": "No",
        "exercise": "Active"
    },
    "summary": "Harper Rodriguez is a 30-year old straight woman based in Los Angeles, California. She works as a Physician in the Healthcare industry after obtaining her doctoral degree at the University of California, Los Angeles. Harper comes from a Hispanic/Latino ethnicity and identifies herself primarily through her pronouns 'She/Her/Hers'. She's an agnostic following liberal political ideologies.\n\nHarper enjoys hiking, reading medical journals, and playing the guitar. As an infrequent drinker and a non-smoker, she maintains an active lifestyle. On the romantic front, Harper is looking for a long-term, monogamous relationship. She doesn't have children, but she would like to have them in the future. Harper is a pet lover and has a cat at home.\n\nShe's an Aries and her Myers-Briggs Type Indicator is INFJ. In terms of her ideal partner, Harper prefers a straight man between the ages of 30 and 40 who is at least 5'8\" in height. Her ideal match would have no children, be eager to have children in the future, lead an active life, and have similar habits including moderate drinking and no smoking.",
    "user_id": "4a41e3d0-a6bc-4fc5-8947-86087cab5d90"
}
