{
    "name": "Jasmine Morgan",
    "age": 30,
    "height": "5'6\"",
    "school": "Stanford University",
    "job_industry": "Healthcare",
    "job_title": "Pediatrician",
    "hometown_location": "New York, New York",
    "dating_location": "Los Angeles, California",
    "languages_spoken": [
        "English",
        "Spanish"
    ],
    "values": "Caring, ambitious, empathetic, and proactive",
    "interests": "Reading, traveling, yoga, and photography",
    "education_level": "Doctoral",
    "religious_beliefs": "Buddhist",
    "politics": "Liberal",
    "dating_intentions": "Life partner",
    "relationship_type": "Monogamy",
    "gender": "Woman",
    "pronouns": "She/Her/Hers",
    "sexuality": "Straight",
    "ethnicity": "Black African Descent",
    "has_children": false,
    "want_children": true,
    "pets": [
        "Dog"
    ],
    "zodiac_sign": "Libra",
    "mbti_personality_type": "ENFJ",
    "drinking": "Yes",
    "smoking": "No",
    "marijuana": "No",
    "drugs": "No",
    "exercise": "Active",
    "partner_preferences": {
        "minimum_age": 30,
        "maximum_age": 40,
        "minimum_height": "5'8\"",
        "maximum_height": "6'3\"",
        "has_children": false,
        "want_children": true,
        "sexuality": "Straight",
        "drinking": "Sometimes",
        "smoking": "No",
        "marijuana": "No",
        "drugs": "No",
        "exercise": "Active"
    },
    "summary": "This profile belongs to a 30-year-old woman named Jasmine Morgan from New York, currently residing in Los Angeles. She is a caring, ambitious, empathetic, and proactive pediatrician, representing the healthcare industry. Jasmine is a Stanford University graduate and possesses a doctoral degree. She is fluent in English and Spanish. Her interests include reading, traveling, yoga, and photography.\n\nAs a committed Buddhist with liberal political views, she is seeking a life partner and prefers a monogamous relationship. Jasmine identifies as straight and prefers the pronouns She/Her/Hers. Her ethnicity is Black African descent, and she doesn't have any children, but wants to have some in the future. She owns a dog, doesn't smoke, doesn't use drugs or marijuana, but does enjoy drinking occasionally. Jasmine is active in terms of exercise and identifies herself as an ENFJ from the MBTI personality types. She is a Libra by zodiac sign.\n\nFor a partner, Jasmine prefers a man between the ages of 30 to 40, with a height ranging from 5'8\\\" to 6'3\\\". Her potential match should be a straight individual who is interested in having children, prefers not to smoke, and only drinks occasionally. She would like someone active who doesn't use marijuana or drugs.",
    "user_id": "7dee0326-58e5-41f6-aba6-e485b0501c29"
}
