{
    "name": "Mohammad Patel",
    "age": 31,
    "height": "6'1\"",
    "school": "University of California, Berkeley",
    "job_industry": "Engineering",
    "job_title": "Software Engineer",
    "hometown_location": "Austin, Texas",
    "dating_location": "Los Angeles, California",
    "languages_spoken": [
        "English",
        "Gujarati",
        "Hindi"
    ],
    "values": [
        "Honesty",
        "Hard-Work",
        "Family"
    ],
    "interests": [
        "Hiking",
        "Video Gaming",
        "Reading"
    ],
    "education_level": "Graduate",
    "religious_beliefs": "Muslim",
    "politics": "Liberal",
    "dating_intentions": "Long term",
    "relationship_type": "Monogamy",
    "gender": "Man",
    "pronouns": "He/Him/His",
    "sexuality": "Straight",
    "ethnicity": "South Asian",
    "has_children": false,
    "want_children": true,
    "pets": [
        "Cat"
    ],
    "zodiac_sign": "Gemini",
    "mbti_personality_type": "INTJ",
    "drinking": "No",
    "smoking": "No",
    "marijuana": "No",
    "drugs": "No",
    "exercise": "Active",
    "partner_preferences": {
        "minimum_age": 25,
        "maximum_age": 35,
        "minimum_height": "5'3\"",
        "maximum_height": "6'0\"",
        "has_children": false,
        "want_children": true,
        "sexuality": "Straight",
        "drinking": "No",
        "smoking": "No",
        "marijuana": "No",
        "drugs": "No",
        "exercise": "Active"
    },
    "summary": "Mohammad Patel is a 31 year old South Asian man from Austin, Texas, currently living in Los Angeles. He is a Software Engineer, and an alumnus of the University of California, Berkeley. Mohammad is tall, standing at 6'1\", and is quite active. His languages include English, Gujarati, and Hindi.\n\nPrincipal in his life are honesty, hard work, and family. His leisure activities include hiking, video gaming, and reading. As a Muslim, he holds deep faith. Politically, he leans liberal.\n\nMohammad is looking for a woman between the ages of 25 and 35 who values an active lifestyle, does not drink or smoke, and wants children in the future, just like him. A fellow non-drinker and non-smoker would align well with him. His zodiac sign is Gemini and his personality type is INTJ. He currently has a pet cat and is open to welcoming more pets.",
    "user_id": "c1ce95ef-7bd3-4f1d-974b-e2907eafcc08"
}
