{
    "name": "Alessia Romano",
    "age": 30,
    "height": "5'5\"",
    "school": "Oracle University",
    "job_industry": "Technology",
    "job_title": "Product Manager",
    "hometown_location": "Toronto, Ontario",
    "dating_location": "Los Angeles, California",
    "languages_spoken": [
        "English",
        "Italian",
        "Spanish"
    ],
    "values": "Hardworking, Respect, Integrity",
    "interests": "Traveling, Technology, Fitness",
    "education_level": "Graduate",
    "religious_beliefs": "Agnostic",
    "politics": "Liberal",
    "dating_intentions": "Life partner",
    "relationship_type": "Monogamy",
    "gender": "Woman",
    "pronouns": "She/Her/Hers",
    "sexuality": "Straight",
    "ethnicity": "Hispanic/Latino",
    "has_children": false,
    "want_children": true,
    "pets": [
        "Dog"
    ],
    "zodiac_sign": "Leo",
    "mbti_personality_type": "ENTJ",
    "drinking": "Yes",
    "smoking": "No",
    "marijuana": "No",
    "drugs": "No",
    "exercise": "Active",
    "partner_preferences": {
        "minimum_age": 28,
        "maximum_age": 40,
        "minimum_height": "5'5\"",
        "maximum_height": "6'5\"",
        "has_children": false,
        "want_children": true,
        "sexuality": "Straight",
        "drinking": "Sometimes",
        "smoking": "No",
        "marijuana": "No",
        "drugs": "No",
        "exercise": "Sometimes"
    },
    "summary": "Alessia Romano is a hardworking and respectful 30-year-old product manager in the technology industry. She is from Toronto but currently lives in Los Angeles, California. Alessia is multilingual, speaking English, Italian, and Spanish. Having graduated from Oracle University, she is looking for a life partner who matches her monogamous type of relationship. Alessia identifies as a straight woman, using the pronouns She/Her/Hers. She is of Hispanic or Latino ethnicity and is a liberal agnostic Leo. Her Myers-Briggs personality type is ENTJ. Leading an active lifestyle, Alessia enjoys traveling, technology, and fitness. She is a dog-owner who drinks socially but does not smoke or use marijuana or illicit drugs. Alessia doesn't currently have children, but she would like to in the future. Her preferred partner would be a straight man aged 28 to 40, who doesn't smoke or use drugs but who might drink occasionally and partake in exercise sometimes. Like her, her prospective partner must also want children in future.",
    "user_id": "3d6fa327-4322-440f-b8e4-6bb4e6ce5190"
}
