{
    "name": "Alex Johnson",
    "age": 34,
    "height": "6'0\"",
    "school": "Stanford University",
    "job_industry": "Technology",
    "job_title": "Software Engineer",
    "hometown_location": "Albuquerque, New Mexico",
    "dating_location": "Los Angeles, California",
    "languages_spoken": [
        "English",
        "Spanish",
        "German"
    ],
    "values": "Respect, honesty, and integrity",
    "interests": "Hiking, cooking, and artificial intelligence",
    "education_level": "Graduate",
    "religious_beliefs": "Agnostic",
    "politics": "Liberal",
    "dating_intentions": "Long term",
    "relationship_type": "Monogamy",
    "gender": "Non binary",
    "pronouns": "They/Them/Their",
    "sexuality": "Other",
    "ethnicity": "Hispanic/Latino",
    "has_children": false,
    "want_children": true,
    "pets": [
        "Dog",
        "Fish"
    ],
    "zodiac_sign": "Aquarius",
    "mbti_personality_type": "ENTJ",
    "drinking": "Sometimes",
    "smoking": "No",
    "marijuana": "No",
    "drugs": "No",
    "exercise": "Active",
    "partner_preferences": {
        "minimum_age": 28,
        "maximum_age": 40,
        "minimum_height": "5'2\"",
        "maximum_height": "6'4\"",
        "has_children": false,
        "want_children": true,
        "sexuality": "Other",
        "drinking": "Sometimes",
        "smoking": "No",
        "marijuana": "No",
        "drugs": "No",
        "exercise": "Active"
    },
    "summary": "Alex Johnson is a 34-year-old non-binary software engineer from Albuquerque, New Mexico who now lives in Los Angeles, California. They are highly educated, having graduated from Stanford University and are fluent in English, Spanish, and German. Alex values honesty, respect, and integrity and enjoys hiking, cooking, and artificial intelligence. Holding liberal political views and identifying as agnostic, they are interested in long term, monogamous relationships. Alex belongs to the Hispanic/Latino ethnicity and uses they/them/their pronouns. They have a dog and a fish, and although they currently don't have children, they desire to have some in the future. Alex prefers a partner who is aged between 28 and 40, and appreciates an active lifestyle similar to theirs. They avoid smoking and drug use and occasionally enjoy a drink. With their Aquarius zodiac sign and their ENTJ personality type, Alex brings a unique perspective to relationships.\n",
    "user_id": "cb2b54b7-25cf-4944-a9ce-47b19d93669a"
}
