{
    "name": "Henry Davis",
    "age": 33,
    "height": "6'0\"",
    "school": "University of Pennsylvania",
    "job_industry": "Technology",
    "job_title": "Software Engineer",
    "hometown_location": "Philadelphia, Pennsylvania",
    "dating_location": "Los Angeles, California",
    "languages_spoken": [
        "English",
        "Spanish"
    ],
    "values": [
        "Honesty",
        "Family",
        "Personal Growth"
    ],
    "interests": [
        "Movies",
        "Outdoor activities",
        "Programming",
        "Meditation"
    ],
    "education_level": "Graduate",
    "religious_beliefs": "Agnostic",
    "politics": "Moderate",
    "dating_intentions": "Long term",
    "relationship_type": "Monogamy",
    "gender": "Man",
    "pronouns": "He/Him/His",
    "sexuality": "Straight",
    "ethnicity": "White Caucasian",
    "has_children": false,
    "want_children": true,
    "pets": [
        "Dog"
    ],
    "zodiac_sign": "Taurus",
    "mbti_personality_type": "INTJ",
    "drinking": "Sometimes",
    "smoking": "No",
    "marijuana": "No",
    "drugs": "No",
    "exercise": "Active",
    "partner_preferences": {
        "minimum_age": 27,
        "maximum_age": 35,
        "minimum_height": "5'3\"",
        "maximum_height": "6'0\"",
        "has_children": false,
        "want_children": true,
        "sexuality": "Straight",
        "drinking": "Yes",
        "smoking": "No",
        "marijuana": "No",
        "drugs": "No",
        "exercise": "Active"
    },
    "summary": "Henry Davis is a 33-year-old Software Engineer who values honesty, family, and personal growth. He is an active individual standing 6 feet tall. He cultivates numerous interests like movies, outdoor activities, programming and meditation. He identifies as a man, uses he/him/his pronouns, and is straight. An agnostic, he leans politically moderate. Originally from Philadelphia, Pennsylvania, he currently lives in Los Angeles, California.\n\nHe is fluent in English and Spanish and holds a graduate degree from the University of Pennsylvania. Identifying as a monogamous white Caucasian, he is interested in a long-term relationship and has the intention of having children, although he doesn't have any currently.\n\nHe's a dog-lover, sometimes enjoys drinking but does not smoke, use marijuana, or other drugs. He's a Taurus and an INTJ personality type. The kind of person he's interested in dating should be a woman, straight, between the ages of 27 and 35, active, and share similar intentions about wanting children. She should be a drinker but preferably shouldn't smoke, use marijuana, or other drugs.",
    "user_id": "541e9917-77c7-411b-9c8f-11d61296a3e8"
}
