{
    "name": "Priya Patel",
    "age": 30,
    "height": "5'5\"",
    "school": "University of California, Los Angeles",
    "job_industry": "Tech",
    "job_title": "Software Engineer",
    "hometown_location": "San Francisco, California",
    "dating_location": "Los Angeles, California",
    "languages_spoken": [
        "English",
        "Hindi",
        "Spanish"
    ],
    "values": "Family, Ambition, Creativity",
    "interests": "Programming, Hiking, Cooking, Travelling, Reading",
    "education_level": "Graduate",
    "religious_beliefs": "Hindu",
    "politics": "Liberal",
    "dating_intentions": "Life partner",
    "relationship_type": "Monogamy",
    "gender": "Woman",
    "pronouns": "She/Her/Hers",
    "sexuality": "Straight",
    "ethnicity": "South Asian",
    "has_children": false,
    "want_children": true,
    "pets": [
        "Cat",
        "Fish"
    ],
    "zodiac_sign": "Scorpio",
    "mbti_personality_type": "INTP",
    "drinking": "Sometimes",
    "smoking": "No",
    "marijuana": "No",
    "drugs": "No",
    "exercise": "Active",
    "partner_preferences": {
        "minimum_age": 29,
        "maximum_age": 35,
        "minimum_height": "5'5\"",
        "maximum_height": "6'3\"",
        "has_children": false,
        "want_children": true,
        "sexuality": "Straight",
        "drinking": "Yes",
        "smoking": "No",
        "marijuana": "No",
        "drugs": "No",
        "exercise": "Active"
    },
    "summary": "Priya Patel is a 30-year-old Software Engineer who resides in Los Angeles, California. She values family, ambition, and creativity while enjoying interests, such as programming, hiking, cooking, traveling, and reading. Originally from San Francisco, Priya is a graduate from the University of California, Los Angeles. \n\nDespite being busy in the tech industry, she incorporates active routine into her lifestyle. She is a multilingual, confidently communicating in English, Hindi, and Spanish. Priya follows Hindu beliefs and leans politically liberal. She identifies as a straight woman using She/Her/Hers pronouns. Her ethnicity reflects her South Asian roots. \n\nAs a Scorpio, according to the zodiac, and INTP type according to MBTI, she adds an interesting mix to her personality. She is open to drinking occasionally but refrains from smoking, marijuana, and other drugs. Animal lover, she has a cat and a fish as pets. Currently childless, she\u2019s hopeful for having children in the future. \n\nShe is seeking a life partner for a monogamous relationship, preferably a straight man who is active, non-smoker, matching her drink habits, wanting children, and falls in between an age range of 29 and 35, with a height somewhere between 5'5\\\" and 6'3\\\".\n",
    "user_id": "12053f9a-a0c8-44c8-94d6-8cfccbb683a6"
}
