{
    "name": "Donovan Birch",
    "age": 32,
    "height": "6'1\"",
    "school": "University of California, Berkeley",
    "job_industry": "Technology",
    "job_title": "Software Developer",
    "hometown_location": "Sacramento, California",
    "dating_location": "Los Angeles, California",
    "languages_spoken": [
        "English",
        "Spanish"
    ],
    "values": [
        "Creativity",
        "Fitness",
        "Knowledge",
        "Ambition"
    ],
    "interests": [
        "Running",
        "Reading",
        "Video Gaming",
        "Cooking"
    ],
    "education_level": "Graduate",
    "religious_beliefs": "Agnostic",
    "politics": "Liberal",
    "dating_intentions": "Long term",
    "relationship_type": "Monogamy",
    "gender": "Man",
    "pronouns": "He/Him/His",
    "sexuality": "Straight",
    "ethnicity": "White Caucasian",
    "has_children": false,
    "want_children": true,
    "pets": [
        "Dog"
    ],
    "zodiac_sign": "Libra",
    "mbti_personality_type": "INTJ",
    "drinking": "Yes",
    "smoking": "No",
    "marijuana": "No",
    "drugs": "No",
    "exercise": "Active",
    "partner_preferences": {
        "minimum_age": 25,
        "maximum_age": 35,
        "minimum_height": "5'5\"",
        "maximum_height": "6'0\"",
        "has_children": false,
        "want_children": true,
        "sexuality": "Straight",
        "drinking": "Sometimes",
        "smoking": "No",
        "marijuana": "No",
        "drugs": "No",
        "exercise": "Active",
        "gender": "Woman",
        "dating_intentions": "Long term",
        "relationship_type": "Monogamy",
        "ethnicities": [
            "Any"
        ],
        "politics": [
            "Liberal",
            "Moderate"
        ],
        "job_industry": [
            "Any"
        ],
        "languages_spoken": [
            "Any"
        ],
        "values": [
            "Fitness",
            "Honesty",
            "Ambition"
        ],
        "interests": [
            "Music",
            "Cinema",
            "Nature",
            "Sportive Activities"
        ],
        "education_level": [
            "Any"
        ]
    },
    "profile_summary": "Our user is a 32-year-old man with pronouns He/Him/His, 6'1\" tall and a white Caucasian. He is graduated from the University of California, Berkeley and is currently working as a Software Developer in the technology industry. Originally from Sacramento, California, he now lives in Los Angeles. A straight man, with an INTJ personality type, who labels himself as a Libra and Agnostic, he is politically liberal and is interested in a long-term, monogamous relationship. In terms of lifestyle, he is physically active, drinks occasionally, but doesn't smoke or use marijuana or other drugs. He is a dog lover with no children, but he wishes to have some in the near future. You'll find him running, reading, gaming or cooking in his free time - interests that reflect his core values of creativity, fitness, knowledge, and ambition. He is fluent in both English and Spanish. His ideal dating location is his current residence - Los Angeles, California.\n",
    "preferences_summary": "The user is seeking a woman, aged 25 to 35, who stands between 5'5\" and 6'0\". The potential partner should not have children but should also have the intention to have children over the long term. The partner should be of any ethnic background, possess values of fitness, honesty, and ambition, and share interests in music, cinema, nature and sportive activities. In terms of lifestyle, she should at least sometimes drink, abstain from using tobacco, marijuana, and other drugs, and engage in regular exercise. She should be either liberal or moderate in her political beliefs. The educational background, job industry, or languages spoken can fall into any categories as long as the dating intention is focused on a long-term monogamous relationship.",
    "user_id": "ed490895-f103-4e08-83e3-63d8f00861be"
}
