{
    "name": "Natalia Kuznetsova",
    "age": 29,
    "height": "5'8\"",
    "school": "University of Moscow",
    "job_industry": "Finance",
    "job_title": "Risk Analyst",
    "hometown_location": "Moscow, Russia",
    "dating_location": "Los Angeles, California",
    "languages_spoken": [
        "Russian",
        "English"
    ],
    "values": [
        "Hard work",
        "Family",
        "Independence"
    ],
    "interests": [
        "Traveling",
        "Cooking",
        "Hiking"
    ],
    "education_level": "Graduate",
    "religious_beliefs": "Orthodox Christian",
    "politics": "Moderate",
    "dating_intentions": "Long term",
    "relationship_type": "Monogamy",
    "gender": "Woman",
    "pronouns": "She/Her/Hers",
    "sexuality": "Straight",
    "ethnicity": "White Caucasian",
    "has_children": false,
    "want_children": true,
    "pets": [
        "Cat"
    ],
    "zodiac_sign": "Virgo",
    "mbti_personality_type": "ISTJ",
    "drinking": "Sometimes",
    "smoking": "No",
    "marijuana": "No",
    "drugs": "No",
    "exercise": "Active",
    "partner_preferences": {
        "minimum_age": 30,
        "maximum_age": 40,
        "minimum_height": "5'10\"",
        "maximum_height": "6'4\"",
        "has_children": false,
        "want_children": true,
        "sexuality": "Straight",
        "drinking": "Yes",
        "smoking": "No",
        "marijuana": "No",
        "drugs": "No",
        "exercise": "Active"
    },
    "summary": "Natalia Kuznetsova is a 29-year-old risk analyst working in the finance industry. She stands at 5'8\" and is a graduate of the University of Moscow. Originally from Moscow, Russia, Natalia now resides in Los Angeles, California. She speaks Russian and English and values hard work, family, and independence. \n\nHer interests include traveling, cooking, and hiking. As an Orthodox Christian, Natalia is moderately politically inclined. She is interested in long-term relationships and is committed to monogamy. Natalia identifies as a straight woman using the pronouns She/Her/Hers.\n\nShe does not currently have children but is open to having them in the future. Natalia has a pet cat and is a Virgo by zodiac sign. She has an ISTJ MBTI personality type. In terms of lifestyle, Natalia occasionally drinks, does not smoke or use marijuana or other drugs, and is physically active.\n\nThe type of partner Natalia is looking for should be a straight man aged between 30 and 40, taller than her (between 5'10\" and 6'4\"), who does not have children currently but wants them in the future. He should be an active drinker, non-smoker, does not use marijuana or other drugs, and leads an active lifestyle.",
    "user_id": "f93cd081-d01d-4c5f-bd4c-cd16ae7bed59"
}
