{
    "name": "Jing Zhou",
    "age": 30,
    "height": "5'7\"",
    "school": "Tsinghua University",
    "job_industry": "Technology",
    "job_title": "Software Engineer",
    "hometown_location": "Shanghai, China",
    "dating_location": "Los Angeles, California",
    "languages_spoken": [
        "Chinese",
        "English"
    ],
    "values": [
        "Honesty",
        "Ambition",
        "Kindness"
    ],
    "interests": [
        "Coding",
        "Hiking",
        "Reading",
        "Cycling"
    ],
    "education_level": "Graduate",
    "religious_beliefs": "Buddhist",
    "politics": "Liberal",
    "dating_intentions": "Long term",
    "relationship_type": "Monogamy",
    "gender": "Woman",
    "pronouns": "She/Her/Hers",
    "sexuality": "Straight",
    "ethnicity": "East Asian",
    "has_children": false,
    "want_children": true,
    "pets": [
        "None"
    ],
    "zodiac_sign": "Capricorn",
    "mbti_personality_type": "INTJ",
    "drinking": "Sometimes",
    "smoking": "No",
    "marijuana": "No",
    "drugs": "No",
    "exercise": "Active",
    "partner_preferences": {
        "minimum_age": 28,
        "maximum_age": 40,
        "minimum_height": "5'7\"",
        "maximum_height": "6'2\"",
        "has_children": false,
        "want_children": true,
        "sexuality": "Straight",
        "drinking": "Yes",
        "smoking": "No",
        "marijuana": "No",
        "drugs": "No",
        "exercise": "Active",
        "gender": "Man",
        "dating_intentions": "Long term",
        "relationship_type": "Monogamy",
        "ethnicities": [
            "East Asian",
            "White Caucasian"
        ],
        "politics": [
            "Liberal",
            "Moderate"
        ],
        "job_industry": [
            "Technology",
            "Finance"
        ],
        "languages_spoken": [
            "Chinese",
            "English"
        ],
        "values": [
            "Honesty",
            "Ambition",
            "Kindness"
        ],
        "interests": [
            "Coding",
            "Hiking",
            "Reading",
            "Cycling"
        ],
        "education_level": [
            "Graduate",
            "Doctoral"
        ]
    },
    "profile_summary": "The user is a 30-year-old woman identifying with the pronouns 'She/Her/Hers'. She stands 5'7\" tall, is of East Asian descent, and comes from Shanghai, China but is currently dating in Los Angeles, California. She works as a Software Engineer in the Technology industry and graduated from Tsinghua University. She's multilingual, speaking both Chinese and English. Her core values encompass honesty, ambition, and kindness, and she enjoys activities like coding, hiking, reading, and cycling. She is a Buddhist and has liberal political views. She is seeking a long-term, monogamous relationship. Although she doesn't have children, she wants them in the future. She is straight and doesn't have any pets. Her Zodiac sign is Capricorn and she's an INTJ according to the MBTI personality types. She occasionally drinks but doesn't smoke or use marijuana or other drugs. She's an active person, often engaging in exercising.",
    "preferences_summary": "The user is seeking a man who is between 28 and 40 years of age, and between 5'7\" and 6'2\" in height. Her preferred partner should not have children but should want them in the future. He should be straight, do not smoke, use marijuana or drugs, but may drink occasionally. He should also have an active lifestyle in terms of exercise. His ethnicity should either be East Asian or White Caucasian. She is seeking a long-term relationship and prefers her partner to have liberal or moderate political views. The man should work in either the technology or finance industry. They should share the same values of honesty, ambition, and kindness, and have interests in coding, hiking, reading, and cycling. He should able to speak both Chinese and English, and should have a graduate or doctoral education level.",
    "user_id": "84c713ba-6c5a-42fa-a3ae-f436330d74ed"
}
