{
    "name": "Natasha Patel",
    "age": 28,
    "height": "5'6\"",
    "school": "University of Southern California",
    "job_industry": "Tech",
    "job_title": "Product Manager",
    "hometown_location": "Sacramento, California",
    "dating_location": "Los Angeles, California",
    "languages_spoken": [
        "English",
        "Hindi"
    ],
    "values": [
        "Honesty",
        "Hard work",
        "Compassion"
    ],
    "interests": [
        "Hiking",
        "Reading",
        "Cooking",
        "Travel"
    ],
    "education_level": "Graduate",
    "religious_beliefs": "Hindu",
    "politics": "Liberal",
    "dating_intentions": "Long term",
    "relationship_type": "Monogamy",
    "gender": "Woman",
    "pronouns": "She/Her/Hers",
    "sexuality": "Straight",
    "ethnicity": "South Asian",
    "has_children": false,
    "want_children": true,
    "pets": [
        "None"
    ],
    "zodiac_sign": "Virgo",
    "mbti_personality_type": "ENFP",
    "drinking": "Sometimes",
    "smoking": "No",
    "marijuana": "No",
    "drugs": "No",
    "exercise": "Active",
    "partner_preferences": {
        "minimum_age": 27,
        "maximum_age": 35,
        "minimum_height": "5'8\"",
        "maximum_height": "6'2\"",
        "has_children": false,
        "want_children": true,
        "sexuality": "Straight",
        "drinking": "Yes",
        "smoking": "No",
        "marijuana": "No",
        "drugs": "No",
        "exercise": "Active"
    },
    "summary": "Natasha Patel is a 28-year-old Product Manager in the tech industry, based in Los Angeles but originally from Sacramento, California. Educated at the University of Southern California, she values honesty, hard work, and compassion. Natasha enjoys hiking, reading, cooking, and traveling. She speaks English and Hindi, and identifies herself as Hindu and politically liberal. She is interested in a long-term, monogamous relationship. Natasha does not have children, but wants them in the future. She doesn't have any pets currently. Being health-conscious, she is active and refrains from smoking, while occasionally enjoys a drink. Her age preference for a partner lies between 27 and 35. Similar to herself, she prefers her partner to be active, a non-smoker, and someone who is interested in having children. She is a straight, South Asian woman, and respects Virgo qualities and as an ENFP in the MBTI personality type.",
    "user_id": "e29bdf42-ba06-453e-91e9-ae5bb1d748d3"
}
