{
    "name": "Toshiko Tanaka",
    "age": 32,
    "height": "5'5\"",
    "school": "Kyoto University",
    "job_industry": "Technology",
    "job_title": "Software Developer",
    "hometown_location": "Tokyo, Japan",
    "dating_location": "Los Angeles, California",
    "languages_spoken": [
        "Japanese",
        "English"
    ],
    "values": [
        "Honesty",
        "Family",
        "Personal Growth"
    ],
    "interests": [
        "Travel",
        "Reading",
        "Hiking",
        "Cooking"
    ],
    "education_level": "Graduate",
    "religious_beliefs": "Buddhist",
    "politics": "Liberal",
    "dating_intentions": "Long term",
    "relationship_type": "Monogamy",
    "gender": "Woman",
    "pronouns": "She/Her/Hers",
    "sexuality": "Straight",
    "ethnicity": "East Asian",
    "has_children": false,
    "want_children": true,
    "pets": [
        "None"
    ],
    "zodiac_sign": "Libra",
    "mbti_personality_type": "INFJ",
    "drinking": "Yes",
    "smoking": "No",
    "marijuana": "No",
    "drugs": "No",
    "exercise": "Active",
    "partner_preferences": {
        "minimum_age": 28,
        "maximum_age": 36,
        "minimum_height": "5'7\"",
        "maximum_height": "6'0\"",
        "has_children": false,
        "want_children": true,
        "sexuality": "Straight",
        "drinking": "Yes",
        "smoking": "No",
        "marijuana": "No",
        "drugs": "No",
        "exercise": "Active"
    },
    "summary": "Toshiko Tanaka, a 32-year-old woman originally from Tokyo, is actively seeking a long-term relationship while residing in Los Angeles, California. She is a software developer in the tech industry and a graduate of Kyoto University. Standing 5'5\" tall, she identifies herself as a straight East Asian woman, who uses the 'She/Her/Hers' pronouns. She is a Buddhist and expresses liberal political views. Toshiko is multilingual, speaking both Japanese and English. Honesty, family, and personal growth are principles she highly values. In her free time, she loves traveling, reading, hiking, and cooking. Non-smoker Toshiko is socially comfortable with drinking but does not use marijuana or drugs. She is quite active and exercises regularly. She does not have children but desires to have them in the future. According to the zodiac, Toshiko is a harmonious Libra and her MBTI personality type is the insightful and empathetic INFJ.  \n\nToshiko is interested in a straight man that falls within the age range of 28-36 years and stands between 5'7'' and 6'0''. Like her, he should have no children but be open to the idea of having them. Further, he should be respectful of her habits which are social drinking, not smoking, and no marijuana or other drug use. He should also be physically active.",
    "user_id": "49f73675-72a2-45b8-a17a-299523d70dc0"
}
