{
    "name": "Devin Sanford",
    "age": 32,
    "height": "6'0\"",
    "school": "New York University",
    "job_industry": "Technology",
    "job_title": "Software Developer",
    "hometown_location": "Chicago, Illinois",
    "dating_location": "Los Angeles, California",
    "languages_spoken": [
        "English",
        "Spanish"
    ],
    "values": [
        "Kindness",
        "Academic Knowledge"
    ],
    "interests": [
        "Cycling",
        "Cooking",
        "Reading",
        "Coding"
    ],
    "education_level": "Graduate",
    "religious_beliefs": "Atheist",
    "politics": "Liberal",
    "dating_intentions": "Long term",
    "relationship_type": "Monogamy",
    "gender": "Man",
    "pronouns": "He/Him/His",
    "sexuality": "Straight",
    "ethnicity": "Black African Descent",
    "has_children": false,
    "want_children": true,
    "pets": [
        "Dog"
    ],
    "zodiac_sign": "Aries",
    "mbti_personality_type": "INTJ",
    "drinking": "Sometimes",
    "smoking": "No",
    "marijuana": "No",
    "drugs": "No",
    "exercise": "Active",
    "partner_preferences": {
        "minimum_age": 26,
        "maximum_age": 34,
        "minimum_height": "5'4\"",
        "maximum_height": "6'0\"",
        "has_children": false,
        "want_children": true,
        "sexuality": "Straight",
        "drinking": "Yes",
        "smoking": "No",
        "marijuana": "No",
        "drugs": "No",
        "exercise": "Active"
    },
    "summary": "Devin Sanford is a 32-year-old man who stands at 6'0\". He identifies as straight and goes by the pronouns He/Him/His. Currently residing in Los Angeles, California, Devin hails from Chicago, Illinois. He works as a Software Developer in the technology industry and has a graduate degree from New York University. \n\nDevin values kindness and academic knowledge. In his free time, he enjoys cycling, cooking, reading, and coding. Fluent in English and Spanish, he is of Black African descent and is an atheist with liberal political views.\n\nHe has categorically expressed his intention towards long-term dating and prefers monogamous relationships. Although he currently doesn't have any children, he would like to in the future. A dog owner, he isactive physically, is an occasional drinker, and does not smoke or use marijuana or other drugs.\n\nDevin is open to connecting with a straight woman who ranges in age from 26 to 34 and stands anywhere between 5'4\" to 6'0\". His potential match should have no children but be open to having some in the future. In terms of lifestyle, he desires a non-smoking, active woman who enjoys an occasional drink but abstains from marijuana and drugs.",
    "user_id": "fd20ee95-c72a-4bfa-b627-3faced85ecb5"
}
