{
    "name": "Alejandra Silva",
    "age": 29,
    "height": "5'7\"",
    "school": "University of California",
    "job_industry": "Non-profit Organization",
    "job_title": "Community Outreach Specialist",
    "hometown_location": "Miami, Florida",
    "dating_location": "Los Angeles, California",
    "languages_spoken": [
        "English",
        "Spanish",
        "French"
    ],
    "values": "Compassion, Justice, Art, Nature, Education",
    "interests": "Travelling, Finger-painting, Hiking, Reading, Cooking",
    "education_level": "Graduate",
    "religious_beliefs": "Spiritual",
    "politics": "Liberal",
    "dating_intentions": "Life partner",
    "relationship_type": "Monogamy",
    "gender": "Woman",
    "pronouns": "She/Her/Hers",
    "sexuality": "Straight",
    "ethnicity": "Hispanic/Latino",
    "has_children": false,
    "want_children": true,
    "pets": [
        "Dog",
        "Cat"
    ],
    "zodiac_sign": "Pisces",
    "mbti_personality_type": "ENFP",
    "drinking": "Sometimes",
    "smoking": "No",
    "marijuana": "No",
    "drugs": "No",
    "exercise": "Active",
    "partner_preferences": {
        "minimum_age": 28,
        "maximum_age": 37,
        "minimum_height": "5'7\"",
        "maximum_height": "6'3\"",
        "has_children": false,
        "want_children": true,
        "sexuality": "Straight",
        "drinking": "Yes",
        "smoking": "No",
        "marijuana": "No",
        "drugs": "No",
        "exercise": "Active"
    },
    "summary": "Alejandra Silva is a 29-year-old woman who identifies herself under the pronouns \"She/Her/Hers\" and is of Hispanic/Latino ethnicity. She grew up in Miami, Florida, and currently lives in Los Angeles, California while working as a Community Outreach Specialist in the non-profit sector. She is a graduate from the University of California and is intellectually stimulated by reading. She is fluent in English, Spanish, and French and enjoys travelling, finger painting, hiking, and cooking. Alejandra is spiritually inclined and leans towards liberal politics. Her essential values include compassion, justice, art, nature, and education. A dog and cat lover, she sometimes likes to have a drink but stays away from smoking. She is actively involved in exercise and sport and her MBTI personality type is ENFP. Alejandra hopes to find a life partner who is a non-smoker, keeps active, and is interested in having children in the future.",
    "user_id": "2f7cd047-62a9-4a84-86cb-8024d0b8c84a"
}
