{
    "name": "Kim Rivera",
    "age": 30,
    "height": "5'5\"",
    "school": "Brown University",
    "job_industry": "Tech",
    "job_title": "Software Engineer",
    "hometown_location": "Chicago, Illinois",
    "dating_location": "Los Angeles, California",
    "languages_spoken": [
        "English",
        "Spanish"
    ],
    "values": "Empathy, kindness, and hard work",
    "interests": "Coding, hiking, and cooking",
    "education_level": "Graduate",
    "religious_beliefs": "Agnostic",
    "politics": "Liberal",
    "dating_intentions": "Long term",
    "relationship_type": "Monogamy",
    "gender": "Woman",
    "pronouns": "She/Her/Hers",
    "sexuality": "Gay",
    "ethnicity": "Hispanic/Latino",
    "has_children": false,
    "want_children": true,
    "pets": [
        "Cat"
    ],
    "zodiac_sign": "Cancer",
    "mbti_personality_type": "ENFJ",
    "drinking": "Yes",
    "smoking": "No",
    "marijuana": "Sometimes",
    "drugs": "No",
    "exercise": "Active",
    "partner_preferences": {
        "minimum_age": 28,
        "maximum_age": 35,
        "minimum_height": "5'5\"",
        "maximum_height": "5'9\"",
        "has_children": false,
        "want_children": true,
        "sexuality": "Gay",
        "drinking": "Yes",
        "smoking": "No",
        "marijuana": "Sometimes",
        "drugs": "No",
        "exercise": "Active"
    },
    "summary": "Kim Rivera is a 30-year-old gay woman who identifies with the pronoun \"she/her\". She is a Software Engineer in the tech industry. A graduate from Brown University, Kim is based in Los Angeles, California, originally from Chicago, Illinois. She is bilingual, speaking English and Spanish. She values empathy, kindness, and hard work.\n\nKim enjoys coding, hiking, and cooking. Her liberal political views align with her Agnostic religious beliefs. She is looking to engage in a long-term monogamous relationship with a goal of having children in the future.\n\nCurrently, Kim is a cat owner and holds a zodiac sign of Cancer. She identifies as an ENFJ according to the Myers-Briggs Type Indicator. She occasionally enjoys drinking and using marijuana, whilst negating smoking and drug use. She stays active by regularly exercising.\n\nShe prefers to date gay women who are aged between 28 to 35 years old, taller than 5'5\", and looking to have children. Similar to her lifestyle, she prefers a partner who drinks, sometimes uses marijuana, doesn't smoke or use other drugs, and maintains an active life.",
    "user_id": "36e80623-1332-4a4a-87dd-49b965b64fa6"
}
