{
    "name": "Priya Patel",
    "age": 28,
    "height": "5'4\"",
    "school": "University of Michigan",
    "job_industry": "Healthcare & Medical",
    "job_title": "Pediatric Nurse",
    "hometown_location": "Detroit, Michigan",
    "dating_location": "Los Angeles, California",
    "languages_spoken": [
        "English",
        "Hindi"
    ],
    "values": "Equality, Civil rights, Self-development",
    "interests": "Traveling, Meditation, Photography",
    "education_level": "Graduate",
    "religious_beliefs": "Hindu",
    "politics": "Liberal",
    "dating_intentions": "Life partner",
    "relationship_type": "Monogamy",
    "gender": "Woman",
    "pronouns": "She/Her/Hers",
    "sexuality": "Straight",
    "ethnicity": "South Asian",
    "has_children": false,
    "want_children": true,
    "pets": [
        "None"
    ],
    "zodiac_sign": "Taurus",
    "mbti_personality_type": "ISFJ",
    "drinking": "No",
    "smoking": "No",
    "marijuana": "No",
    "drugs": "No",
    "exercise": "Active",
    "partner_preferences": {
        "minimum_age": 28,
        "maximum_age": 35,
        "minimum_height": "5'6\"",
        "maximum_height": "6'4\"",
        "has_children": false,
        "want_children": true,
        "sexuality": "Straight",
        "drinking": "No",
        "smoking": "No",
        "marijuana": "No",
        "drugs": "No",
        "exercise": "Active"
    },
    "summary": "Priya Patel is a 28-year-old Pediatric Nurse working in the healthcare and medical industry. She currently lives in Los Angeles, California, and is originally from Detroit, Michigan. Holding a graduate's degree from the University of Michigan, she upholds equality, civil rights, and self-development as her core values. \n\nPriya speaks English and Hindi and has a strong interest in traveling, meditation, and photography. She follows Hindu religious beliefs and leans towards liberal viewpoints politically. Priya identifies as a straight woman and uses she/her pronouns. Her background is South Asian. She doesn't have any children but has expressed a desire to have children in the future.\n\nPriya is a non-smoker and non-drinker. She leads an active lifestyle and is an ISFJ on the MBTI personality type chart. As a Taurus, she is looking for a life partner within the age range of 28 to 35 years. Her ideal partner shares her lifestyle choices, including non-smoking and non-drinking, and should also have a desire for kids, just like Priya herself.",
    "user_id": "392845c8-b073-460a-9258-17952c7e9a2b"
}
