{
    "name": "Jasmine Laverne",
    "age": 34,
    "height": "5'8\"",
    "school": "University of Michigan",
    "job_industry": "Entertainment",
    "job_title": "Film Director",
    "hometown_location": "Atlanta, Georgia",
    "dating_location": "Los Angeles, California",
    "languages_spoken": [
        "English",
        "Spanish"
    ],
    "values": "Creativity, Independence, Kindness",
    "interests": "Film, Yoga, Reading, Vegan Cooking",
    "education_level": "Graduate",
    "religious_beliefs": "Spiritual",
    "politics": "Liberal",
    "dating_intentions": "Long term",
    "relationship_type": "Monogamy",
    "gender": "Woman",
    "pronouns": "She/Her/Hers",
    "sexuality": "Gay",
    "ethnicity": "Black African Descent",
    "has_children": false,
    "want_children": true,
    "pets": [
        "Cat",
        "Dog"
    ],
    "zodiac_sign": "Virgo",
    "mbti_personality_type": "INFJ",
    "drinking": "Sometimes",
    "smoking": "No",
    "marijuana": "No",
    "drugs": "No",
    "exercise": "Active",
    "partner_preferences": {
        "minimum_age": 30,
        "maximum_age": 40,
        "minimum_height": "5'0\"",
        "maximum_height": "6'0\"",
        "has_children": false,
        "want_children": true,
        "sexuality": "Gay",
        "drinking": "Yes",
        "smoking": "No",
        "marijuana": "No",
        "drugs": "No",
        "exercise": "Active"
    },
    "summary": "Jasmine Laverne, a 34-year-old Film Director based in Los Angeles, is seeking a long-term, monogamous relationship. Fluent in English and Spanish, she holds a degree from the University of Michigan and works in the Entertainment industry. Hailing from Atlanta, Georgia, she takes pride in her creativity, independence, and kindness. Her interests include film, yoga, reading, and vegan cooking. She identifies as a Gay woman and primarily uses she/her/hers pronouns. She is of Black African descent, does not smoke or do drugs, and only drinks on occasion. Being an active individual, she likes to exercise regularly. She owns a cat and a dog and hopes to have children one day. As a Virgo and an INFJ, Jasmine tends to be introspective, spiritual, and liberal. When it comes to potential partners, Jasmine prefers women between 30 and 40 years old who do not smoke or do drugs but enjoy a drink now and then and maintain an active lifestyle. She hopes to meet a partner who also wants children.",
    "user_id": "ecf046ae-dbb7-432e-bac5-6ce42c1327fe"
}
