{
    "name": "Olivia Blanchard",
    "age": 29,
    "height": "5'7\"",
    "school": "University of California, Los Angeles",
    "job_industry": "Technology",
    "job_title": "Software Engineer",
    "hometown_location": "Berkeley, California",
    "dating_location": "Los Angeles, California",
    "languages_spoken": [
        "English",
        "Spanish",
        "French"
    ],
    "values": [
        "Hard Work",
        "Compassionate",
        "Independence"
    ],
    "interests": [
        "Hiking",
        "Coding",
        "Photography",
        "Cooking",
        "Yoga"
    ],
    "education_level": "Graduate",
    "religious_beliefs": "Agnostic",
    "politics": "Liberal",
    "dating_intentions": "Long term",
    "relationship_type": "Monogamy",
    "gender": "Woman",
    "pronouns": "She/Her/Hers",
    "sexuality": "Straight",
    "ethnicity": "White Caucasian",
    "has_children": false,
    "want_children": true,
    "pets": [
        "Dog"
    ],
    "zodiac_sign": "Gemini",
    "mbti_personality_type": "ENFJ",
    "drinking": "Sometimes",
    "smoking": "No",
    "marijuana": "No",
    "drugs": "No",
    "exercise": "Active",
    "partner_preferences": {
        "minimum_age": 28,
        "maximum_age": 35,
        "minimum_height": "5'9\"",
        "maximum_height": "6'3\"",
        "has_children": false,
        "want_children": true,
        "sexuality": "Straight",
        "drinking": "Sometimes",
        "smoking": "No",
        "marijuana": "No",
        "drugs": "No",
        "exercise": "Active"
    },
    "summary": "Olivia Blanchard is a 29-year-old, 5'7\" tall Software Engineer residing in Los Angeles, California, originally from Berkeley, California. She is a graduate of the University of California, Los Angeles, is an ENFJ, and identifies as a Woman with pronouns She/Her/Hers. \n\nOlivia's interests range from Hiking, Coding, and Photography to Cooking and Yoga. Her values center on hard work, compassion, and independence, matching her liberal political views. She is a white Caucasian who identifies as Straight and is currently looking for long-term dating prospects.\n\nOlivia is also fairly active, sometimes indulges in drinking but discourages smoking, marijuana, and illegal drug use. She is a dog lover who doesn\u2019t have children but wants them in the future. \n\nAs for her partner, Olivia prefers someone between the ages of 28 and 35, a height ranging from 5'9\" to 6'3\", who doesn't have children but wants them, doesn't smoke, and is also fairly active.",
    "user_id": "5d6ee8bb-c758-4a91-9a13-8e9cda30bc97"
}
