{
    "name": "Kimiko Takahashi",
    "age": 36,
    "height": "5'4\"",
    "school": "UC Berkeley",
    "job_industry": "Tech",
    "job_title": "Software Developer",
    "hometown_location": "Kyoto, Japan",
    "dating_location": "Los Angeles, California",
    "languages_spoken": [
        "English",
        "Japanese"
    ],
    "values": "Discipline, Integrity, and Self-Development",
    "interests": "Coding, Cooking, Gardening, and Traveling",
    "education_level": "Graduate",
    "religious_beliefs": "Buddhist",
    "politics": "Moderate",
    "dating_intentions": "Life partner",
    "relationship_type": "Monogamy",
    "gender": "Woman",
    "pronouns": "She/Her/Hers",
    "sexuality": "Straight",
    "ethnicity": "East Asian",
    "has_children": false,
    "want_children": true,
    "pets": [
        "Cat"
    ],
    "zodiac_sign": "Capricorn",
    "mbti_personality_type": "ISTJ",
    "drinking": "Yes",
    "smoking": "No",
    "marijuana": "No",
    "drugs": "No",
    "exercise": "Active",
    "partner_preferences": {
        "minimum_age": 30,
        "maximum_age": 40,
        "minimum_height": "5'7\"",
        "maximum_height": "6'2\"",
        "has_children": false,
        "want_children": true,
        "sexuality": "Straight",
        "drinking": "Yes",
        "smoking": "No",
        "marijuana": "No",
        "drugs": "No",
        "exercise": "Active"
    },
    "summary": "Kimiko Takahashi is a 36-year-old Software Developer from Kyoto, Japan and currently resides in Los Angeles, California. She holds a graduate degree from UC Berkeley and works in the tech industry. Kimiko speaks English and Japanese and self-identifies as a disciplined, active woman with interests in coding, cooking, gardening, and traveling. Practicing Buddhism, she holds moderate political views. As a straight woman, Kimiko is searching for a life partner and is open to monogamy. She is a proud cat owner and does not have children but is keen to have them in the future. Kimiko is a Capricorn and her Myers Briggs personality type is ISTJ. She enjoys drinking but does not smoke or do drugs. She is looking for a straight male partner between the ages of 30 and 40, who does not have children, but wants them in the future. Her ideal partner must be active and enjoy drinking but should not smoke or take drugs.",
    "user_id": "7ee4ed2d-95bf-4719-8a1c-b5ed04226aa7"
}
