{
    "name": "Malaika Jabari",
    "age": 28,
    "height": "5'6\"",
    "school": "University of Nairobi",
    "job_industry": "Healthcare",
    "job_title": "Pediatrician",
    "hometown_location": "Nairobi, Kenya",
    "dating_location": "Los Angeles, California",
    "languages_spoken": [
        "English",
        "Swahili",
        "French"
    ],
    "values": [
        "Family",
        "Health",
        "Career",
        "Faith"
    ],
    "interests": [
        "Cooking",
        "Travel",
        "Photography",
        "Yoga"
    ],
    "education_level": "Doctoral",
    "religious_beliefs": "Muslim",
    "politics": "Moderate",
    "dating_intentions": "Life partner",
    "relationship_type": "Monogamy",
    "gender": "Woman",
    "pronouns": "She/Her/Hers",
    "sexuality": "Straight",
    "ethnicity": "Black African Descent",
    "has_children": false,
    "want_children": true,
    "pets": [
        "Cat",
        "Fish"
    ],
    "zodiac_sign": "Virgo",
    "mbti_personality_type": "INFJ",
    "drinking": "No",
    "smoking": "No",
    "marijuana": "No",
    "drugs": "No",
    "exercise": "Active",
    "partner_preferences": {
        "minimum_age": 28,
        "maximum_age": 35,
        "minimum_height": "5'8\"",
        "maximum_height": "6'4\"",
        "has_children": false,
        "want_children": true,
        "sexuality": "Straight",
        "drinking": "No",
        "smoking": "No",
        "marijuana": "No",
        "drugs": "No",
        "exercise": "Active"
    },
    "summary": "Malaika Jabari is a 28-year-old pediatrician from Nairobi, Kenya, currently living in Los Angeles, California. She stands at 5'6\" and values her family, health, career, and faith. Her interests include cooking, traveling, photography, and practicing yoga. \n\nMalaika is a university graduate with a doctoral degree, identifies as a Muslim, and has moderate political beliefs. She is interested in finding a life partner and prefers monogamous relationships. Her preferred pronouns are she/her/hers, and she identifies as a straight woman of Black African descent. \n\nShe does not have children yet but plans to in the future. She is a proud pet owner of a cat and some fish. Malaika is a Virgo and is categorized as an INFJ in the MBTI personality type framework. \n\nShe lives a healthy lifestyle - she doesn't smoke, drink, or use marijuana or any other drugs, and she also maintains an active fitness regime. \n\nShe's looking for a partner between 28 and 35 years old, who doesn't smoke or drink, and maintains an active lifestyle like herself. Her ideal partner should also want children in the future.",
    "user_id": "ee0d7ec3-2ef2-449c-bdcf-f51db34b5973"
}
