{
    "name": "Oliver Patterson",
    "age": 32,
    "height": "6'2\"",
    "school": "University of California, Berkeley",
    "job_industry": "Technology",
    "job_title": "Software Engineer",
    "hometown_location": "San Francisco, California",
    "dating_location": "Los Angeles, California",
    "languages_spoken": [
        "English",
        "Spanish"
    ],
    "values": [
        "Hard work",
        "Honesty",
        "Kindness"
    ],
    "interests": [
        "Traveling",
        "Hiking",
        "Reading",
        "Gaming"
    ],
    "education_level": "Graduate",
    "religious_beliefs": "Agnostic",
    "politics": "Liberal",
    "dating_intentions": "Life partner",
    "relationship_type": "Monogamy",
    "gender": "Man",
    "pronouns": "He/Him/His",
    "sexuality": "Straight",
    "ethnicity": "White Caucasian",
    "has_children": false,
    "want_children": true,
    "pets": [
        "Dog",
        "None"
    ],
    "zodiac_sign": "Gemini",
    "mbti_personality_type": "INTJ",
    "drinking": "Sometimes",
    "smoking": "No",
    "marijuana": "No",
    "drugs": "No",
    "exercise": "Active",
    "partner_preferences": {
        "minimum_age": 26,
        "maximum_age": 35,
        "minimum_height": "5'2\"",
        "maximum_height": "6'0\"",
        "has_children": false,
        "want_children": true,
        "sexuality": "Straight",
        "drinking": "Sometimes",
        "smoking": "No",
        "marijuana": "No",
        "drugs": "No",
        "exercise": "Active"
    },
    "summary": "Oliver Patterson is a 32-year-old Software Engineer living in Los Angeles but originally from San Francisco. He is 6'2\", a graduate of the University of California, Berkeley, and works in the technology industry. He speaks two languages: English and Spanish. His key values are hard work, honesty, and kindness. \n\nIn his free time, Oliver enjoys traveling, hiking, reading, and gaming. While he does not adhere to any particular religious beliefs, he leans towards liberal politics. \n\nHe is currently looking for a life partner in a monogamous relationship. Describing himself as an agnostic, straight, white Caucasian man, he does not have children but hopes to in the future. He doesn't own any pets yet and his zodiac sign is Gemini. \n\nOliver identifies as an INTJ personality type, enjoys an active lifestyle, and sometimes drinks alcohol but does not smoke or use marijuana or other drugs. \n\nAs for his partner preferences, he is seeking a straight woman aged between 26-35 who does not smoke, partakes in alcohol occasionally, does not use marijuana or other drugs, and has an active lifestyle. She should ideally not have children yet but desire them in the future.",
    "user_id": "28835c92-2ea8-4b7e-a85c-78a074055ed7"
}
