{
    "name": "Emma Barnes",
    "age": 28,
    "height": "5'6\"",
    "school": "University of California",
    "job_industry": "Tech",
    "job_title": "Software Engineer",
    "hometown_location": "San Francisco, California",
    "dating_location": "Los Angeles, California",
    "languages_spoken": [
        "English",
        "Spanish"
    ],
    "values": [
        "Honesty",
        "Kindness",
        "Humor"
    ],
    "interests": [
        "Traveling",
        "Cooking",
        "Hiking"
    ],
    "education_level": "Graduate",
    "religious_beliefs": "Agnostic",
    "politics": "Liberal",
    "dating_intentions": "Long term",
    "relationship_type": "Monogamy",
    "gender": "Woman",
    "pronouns": "She/Her/Hers",
    "sexuality": "Straight",
    "ethnicity": "White Caucasian",
    "has_children": false,
    "want_children": true,
    "pets": [
        "Cat"
    ],
    "zodiac_sign": "Virgo",
    "mbti_personality_type": "INFJ",
    "drinking": "Sometimes",
    "smoking": "No",
    "marijuana": "No",
    "drugs": "No",
    "exercise": "Active",
    "partner_preferences": {
        "minimum_age": 27,
        "maximum_age": 35,
        "minimum_height": "5'8\"",
        "maximum_height": "6'2\"",
        "has_children": false,
        "want_children": true,
        "sexuality": "Straight",
        "drinking": "Yes",
        "smoking": "No",
        "marijuana": "No",
        "drugs": "No",
        "exercise": "Active"
    },
    "summary": "Emma Barnes is a 28-year-old Software Engineer who works in the tech industry and lives in Los Angeles, California. She is a graduate from the University of California and fluent in English and Spanish. Standing at 5'6\", she identifies as a straight white woman who uses she/her pronouns. She doesn't have children but is interested in having some in the future. \n\nHer interests include traveling, cooking, and hiking. Her core values are honesty, kindness, and humor. She owns a cat and is in good shape with an active exercise routine. She is an occasional drinker, doesn't smoke, and is against drugs. She identifies as an INFJ and her zodiac sign is Virgo.\n\nAs for her partner preferences, she is looking for a monogamous relationship and intends to date long-term. She is interested in straight men aged between 27 and 35, who are taller than her (5'8\" to 6'2\"), don't have children currently but want to in the future. The partner should also have an active lifestyle, be a drinker but not a smoker or a drug user.",
    "user_id": "e90cc19d-dd7a-41c6-82d9-969d8230f134"
}
