{
    "name": "Juliet Nkosi",
    "age": 28,
    "height": "5'6\"",
    "school": "Stanford University",
    "job_industry": "Software",
    "job_title": "Software Developer",
    "hometown_location": "Johannesburg, South Africa",
    "dating_location": "Los Angeles, California",
    "languages_spoken": [
        "English",
        "Zulu",
        "Afrikaans",
        "Japanese"
    ],
    "values": [
        "Hard work",
        "Respect",
        "Empathy",
        "Sincerity",
        "Independence"
    ],
    "interests": [
        "Technology",
        "Yoga",
        "Music",
        "Outdoor Adventure",
        "Cooking",
        "Reading"
    ],
    "education_level": "Graduate",
    "religious_beliefs": "Agnostic",
    "politics": "Liberal",
    "dating_intentions": "Long term",
    "relationship_type": "Monogamy",
    "gender": "Woman",
    "pronouns": "She/Her/Hers",
    "sexuality": "Straight",
    "ethnicity": "Black African Descent",
    "has_children": false,
    "want_children": true,
    "pets": [
        "None"
    ],
    "zodiac_sign": "Cancer",
    "mbti_personality_type": "INFJ",
    "drinking": "Sometimes",
    "smoking": "No",
    "marijuana": "No",
    "drugs": "No",
    "exercise": "Active",
    "partner_preferences": {
        "minimum_age": 26,
        "maximum_age": 35,
        "minimum_height": "5'6\"",
        "maximum_height": "6'3\"",
        "has_children": false,
        "want_children": true,
        "sexuality": "Straight",
        "drinking": "Yes",
        "smoking": "No",
        "marijuana": "No",
        "drugs": "No",
        "exercise": "Active"
    },
    "summary": "Juliet Nkosi is a 28-year-old woman from Johannesburg, South Africa currently living in Los Angeles, California. She's straight, identifies with the pronouns She/Her/Hers, and is interested in a monogamous, long-term relationship with a man. Juliet is a Software Developer in the tech industry and a graduate from Stanford University.\n\nWhile being a dedicated professional, Juliet also enjoys yoga, music, outdoor adventure, cooking, and reading. She speaks multiple languages that include English, Zulu, Afrikaans, and Japanese. She holds close to her heart values of hard work, respect, empathy, sincerity, and independence.\n\nShe is liberal and agnostic. She has no pets and does not have any children yet, but she does want children in the future. She often drinks socially, but she does not smoke or use marijuana or other drugs.\n\nFor a potential partner, she prefers someone who does not currently have kids but wants them in the future. Similarly, a potential partner should be active and wouldn't mind a drink socially but not indulge in smoking or drug use.\n\nWith a Cancer zodiac sign and her INFJ Myers\u2013Briggs personality type, Juliet prefers to make her relationships personal, meaningful, and long-lasting. She's looking for someone between 26 and 35, with a height ranging from 5'6\" to 6'3\".",
    "user_id": "25d3add9-2653-4bac-a604-6012c2bbc866"
}
