{
    "name": "Marisol Rodriguez",
    "age": 32,
    "height": "5'5\"",
    "school": "University of Southern California",
    "job_industry": "Marketing",
    "job_title": "Digital Marketing Specialist",
    "hometown_location": "San Juan, Puerto Rico",
    "dating_location": "Los Angeles, California",
    "languages_spoken": [
        "Spanish",
        "English"
    ],
    "values": [
        "Family",
        "Hard Work",
        "Creativity"
    ],
    "interests": [
        "Reading",
        "Cooking",
        "Hiking"
    ],
    "education_level": "Graduate",
    "religious_beliefs": "Catholic",
    "politics": "Moderate",
    "dating_intentions": "Long term",
    "relationship_type": "Monogamy",
    "gender": "Woman",
    "pronouns": "She/Her/Hers",
    "sexuality": "Straight",
    "ethnicity": "Hispanic/Latino",
    "has_children": false,
    "want_children": true,
    "pets": [
        "Dog"
    ],
    "zodiac_sign": "Virgo",
    "mbti_personality_type": "ISFJ",
    "drinking": "Sometimes",
    "smoking": "No",
    "marijuana": "No",
    "drugs": "No",
    "exercise": "Active",
    "partner_preferences": {
        "minimum_age": 30,
        "maximum_age": 40,
        "minimum_height": "5'8\"",
        "maximum_height": "6'3\"",
        "has_children": false,
        "want_children": true,
        "sexuality": "Straight",
        "drinking": "Yes",
        "smoking": "No",
        "marijuana": "No",
        "drugs": "No",
        "exercise": "Active"
    },
    "summary": "Marisol Rodriguez is a 32-year-old Digital Marketing Specialist from San Juan, Puerto Rico, currently living in Los Angeles, California. She is a Graduate of the University of Southern California and speaks both Spanish and English. She values family, hard work, and creativity and enjoys reading, cooking, and hiking. As a Catholic and political moderate, she is seeking a long-term, monogamous relationship with a straight man. Marisol is a straight woman who uses She/Her pronouns, identifies as Hispanic/Latino and does not have any children but is open to having in the future. She has a pet dog and exercises regularly; occasionally enjoys a drink, but does not smoke or use marijuana or other drugs. Her zodiac sign is Virgo, and her MBTI personality type is ISFJ. She prefers a partner between the ages of 30 and 40, with a height between 5'8\" and 6'3\". Preferably, her potential partner does not have children, wants children in the future, is active physically, enjoys a drink occasionally but does not smoke or use drugs.",
    "user_id": "8bb4a941-8940-4cd4-8818-95da8689dd42"
}
