{
    "name": "Elise Hamilton",
    "age": 28,
    "height": "5'7\"",
    "school": "University of California, Los Angeles",
    "job_industry": "Healthcare",
    "job_title": "Physical Therapist",
    "hometown_location": "Portland, Oregon",
    "dating_location": "Los Angeles, California",
    "languages_spoken": [
        "English",
        "Spanish"
    ],
    "values": [
        "Family",
        "Work-life balance",
        "Self-improvement"
    ],
    "interests": [
        "Hiking",
        "Reading",
        "Cooking"
    ],
    "education_level": "Graduate",
    "religious_beliefs": "Agnostic",
    "politics": "Liberal",
    "dating_intentions": "Long term",
    "relationship_type": "Monogamy",
    "gender": "Woman",
    "pronouns": "She/Her/Hers",
    "sexuality": "Straight",
    "ethnicity": "White Caucasian",
    "has_children": false,
    "want_children": true,
    "pets": [
        "Dog",
        "None"
    ],
    "zodiac_sign": "Virgo",
    "mbti_personality_type": "ENFJ",
    "drinking": "Sometimes",
    "smoking": "No",
    "marijuana": "No",
    "drugs": "No",
    "exercise": "Active",
    "partner_preferences": {
        "minimum_age": 28,
        "maximum_age": 35,
        "minimum_height": "5'9\"",
        "maximum_height": "6'3\"",
        "has_children": false,
        "want_children": true,
        "sexuality": "Straight",
        "drinking": "Yes",
        "smoking": "No",
        "marijuana": "No",
        "drugs": "No",
        "exercise": "Active"
    },
    "summary": "Elise Hamilton is a 28-year-old woman who serves as a Physical Therapist in the healthcare industry. She's 5'7\" tall, lives in Los Angeles and originates from Portland, Oregon. As a graduate of UCLA, Elise values family, work-life balance, and self-improvement. She identifies as a liberal agnostic.\n\nIn her free time, she enjoys hiking, reading, and cooking. Elise, an ENFJ, identifies as straight and has no children but does want them in the future. She likes dogs but does not have one of her own. As a Virgo, she occasionally drinks but does not smoke or use drugs. \n\nElise is searching for a straight man between the ages of 28 and 35, who stands between 5'9\" and 6'3\" tall. She prefers someone without children but who would like children in the future. He should also be active, non-smoker, and moderate to occasional drinker.",
    "user_id": "47a92665-ffa9-455d-849b-af3170de0357"
}
