{
    "name": "Ava Johnson",
    "age": 28,
    "height": "5'6\"",
    "school": "University of California, Los Angeles",
    "job_industry": "Information Technology",
    "job_title": "Software Developer",
    "hometown_location": "New York, New York",
    "dating_location": "Los Angeles, California",
    "languages_spoken": [
        "English",
        "Spanish",
        "Korean"
    ],
    "values": "Family, Creativity, Independence",
    "interests": "Yoga, Hiking, Coding, Painting, Music",
    "education_level": "Graduate",
    "religious_beliefs": "Agnostic",
    "politics": "Liberal",
    "dating_intentions": "Long term",
    "relationship_type": "Monogamy",
    "gender": "Woman",
    "pronouns": "She/Her/Hers",
    "sexuality": "Straight",
    "ethnicity": "Hispanic/Latino",
    "has_children": false,
    "want_children": true,
    "pets": [
        "Dog"
    ],
    "zodiac_sign": "Gemini",
    "mbti_personality_type": "INTJ",
    "drinking": "Sometimes",
    "smoking": "No",
    "marijuana": "No",
    "drugs": "No",
    "exercise": "Active",
    "partner_preferences": {
        "minimum_age": 28,
        "maximum_age": 38,
        "minimum_height": "5'8\"",
        "maximum_height": "6'2\"",
        "has_children": false,
        "want_children": true,
        "sexuality": "Straight",
        "drinking": "Yes",
        "smoking": "No",
        "marijuana": "No",
        "drugs": "No",
        "exercise": "Active"
    },
    "summary": "Ava Johnson is a 28-year-old software developer from New York, currently living in Los Angeles. She is a graduate from the University of California, Los Angeles and is multilingual, speaking English, Spanish and Korean. Ava cherishes values such as family, creativity, and independence, and has diverse interests in Yoga, hiking, coding, painting, and music.\n\nShe identifies as a straight woman with Hispanic/Latino ethnicity and prefers using 'She/Her' pronouns. While she currently does not have children, Ava indicates that she'd like to have them in the future. She is a dog lover and is in the market for a long-term relationship. Her political leanings are liberal and is Agnostic.\n\nAva is a gemini by star sign and an INTJ by MBTI personality type. She infrequently consumes alcohol but steers clear of smoking and drugs. She prefers a partner who does not smoke or use drugs, but doesn't mind if they drink. Her prospective partners should ideally lead an active lifestyle, similar to hers, sharing her interest in fitness and exercise.\n\nShe seeks a straight man who ranges in age from 28 to 38 years. It's important to her that this person does not have children but is open to the possibility in the future. Beyond this, she also prefers that they are taller, standing between 5'8\" and 6'2\".",
    "user_id": "2dd5d2a5-e4b9-480d-a661-78ea02cb1c9c"
}
