{
    "name": "Mei Huang",
    "age": 28,
    "height": "5'6\"",
    "school": "University of California, Los Angeles",
    "job_industry": "Technology",
    "job_title": "Software Developer",
    "hometown_location": "San Francisco, California",
    "dating_location": "Los Angeles, California",
    "languages_spoken": [
        "English",
        "Mandarin"
    ],
    "values": [
        "Honesty",
        "Hard Work",
        "Kindness"
    ],
    "interests": [
        "Coding",
        "Hiking",
        "Reading",
        "Cooking"
    ],
    "education_level": "Graduate",
    "religious_beliefs": "Buddhist",
    "politics": "Liberal",
    "dating_intentions": "Long term",
    "relationship_type": "Monogamy",
    "gender": "Woman",
    "pronouns": "She/Her/Hers",
    "sexuality": "Straight",
    "ethnicity": "East Asian",
    "has_children": false,
    "want_children": true,
    "pets": [
        "Cat"
    ],
    "zodiac_sign": "Gemini",
    "mbti_personality_type": "INTJ",
    "drinking": "Sometimes",
    "smoking": "No",
    "marijuana": "No",
    "drugs": "No",
    "exercise": "Active",
    "partner_preferences": {
        "minimum_age": 27,
        "maximum_age": 35,
        "minimum_height": "5'6\"",
        "maximum_height": "6'3\"",
        "has_children": false,
        "want_children": true,
        "sexuality": "Straight",
        "drinking": "Sometimes",
        "smoking": "No",
        "marijuana": "No",
        "drugs": "No",
        "exercise": "Active"
    },
    "summary": "Mei Huang is a 28-year-old software developer who resides in Los Angeles. Originally from San Fransico, Mei holds a graduate degree from UCLA. She speaks English and Mandarin, and identifies as a straight woman with Buddhist beliefs and liberal politics. She doesn't currently have children, but would like some in her future. \n\nHer interests include coding, hiking, reading, and cooking. She values honesty, hard work, and kindness, and is seeking a long-term monogamous relationship with someone who shares these same values. She doesn't smoke or use drugs, and only drinks occasionally. Mei leads an active lifestyle and owns a cat.\n\nShe prefers a straight man between the ages of 27 and 35. The ideal candidate should be between the heights of 5'6\" and 6'3\", does not currently have children but would like to in the future, is an active individual who exercises regularly, and a non-smoker who doesn't use drugs or marijuana but drinks occasionally.",
    "user_id": "b9d28972-a2fa-40d6-bb77-27d08a0b4f99"
}
