{
    "name": "Aaliyah Smith",
    "age": 28,
    "height": "5'6\"",
    "school": "University of California, Los Angeles",
    "job_industry": "Tech",
    "job_title": "Software Engineer",
    "hometown_location": "San Francisco, California",
    "dating_location": "Los Angeles, California",
    "languages_spoken": [
        "English",
        "French",
        "Arabic"
    ],
    "values": "Diversity, Equality, and Integrity",
    "interests": "Cooking, Yoga, and Coding",
    "education_level": "Graduate",
    "religious_beliefs": "Muslim",
    "politics": "Liberal",
    "dating_intentions": "Long term",
    "relationship_type": "Monogamy",
    "gender": "Woman",
    "pronouns": "She/Her/Hers",
    "sexuality": "Gay",
    "ethnicity": "Black African Descent",
    "has_children": false,
    "want_children": true,
    "pets": [
        "Cat"
    ],
    "zodiac_sign": "Gemini",
    "mbti_personality_type": "ENFP",
    "drinking": "Sometimes",
    "smoking": "No",
    "marijuana": "No",
    "drugs": "No",
    "exercise": "Active",
    "partner_preferences": {
        "minimum_age": 26,
        "maximum_age": 35,
        "minimum_height": "5'4\"",
        "maximum_height": "6'2\"",
        "has_children": true,
        "want_children": true,
        "sexuality": "Gay",
        "drinking": "Sometimes",
        "smoking": "No",
        "marijuana": "No",
        "drugs": "No",
        "exercise": "Active"
    },
    "summary": "Aaliyah Smith is a 28 year old software engineer who identifies as a gay woman. She is from San Francisco and currently lives in Los Angeles. Aaliyah holds a graduate degree from the University of California, Los Angeles and works within the tech industry. Known for valuing diversity, equality, and integrity, she is interested in various hobbies like cooking, yoga, and coding. She is articulate in English, French, and Arabic. Aaliyah follows Muslim faith and holds liberal political views. She is relationship-oriented and prefers monogamy. Despite not having children, she would like to be a mother in the future. She has a pet cat, indulges in drinking occasionally, and is committed to an active lifestyle. She is specifically seeking a gay woman between the ages of 26 and 35 who doesn't smoke, drinks sometimes, and maintains an active lifestyle. Someone who already has children and wants more in the future would be ideal. As an ENFP, Aaliyah is outgoing, enthusiastic, and resourceful.\n",
    "user_id": "f714c3b0-d76c-4c28-b704-71522bcb6e68"
}
